date,topline,headline,content18.02.2010 16:58 Uhr,Verbände und Gewerkschaften rügen Hartz IV,Armutsmaschine oder gelungene Reform?,"Fünf Jahre nach der Einführung der Arbeitsmarktreform Hartz IV haben Wohlfahrtsverbände, Gewerkschaften und die Partei Die Linke die Gesetze scharf kritisiert und eine Reform der Reform angemahnt. Nach Ansicht des Deutschen Paritätischen Wohlfahrtsverbandes sind die Hartz IV-Bezüge zu gering, um am gesellschaftlichen Leben teilzuhaben. ""Die Betroffenen leben auf einem finanziellen Niveau, mit dem man absolut nicht über die Runden kommen kann. Hartz IV heißt, gesellschaftlich abgemeldet zu sein"", sagte Hauptgeschäftsführer Ulrich Schneider auf NDR Info. Er warnte vor tieferen Gräben in der Gesellschaft. Wer einmal Hartz IV beziehe, komme auch nur schwer aus dieser staatlichen Hilfe wieder heraus. So blieben mehr als 50 Prozent der Hartz-IV-Bezieher drei Jahre oder länger in dieser Hilfe. ""Da bewegt sich nichts mehr"", sagte Schneider. ""Das ist es, was die Spaltung in Deutschland immer tiefer werden lässt. Die Partei Die Linke stimmte in die Kritik ein. Das Gesetz habe die Ansprüche nicht erfüllt, urteilte der stellvertretende Linke-Vorsitzende Klaus Ernst. Er nannte Hartz IV eine ""Armuts- und Niedriglohnmaschine"" und forderte - ähnlich wie Verbände und Gewerkschaften - eine Reform der Reform. ""Wir brauchen ein Bündel von Sofortmaßnahmen, weil die Krise jetzt auf dem Arbeitsmarkt durchschlägt."" Konkret verlangte Ernst eine Anhebung der Hartz-Regelsätze für Kinder und Alleinerziehende. Der Hartz-IV-Regelsatz für Kinder sei falsch bemessen und müsse geändert werden, forderte auch der stellvertretende SPD-Fraktionschef Hubertus Heil. Derzeit verhandelt das Bundesverfassungsgericht in Karlsruhe über Hartz-IV-Regelsätze. Die Richter wollen im Laufe des ersten Quartals 2010 entscheiden, wie viel für ein menschenwürdiges Dasein notwendig ist. Grundsätzliche Kritik an der Reform ließ der frühere SPD-Generalsekretär Heil aber nicht gelten. ""Die Grundlinien waren richtig."" Die Reformen hätten die Sozialsysteme stabilisiert und die Arbeitslosigkeit bis zur Finanzkrise massiv gesenkt. "
18.02.2010 14:57 Uhr,Außenminister heben Einreiseverbote auf,EU lockert Sanktionen gegen Weißrussland,"Die EU-Außenminister begründeten ihre Entscheidung unter anderem mit der Entlassung politischer Häftlinge aus weißrussischen Gefängnisse. ""Wir müssen zeigen, dass Fortschritt sich lohnt"", argumentierte EU-Außenkommissarin Benita Ferrero-Waldner. ""Unser Appell an Minsk ist, diese Chancen zu nutzen und weitere Reformen folgen zu lassen"", erklärte der deutsche Staatsminister im Auswärtigen Amt, Günter Gloser. Ein Vertreter der Opposition in Weißrussland kritisierte die Entscheidung der EU. ""Europa hat angefangen, mit Lukaschenko zu spielen, um Weißrussland von Russland wegzulocken. Aber ich glaube nicht, dass das zu demokratischen Verbesserungen in Weißrussland führen wird"" sagte Anatoli Lebedko, der Vorsitzende der oppositionellen Vereinigten Bürgerpartei. Die weißrussische Regierung orientierte sich bislang eng an den Machthabern Moskau. Die Beziehungen der Europäischen Union zu Russland sorgten bei dem Außenministertreffen für neuerlichen Streit. Ungeachtet des russischen Truppenabzugs aus Georgien konnten sich die Minister nicht auf eine Wiederaufnahme des Dialogs verständigen. Länder wie Polen und Schweden pochen darauf, dass Russland seine gesamte Armee auf die Positionen vor Beginn des Kaukasus-Konflikts zurückzieht. Damit liegt ein neues Partnerschaftsabkommen mit Russland weiter auf Eis. Die weiteren Beratungen in der Russland-Frage wurden auf den EU-Gipfel der Staats- und Regierungschefs vertagt, der am Mittwoch in Brüssel beginnt. Ob dort eine Entscheidung fällt, ist allerdings fraglich. Ferrero-Waldner sprach sich dafür aus, die Entscheidung weiter zu verschieben. ""Wir haben Zeit bis zum EU-Russland-Gipfel am 14. November"", sagte Ferrero-Waldner. Die Kommission arbeite derzeit an einer umfassenden Analyse der EU-Beziehungen zu Russland, ""ich denke, das sollte die Grundlage der Diskussion sein"". "
18.02.2010 12:13 Uhr,Studie der OECD,Hartz-IV-Familien haben wenig Anreize zur Jobsuche,"Langzeitarbeitslose mit Familie haben laut einer OECD-Studie trotz der Hartz-Reformen offenbar immer noch wenig Anreize, sich eine gering bezahlte, aber existenzsichernde Arbeit zu suchen. Schon bei einem geringen Verdienst würden für sie relativ hohe Steuern und Sozialbeiträge fällig, begründete die Organisation für Wirtschaftliche Zusammenarbeit und Entwicklung ihre Einschätzung. Minijobs und andere Formen geringfügiger Beschäftigung würden dagegen etwa durch Freibeträge gefördert. Die Studie platzt mitten in die Debatte um Hartz IV. Nachdem das Bundesverfassungsgericht eine Neuberechnung der Hartz-IV-Regelsätze angemahnt hatte, griff FDP-Chef Guido Westerwelle das Thema auf. Er forderte einen ""völligen Neuanfang"" für den Sozialstaat: Zur Begründung sagte Westerwelle, es könne nicht sein, dass diejenigen, die morgens aufstünden und hart arbeiteten, sich dafür entschuldigen müssten, etwas von ihrem Geld behalten zu wollen. Im internationalen Vergleich sind Arbeitslose mit Kindern in Deutschland bei den Sozialleistungen jedoch gut gestellt: Nach fünf Jahren ohne Arbeitsplatz erhalte ein Durchschnittsverdiener mit zwei Kindern und nicht erwerbstätigem Ehepartner 63 Prozent seines ehemaligen Nettoeinkommens an Sozialleistungen wie Arbeitslosengeld oder Wohngeld. Im OECD-Durchschnitt seien es nur 55 Prozent. ""Trotzdem ist das Armutsrisiko dieser Gruppe im internationalen Vergleich sehr hoch"", schrieben die Forscher. Unterschiede stellten die Wissenschaftler zwischen Durchschnittsverdienern und Geringverdienern fest: Verliert ein Alleinstehender Durchschnittsverdiener in Deutschland seinen Job, bekommt er zunächst 60 Prozent seines Nettolohns aus Transfers ersetzt, nach fünf Jahren nur noch 36 Prozent. Deutschland rangiert damit leicht über dem OECD-Durchschnitt. Die höchsten Ersatzleistungen gibt es demnach in Dänemark, den Niederlanden und Irland. Familien und Alleinerziehende erhalten einschließlich Kindergeld 72 beziehungsweise 70 Prozent des letzten Nettoeinkommens. Als Durchschnittsverdienst gilt in Deutschland ein Bruttoeinkommen von 41.400 Euro. Verliert ein Geringverdiener seinen Arbeitsplatz, so kann er hierzulande genauso wie ein Durchschnittsverdiener auf 60 Prozent Lohnersatz hoffen. Deutschland rangiert hier im OECD-Vergleich allerdings im unteren Drittel. Die OECD-Berechnungen beruhen auf Daten der zuständigen Ministerien in den Mitgliedsländern. Sie enthalten alle finanziellen Leistungen wie Sozialhilfe sowie Leistungen für Kinder und Wohngeld. Nicht in die Berechnungen einbezogen sind Sachleistungen und sonstige Vergünstigungen wie etwa subventionierte Fahrkarten. Ebenfalls nicht einbezogen sind die Kosten für Kinderbetreuung. "
18.02.2010 12:11 Uhr,Rückgang um 209.100 Tonnen,Luftfrachtaufkommen sinkt so stark wie noch nie,"Auf den deutschen Flughäfen ist im vergangenen Jahr der bislang stärkste Rückgang von Luftfracht seit Einführung der entsprechenden Statistik registriert worden. Die Menge sank nach Angaben des Statistischen Bundesamts gegenüber dem Vorjahr um 209.100 Tonnen oder 6,1 Prozent auf 3,24 Millionen Tonnen. Das ist der stärkste Rückgang seit 1951. Die größten Rückgänge seien in der ersten Jahreshälfte beobachtet worden. Noch stärker als die Luftfracht ging das Aufkommen bei der Luftpost zurück. Dort gab es ein Minus um 15,6 Prozent auf 99.100 Tonnen. Innerdeutsch wurden nur noch 16.500 Tonnen Luftpost transportiert und damit 42,5 Prozent weniger als 2008. Große Mengen seien auf die Straße verlagert worden, erklärte das Bundesamt die Ergebnisse. Zuvor hatte das Amt bereits mitgeteilt, dass der Passagierverkehr im vergangenen Jahr aufgrund der Wirtschaftskrise so stark zurückgegangen wie noch nie. "
17.02.2010 17:36 Uhr,Interview zur Oppositionspartei SPD,Identitätssuche in ungewohnter Stille,"Was macht eigentlich die SPD? Von der Partei hört man momentan wenig - und das ist für sie gut so, sagt der Politikwissenschaftler Korte im Interview mit tagesschau.de. Die SPD sei eben ernsthaft auf der Suche nach sich selbst, ihr Spitzenpersonal in den neuen Rollen noch unsicher. Und auch wenn sie wohl nie zu alter Stärke zurückfinden werde - ihre strategische Lage im Parteiensystem bleibe exzellent. tagesschau.de: Man hört momentan viel von der FDP, von der Union, von den Grünen und von der Linkspartei - nur nicht so recht von der SPD. Ist das für die Partei ein gutes Zeichen? Außerdem liegt das wohl an einer arbeitsteiligen Absprache zwischen dem neuen Parteivorsitzenden Sigmar Gabriel und dem neuen Fraktionschef Frank-Walter Steinmeier. Beide suchen ihre Rollen noch - und bevor sie sich gegenseitig widersprechen und damit torpedieren, bewahren sie lieber organisierte Stille. tagesschau.de: Gabriel ist nach dem Bundestagsdebakel quasi als letzte Hoffnung Parteichef geworden. Wie macht er sich? Korte: Er geht sehr behutsam und nicht demagogisch vor. Er wirkt auch nachdenklicher als vorher. Die Stille hat mich überrascht, er war sonst um keine Pressemitteilung verlegen. Ob er aber wirklich nachdenklicher geworden ist oder aus taktischen Gründen schweigt, kann ich nicht beurteilen. tagesschau.de: Bei Frank-Walter Steinmeier waren viele - gelinde gesagt - überrascht, dass er als Fraktionschef in die Opposition ziehen wollte… Korte: …und seine Amtsführung wirkt jetzt auch noch nicht richtig vollendet oder rund. So eine Funktion wie Fraktionsvorsitzender muss man aber auch erst lernen. Aus meiner Sicht gibt es in der Bundesrepublik kein schwierigeres Amt: Man hat keine Patronage-Macht, man hat kein Repräsentationsamt, niemand rollt für einen den roten Teppich aus. Stattdessen muss man all diese Wahlkreiskönige auf eine Linie bringen, das ist nicht so einfach. tagesschau.de: Die dritte im Bunde ist die neue Generalsekretärin Andrea Nahles. Haben Sie in den vergangenen Wochen viel von ihr mitbekommen? Korte: Nahles ist in der letzten Zeit zwar durch einige inhaltliche Beiträge aufgefallen, und als sie ihr Buch ""Frau, gläubig, links"" vorgestellt hat. Aber auch bei ihr dominiert nach außen die Stille als beredtes Schweigen - ob aus Demut vor dem neuen Amt oder aus Orientierungslosigkeit, kann ich nicht beurteilen. tagesschau.de: Aber in letzter Zeit hat es kaum noch wahrnehmbare innerparteiliche Querelen gegeben. Korte: Das ist ein Gesundschrumpfen auf niedrigem Niveau. Da hilft es auch, dass mit Lafontaine einer der Hauptgegner nicht mehr da ist - das stärkt sicherlich auch die inneren Kräfte der SPD, sich selbst wiederzufinden. Ob es aber eine substanzielle Versöhnung über alle Flügel der Partei hinweg gibt, wird sich an der Frage der Linken entscheiden: Wie hält es die SPD künftig mit der Konstellation, dass es links von ihr weiterhin eine Partei gibt, welche die Hegemonie über soziale Gerechtigkeit beansprucht? An der Antwort auf diese Schlüsselfragen wird man erkennen, ob die SPD in der Opposition einig auftritt - oder eben nicht und stattdessen die Interessen der Flügel dominieren. tagesschau.de: Die SPD war elf Jahre an der Macht – hat sie in der Opposition inhaltliche Kurswechsel vollzogen? Korte: Nein. Das kann ich nicht erkennen. Ich habe eher den Eindruck, dass Schwarz-Rot-Gelb regiert. Für die SPD gibt es im Moment nicht viele Angriffsflächen, weil sie in der Großen Koalition vieles mitverantwortet hat - und die Union die Kontinuität der Politik der Großen Koalition feiert – zumindest in den zentralen innen- und außenpolitischen Fragen. Soziale Gerechtigkeit muss natürlich Großthema der SPD sein - was auch sonst? Dazu gehört auch, dass mit der Schuldenlast gerecht umgegangen werden muss. Aber da sehe ich im Moment keine Kontroversen mit der Bundesregierung. Wenn konkrete Steuersparmodelle der schwarz-gelben Regierung vorliegen - vielleicht sogar als Gesetzesentwurf - dann kann die SPD zum Angriff blasen. tagesschau.de: In den vergangenen Tagen wurde wieder mehr über Schwarz-Grün diskutiert. Hat sich die strategische Situation der SPD verschlechtert? Korte: Nein, die ist im Prinzip weiter sehr gut. Die SPD ist multikoalitionsfähig - sie kann mit allen Bündnisse eingehen. Seit Lafontaine sich bundespolitisch verabschiedet hat, gilt das auch für die Linkspartei auf Bundesebene. Diesen strategischen Vorteil hat keine andere Partei. Aber Gabriel hat bei seiner Bewerbungsrede als Parteivorsitzender den schönen Satz gesagt: ""Wer einen Laden hat, muss auch lächeln können - sonst kommt ja keiner."" Und genau das ist die momentane Situation: Wenn die SPD sich selbst attraktiv findet, wird sie auch einen Partner finden. Aber man hat noch nicht den Eindruck, dass die Partei sich selbst richtig attraktiv findet. tagesschau.de: Wann kann die SPD wieder in den Spiegel sehen – in fünf Jahren? Oder in zehn Jahren? Korte: Die Zeiten für solche langsamen Entwicklungen sind vorbei. Vieles passiert inzwischen im Minutentakt - und Parteiensysteme sind auch nicht mehr so gemeißelt, wie sie es einmal waren. Wir werden mit diesen Koalitionslotterien, mit dem geringen Einfluss der Wähler auf Regierungsbildungen, mit asymmetrischen Fünf-Parteien-Systemen und abgeschwächten Lagern noch eine ganze Weile leben. Aber dadurch sind viele Mehrheiten auch situativ möglich. tagesschau.de: Und wann kommt die SPD in den Umfragen wieder über 30 Prozent? Korte: Ich sehe nur noch Volkspartei-Ruinen und mittelgroße Parteien. Dass Parteien automatisch über 30 oder 40 Prozent kommen, das wird zur Ausnahme. Da ist ein breites Mittelfeld - und die SPD ist mittendrin. Das sind insgesamt fast schon europäische Verhältnisse. Das Interview führte Fabian Grabowsky, tagesschau.de "
17.02.2010 14:32 Uhr,"Wachstumsprognose auf 2,3 Prozent angehoben",DIHK stellt sich an die Spitze der Optimisten,"Der Deutsche Industrie- und Handelskammertag (DIHK) hat seine Wachstumsprognose angesichts wachsender Zuversicht der Unternehmen erhöht. ""Wir halten für 2010 inzwischen ein Wirtschaftswachstum von 2,3 Prozent für realistisch"", sagte Hauptgeschäftsführer Martin Wansleben bei der Vorstellung einer Umfrage unter mehr als 25.000 Unternehmen. Bisher hatte der Verband ein Plus von zwei Prozent erwartet und war schon damit weit optimistischer als die Bundesregierung, die von 1,4 Prozent ausgeht. Bei der Beschäftigung könne ""erste Entwarnung"" gegeben werden. Die Arbeitslosenzahl wird laut DIHK 2010 im Jahresschnitt auf 3,6 Millionen steigen. Bislang hatte er einen Anstieg auf 3,9 Millionen erwartet. Das Münchner Ifo-Institut hält die vom DIHK prognostizierten Zahlen für ""Zweckoptimismus"": ""Es wird Zeit brauchen, bis die Krise überwunden sein wird"", sagte Ifo-Konjunkturchef Kai Carstensen. Die Wirtschaft wird laut Ifo nach der jüngsten Aufholjagd in der zweiten Jahreshälfte eine Verschnaufpause einlegen, wobei sich insbesondere das Auslaufen der Konjunkturprogramme bemerkbar machen wird. Da viele Länder weltweit unter der großen Schuldenlast ächzten, die sie sich im Kampf gegen die Finanzkrise aufgebürdet hätten, seien auch keine weiteren großen staatlichen Stützen mehr zu erwarten: ""Wir müssen jetzt die Märkte machen lassen"", sagte Carstensen. Das Ifo rechnet insgesamt mit einem Wachstum in Höhe von 1,7 Prozent in diesem Jahr. "
17.02.2010 11:39 Uhr,Fluggastzahlen sinken so stark wie noch nie,"""Rekordrückgang in der Geschichte der Luftfahrt""","Der Reiseverkehr an deutschen Flughäfen ist im vergangenen Jahr im Zuge der Wirtschaftskrise so stark zurückgegangen wie noch nie. Nach Zahlen des Statistischen Bundesamts starteten oder beendeten 158,2 Millionen Passagiere ihre Reise an deutschen Flughäfen. Das waren 7,5 Millionen oder 4,5 Prozent weniger als im Vorjahr. Bereits im ersten Halbjahr war mit einem Rückgang um 3,6 Millionen Passagiere das bisher größte absolute Minus seit Beginn der Veröffentlichungen zur Luftverkehrsstatistik im Jahr 1951 gemessen worden. "
16.02.2010 16:50 Uhr,Griechenland und die neue Härte der EU,So viel Hineinregieren war noch nie,"Von Martin Bohne, MDR-Hörfunkstudio Brüssel Das muss man sich mal auf der Zunge zergehen lassen: Ein souveränes Land gibt de facto die Hoheit über seinen Haushalt ab. Von jetzt an steht Griechenland unter Zwangsverwaltung der EU. Die Sparziele werden von Brüssel vorgegeben. Einmal monatlich müssen die stolzen Hellenen zum Rapport antreten, ob die Reformanstrengungen auch ausreichen. Und dem griechischen Finanzminister wurde gleich auf den Weg gegeben, dass er gefälligst im März schon mal nachlegen solle. So viel Hineinregieren gab es in der EU noch nie. Die EU zeigt sich bis jetzt in der Causa Griechenland erstaunlich hart. Viele hatten erwartet, dass man den Griechen schon schnell die rettende Hand reichen werde, um sie aus dem Strudel der Finanzmärkte herauszuziehen. Bisher gibt es aber nur die Hilfe zur Selbsthilfe – und das feste Versprechen, das Land nicht untergehen zu lassen, falls die griechische Regierung die Selbsthilfe wirklich ernsthaft betreibt. Leider kommt diese Härte sehr spät. Vielleicht zu spät. Jahrelang hat die EU tatenlos zugesehen, wie die Griechen ihre Statistiken manipulierten, wie sie für jedermann erkennbar über ihre Verhältnisse lebten. Ein paar mahnende Worte vielleicht, aber nichts, was die Griechen zum Nachdenken hätte bringen können. Das war nicht nur Nachlässigkeit oder Mutlosigkeit. Das sagt auch viel über den Zustand der Europäischen Union. Keiner will sich da zu sehr hineinreden lassen, also behandelt man Verstöße gegen die Gemeinschaftsdisziplin als Kavaliersdelikt. Die Mitgliedsstaaten, insbesondere die, die den Euro haben, haben sich zwar alle in ein Boot gesetzt, aber man behält die vielen Steuermänner, die alle in eine andere Richtung schauen. Ein Seemann weiß, wohin das führt. Das Boot geht irgendwann unter. Die EU-Chefs werden erst jetzt mit der Nase auf diese einfache Wahrheit gestoßen. Viele sagen es jetzt, auch Bundeskanzlerin Merkel: Es muss in Europa möglich sein, Länder, die ihre Hausaufgaben nicht machen, zu Reformen zu zwingen. Dabei geht es nicht nur um die Drei-Prozent-Zahl aus dem Stabilitätspakt, auf die alle immer so starren. Es geht um Leistungsbilanzen, um Sozialsysteme, um Bildung und Forschung, letztlich um die Wettbewerbsfähigkeit der Volkswirtschaften. Der Euro kann auf Dauer nur überleben, wenn die realwirtschaftlichen Differenzen zwischen den einzelnen Ländern geringer werden. Bislang sind sie in den vergangenen zehn Jahren - trotz oder vielleicht sogar wegen des Euros - eher noch größer geworden. Nichts garantiert, dass die EU die Wandlung schafft - von einer Schicksalsgemeinschaft, die lediglich in Sonntagsreden beschworen wird – zu einer Gemeinschaft, die gemeinsam beschlossene Ziele auch durchsetzt. Aber das griechische Drama – und die weltweite  Finanzkrise – haben gezeigt, dass eine Gemeinschaft der Sonntagsreden keine Zukunft hat. "
16.02.2010 15:40 Uhr,EU erhöht Druck auf Griechenland,"""Das reicht nicht aus""","Die EU-Kommission erwartet von der griechischen Regierung binnen eines Monats Vorschläge für weitere Sparbemühungen. ""Griechenland wird Mitte März zusätzliche Maßnahmen vorschlagen müssen, um die Reduktionsziele in diesem Jahr zu erreichen"", sagte EU-Wirtschaftskommissar Olli Rehn nach einem Treffen der EU-Finanzminister in Brüssel. Die Minister beschlossen, dass das griechische Sparprogramm im März zum ersten Mal überprüft wird. Der nächste Termin ist Mitte Mai, ab dann muss die griechische Regierung alle drei Monate Erfolge beim Schuldenabbau nachweisen. Rehn kündigte zudem eine eingehende Untersuchung des Einsatzes von Derivategeschäften zum Verschleiern von Schulden vor dem Beitritt zur Euro-Zone in Griechenland 2001 an. Der EU-Finanzministerrat hatte, wie erwartet, eine strikte Überwachung des griechischen Staatshaushaltes beschlossen. Griechenland ist das erste Mitgliedsland, dessen Budget unter EU-Kontrolle gestellt wird. Der Schuldenabbau wird nun monatlich überprüft. Bis zum 16. März muss Athen darlegen, ob weitere Einschnitte nötig sind, um das Defizit von derzeit 12,7 Prozent um vier Punkte zu senken. Nach Angaben von EU-Wirtschaftskommissar Rehn werden Vertreter der Kommission, der Europäischen Zentralbank (EZB) und des Internationalen Währungsfonds (IWF) bereits in den kommenden Tagen in Athen mit den Kontrollen beginnen. Auch die Finanzminister der 16 Euro-Länder hatten zuvor das griechische Sparpaket vorerst gebilligt. Bereits jetzt sind die Sparpläne in Griechenland unpopulär: Vergangene Woche gingen mehr als 10.000 Staatsbeamte gegen eine Nullrunde bei den Gehältern auf die Straße. Weitere Proteste sind bereits angekündigt. Heute traten die Zollbeamten in einen dreitägigen Ausstand. Am Freitag wollen Taxi-, Tank- und Lastwagenfahrer für 24 Stunden streiken. Vor den Tankstellen bildeten sich bereits am Morgen lange Warteschlangen - aus Angst, es könnte zu Engpässen bei der Treibstoffversorgung kommen, stellten sich Hunderte Autofahrer an den Zapfsäulen an. Am 24. Februar soll das Land durch umfangreiche Streiks im staatlichen wie auch im privaten Wirtschaftsbereich lahmgelegt werden. Griechenland hat in den vergangenen Jahren Rekordschulden angehäuft, die Neuverschuldungsrate lag zuletzt bei 12,7 Prozent des Bruttoinlandsproduktes (BIP). In der Eurozone sind maximal drei Prozent erlaubt. Die Finanzprobleme von Griechenland und anderen Euro-Ländern wie Spanien oder Portugal belasten seit Wochen den Kurs der Gemeinschaftswährung. Beim EU-Sondergipfel in Brüssel hatten sich die europäischen Staats- und Regierungschefs am Donnerstag zunächst auf politische Rückendeckung für Athen geeinigt. Vorerst erhält das hoch verschuldete Griechenland also keine Finanzhilfen. Die EU-Staaten schlossen ein späteres Hilfspaket aber nicht aus. "
