date,topline,headline,content12.02.2010 17:50 Uhr,Diskussion über Staatshilfe,Wirtschaftsministerium zweifelt an Opel-Konzept,"Das Bundeswirtschaftsministerium hat einem Bericht zufolge erhebliche Zweifel am Sanierungsplan für den kriselnden Autobauer Opel. ""Die Tragfähigkeit ist fraglich"", zitierte das Nachrichtenmagazin ""Der Spiegel"" vorab aus einer internen Bewertung des Ministeriums. Der geplante Stellenabbau sei ""nur bedingt nachvollziehbar"". Zudem bestehe die Gefahr, das mögliche Staatshilfen für Opel in die USA abflössen, etwa in Form von Lizenzgebühren, die Opel an den US-Mutterkonzern General Motors (GM) zahlen müsse. ""Ein Abschottungskonzept wird nicht vorgelegt"", zitierte das Magazin aus dem internen Dokument. Wirtschaftsminister Rainer Brüderle forderte indes die EU zu einer strengen Prüfung möglicher Hilfen für Opel auf. Er habe den Vizepräsidenten der EU-Kommission, Joaquín Almunia, gebeten, ""kritisch zu untersuchen, ob das Unternehmenskonzept tragfähig ist und ob Wettbewerbsverzerrungen in Europa ausgeschlossen werden können"", sagte Brüderle der ""Süddeutschen Zeitung"". Eine Sprecherin von EU-Wettbewerbskommissar Almunia erklärte dagegen, dass zunächst die Regierungen der EU-Staaten mit Opel-Werken entscheiden müssten, ob sie Staatshilfe bereitstellen wollten. Dann müssten sie darüber die Kommission informieren. ""Zu diesem Zeitpunkt hat noch kein Land staatliche Hilfen für Opel in Brüssel angemeldet"", sagte die Sprecherin. Die Erfolgsaussichten eines Antrags von GM auf Staatshilfen für Opel bewertete Brüderle nicht direkt. Der Wirtschaftsminister sagte lediglich, GM habe ""wie jedes andere Unternehmen auch"" das Recht, Staatshilfen zu beantragen. Ein rechtlicher Anspruch auf Hilfen vom Staat bestehe aber nicht. "
12.02.2010 09:53 Uhr,Stagnation im vierten Quartal in Deutschland,Konjunkturerholung ins Stocken geraten,"Im Vorjahresvergleich war die Wirtschaftsleistung laut Bundesamt in allen Quartalen 2009 rückläufig. Das preisbereinigte BIP ging im vierten Quartal im Vergleich mit dem Vorjahresvierteljahr um 1,7 Prozent zurück. Kalenderbereinigt war der Rückgang mit 2,4 Prozent noch stärker, da im Berichtsquartal 2,1 Arbeitstage mehr zur Verfügung standen. Positive Impulse kamen im Vorquartalsvergleich lediglich vom Außenhandel, wie die Statistiker berechneten. Während die Exporte wieder zulegten, waren die Importe rückläufig. Die Konsumausgaben und die Investitionen gingen zurück und bremsten so das Wirtschaftswachstum. "
12.02.2010 02:14 Uhr,Prognose der KfW für 2010,Unternehmenskredite werden knapper,"Für die deutschen Unternehmen wird der Zugang zu Krediten in diesem Jahr nach Einschätzung der Förderbank KfW noch schwieriger. Auf der einen Seite drückten sinkende Umsätze und Gewinne auf die Kreditwürdigkeit der Firmen. Andererseits verschärfe sich die Eigenkapitalknappheit bei Banken. Auch Kunden von Sparkassen und Genossenschaftsbanken, den Hauptfinanzierern des Mittelstands, müssten voraussichtlich mit Einschränkungen rechnen. ""Es besteht die Gefahr, dass der Finanzierungsbedarf im konjunkturellen Aufschwung nicht gedeckt werden kann"", warnt KfW-Chefvolkswirt Norbert Irsch. Die Erwartungen an die künftige Kreditvergabe sind noch düsterer: Drei Viertel der Befragten rechnen mit einer Verschlechterung beim Zugang zu Investitionskrediten. Im August waren noch 63 Prozent dieser Ansicht. Der aktuelle Wert ist so hoch wie seit einem Jahr nicht mehr. Von einer totalen Kreditknappheit will Irsch dennoch nicht sprechen. ""Eine flächendeckende Kreditklemme haben wir derzeit nicht"", betonte der KfW-Ökonom. Diese existiere erst dann, wenn ein typisches Unternehmen einer Branche Probleme habe, Darlehen zu erhalten. Im vergangenen Jahr sei bei Banken aber noch kein ungewöhnlich restriktives Kreditvergabeverhalten festzustellen gewesen. Der Anteil der Firmen, deren Darlehen abgelehnt worden sei, lag 2009 mit 19 Prozent in etwa auf dem Niveau von 2004, als sich die Wirtschaft von der letzten größeren Krise erholte. ""Die Ablehnungsquote im Jahr 2009 war angesichts der Schwere der Wirtschaftskrise eigentlich erstaunlich gering"", so der KfW-Chefvolkswirt. So sei etwa das 40 Milliarden Euro Konjunkturprogramm der KfW bislang nur zum Teil ausgeschöpft. Zudem prüft die Regierung Garantien für Kreditverbriefungen bei Banken. Die Deutsche Bank plant zudem einen insgesamt 500 Millionen Euro großen Fonds, aus dem Firmen Eigenkapital zur Verfügung gestellt werden soll. "
11.02.2010 22:23 Uhr,Marode Staatsfinanzen in Irland,"Mit ""masochistischem"" Sparkurs aus der Krise","Die Iren hat die Finanzkrise schwer getroffen, die Neuverschuldung kletterte auf zwölf Prozent des Bruttoinlandprodukts. Doch anstatt mit öffentlichen Geldern die Wirtschaft anzukurbeln und auf finanzielle Hilfen zu hoffen, entschlossen sich die Iren zu einem radikalen Sparkurs. Von Barbara Wesel, RBB-Hörfunkstudio London Die Iren haben schließlich schnell und entschlossen gehandelt, um sich an den eigenen Haaren aus dem Sumpf zu ziehen. Kaum hatte der Zusammenbruch der Finanzmärkte die vormals boomende irische Wirtschaft mit in seinen Strudel gerissen, griff die Regierung in Dublin auch schon zu drastischen Gegenmaßnahmen. Anders als nach der gängigen Lehre bei den großen Nachbarn Großbritannien, Deutschland und Frankreich, versuchte man sich nicht durch Ausgabenprogramme aus der Rezession zu befreien. Stattdessen ging es an den öffentlichen Haushalt. Etwas anderes war auch kaum möglich: Durch die Bankenrettung schoss die Neuverschuldung auf rund zwölf Prozent des Bruttoinlandsprodukts. Rund 77 Milliarden Euro faule Kredite sind inzwischen in einer Bad Bank gelagert. Eigenes Geld drucken, so wie die Briten, können die Iren nicht mehr, seit sie den Euro haben. Was Lenihan seinen Bürgern zumutet, ist wirklich dramatisch: minus zehn Prozent beim Kindergeld, minus vier Prozent bei der Arbeitslosenhilfe, minus 15 Prozent bei den Bediensteten im öffentlichen Dienst. Polizisten klagen mittlerweile, dass sie im Monat über 200 Euro weniger in der Tasche haben, bei den Lehrern wirken sich die Kürzungen noch härter aus. Ann English hat am Monatsende rund 400 Euro weniger auf dem Konto. ""Ich bin total wütend! Ich fühle mich schlecht gemacht"", empört sie sich. Die Sozialpartnerschaft in Irland wird auf eine harte Probe gestellt. Inzwischen kündigte die Regierung auch Steuererhöhungen für Reiche an. Außerdem kürzte sie sich selbst die Bezüge, um mit gutem Beispiel voran zu gehen. Doch mit den Sparmaßnahmen würden vor allem die Ärmeren getroffen, sagt Fintan O'Toole von der ""Irish Times"": ""Wir werden eine Rückkehr der Armut im Land sehen - und eine Rückkehr der Auswanderung. Die Regierung sagt, die Schnitte sind nötig, um das Vertrauen in die Wirtschaft wieder herzustellen."" Aber Armut und Emigration hätten sicherlich kein gesteigertes Vertrauen in die Regierung zur Folge, meint O'Toole. Und das ist das Problem: Die Regierung in Dublin hofft, dass die Finanzmärkte den brutalen Sparkurs honorieren werden und das Kredit-Rating des Landes nicht herunter setzen. Damit würde es nämlich noch teurer, die Schulden zu bedienen. Aber was sehen die bekanntermaßen gnadenlosen Finanzmärkte in Irland? Es ist ein kleines Land in einer tiefen Rezession. Das Ergebnis des Experiments ist offen. "
11.02.2010 18:34 Uhr,Weitergabe von EU-Bankdaten,SWIFT hofft auf Einigung zum Datenaustausch,"Der Finanzdienstleister SWIFT hat die bisherige Zusammenarbeit mit Anti-Terrorfahndern aus den USA verteidigt. Der Zugang zu den Bankdaten sei durch hohe Hürden begrenzt. Für das Unternehmen fehle nun der ""rechtliche Rahmen"". Von Christopher Plass, HR-Hörfunkstudio Wiesbaden Jeder, der eine Auslandsüberweisung macht, hat mit SWIFT zu tun. Er muss den sogenannten BIC-Code eintragen, eine Art internationale Bankleitzahl. Diese wird von SWIFT vergeben. Die weltweit operierende Genossenschaft von rund 8000 Banken und Finanzinstituten sorgt dann für die Überweisung: täglich rund elf Millionen mal, weltweit und vor allem mit großen Summen. Die Genossenschaft hat ihren Sitz in Belgien. Früher wurden die Transaktionen über Operationszentren in den Niederlanden und den USA abgewickelt. In beiden Zentren lagen identische Datensätze. Damit kamen amerikanische Anti-Terror-Fahnder mithilfe von Beschlagnahme-Anordnungen an ein stattliches Datenvolumen. Erst kürzlich eröffnete SWIFT im Rahmen einer Strukturreform ein neues Zentrum in der Schweiz: Daten innereuropäischer Finanztransaktionen bleiben jetzt in Europa. Die US-Behörden können weiter in Amerika auf einen Teil der transatlantischen Überweisungs-Vorgänge zugreifen, wollen mit dem umstrittenen Abkommen mit der EU aber auch die Europa-internen Daten weiter im Blick behalten können. SWIFT beteuert, dass der Datenschutz schon heute groß geschrieben werde, egal welche Bestimmungen ein Abkommen der EU mit den USA enthalten wird. Mit den Transaktionen würden ohnehin nur begrenzt Daten ausgetauscht, sagt SWIFT-Manager Kothe: ""Was wir heute austauschen, sind Instruktionen zwischen Banken. Das heißt Überweisungen vom Konto einer Bank A zu einer Bank B oder eines Kunden einer Bank zum Empfänger. Oder Wertpapieraufträge oder Kontoauszüge. Was wir bei SWIFT nicht halten, sind Informationen zum Konto oder zum Depot."" Und wenn US-Anti-Terror-Fahnder eine Anfrage starteten, so die Version von SWIFT, gebe es hohe Hürden: ""Es muss ein konkreter Verdacht vorliegen, der einem Dritten und uns und einer entsprechenden Aufsicht, die wir hinzugenommen haben, klar macht, dass es hier Terrorismus-Finanzierung gibt und dass die Daten relevant sind, um Terrorismus-Finanzierung zu unterbinden."" Unabhängige Prüfer und letztlich betroffene Mitgliedstaaten seien immer einbezogen. Dennoch sind Zweifel der Datenschützer angesichts des angestrebten Abkommens nicht verstummt. SWIFT räumt ein, dass man keinen Einfluss darauf habe, was die US-Behörden mit den Daten mache und wer noch an die Daten herankommen könnte. Nach den Diskussionen der vergangenen Wochen steht SWIFT unter verschärfter öffentlicher Beobachtung. Das bringt manche zu der Einschätzung, dass jemand, der wirklich Geld für Terror-Aktionen transferieren möchte, andere Wege suchen dürfte. "
11.02.2010 16:52 Uhr,Bankenabkommen abgelehnt,Europaparlament stoppt SWIFT-Abkommen,"Das Europaparlament hat das umstrittene SWIFT-Abkommen über die Weitergabe von EU-Bankdaten an die USA gestoppt. Mit 378 zu 196 Stimmen lehnten die Abgeordneten die Vereinbarung ab. Parlamentspräsident Jerzy Buzek erklärte nach der Abstimmung: ""Die Mehrheit ist der Ansicht, dass die richtige Balance zwischen Sicherheit auf der einen Seite und dem Schutz der Bürger- und Grundrechte auf der anderen Seite nicht gewährleistet ist."" Der Vertrag, der bereits am 1. Februar vorübergehend in Kraft getreten war, ist damit ausgesetzt. Die Vereinbarung hatte zum Ziel, US-Terrorfahndern Zugriff auf die Bankdaten von Millionen europäischen Bürgern zu geben, die über den globalen Finanzdienstleister SWIFT verrechnet werden. Datenschützer hatten gewarnt, dass theoretisch damit jeder EU-Bürger ins Visier der US-Fahnder gelangen könnte. Nun müssen die zuständigen Behörden in den USA in jedem Einzelfall einen Antrag bei SWIFT stellen. Die USA äußerten sich ""enttäuscht"" über das Veto des Europaparlaments. Dies sei ein Rückschlag für die Zusammenarbeit zwischen den USA und der EU im Kampf gegen den Terrorismus, so die US-Vertretung in Brüssel. Mit dem Aussetzen des Vertrags werde ein wichtiges Anti-Terror-Programm unterbrochen. Dank der vom Finanzdienstleister SWIFT bisher an die USA übermittelten Daten hätten die US-Behörden den europäischen Regierungen ""mehr als 1500 Berichte und zahlreiche Hinweise"" geliefert. Da das Parlament nach dem jetzt geltenden Vertrag von Lissabon über Abkommen im Justizbereich mitentscheiden darf, schloss die schwedische EU-Ratspräsidentschaft im vergangenen Jahr mit den USA zunächst ein Übergangsabkommen. Im Dezember soll es von einem endgültigen Vertrag abgelöst werden. Auch in der Bundesregierung hatte das Abkommen für Zwist gesorgt. Justizministerin Sabine Leutheusser-Schnarrenberger lehnte den Vertrag ab. Innenminister Thomas de Maizière hatte dagegen den Weg zu der Vereinbarung mit einer Enthaltung im EU-Ministerrat frei gemacht. Das Abkommen sei besser als die bisherige Rechtsgrundlage. Vor der Abstimmung des EU-Parlaments hatten die USA die Europa-Abgeordneten stark unter Druck gesetzt. Unter anderem schrieben Außenministerin Hillary Clinton und Finanzminister Timothy Geithner an Parlamentspräsident Buzek. "
11.02.2010 16:52 Uhr,EU-Sondergipfel zu Griechenland,"Keine finanzielle, aber ""entschlossene"" Hilfe","Im Kampf gegen den Staatsbankrott wollen die EU-Staaten Griechenland kein Geld geben, dafür aber politische Unterstützung gewähren. EU-Ratspräsident Van Rompuy erklärte auf dem Sondergipfel in Brüssel, die Gemeinschaft werde entschlossen handeln, wenn es notwendig sei. Von Peter Heilbrunner, SWR-Hörfunkkorrespondent Brüssel Mit einem entschlossenen Sowohl-Als-Auch wollen die Staats- und Regierungschef der Europäischen Union der griechischen Krise begegnen. Ja, die 16 Länder mit dem Euro als Währung werden Griechenland nicht hängen lassen, erklärte EU-Ratspräsident Herman Van Rompuy kurz nach Beginn des Gipfeltreffens: ""Wenn es notwendig ist, werden die Länder der Eurozonen entschlossene und koordinierte Maßnahmen ergreifen, um die Stabilität des Währungsraumes sicherzustellen."" Um finanzielle Unterstützung habe die griechische Regierung aber gar nicht gebeten. Das heißt aber auch: Es gibt keinen ausgearbeiteten Rettungsplan für Griechenland – nur das Signal an die Spekulanten und die Finanzmärkte: Wir stehen hinter der Regierung in Athen. Damit hat die Bundesregierung und namentlich Bundeskanzlerin Angela Merkel ihr Ziel erreicht. Sie wollte verhindern, dass den Griechen bereits zu diesem frühen Zeitpunkt beigesprungen wird. In der derzeitigen Situation müsse erst einmal die Führung in Athen ihre Hausaufgaben machen. ""Griechenland ist Teil der Europäischen Union, Griechenland wird nicht alleine gelassen"", sagte Merkel vor Beginn des Gipfels. Zugleich stellte sie klar: ""Es gibt Regeln, und diese Regeln müssen auch eingehalten werden. Auf dieser Grundlage werden wir eine Erklärung verabschieden."" Diese Erklärung passt dann auf ein zartrosa DINA4 Blatt, mit dem der Vorsitzende der Gipfelrunde, van Rompuy, vor die Tür trat. Ob die dürren Sätze aber ausreichen, um die Börsianer zu beruhigen, ist zweifelhaft. Der Euro hat seine Talfahrt erst einmal fortgesetzt. Schon in wenigen Tagen werden die Gespräche über eine mögliche Stützung Griechenlands weitergehen. Anfang kommender beraten die EU-Finanzminister über das Sparprogramm Athens. ""Wir unterstützen die Bemühungen der griechischen Regierung"", verteidigte van Rompuy die Liste der Grausamkeiten, gegen die in Athen abermals Tausende auf die Straße gingen. Die EU begrüße, dass darüber hinaus neue Sparmaßnahmen angekündigt worden seien. Es ist dies die psychologisch-politische Rückendeckung, die sich der griechische Ministerpäsident Giorgos Papandreou per Zeitungsinterview gewünscht hatte. Der Sozialdemokratische Regierungschef muss nicht nur das ausufernde Defizit von fast 13 Prozent der Wirtschaftsleistung drücken, sondern auch gegen die Demonstranten auf der Straße ankämpfen. Einschnitte bei der Rente, Lohnkürzungen im öffentlichen Dienst und Maßnahmen gegen den grassierenden Steuerbetrug sind nicht wirklich populär. "
11.02.2010 15:50 Uhr,EU-Sondergipfel zu Griechenland,"Rückendeckung ja, Geld nein","Die EU hat sich auf einem Sondergipfel in Brüssel auf Unterstützung für das vom Staatsbankrott bedrohte Griechenland verständigt, will aber vorerst keine Finanzhilfe leisten. EU-Ratspräsident Van Rompuy erklärte, die EU sei bereit, Griechenland notfalls zu helfen. Zunächst aber sei das Land aufgefordert, seine ""ambitionierten"" Sparziele für 2010 und in den Folgejahren ""rigoros und entschlossen"" umzusetzen. Das Defizit müsse 2010 um vier Prozentpunkte im Vergleich zum Vorjahresdefizit von 12,7 Prozent gesenkt werden, sagte van Rompuy. Kommission und Europäische Zentralbank (EZB) würden die Anstrengungen Athens streng überwachen; im März werde es eine erste Analyse geben. Der Ratspräsident unterstrich, Griechenland habe nicht um Finanzhilfe gebeten. Vielmehr habe der griechische Ministerpräsident Giorgos Papandreou zusätzliche Anstrengungen vorgestellt, um aus eigener Kraft den Staatsbankrott abzuwenden. Die Mitglieder der Euro-Zone würden aber ""falls notwendig entschlossene und abgestimmte Maßnahmen ergreifen, um die Stabilität in dem gesamten Währungsraum sicherzustellen"". ""Griechenland wird nicht alleingelassen"", sagte Bundeskanzlerin Angela Merkel. ""Aber die Regeln müssen eingehalten werden"", fügte sie hinzu. Papandreou sagte der französischen Zeitung ""Le Monde"" zufolge, sein Land benötige psychologische wie politische Unterstützung aus Europa. ""Wenn die Spekulation anhält, ist das nicht nur eine Sache von Griechenland, sondern der Euro-Zone und Europas."" Die EU ist in einer heiklen Lage, denn laut EU-Vertrag dürfen die Euro-Länder nicht untereinander für andere einspringen. Der EZB ist es sogar untersagt, Euro-Staaten direkt Kredite zu gewähren. Möglich wären zwar bilaterale Kredite einzelner Staaten. Diese sind aber zum Beispiel in Deutschland umstritten. Als Alternativen sind auch ein Eingreifen des Internationalen Währungsfonds (IWF) oder der Kauf griechischer Staatsanleihen in der Debatte. An den Finanzmärkten setzen grassierende Spekulationen über einen Staatsbankrott des Landes den Euro seit Wochen unter Druck. Nicht nur Griechenland, auch andere hoch verschuldete Euro-Länder wie Portugal und Spanien müssen den verunsicherten Anlegern inzwischen mehr Zinsen für ihre Staatspapiere zahlen, was die Verschuldung noch weiter in die Höhe treibt. "
11.02.2010 12:37 Uhr,Positivere Einschätzung am Arbeitsmarkt,Zahl der offenen Stellen leicht gestiegen,"""Deutliche Zuwächse gab es nicht nur bei den sofort zu besetzenden Stellen, sondern vor allem bei den später zu besetzenden Arbeitsplätzen"", erklärte Heckmann. ""Das ist ein Hinweis darauf, dass die Unternehmen ihre wirtschaftliche Lage längerfristig wieder positiver einschätzen."" Allerdings gab es insgesamt immer noch 149.000 weniger offene Stellen als im vierten Quartal 2008. Der Anstieg bei den offenen Stellen fand ausschließlich in Westdeutschland statt. In Ostdeutschland ging die Zahl dagegen leicht zurück. Die weniger exportabhängige ostdeutsche Wirtschaft sei von der Wirtschaftskrise bisher in geringerem Ausmaß betroffen gewesen als der Westen, erklärte Heckmann. Dies gelte nun jedoch auch für die allmähliche Erholung der Weltwirtschaft. Das IAB erfasst viermal jährlich das gesamte Stellenangebot, also auch jene Stellen, die nicht den Arbeitsagenturen gemeldet werden. Im vierten Quartal 2009 wurden rund 15.000 Arbeitgeber befragt. "
