date,topline,headline,content09.02.2010 15:52 Uhr,Urteil des Bundesverfassungsgerichts,Hartz-IV-Sätze sind verfassungswidrig,"Die seit 2005 geltenden Hartz-IV-Regelsätze für Erwachsene und Kinder verstoßen gegen das Grundgesetz. Das entschied das Bundesverfassungsgericht in Karlsruhe. Die Leistungen seien nicht korrekt ermittelt worden. Nach dem von Gerichtspräsident Hans-Jürgen Papier verkündeten Urteil genügten die gesetzlichen Vorschriften nicht dem Grundrecht auf Gewährleistung eines menschenwürdigen Existenzminimums nach Artikel 1 des Grundgesetzes. Zudem verstoßen sie gegen das in der Verfassung garantierte Sozialstaatsprinzip, hieß es zur Begründung. Die bisherigen Regelungen dürfen aber bis zum Jahresende weiter gelten. Der 1. Senat gab dem Gesetzgeber auf, zum 1. Januar 2011 die Berechnungsgrundlage neu zu regeln. Die Richter ließen in ihrer Entscheidung aber ausdrücklich offen, ob das Arbeitslosengeld II erhöht werden muss oder nicht. Zudem ordneten die Richter an, dass Hartz-IV-Empfänger ab sofort in seltenen Ausnahmefällen Zusatzleistungen erhalten müssen. Das gilt etwa bei Krankheiten, für die Kranken- und Sozialkassen keine Kosten übernehmen. Nach Ansicht des Verfassungsgerichts ist das zur Bedarfsermittlung von Hartz-IV-Empfängern gewählte ""Statistikmodell"" ein geeignetes Berechnungsverfahren. Allerdings sei in der Praxis immer wieder abgewichen worden. So sei die Koppelung an den aktuellen Rentenwert sachwidrig. Die Karlsruher Richter bemängelten weiter, dass ein kinderspezifischer Bedarf überhaupt nicht ermittelt werde. Die Festsetzung des Sozialgelds für Kinder auf 60 Prozent der Erwachsenen beruhe auf keiner vertretbaren Methode zur Bestimmung eines menschenwürdigen Existenzminimums. Dies umfasse neben der ""physischen Existenz"" auch ein ""Mindestmaß an Teilhabe am gesellschaftlichen, kulturellen und politischen Leben"". Für unabweisbare besondere Notwendigkeiten, etwa Kleidung in Übergröße oder Klassenfahrten, sei eine Härte-Klausel erforderlich. Generell schreibe das Grundgesetz keine bestimmte Methode der Bedarfsermittlung für Hartz-IV-Bezieher vor, führte Gerichtspräsident Papier weiter aus. Der Gesetzgeber sei aber von Verfassungs wegen verpflichtet, alle existenznotwenigen Aufwendungen folgerichtig in einem transparenten und sachgerechten Verfahren nach dem tatsächlichen Bedarf, also realitätsgerecht, zu bemessen. Dem müssten verlässliche Zahlen und schlüssige Berechnungsverfahren zugrunde liegen. Das Bundessozialgericht und das Landessozialgericht Hessen hatten Zweifel an der bisherigen Berechnungsmethode angemeldet und deshalb Karlsruhe zur höchstrichterlichen Klärung angerufen. Zugrunde lagen drei Verfahren von Langzeitarbeitslosen, die ihre Kinder mit den bisherigen Regelsätzen nicht ausreichend versorgt sahen. Bisher werden die Regelsätze für die Kinder von Hartz-IV-Beziehern rein prozentual von dem alleinstehender Erwachsener abgeleitet. Die Kläger und auch die gerichtlichen Vorinstanzen bemängelten, dass kein eigener Bedarf der Kinder errechnet werde, obwohl diese häufiger neue Kleidung bräuchten und für sie auch Bildungsausgaben anfielen. Der monatliche Hartz-IV-Regelsatz für einen alleinstehenden Erwachsenen beträgt derzeit 359 Euro; Ehepaare oder Paare in eheähnlichen Beziehungen erhalten pro Person 323 Euro. Kinder bekommen davon je nach Alter 60 bis 80 Prozent. In Deutschland sind 6,7 Millionen Menschen auf das Arbeitslosengeld II angewiesen. (Aktenzeichen: Bundesverfassungsgericht 1 BvL 1/09, 1 BvL 3/09 und 1 BvL 4/09) "
09.02.2010 15:10 Uhr,Autoexperte Bratzel im Interview,"""Sanierung ist nie abgeschlossen""","Selbst wenn Opel sich mit der jetzt vorgelegten Sanierung retten kann - die Probleme des Autobauers bleiben bestehen. Das sagt Autoexperte Bratzel im Gespräch mit tagesschau.de. Für die Zukunft könne in der Autobranche aber ohnehin niemand Garantien für den Erhalt von Standorten übernehmen. tagesschau.de: Herr Bratzel, der Opel-Sanierungsplan ist nun auch offiziell übergeben - wird es der letzte sein? Stefan Bratzel: In der Autobranche ist die Sanierung inzwischen eine Daueraufgabe geworden. Das heißt: Die Sanierung ist nie abgeschlossen. Das gilt nicht nur für Opel, es gilt für nahezu alle Autobauer. tagesschau.de: Was müsste geschehen, damit Opel dauerhaft - oder zumindest für länger - aus der Krise rauskommt? Bratzel: Dauerhaft schafft man es, wenn man sich von den Produkten wie von den Kosten her am Markt ausrichtet. Opels Mutterkonzern GM müsste sich nur an Ford ein Beispiel nehmen, übrigens dem einzigen US-Autobauer, der in der letzten Krise keine Hilfen in Anspruch nehmen musste. Ford hat kostensparend Autos entwickelt, die sich verkauft haben. tagesschau.de: Aber Opel hat doch auch Autos gebaut, die sich verkauft haben. Bratzel: Man muss aber mit den Autos auch Geld verdienen. Das ist Opel nicht ausreichend gelungen. Immerhin hat Opel-Chef Nick Reilly jetzt aber angekündigt, wie viel Geld in die Sanierung fließen soll: Das sind bis 2014 elf Milliarden Euro. tagesschau.de: Davon soll einiges vom Steuerzahler kommen, in Form von Staatshilfen und Bürgschaften. Hessens Ministerpräsident Roland Koch hat sich bereits zu Wort gemeldet: Der Opel-Beitrag reiche nicht aus. Er fordert, dass der Mutterkonzern GM größere Opfer bringt ... Bratzel: Ich bin mit Herrn Koch einig: 600 Millionen Euro als Sanierungsbeitrag von Opel sind nicht besonders viel. Und die Politik muss sich gut überlegen, ob sie Mittel zur Verfügung stellt. tagesschau.de: Opel macht den Standort Antwerpen dicht, will mehr als 3000 Stellen in Deutschland streichen. Können die deutschen Standorte dadurch gehalten werden? Bratzel: Das wird sich erst noch zeigen müssen. Es gibt in der Autobranche keinerlei Garantien auf Standorte oder Arbeitsplätze mehr. Was heute als Sanierungsplan übergeben wurde, ist nur eine Momentaufnahme. Das Problem des Überangebots auf dem Automarkt besteht weiterhin. Die Fragen stellte Christian Radler, tagesschau.de "
09.02.2010 14:48 Uhr,Sanierungsplan für Opel vorgestellt,Staatshilfe beantragt - Stellenabbau angekündigt,"Deutschland soll sich mit 1,5 Milliarden Euro an der Sanierung des angeschlagenen Autobauers Opel beteiligen. Bundeswirtschaftsminister Rainer Brüderle bestätigte, dass ein entsprechender Antrag bei der Bundesregierung gestellt worden sei. Dieser werde nun geprüft. Europaweit sollen insgesamt 8300 der knapp 50.000 Arbeitsplätze abgebaut werden - betroffen sind 1300 Stellen in der Verwaltung und 7000 in der Produktion. Opel bekräftigte auch die Absicht, das Werk im belgischen Antwerpen schließen zu wollen. Weitere Staatshilfe will die US-Mutter General Motors (GM) auch in den anderen europäischen Ländern mit Opel-Standorten einsammeln. Der Konzern hofft auf rund 2,7 Milliarden Euro. GM beziffert die Sanierungskosten für die europäische Tochter Opel/Vauxhall auf 3,3 Milliarden Euro. Der Mutterkonzern will im Zuge der Sanierung von Opel bis 2014 elf Milliarden Euro in den Rüsselsheimer Autobauer investieren. Damit sollen 80 Prozent der Produkte erneuert werden, erläuterte Reilly. Das Konzept wurde gemeinsam mit einem Gutachten einer Wirtschaftsprüfungsgesellschaft der Bundesregierung zugestellt. Reilly räumte ein, dass er sich mit dem Betriebsrat bislang nicht auf einen Beitrag zur Sanierung einigen konnte. Opel hatte die Belegschaft zu einem Lohnverzicht von 265 Millionen Euro pro Jahr aufgefordert. Das lehnen Betriebsräte und Gewerkschaften ab, weil sie das Aus des Standortes Antwerpen nicht mittragen wollen. Opel-Gesamtbetrisbratschef Klaus Franz sagte der Zeitung ""Die Welt"", es sei unklar, wann es zu Verhandlungen über einen Beitrag der Arbeitnehmer kommen werde: ""Es sind keine Gesprächstermine derzeit vereinbart."" Der Betriebsrat fordert als Gegenleistung für den Lohnverzicht eine Beteiligung der Mitarbeiter am Unternehmen. Die IG Metall forderte Bund und Länder auf, den Opel-Sanierungsplan nicht mit Staatsgeldern zu unterstützen. Es bleibe weiter unklar, wie der Autobauer zukunftsfähig gemacht werden solle, kritisierten die für die Opel-Standorte zuständigen Bezirksleiter der IG Metall, Armin Schild und Oliver Burkhard. ""Wir wollen, dass Opel unterstützt wird, wenn ein entsprechendes Konzept vorliegt"", betonte Schild. ""Aber den Plan, den wir kennen, werden wir so nicht unterstützen, insbesondere nicht durch Beiträge der Arbeitnehmer."" Beide forderten, das Opel-Management müsse frühere Zusagen einhalten und die Pläne für eine Schließung des Opel-Werks Antwerpen zurücknehmen. Die Politik reagierte mit Kritik. ""Nach unserer ersten Einschätzung wird es geboten sein, dass GM als Eigentümer seine Beteiligung an der Sanierung und Neuaufstellung deutlich erhöht"", ließ Hessens Ministerpräsident Roland Koch mitteilen. Die Grünen lehnten eine Bürgschaft des Bundes für die Opel-Sanierung ab. ""Ein Opel-Zuschuss durch den Bund ist falsch"", sagte der Vize-Chef der Grünen-Bundestagsfraktion, Fritz Kuhn, der dpa. Der Bund sollte lieber die ökologische Modernisierung der gesamten Autoindustrie unterstützen. Anders sehe es in den Bundesländern mit Opel-Standorten aus: ""Ob es Landeszuschüsse geben soll, hängt von einem Gesamtkonzept der Länder ab"", sagte Kuhn. Die Linke forderte eine härtere Gangart der Bundesregierung gegenüber dem General-Motors-Management. Es sei nicht vermittelbar, wenn mit Steuermitteln die massenhafte Entlassung von Steuerzahlern subventioniert werde, sagte Vize-Parteichef Klaus Ernst. Eine mögliche Bürgschaft müsse mit einer Jobsicherung verbunden werden. "
09.02.2010 12:08 Uhr,Trotz leichter Erholung am Ende des Krisenjahres,Deutschland nicht mehr Exportweltmeister,"Nach einem drastischen Einbruch der Ausfuhren im Krisenjahr 2009 hat Deutschland den Titel des Exportweltmeisters an China verloren. Die deutschen Ausfuhren sanken 2009 im Vergleich zum Vorjahr um 18,4 Prozent auf einen Wert von 803,2 Milliarden Euro. Die Importe gingen demnach in diesem Zeitraum um 17,2 Prozent auf einen Wert von 667,1 Milliarden Euro zurück. Beides entspricht laut Bundesamt dem höchsten Rückgang in der Außenhandelsstatistik seit 1950. Im Dezember deutete sich jedoch eine Trendwende an: Der Wert der Ausfuhren lag erstmals seit mehr als einem Jahr wieder über dem des Vorjahresmonats, wie das Statistische Bundesamt in Wiesbaden mitteilte. Im Dezember wurden von Deutschland Waren im Wert von 69 Milliarden Euro ausgeführt und stiegen damit um 3,4 Prozent gegenüber Dezember 2008. "
09.02.2010 11:13 Uhr,Fragen und Antworten zu Hartz IV,Was bedeutet das Urteil für Hartz-IV-Empfänger?,"Mit ihrem Urteil zur Höhe der Hartz-IV-Leistungen haben sich die Karlsruher Richter zu den Eckpfeilern des deutschen Sozialsystems geäußert. Die Richter haben zwar nicht die Höhe der Zahlungen festgelegt, die Politik muss trotzdem nachbessern. tagesschau.de hat die wichtigsten Fakten zusammengestellt. Die Hartz-IV-Regelsätze für Kinder und Erwachsene müssen neu berechnet werden. Die bisherige Regelung verstößt nach Ansicht der Richter gegen das Grundgesetz. Kritik übten sie vor allem an der Berechnungsmethode. Diese sei nicht transparent genug, erklärten die Richter. Ob die Bezieher von Arbeitslosengeld II aufgrund des Urteils mehr Geld bekommen müssen, hat das Verfassungsgericht offen gelassen. Die Richter kritisierten lediglich die Berechnungsmethode. Das Verfassungsgericht hat dem Gesetzgeber eine Frist bis zum 31. Dezember 2010 gesetzt. Bis dahin sind die aktuellen Bestimmungen weiter gültig. Betroffen sind rund 6,7 Millionen Hartz-IV-Empfänger. Darunter sind etwa 1,7 Millionen Kinder, die staatliche Gelder im Rahmen von Hartz IV erhalten. Die Grundsicherung für alleinstehende Erwachsene betrug im Jahr 2005 zunächst 345 Euro, heute sind es 359 Euro pro Monat. Kinder ab 14 Jahren bekommen mit 287 Euro 80 Prozent des Erwachsenen-Satzes. Für Kinder im Alter zwischen sechs und 13 Jahren sind 251 Euro, für Kinder bis fünf Jahre 215 Euro angesetzt. Ausgezahlt als Hartz IV wird jedoch weniger, weil das Kindergeld angerechnet wird. Neben diesem Fixbetrag übernimmt der Staat auch die Wohnungskosten. Für Schwangere und Alleinerziehende werden Zuschläge gezahlt. Außerdem werden auch manche Extrakosten übernommen, beispielsweise Beiträge für Klassenfahrten. Das Bundessozialgericht in Kassel hat sich bereits mehrfach mit den Regelleistungen für Erwachsene befasst, verändert wurden sie jedoch nicht. Anfang 2009 rügte das Gericht allerdings, dass die Leistungen für Kinder pauschal von den Leistungen für Erwachsene abgeleitet würden. Schließlich hätten Kinder ganz andere Bedürfnisse als Erwachsene – etwa Spielsachen, Schulmaterial oder den Ersatz für zu klein gewordene Schuhe. Zusammengestellt von Andreas Wallbillich für tagesschau.de "
08.02.2010 14:40 Uhr,60 Jahre Israel,Ein Land in sechs Porträts,60 Jahre Israel - das sind 60 Jahre Konflikt mit den muslimischen Nachbarn. Israel ist jedoch weit mehr als nur ein Land im permanenten Kriegszustand: Der kleine Staat ist die einzige Demokratie im Nahen Osten - und entsprechend bunt ist die Gesellschaft. Die ARD-Hörfunkkorrespondenten Clemens Verenkotte und Sebastian Engelbrecht zeichnen zum Jahrestag am 8. Mai in sechs Porträts ein Bild des modernen Israels. 
08.02.2010 12:57 Uhr,Fragen und Antworten,Warum müssen Jobcenter reformiert werden?,"Nach der Einigung zwischen Bundesarbeitsministerin Ursula von der Leyen und den Unions-Ministerpräsidenten über eine Änderung des Grundgesetzes scheint die seit Jahren angemahnte Reform der Jobcenter endlich möglich. Warum sie nötig ist und wo die Konfliktlinien verlaufen, fasst tagesschau.de zusammen. In den sogenannten Jobcentern und Arbeitsgemeinschaften (Argen) überschneiden sich die Zuständigkeiten von Bund und Kommunen bei der Betreuung von Hartz-IV-Empfängern und von Langzeitarbeitslosen. Im Jahr 2007 urteilten die der Karlsruher Verfassungsrichter, diese Mischform verstoße gegen das Grundgesetz, weil der Grundsatz der kommunalen Selbstverwaltung nicht gewährleistet sei. Außerdem sei für die Bürger nicht mehr erkennbar, wer für die Wahrnehmung staatlicher Aufgaben zuständig ist. Bis 2011 soll dieser Missstand beseitigt sein. Diejenigen, die nun eine Änderung des Grundgesetzes statt einer Reform der Jobcenter fordern, betonen vor allem die Nachteile, die eine (auch räumliche) Trennung der Zuständigkeiten für die Betroffenen hätte: Eine zusätzlich zu schaffende Behörde bedeute automatisch auch zusätzliche Bürokratie mit noch zu definierenden Strukturen und Arbeitsvorgängen, sagen sie, und berge die Gefahr von Doppelarbeit. All das gehe zu Lasten der Hilfeempfänger. Gerade in diesen wirtschaftlich schwierigen Zeiten sei das nicht zumutbar und schwerlich zu erklären. Die Chancen stehen gut: Die unionsgeführten Bundesländer sind seit ihrer Einigung mit von der Leyen mit im Boot, die SPD hat bereits ihre Unterstützung für die notwendige Zwei-Drittel-Mehrheit bei der Abstimmung in Bundestag und Bundesrat zugesagt. Noch in dieser Woche wollen von der Leyen und der sächsische Ministerpräsident Stanislaw Tillich (ebenfalls CDU) einen Text zur Gestzesänderung erarbeiten und diesen so schnell wie möglich mit SPD-Fraktionschef Frank-Walter Steinmeier und dem rheinland-pfälzischen Ministerpräsidenten Kurt Beck abstimmen. Grünen-Chef Cem Özdemir hatte von der Leyens Kompromissidee mit der Aufforderung abgewatscht, ""schleunigst"" einen neuen Vorschlag vorzulegen, der auch eine Grundgesetzänderung enthalte. Auch die FDP will für eine Grundgesetz-Änderung stimmen - sofern die Zahl der Optionskommunen erhöht wird, wie Johannes Vogel betont, Arbeitsmarktexperte der Liberalen. Die Ablehnung einer Verfassungsänderung findet auf zwei Ebenen statt. Die eine ist die grundsätzliche Überlegung, ob das Grundgesetz angetastet werden soll, um vermurkste politische Entscheidungen im Nachhinein zu legitimieren. Zu diesen Wahrern der Prinzipien politischen Handelns zählt der CSU-Landesgruppenchef im Bundestag, Hans-Peter Friedrich. Und natürlich spielt auch in dieser Frage Polit-Taktik eine Rolle. Die Union ist für eine Änderung des Grundgesetzes auf die SPD angewiesen - Unionsfraktionschef Volker Kauder mutmaßte bereits, die SPD würde die Chance nutzen, Zwietracht in der schwarz-gelben Regierung zu säen. Mit Kauders Worten: ""Die werden uns doch am Nasenring durch die Arena führen."" Hinter dem Begriff ""Betroffene"" stecken 6,7 Millionen Menschen. So viele Hartz-IV-Empfänger gibt es derzeit. Dazu gehören Langzeitarbeitslose, aber auch Kinder und Arbeitsunfähige. "
08.02.2010 08:33 Uhr,EU-Kommissar Verheugen hört auf,"""In Brüssel kann man etwas bewegen""","Nach zehn Jahren als EU-Kommissar kehrt Günter Verheugen nach Deutschland zurück. Stolz erinnert er sich an seine Zeit als Erweiterungskommissar und bilanziert seine Erfahrung in der EU-Kommission: Man muss auch mal eine Schlacht aufgeben, um einen Krieg zu gewinnen. Sein Nachfolger Oettinger gewöhnt sich gerade ein. Von Birgit Schmeitzner, BR-Hörfunkstudio Brüssel Als EU-Kommissar in Brüssel hat man Macht und das unabhängig von parteipolitischen Zwängen daheim. Günter Verheugen hat es erlebt. Zufrieden zieht er Bilanz nach zehn Jahren als Kommissar, erst für Erweiterung, dann für Industrie. Er sagt: Man kann viel mehr bewegen als jeder Minister daheim, wobei Verheugen an die erste Hälfte seiner Zeit in der europäischen Hauptstadt die besseren Erinnerungen hat: ""Natürlich war die erste Amtszeit, in der ich Erweiterungskommissar war und in der die große Erweiterung nach Osten erfolgreich abgeschlossen werden konnte, ein politischer Höhepunkt, nicht nur in meinem Leben sondern auch im Leben vieler, der so leicht nicht übertroffen werden kann."" Mittlerweile habe sich die Finanz- und Wirtschaftskrise wie ein Schatten auf die politische Arbeit gelegt. Verheugen zufolge hat es sich gerächt, dass die Mitgliedsstaaten immer gegen eine schlagkräftige gemeinsame Wachstums- und Beschäftigungspolitik waren. Allen voran übrigens Deutschland, diesen Seitenhieb kann sich Verheugen nicht verkneifen. Er begrüßt aber auch, dass die Krise ein Umdenken bewirkt hat. Der neue EU-Vertrag sieht vor, dass die Wirtschaftspolitik besser koordiniert werden kann: ""Wir wollen mal gucken, wie das Instrument funktioniert. Ich habe die Hoffnung, dass wir ein höheres Maß an Verbindlichkeit bekommen."" Wie dies aussehen könnte - ob die geplante EU-Strategie 2020 auch Sanktionen vorsehen wird - wird der Sondergipfel in Brüssel am Donnerstag zeigen. Strategie ist das eine, konkrete Vorgaben für Unternehmen das andere. Hier mahnt Verheugen zum Maßhalten, sagt mit Verweis auf Opel, den Streit um Beihilfen und um Standorte: ""Politik ist nicht zuständig für die Entscheidung eines Unternehmens, wo es produziert. Politik ist zuständig für die Rahmenbedingungen, daran soll sie sich halten. Wenn man sich in die Management-Entscheidungen eines Unternehmens einmischt, geht das immer schief."" Und wie sieht es mit der Arbeit innerhalb der Kommission aus? Welche Taktik hat sich da bewährt? Auf diese Frage antwortet Verheugen: Alles im Blick haben, auch die anderen Ressorts, den Mut haben, das Gewicht als größtes EU-Land einzusetzen – ohne die Jahrzehnte alten Ängste zu befördern, dass Deutschland wieder national aufrüstet. ""Man muss manchmal bereit sein, eine Schlacht zu verlieren, wenn man den Krieg gewinnen kann."" Also auch mal nachgeben, wenn am Ende das Ergebnis stimmt. Verheugens Nachfolger als deutscher Kommissar, Günther Oettinger, scheint diesen Ratschlag schon verinnerlicht zu haben. Er sagt: ""Ich will in Brüssel nicht nur repräsentieren, ich will etwas erreichen."" Er glaube, dass man gerade beim Boom-Thema Energie viel bewegen könne. Ansonsten sei Brüssel anders als Stuttgart, ""aber unglaublich lebenswert, dynamisch, multikulturell, europäisch und ich freue mich, noch einmal in eine ganz andere Umgebung eintauchen zu können."" Der Schwabe Günther Oettinger also künftig in Brüssel, sein Namensvetter Günter Verheugen wird künftig in Berlin und in Frankfurt an der Oder sein. Er wird in der Bundeshauptstadt leben und im Osten Brandenburgs, an der polnischen Grenze lehren. Seine Vorlesungsreihe an der Europa-Universität Viadrina trägt den Titel ""Europäisches Regieren"". "
06.02.2010 23:22 Uhr,G7-Finanzminister wollen Wirtschaft weiter stützen,"""Wichtig ist, dass wir uns alle einig sind""","Informeller und vertraulicher wollen die G7, die führenden Industriestaaten, wieder arbeiten, da in der Weltwirtschaftskrise die G20 der wichtigsten Industrie- und Schwellenländer die führende Rolle eingenommen haben. Ein Schritt dazu war das Treffen der Finanzminister im kanadischen Iqaluit am Polarkreis. Im Mittelpunkt standen die Finanzregulierung und die Konjunktur. Von Lena Bodewein, ARD-Hörfunkstudio New York Mit Hundeschlittenfahrten und Iglu-Besichtigungen hatte das Treffen der G7-Finanzminister in Iqaluit begonnen. Die Stadt mit dem Inuit-Namen ""Ort mit vielen Fischen"" liegt hoch oben im Nordosten Kanadas, nahe dem Polarkreis. ""Dass wir hier in die Kälte gekommen sind, hat die Atmosphäre aufgewärmt"", meinte die französische Finanzministerin Christine Lagarde. Hauptthemen des Treffens waren die Finanzregulierung und globale Konjunkturaussichten. Sie alle wollten weiterhin an strikten Reformen für das Finanzsystem arbeiten, sagte der amerikanische Vertreter Timothy Geithner. Ein starker internationaler Rahmen sei Bedingung dafür. Der britische Schatzkanzler Alistair Darling nannte das Treffen einen Meilenstein auf dem Weg zur Erholung der Weltwirtschaft. ""Wichtig ist, dass wir alle uns einig sind, dass wir die Wirtschaft weiter stützen und unterstützen werden, bis wir sicher sein können, dass sie sich erholt hat. Wir können uns erst dann zurückziehen, wenn wir ein lang andauerndes Wachstum gesichert haben."" Staatliche Impulse seien dafür weiterhin notwendig, erklärte der kanadische Finanzminister Jim Flaherty. Doch die Ministerrunde habe auch darüber gesprochen, welche Strategien notwendig seien, um die Konjunkturhilfen wieder zurückzufahren, wenn sich die Wirtschaft im kommenden Jahr gefestigt habe. Lange hätten die Minister über Ressourcen und Reformen von internationalen Finanzorganisationen, um den Armen der Welt zu helfen, gesprochen, erläuterte Flaherty und bezog sich auch auf Haiti: Alle G7-Länder erlassen dem Karibikstaat die bilateralen Schulden, und sie wollen auch dafür sorgen, dass andere Schulden ebenfalls erlassen werden. Das Thema der drohenden Staatspleiten in Europa war noch in letzter Minute auf die Agenda gelangt. Doch, wie Flaherty meinte, das ist nichts, das die G7-Staaten ändern können, sondern liegt in der Verantwortung der Europäischen Union. Dennoch zielen die Beruhigungsmaßnahmen für die globalen Märkte auch darauf ab, die europäische Situation zu verbessern. Der deutsche Finanzminister Wolfgang Schäuble, der den Besuch in Iqaluit als ""unvergesslich"" bezeichnete, lud seine Kollegen zu einer Konferenz am 20. Mai nach Berlin ein. Alle Teilnehmer betonten, dass die G7 nun wieder zu einer informellen, aber umso wirkungsvolleren Runde geworden sind, da die G20 eine stärkere Rolle übernommen haben. Zum Abschluss des Treffens gab es ein Robbenfleisch-Diner. Ein zumindest heikles Abendessen, da die Europäische Union - sehr zum Unverständnis der kanadischen Inuit - im vergangenen Mai ein weitgehendes Handelsverbot für Robbenprodukte erlassen hat. Die Inuit dürfen ihre traditionelle Jagd weiter ausüben. "
06.02.2010 03:47 Uhr,Finanzprobleme in EU-Staaten,Ist der Euro in Gefahr?,"Bundesfinanzminister Wolfgang Schäuble widersprach dieser Einschätzung. ""Der Euro bleibt stabil"", sagte er zum Auftakt des G7-Finanzministertreffens im kanadischen Iqaluit. Die jüngsten Turbulenzen an den weltweiten Kapital- und Devisenmärkten wertete er als übertrieben. ""Griechenland muss die Erfahrung machen, dass, wenn man über lange Zeit die Regeln nicht einhält, man einen hohen Preis zahlen muss"", sagte er. Die EU habe dem Land harte Spar-Auflagen gemacht, damit dessen Staatshaushalt wieder in Ordnung komme. Unterdessen legte die spanische Regierung Vorschläge vor, mit denen sie das wachsende Haushaltsdefizit eindämmen will. Ministerpräsident José Luiz Rodriguez Zapatero setzt dabei auf Arbeitsmarktreformen. Sie sollen Firmen die Einstellung von Mitarbeitern erleichtern. ""Das Ziel sind Jobs und nochmals Jobs, und das so bald wie möglich"", sagte Zapatero. Er will unter anderem Teilzeit-Jobs und Beschäftigung von ungelernten, jungen Arbeitssuchenden stärker fördern. Zudem setzt er auf ein Kurzarbeit-Modell, um den weiteren Anstieg der Arbeitslosenquote zu bremen, die mittlerweile bei rund 19 Prozent liegt. Sowohl Gewerkschaften als auch der spanische Arbeitgeberverband CEOE begrüßten die Vorschläge. "
