date,topline,headline,content08.04.2011 09:44 Uhr,Nach Schlüpfen unter Euro-Rettungsschirm,Erleichterung über Portugals Hilferuf,"Der portugiesische Antrag auf Hilfen des Euro-Rettungsschirms hat überwiegend positive Reaktionen ausgelöst. Bundesfinanzminister Wolfgang Schäuble sprach von einem ""vernünftigen und notwendigen Schritt"" angesichts der wirtschaftlichen und finanziellen Lage des Landes. Bundeswirtschaftsminister Rainer Brüderle forderte ein ""scharfes Anpassungsprogramm"", um die Wettbewerbsfähigkeit Portugals wiederherzustellen. Den Antrag auf Finanzhilfen des Rettungsschirms hätten die Märkte schon lange erwartet, erklärte er in Berlin. Die Europäische Zentralbank (EZB) zeigte sich erfreut über den Hilfsantrag aus Lissabon. ""Wir haben die portugiesischen Behörden ermutigt, um Unterstützung nachzufragen"", sagte EZB-Präsident Jean-Claude Trichet in Frankfurt. Auch die EU-Kommission begrüßte die Entscheidung der portugiesischen Regierung. ""Das ist ein verantwortungsvoller Schritt für die Sicherung der Finanzstabilität im Euro-Raum"", sagte Währungskommissar Olli Rehn der ""Financial Times Deutschland"". EU-Kommissionspräsident José Manuel Barroso sicherte Portugal bereits ""schnellstmögliche"" Hilfe zu. ""Bis dahin können Einzelfragen, zum Beispiel zum Umfang der finanziellen Hilfe, nicht verlässlich beantwortet werden"", sagte Schäuble. Auch der Sprecher der EU-Kommission erklärte, dass sich derzeit nicht genau beziffern lasse, wieviel Geld Portugal benötigt. Experten schätzen Portugals Finanzierungsbedarf auf bis zu 80 Milliarden Euro. Der schwedische Finanzminister Anders Borg kritisierte in scharfer Form, dass die Regierung in Lissabon erst jetzt den Antrag stellt. ""Die hätten schon viel früher Hilfe beantragen sollen"", sagte er in Stockholm. Schweden gehört zwar nicht zur Euro-Zone, beteiligt sich aber mit bilateralen Krediten an der Stützung Irlands. ""Wir haben allen Grund für scharfe Kritik an den Portugiesen. Sie haben sich selbst und Europa in eine sehr schwierige Lage gebracht."" Schon Ende 2010 hätte das hoch verschuldete Land die Hilfe beantragen müssen, sagte Borg. Seinen Schätzung zufolge braucht Portugal in den kommenden Monaten zwischen 15 und 20 Milliarden Euro. Ob auch Schweden Finanzhilfen bereitstelle, ließ der Minister offen. Für die Freigabe von Mitteln des Euro-Rettungsschirms ist EU-Angaben zufolge kein Sondergipfel der Europäischen Union notwendig. Die Euro-Gruppe und der EU-Finanzministerrat könnten alle notwendigen Entscheidungen treffen, teilte die ungarische Regierung mit, die derzeit den EU-Ratsvorsitz innehat. Beim heutigen Treffen der Euro-Gruppe sollen die Finanzhilfen für Portugal und das weitere Vorgehen erörtert werden. Zu dem zweitägigen Treffen im ungarischen Gödöllö kommen die Finanzminister der Euro-Zone und der übrigen EU-Länder zusammen. Eine Entscheidung - etwa über die Höhe der Notkredite für Portugal - ist bei den Gesprächen nicht zu erwarten. Der Ministerrat findet in Ungarn statt, da das Land derzeit die EU-Ratspräsidentschaft inne hat. Ehe das Geld aus dem Euro-Rettungsschirm fließen kann, müssen mehrere Fragen beantwortet werden. So war zuletzt unklar, ob die geschäftsführende Regierung vor den Neuwahlen am 5. Juni verbindlich ein Anpassungs- und Reformprogramm aushandeln kann. Dieses ist die Bedingung für Kredite. Nach Ansicht von Verfassungsexperten in Portugal ist das möglich, wenn der Staatspräsident und alle großen Parteien den Sparplänen verbindlich zustimmen. Die größte Oppositionspartei, die konservativen Sozialdemokraten, erklärte umgehend, das Hilfeersuchen mitzutragen. Die Regierung hat bereits das vor Kurzem im Parlament gescheiterte Konzept in der Schublade liegen. Insofern wird es nach Ansicht der Kommission nicht lange dauern, bis die ersten Gelder fließen können. Eurostaaten mit massiven Haushaltsproblemen können seit dem vergangenen Jahr mit Hilfe des Euro-Rettungsschirms eine drohende Staatspleite abwenden. Kernstück ist der Rettungsfonds EFSF in Luxemburg. Er gibt in einem Notfall an den Finanzmärkten Anleihen heraus, für die die anderen Euro-Staaten bürgen, und reicht das erlöste Geld an den hilfesuchenden Staat weiter. Deutschland steht dabei für mehr als ein Viertel der garantierten Summe gerade. Tatsächliche Kosten für den deutschen Staatshaushalt entstünden aber erst dann, wenn Portugal oder ein anderes hilfesuchendes Land das Geld nicht fristgerecht zurückzahlen kann, das es mit Hilfe des EFSF erhalten hat. Bisher ist Irland das einzige Land, das den Rettungsfonds in Anspruch nimmt. Europäer und IWF schnürten im vergangenen November ein Hilfspaket von 85 Milliarden Euro. Für Griechenland wurde im vergangenen Jahr ein separates Paket mit einem Umfang von 110 Milliarden Euro geschnürt. Der geschäftsführende portugiesische Premierminister José Sócrates hatte am Mittwoch offiziell den Antrag seines Landes auf Hilfen des Rettungsfonds verkündet. "
08.04.2011 05:08 Uhr,Roma in deutschen Städten,"""An den Grenzen des Sozialstaats""","International wird heute der sogenannte Roma-Tag begangen. Die ethnische Minderheit ist gerade in osteuropäischen Staaten von rassistischen Übergriffen bedroht. Kanada gewährte ihnen deshalb Asyl, EU-Länder nicht. Für deutsche Städte wird es immer schwieriger, das Elend der Roma aufzufangen. Von Kristiana Ludwig für tagesschau.de Die Probleme, die Alfred Bornhalm lösen muss, klingen unwirklich in einer Stadt wie Kiel. Dem Sozialamtsleiter wird von Kindern berichtet, die im Winter keine Strümpfe und keine Jacken tragen, die hungrig sind und nicht zum Arzt gehen - denn ihre Eltern könnten ihn nicht bezahlen. Sie leben in den schlechtesten Wohnverhältnissen, die in der schleswig-holsteinischen Stadt bekannt sind: Ganze Familien teilen sich ein einziges Zimmer. Ohne Briefkasten, mit Kakerlaken. Doch Bornhalm kann ihnen offiziell nicht helfen: ""Wir sind an den Grenzen des Sozialstaats"", sagt er. Wie Kiel waren viele deutsche Städte im letzten Jahr mit unterversorgten Haushalten und ""Mangelsituationen"" für Kinder konfrontiert, erklärt der Deutsche Städtetag in einem Brief an die Sozialreferenten seiner Kommunen. Es geht um Familien aus Bulgarien und Rumänien, den beiden Ländern im Übergang zur vollen EU-Mitgliedschaft. Die Städte berichten von Müttern, die ""unmittelbar nach der Entbindung mangels Versicherungsschutzes die Klinik verließen"". Von Frauen, die sich prostituieren, eventuell unfreiwillig. Von Analphabetismus und Gesundheitsproblemen bei den Kindern, in Städten in Hessen und in Berlin. Der Sozialreferent dort berichtet von einer Problematik ""seit Jahren"", wie auch in Mannheim, München und in anderen Städten. „Ein Konflikt wird kommunalisiert“, sagt Bornhalm. Den Konflikt, den er meint, beschreibt der Präsident des Europäischen Forums für Roma und Fahrende, Rudko Kawczynski, so: ""Roma müssen sich de facto wie Illegale verhalten"", dabei hätten sie ""massive Vertreibungen"" in ihren osteuropäischen Heimatländern erlitten. Der europäische Gerichtshof für Menschenrechte fand 2005 Menschenrechtsverletzungen sowohl in Bulgarien, wo Polizisten rassistisch motivierte Morde an Roma begingen und straffrei davon kamen, als auch in Rumänien, wo Pogrome von staatlichen Institutionen stillschweigend akzeptiert wurden. Die Lage habe sich nicht verändert, es gebe Tag für Tag Todesfälle: ""Etikettenschwindel"", nennt Kawczynski den deutschen Umgang mit den Roma. Sie seien keine Migranten, keine gleichgestellten EU-Bürger - sie seien Flüchtlinge. Mittellos. So schätzte auch die kanadische Regierung die Situation von Roma aus Ungarn und der Tschechischen Republik ein und gewährte hunderten Europäern Flüchtlingsstatus. Die Bundesregierung bleibt jedoch bei ihrer Auffassung, es handele sich um Mitgliedsstaaten der Europäischen Union, ""in denen keine politische Verfolgung stattfindet"" - auch wenn Roma in vielen Staaten Europas Diskriminierungen und Benachteiligungen ausgesetzt seien. Die EU hält an ihren Regelungen fest: Bürger dürfen das EU-Land wechseln, wenn sie genug Geld haben, um sich nach Ablauf einer dreimontigen Frist zu versorgen. Sonst verstoßen sie gegen die Freizügigkeitsregeln und können abgeschoben werden. Es hindert sie allerdings kein Gesetz daran, sich dann wieder auf die Reise zu machen. Die europäische Kommission hat jüngst zu einer besseren Integration der europäischen Roma in ihren Heimatländern aufgerufen. Dagegen kritisiert die parlamentarische Versammlung des Europarats deutlich die ewige Wanderung der Roma und die Haltung der EU, Mitgliedsstaaten generell als ""sichere Herkunftsländer"" zu bezeichnen. ""Wir erleben, wie sogenannte Zigeuner geschaffen werden"", sagt Kawczynski. Drei Millionen Menschen seien so in Europa unterwegs. Aus Deutschland sind nach Statistiken der Bundespolizei zwischen 2007 und Juni vergangenen Jahres 150 bulgarische und 526 rumänische Staatsangehörige abgeschoben worden. Sie machten damit rund ein Viertel der Unionsbürger aus, die Deutschland verlassen mussten. Vor zwei Jahren bot die Berliner Senatsverwaltung 106 Roma aus Rumänien eine ""Rückkehrhilfe"" an - 250 Euro für jeden Erwachsenen, 150 Euro pro Kind. Nach Konflikten ""mit der Mehrheitsbevölkerung"" richtete Berlin dann im Mai vergangenen Jahres eine Anlaufstelle für Roma ein, schreibt ein Referent an den Städtetag. Die Kieler Roma nutzen zur Zeit die Angebote wie das ""Medibüro"", die eigentlich eingerichtet wurde, um papierlosen Migranten Ärzte zu vermitteln. Eine Roma-Frau brachte Zwillings-Frühchen zur Welt. Auf den Kosten für die Geburt blieb das Städtische Krankenhaus zunächst sitzen. Sozialamtsleiter Bornhalm muss einen Weg finden, die Kosten auszugleichen, irgendwie. Über soziale Netzwerke sollen Roma Kleider- und Essensspenden nutzen dürfen. Doch die Stadt müsse abwägen - sie dürfe, laut Stadtrat Adolf-Martin Möller, ""keinen Anreiz für die weitere Zuwanderung von Menschen in ähnlicher Lebenssituation bieten."" Auch Bornhalm spricht vom ""Fluch der guten Tat"". ""Wer sich hier niederlässt, muss meist unter menschenfeindlichen Bedingungen arbeiten"", sagt der Kieler SPD-Landtagsabgeordnete Bernd Heinemann. Ein Großteil der Roma leben in seinem Wahlkreis, im Kieler Stadtteil Gaarden. Hier hat sich, laut der Kieler Kriminalpolizei, mittlerweile auch Gaststättenprostitution etabliert - in Hinterräumen und Toiletten arbeiteten meist Bulgarinnen. Heinemann hat das Problem der zugezogenen Roma an den Europaausschuss des Kieler Landtags weitergeleitet. Denn lösen kann es auf regionaler Ebene niemand. "
08.04.2011 01:18 Uhr,Aufräumarbeiten nach dem Tsunami,"""Wir stehen gemeinsam wieder auf""","Das neue Beben ereignete sich in der Region, die vor vier Wochen von der Naturkatastrophe verwüstet worden war. Dabei sind die Menschen im japanischen Myjako gerade dabei, die Trümmer zu beseitigen und ihr Leben zu ordnen. Dabei hilft ihnen ihr Einfallsreichtum, ihr Bürgersinn und ein lokaler Radiosender: ""Miyako Desaster FM"". Von Mario Schmidt, ARD Tokio "
07.04.2011 22:35 Uhr,ARD-DeutschlandTrend,Mit klarem Profil zum grünen Allzeithoch,"Die Grünen sonnen sich im Erfolg, während alle anderen schwächeln - allen voran die FDP. Im ARD-DeutschlandTrend kommen die Liberalen nur noch auf fünf Prozent. Die Ergebnisse machen deutlich: Die Partei hat ein gravierendes inhaltliches Problem - anders als die Grünen. Bei den beliebtesten Politikern gibt es eine Überraschung. Von Jörg Schönenborn, WDR Im Südwesten der Bundesrepublik ist es am wärmsten und sonnigsten, dort kommt der Frühling früher und es grünt eher. In diesem Jahr lässt sich das auf die politische Stimmungslage übertragen: Knapp zwei Wochen nach dem grünen Rekordsieg in Baden-Württemberg kehrt die Partei auch bundesweit auf ihr Rekordniveau zurück. Sie gewinnt gegenüber dem Vormonat satte 8 Prozentpunkte in der Sonntagsfrage und steht jetzt wieder bei 23 Prozent - einem Wert, den sie bisher nur einmal im November 2010 erreicht hat. Die Grünen gewinnen Wählerinnen und Wähler aus allen politischen Lagern hinzu und schwimmen förmlich auf einer Sympathiewelle. 60 Prozent der Deutschen freuen sich darüber, ""dass die Grünen in Baden-Württemberg den Ministerpräsidenten stellen"". Und fast zwei Drittel (65 Prozent) fänden es gut, ""wenn die Grünen demnächst auch bundesweit an der Regierung beteiligt wären"". Selbst CDU- und FDP-Wähler vertreten diese Position in großer Zahl. Immerhin 40 Prozent sind der Ansicht, die Grünen sollten in den nächsten Jahren auch mal den Kanzler oder die Kanzlerin stellen. In der Sonntagsfrage führt das grüne Hoch bei allen anderen Parteien zu Verlusten gegenüber dem Vormonat. So steht die SPD nur noch bei 27 Prozent (- 1). Trotzdem erreicht das rot-grüne Lager in der Summe 50 Prozent und damit den besten Wert seit elf Jahren. Auf der Gegenseite schwächelt die Bundesregierung. Die Union fällt um zwei Punkte auf 33 Prozent zurück, die FDP verliert einen Punkt auf 5 Prozent. Große Probleme hat auch die Linkspartei, die nur noch 7 Prozent erreicht (- 2), nachdem sie nach der Bundestagswahl mehr als ein Jahr lang durchgängig zweistellige Werte erzielte. Das alles beherrschende Thema und der entscheidende Grund für die großen Verschiebungen zugunsten der Grünen ist die Atompolitik der Parteien. Der Wunsch nach einem schnellen Ausstieg zieht sich mittlerweile durch alle politischen Lager. Nur unter den CDU/CSU-Anhängern gibt es noch einen kleinen harten Kern von Kernkraftbefürwortern. Das Meinungsbild in der Gesamtbevölkerung ist klar: Nur noch 13 Prozent plädieren dafür, die Atomkraftwerke etwa bis zum Jahr 2040 laufen zu lassen - so wie es die schwarz-gelbe Koalition im Herbst beschlossen hatte. 43 Prozent plädieren für einen Ausstieg um das Jahr 2020 - das entspricht in etwa dem rot-grünen Atomkompromiss. Weitere 43 Prozent wollen aber einen noch früheren Ausstieg. Ähnlich deutlich ist das Votum in der Frage, ob die von der Bundesregierung kurzfristig stillgelegten älteren Atommeiler und ein weiteres Kraftwerk, das ohnehin schon stillgelegt war, abgeschaltet bleiben oder wieder ans Netz gehen sollen. Lediglich drei Prozent der Befragten sind der Ansicht, dass alle acht betroffenen Meiler wieder Strom liefern sollten. Zwei Drittel der Befragten (67 Prozent) finden, dass alle acht Kraftwerke dauerhaft stillgelegt werden sollten, 28 Prozent wünschen sich, dass zumindest ein Teil stillgelegt wird. Überraschend ist, dass anders als bei früheren Befragungen, die große Mehrzahl der Befragten sich auch dann gegen längere Laufzeiten ausspricht, wenn dadurch die Strompreise steigen sollten, den Energiekonzernen Entschädigungen gezahlt werden müssten oder die CO2-Belastung ansteigt. Aber die Grünen profitieren nicht nur von dieser Stimmungslage, sondern insgesamt von einem klaren politischen Profil. Drei Viertel der Befragten (73 Prozent) erklären, dass sie bei den Grünen genau wissen, ""für welche politischen Inhalte die Partei steht"". Für SPD und CDU sagen das jeweils nur 52 Prozent, für die Krisenpartei FDP sogar nur 37. Die Ergebnisse des ARD-DeutschlandTrends machen deutlich, dass die FDP keineswegs nur unter ihrem unpopulären Führungspersonal leidet, sondern ein gravierendes inhaltliches Problem hat. Am ehesten ist sie gegenwärtig für die Wählerinnen und Wähler noch als Bürgerrechtspartei erkennbar. So antworten 51 Prozent der Befragten, die FDP stehe für ""die Freiheit des Einzelnen"" und 46 Prozent sehen sie als die Partei, die ""die Bürgerrechte verteidigt"". ""Verlässliche Außenpolitik"" trauen ihr hingegen nur noch 31 Prozent zu, gerade mal 29 Prozent billigen ihr ""kompetente Wirtschaftspolitik zu"". Der jahrelange Versuch sich als Steuersenkungspartei zu profilieren endet im demoskopischen Desaster: 18 Prozent der Befragten sind der Ansicht, die FDP stehe für ""kluge Steuerpolitik"". Und so mündet die Krise der FDP ungebremst in einer Krise der Bundesregierung. 67 Prozent der Befragten erklären, ""mit der FDP ist eine verlässliche Politik nicht mehr möglich"". Mit 53 Prozent ist sogar die Mehrheit der Unionswähler dieser Ansicht. Allerdings hat Bundeskanzlerin Angela Merkel auch ihren eigenen Beitrag geleistet zu den schlechten Werten der Bundesregierung. Mit 50 Prozent findet nur die Hälfte der Befragten ihren Meinungswandel in Sachen Kernkraft ""glaubwürdig und verständlich"". Und er führt dazu, dass 63 Prozent der Befragten der Ansicht sind, ""bei Angela Merkel weiß man nicht wofür sie wirklich steht"". Immerhin 37 Prozent der Unionsanhänger teilen diese Verunsicherung. So wachsen die Zweifel, ob Union und FDP wirklich die idealen Koalitionspartner sind, und im Gegenzug wachsen die Sympathien selbst bei Unionsanhängern für ein schwarz-grünes Bündnis. So richtig gereift zu sein scheint diese Überzeugung aber noch nicht, denn eine deutliche Mehrheit von 58 Prozent lehnt vorzeitige Neuwahlen zum Deutschen Bundestag ab. Die Probleme der Parteien spiegeln sich auch in der Popularität ihrer Spitzenpolitiker wider. Hier lohnt vor allem der Blick auf das FDP-Personal, das allerdings teilweise nicht nur unter schlechten Bewertungen, sondern auch unter geringer Bekanntheit leidet. Schlusslicht unter den abgefragten FDP-Politikern ist Fraktionschefin Birgit Homburger mit 15 Prozent Zustimmung. Generalsekretär Christian Lindner und Noch-Parteichef Guido Westerwelle kommen auf 25 Prozent, der Gesundheitsminister und künftige Parteichef Philipp Rösler erreicht 30 Prozent, Wirtschaftsminister Rainer Brüderle 32 Prozent. Deutliche Spitzenreiterin unter den FDP-Politikern ist aber Justizministerin Sabine Leutheusser-Schnarrenberger mit 42 Prozent. Angesichts der mittelprächtigen Bewertungen für Philipp Rösler wundert nicht, dass eine Mehrheit die kleine Rochade an der FDP-Spitze skeptisch beurteilt. Nur 40 Prozent sehen darin eine ""Chance für einen politischen Neuanfang"", 52 Prozent interpretieren den Wechsel eher als Signal für ein ""weiter so"". An der Spitze der Liste stehen zum ersten Mal seit zwei Jahren wieder SPD-Politiker. Oppositionsführer Frank-Walter Steinmeier und der ehemalige Finanzminister Peer Steinbrück sind mit 60 und 59 Prozent praktisch gleich auf, gefolgt von Finanzminister Wolfgang Schäuble (57 Prozent) und Arbeitsministerin Ursula von der Leyen (54 Prozent). Grünen-Fraktionschefin Renate Künast rangiert mit 50 Prozent noch vor Kanzlerin Merkel mit 48 Prozent. Es gibt allerdings durchaus Indizien dafür, dass der gegenwärtige grüne Höhenflug (noch) kein festes Fundament hat. Da ist zum einen die Einschätzung der Mehrheitsbefragten (56 Prozent), dass die Grünen derzeit nur ein ""vorübergehendes Hoch hätten"" und ""ihre Bedeutung wieder zurück gehen werde"". Das andere Indiz ist die Bewertung der Wirtschaftslage. Je mehr das Thema Atompolitik in den nächsten Wochen und Monaten wieder in den Hintergrund gerät, desto stärker dürften die gegenwärtigen Wirtschaftszahlen der Bundesregierung wieder aus dem Tal heraus helfen. Das von den Instituten angekündigte Rekordwachstum schlägt mittlerweile voll auf die Stimmung durch. 66 Prozent der Befragten empfinden die Wirtschaftslage als gut oder sehr gut. Das ist Rekordwert im ARD-DeutschlandTrend. Und das gleiche gilt für die persönliche wirtschaftliche Lage der Betroffenen. 75 Prozent geben sie als gut oder sehr gut an. Auch hier gilt: Ein so hoher Wert ist im ARD-DeutschlandTrend seit Januar 1998 (bei allerdings nur gelegentlichen Erhebungen) noch nie gemessen worden. Bei aller Zufriedenheit der Befragten über ihre persönliche Situation darf man allerdings die Sorge über die Preisentwicklung nicht außer acht lassen. 66 Prozent der Deutschen registrieren gegenwärtig stark steigende Verbraucherpreise, und die Befragten können auch benennen, wo an der Preisschraube gedreht wird. 63 Prozent machen Benzin und Öl als die Hauptpreistreiber aus, gefolgt von Lebensmitteln (55 Prozent) sowie Strom und Gas (34 Prozent). Bei dieser Frage waren Mehrfachmeinungen möglich. Fazit in diesem Monat: Trotz bester Wirtschaftsdaten ist die Verunsicherung mit Händen zu greifen. Die anhaltende Euro-Krise, Revolutionen und  Bürgerkrieg in Nordafrika und die Atomkatastrophe in Fukushima tragen dazu bei. In dieser Situation fehlt den meisten Befragten eine feste politische Heimat. Für viele stehen im Moment am ehesten die Grünen für Berechenbarkeit und Verlässlichkeit. "
07.04.2011 14:19 Uhr,Finanzwissenschaftler Otte zur Portugal-Krise,"""Mir wäre lieber, wenn der Rettungsschirm scheitert""","Portugal hätte sich selbst retten können - davon ist Finanzwissenschaftler Otte überzeugt. Im Interview mit tagesschau.de erklärt Otte, warum eine Umschuldung sinnvoller gewesen wäre und warum die Banken immer noch ungeschoren davon kommen. Die wahren Probleme sieht Otte aber in den USA. tagesschau. de: Das hochverschuldete Portugal beantragt Geld aus dem EU-Rettungsschirm - eine ""unvermeidbare Maßnahme"", so Noch-Ministerpräsident José Socrates. Sehen Sie das auch so? Max Otte: Nein! Natürlich hätte Portugal sagen können: Der portugiesische Staat wird zahlungsunfähig - wir müssen über eine Umschuldung oder über einen Teil-Schuldenerlass reden. Das ist Dutzende Male in der Dritten Welt so durchexerziert worden. Natürlich gab es diesen Weg. Die zentrale Frage ist doch, ob wir endlich den Banken zumuten, einen Teil ihrer Fehlkalkulationen und Fehlinvestments zu tragen. tagesschau. de: Inwieweit spielt es eine Rolle, dass Socrates schon wegen der Schuldenkrise zurückgetreten ist, weil er seinen Sanierungskurs nicht durchsetzen konnte? Wer soll die strengen EU-Vorgaben nun umsetzen? Man muss vor allem fragen, ob diese Sparpakete überhaupt richtig sind. Sie können die Sanierung der Staatsfinanzen auf verschiedenen Schultern ruhen lassen: Auf denen der Bürgerinnen und Bürger, die vielleicht auch über ihre Verhältnisse gelebt haben. Dann auf denen der Solidarität der Gemeinschaft, sprich Deutschland. Aber dann müssten sich auch als Dritte die beteiligen, die wir im Finanzjargon die ""informierten Gläubiger"" nennen. Das sind die Banken, die dem entsprechenden Staat bis zum Schluss und unter Umständen wider besseren Wissens Geld geliehen haben. Da nicht anzusetzen, halte ich für falsch. tagesschau. de: Spekuliert wird jetzt über Hilfen in Höhe von 75 Milliarden Euro. Wird das ausreichen? Otte: Portugal hatte nicht dieselben Probleme wie Griechenland oder Irland. Portugal hat sich im Ausland verschuldet und das Staatsdefizit eben etwas hochlaufen lassen. Es könnte sein, dass diese Summe ausreicht. tagesschau. de: Und was kostet das die deutschen Steuerzahler? Otte: Deutschland ist immer ungefähr mit einem Drittel dabei, sei es nur als Garantie in Form von Haftung oder als tatsächlicher Transfer. Zunächst mal handelt es sich größtenteils um Garantien. Wir helfen Portugal, sich billiger zu refinanzieren, und wir müssen uns etwas höher verschulden. Das wiederum wirkt sich auf die Kreditwürdigkeit Deutschlands aus und führt zu etwas höheren Zinsen. Es ist eine Belastung, die man aber nicht direkt spüren wird. tagesschau. de: Beweist das Hilfegesuch Portugals die Notwendigkeit des Rettungsschirms? Otte: Die politische Klasse und die Banken in Europa haben ein Interesse, gegen die Bevölkerung den Rettungsschirm durchzuziehen. Hans-Werner Sinn vom ifo Institut für Wirtschaftsforschung hat sich ähnlich geäußert: Auch Irland hätte sich selbst retten können. Da ist das Pro-Kopf-Einkommen höher als in Deutschland. Aber man will diesen Transfer-Mechanismus etablieren. Man will weg von der Stabilitätskultur der Bundesbank. Man will Deutschland anzapfen. Und die deutsche Regierung wehrt sich leider nicht. tagesschau. de: Ist dieses Hilfegesuch der Anfang vom Ende? Vom Ende der Schuldenkrise oder vielleicht auch vom Ende des Rettungsschirms, weil eine so große Volkswirtschaft wie Spanien gar nicht zu retten ist? Die Fragen stellte Ute Welty, tagesschau.de "
