date,topline,headline,content25.04.2011 15:05 Uhr,Leben in der Sperrzone,"""Viele Menschen wollen nach Tschernobyl""","Eigentlich ist das Leben in der Sperrzone um das havarierte AKW Tschernobyl verboten. Doch viele Menschen sind in ihre alten Häuser zurückgekehrt. Von den Gefahren durch Verstrahlung wollen sie nichts wissen. Derweil entdeckt der Tourismus die Gegend um Tschernobyl. Von Christina Nagel, ARD-Hörfunkstudio Moskau, zzT. Tschernobyl Iwan nimmt seine Pelzmütze vom Kopf und kramt unter dem Tisch ein Stück fetten Speck hervor. Aus einem Einmachglas gießt er Selbstgebrannten in ein Sammelsurium unterschiedlichster Gläser. Der 75-Jährige lässt niemanden gehen, ohne auf die Gesundheit getrunken zu haben. ""Wir produzieren fast alles selbst"", sagt er. ""Wir mästen jährlich ein Schwein. Es gibt Hühner, wir müssen also keine Eier kaufen. Wir konservieren das Fleisch in Gläsern - und es gibt einen Laden auf Rädern, der einmal die Woche kommt. Mehr brauchen wir nicht."" Iwan und seine Frau Maria leben mitten in der Sperrzone. Ihr Hof steht zwischen halb zerfallenen, verlassenen Häusern. Das Dorf stirbt langsam aus. Das habe aber nichts mit der Strahlung zu tun, sagt Iwan energisch. Der Boden hier sei sauber. Das Wasser auch. Sogar Pilze würden sie essen. ""Wir braten oder kochen sie"", sagt Iwan. ""Wir haben Strom, aber kein Gas. Wir bekommen Gasballons. Wir heizen mit Brennholz, das brennt wunderschön im Ofen. Die Post bringt uns unsere Renten, niemand beleidigt uns."" Die beiden Alten sind mit dem Wenigen, das sie haben, zufrieden. Für sie ist es das Wichtigste, hier sein zu dürfen. ""Wir haben das Haus selbst gebaut"", sagt Iwan stolz. ""Auch die Scheune und alles andere. Vier Jahre haben wir drin gewohnt, dann kamen die Soldaten und sagten: Ihr müsst weg! Was sollten wir machen? Es tat sehr weh. Meine Frau und ich, wir hatten doch alles allein aufgebaut."" Das Dorf wurde wenige Tage nach der Reaktorkatastrophe von Tschernobyl evakuiert. Iwan und seine Frau wurden erst bei Fremden untergebracht, dann bekamen sie eine Wohnung. Ein Jahr hielten sie es fern der Heimat aus. Dann kehrten sie einfach zurück. Die Behörden ließen sie. Dass der Staat sich nicht groß um die Rücksiedler kümmert, ist Iwan egal. Er winkt ab, wenn von verstrahlten Böden die Rede ist, von Lebensmitteln, die mit Caesium und Strontium belastet sind. Er und seine Frau bräuchten nicht mehr an die Zukunft zu denken. Das sei etwas für junge Menschen. Dass junge Leute allerdings nach Tschernobyl kommen, um einen Urlaub der besonderen Art zu erleben, dafür hat Iwan wenig Verständnis. Doch der Katastrophen-Tourismus boomt. Er sei ein Selbstläufer geworden, sagt Tour-Anbieter Arseniv Einberg: ""Wenn ich mich nicht irre, hat die Zeitschrift ""Fortune"" Tschernobyl als einen der führenden Orte für Extrem-Tourismus bezeichnet. Voriges Jahr gehörte Tschernobyl zu den Top Drei. Außerdem gibt es noch ein ukrainisches Computerspiel, ""S.T.A.L.K.E.R: Shadow of Chernobyl"", das in der ganzen Welt sehr populär ist. Viele Menschen, die dieses Spiel spielen, wollen in die Tschernobyl-Zone."" Sie wollen durch die leeren Hochhäuser der ehemaligen Vorzeige-Stadt Pripjat streifen, unweit des Atomkraftwerks. Mit dem Geigerzähler vor dem havarierten Reaktor stehen. Und Ausschau halten nach mutierten Riesenfischen im Kühlwasserkanal. Ein Kick, den sie sich etwas kosten lassen: Je nach Gruppengröße sind zwischen 150 und 250 Dollar pro Person fällig. Geld, von dem auch der ukrainische Staat profitiert. Denn ohne Erlaubnis und Begleitung eines Behördenmitarbeiters kommt niemand in die Sperrzone hinein. Das Geschäft mit Tschernobyl ist lukrativ. So lukrativ, dass die Regierung plant, den Strahlen-Tourismus mit ins Fan-Programm für die Fußball-Europameisterschaft 2012 aufzunehmen. Gefährlich sei das nicht, geben selbst die Gegner der Katastrophen-Vermarktung zu. Aber unsittlich. Die Sperrzone sei kein Ort zum Spielen. Das Leid der Menschen, ihre Armut, seien kein Spektakel zum Gruseln. "
24.04.2011 20:47 Uhr,Feierlichkeiten in Tschernobyl,Ostermesse mitten in der Sperrzone,"Die Ostermesse in der Kirche ist gut besucht, dabei dürfte es die Gemeinde gar nicht geben: Die Kirche steht in Tschernobyl, mitten in der verstrahlten Zone. Trotz Verbots leben noch immer Hunderte Menschen hier - vor allem alte Leute. Sie wollen nicht weg aus der Heimat. Von Ina Ruck, ARD-Studio Moskau "
24.04.2011 15:38 Uhr,"Laut Statistikamt 9,1 Prozent Defizit im vergangenen Jahr",Portugals Neuverschuldung höher als angenommen,"Das portugiesische Statistikamt INE hat das Haushaltsdefizit des Landes für 2010 nach oben korrigiert. Wie die Behörde mitteilte, betrug die Neuverschuldung im vergangenen Jahr 9,1 Prozent des Bruttoinlandsprodukts. Bisher war man von 8,6 Prozent ausgegangen. Als Begründung nannte INE die volle Einrechung dreier öffentlich-privater Partnerschaften. Die Gesamtstaatsschuld lag demnach bei 93 Prozent des Bruttoinlandsprodukts, umgerechnet rund 160 Milliarden Euro. Der europäische Stabilitätspakt erlaubt nur einen Gesamtschuldenstand von 60 Prozent und eine jährliche Neuverschuldung von drei Prozent des BIP. Die Minderheitsregierung von Sócrates war zurückgetreten, nachdem die Opposition im Parlament mehrfach Sparpakete abgelehnt hatte. "
24.04.2011 01:32 Uhr,Kroatien will Flussläufe begradigen,Umweltfrevel kurz vor dem EU-Beitritt?,"Umweltschützer sind entsetzt: In Kroatien sollen kurz vor dem geplanten EU-Beitritt Flussläufe begradigt und für die Schifffahrt ausgebaut werden. Hunderte Kilometer Auenlandschaft sind betroffen. Dabei galt etwa der Schutz der Save-Auen als Voraussetzung für einen EU-Beitritt. Von Susanne Glass, ARD Wien "
23.04.2011 14:30 Uhr,Hintergrund zur Arbeitnehmerfreizügigkeit,Jeder darf überall in der EU arbeiten,"Jeder EU-Bürger hat grundsätzlich das Recht, in allen Ländern der Europäischen Union zu arbeiten. Diese sogenannte Arbeitnehmerfreizügigkeit gehört zu den vier Grundfreiheiten des Gemeinsamen Binnenmarktes der Europäischen Union. Das sind neben der Arbeitnehmer- und Personenfreizügigkeit die Dienstleistungsfreiheit sowie der freie Warenverkehr und der freie Kapitalverkehr. Bei der EU-Osterweiterung wurde den ""alten"" 15 EU-Staaten die Möglichkeit eingeräumt, für eine Übergangsfrist von maximal sieben Jahren ihre Arbeitsmärkte vorübergehend noch abzuschotten. Dies betraf Arbeitnehmer aus den damaligen Beitrittsstaaten. Großbritannien, Irland und Schweden öffneten ihre Arbeitsmärkte sofort und vollständig. Die meisten anderen EU-Staaten folgten später. Nur Deutschland und Österreich schöpften die Übergangsfrist voll aus, die am 30. April 2011 endet. Hintergrund war die Sorge, dass der Wettbewerbsdruck durch osteuropäische Arbeitnehmer zu Lohndumping führt und Arbeitsplätze gefährdet. Bürger aus Malta und Zypern, die ebenfalls 2004 der EU beitraten, haben bereits uneingeschränkten Zugang zum deutschen Arbeitsmarkt. Von der vollen Arbeitnehmerfreizügigkeit profitieren ab dem 1. Mai 2011 auch Estland, Lettland, Litauen, Polen, die Slowakei, Slowenien, die Tschechische Republik und Ungarn. Rumänien und Bulgarien bleiben vorerst ausgeschlossen, weil beide Staaten erst 2007 der EU beitraten. Die auch für diese Staaten vereinbarten Übergangsfristen von sieben Jahren laufen spätestens Ende 2013 aus. Nach Gewährung der vollen Arbeitnehmerfreizügigkeit benötigen die betroffenen Osteuropäer in Deutschland keine Arbeitsgenehmigung mehr. Dies gilt für alle Beschäftigten unabhängig von ihrer Qualifikation, der Dauer der Beschäftigung und der Branche. Nehmen sie hier eine Arbeit an, müssen die in Deutschland geltenden Bestimmungen beachtet werden. Für die Einreisegenügt dabei ein Personalausweis. Auch Bewerber für Ausbildungsplätze können sich nun uneingeschränkt hier umsehen. Für die Erntehelfer beim Spargelstechen und Obstpflücken sowie Saisonbeschäftigte in der Gastronomie fielen bereits am 1. Januar dieses Jahres alle Schranken. Bisher mussten die Arbeitsagenturen jeder einzelnen Beschäftigung zustimmen. Weitere Ausnahmen der Übergangsregelung gelten ebenfalls bereits: Selbstständige und Gewerbetreibende aus den neuen EU-Staaten konnten sich schon in den vergangenen Jahren in Deutschland niederlassen. Ab 1. Mai gilt außerdem die volle Dienstleistungsfreiheit. Darunter fallen Dienstleistungen im EU-Ausland, für deren Erbringen Arbeitnehmer nur vorübergehend in ein anderes EU-Land entsandt werden. Damit fallen die Beschränkungen für die Entsendung von Arbeitnehmern aus den Beitrittsländern für Dienstleistungen beim Bau und in der Gebäudereinigung weg. "
23.04.2011 13:26 Uhr,Öffnung des deutschen Arbeitsmarkts,Blick nach Osten weckt Sorge und Hoffnung,"Eine Woche vor der vollständigen Öffnung des deutschen Arbeitsmarkts für Osteuropäer ist eine Debatte über die Folgen entbrannt. ""Ich befürchte, dass viele Zuwanderer bereit sein werden, zu niedrigeren Löhnen zu arbeiten, als sie in Deutschland üblich sind"", sagt Frank Bsirske, Chef der Dienstleistungsgewerkschaft ver.di, der Nachrichtenagentur dapd. Dadurch drohe ""ein neuer Wettbewerb, eine Abwärtsspirale, in der Unternehmen, die billigere Arbeitskräfte aus Ost- und Mitteleuropa einsetzen, diejenigen Firmen verdrängen, die bessere Löhne zahlen und sozialere Arbeitsbedingungen gewähren"". Ähnlich äußerte sich der Fraktionschef der Linkspartei im Bundestag, Gregor Gysi. ""Ich befürchte als Folge, dass hier wieder Polen und andere Osteuropäer zu Billigstlöhnen arbeiten"", sagte Gysi. Er habe nichts dagegen, dass polnische Arbeitnehmer hier beschäftigt würden. Dies müsse aber wenigstens zu einem flächendeckenden gesetzlichen Mindestlohn passieren. Der Vorsitzende der IG Bau, Klaus Wiesehügel, hatte zuvor bereits im Bayerischen Rundfunk die Befürchtung geäußert, dass der Druck auf deutsche Beschäftigte durch die Arbeitnehmerfreizügigkeit steigen werde. Denn dann könnten Firmen aus osteuropäischen Ländern ihre Mitarbeiter zu den in ihrer Heimat üblichen Niedriglöhnen in Deutschland einsetzen. DGB-Vorstandsmitglied Annelie Buntenbach wies Befürchtungen einer ""Invasion"" ausländischer Arbeitskräfte zwar zurück, gab allerdings zu bedenken, dass die Bundesregierung bislang nicht genug zum Schutz vor Lohndumping getan habe. Auch Arbeitgeberpräsident Dieter Hundt rückte die möglichen Vorteile der vollen Arbeitnehmerfreizügigkeit in den Vordergrund, die ab dem 1. Mai zum Tragen kommt. ""Die volle Arbeitnehmerfreizügigkeit wird sich gesamtwirtschaftlich positiv auswirken und dazu beitragen, unseren Fachkräftebedarf zu sichern"", sagte er. ""Qualifizierte Zuwanderer nehmen Einheimischen keine Arbeitsplätze weg, ganz im Gegenteil, sie sichern und schaffen neue Beschäftigung."" Die dringend benötigten Fachkräfte müssten das Signal bekommen, dass sie in Deutschland tatsächlich erwünscht seien. Ähnlich argumentierte der Deutsche Industrie- und Handelskammertag (DIHK). Die Öffnung des deutschen Arbeitsmarktes biete Unternehmen ""gerade vor dem Hintergrund zunehmender Fachkräfteengpässe"" die Gelegenheit, gut qualifiziertes Personal zu finden, sagte DIHK-Hauptgeschäftsführer Martin Wansleben. ""Etwaige Befürchtungen, dass deutsche Arbeitnehmer um ihre Jobs bangen müssen, teilen wir nicht"", fügte er hinzu. Das Institut für Arbeitsmarkt- und Berufsforschung (IAB) fand bislang keine Hinweise darauf, dass sich die Arbeitnehmerfreizügigkeit für EU-Bürger aus Osteuropa negativ auf Deutschland auswirken wird. ""Unsere Modellrechnungen zeigen, dass auf längere Sicht nicht mit negativen Effekten zu rechnen ist. Weder in Form erhöhter Arbeitslosigkeit noch in Form geringerer Löhne"", sagte Joachim Möller, der Direktor des Instituts. Bislang ist völlig offen, wie viele Arbeitnehmer aus osteuropäischen Staaten sich in der Bundesrepublik auf die Suche nach einem Job machen werden. Polens Arbeitsministerin Jolanta Fedak schätzt, dass sich etwa 100.000 bis 400.000 ihrer Landsleute innerhalb der nächsten drei Jahren aufmachen könnten, um in Deutschland zu arbeiten. Der tschechische Ministerpräsident Petr Necas sagte: ""Die Deutschen müssen keinen Zufluss billiger tschechischer Arbeitskräfte befürchten."" Das IAB geht davon aus, dass durch die neue Regelung pro Jahr etwa 100.000 Menschen zusätzlich in die Bundesrepublik kommen könnten. Die Bundesagentur für Arbeit (BA) rechnet mit bis 140.000 Zuwanderern aus Osteuropa pro Jahr. BA-Chef Frank-Jürgen Weise geht aber davon aus, dass weniger Zuwanderer kommen, als Deutschland angesichts des Fachkräftemangels benötige. ""Deutschland ist weniger attraktiv, als viele glauben"", sagte er der ""Rheinischen Post"". Die volle Freizügigkeit gibt nun jedem EU-Bürger aus den damaligen Beitrittsländern das Recht, auch in Deutschland eine Beschäftigung aufzunehmen. Interessenten aus diesen Staaten benötigen in Deutschland keine Arbeitsgenehmigung mehr. Auch Bewerber für Ausbildungsplätze können sich nun uneingeschränkt hier umsehen. Das Recht, sich in Deutschland zur Arbeitsuche aufzuhalten, besteht zwar für mindestens drei Monate. Für die Einreise genügt dabei ein Personalausweis. Anspruch auf Arbeitslosengeld I oder Hartz IV haben die Arbeitsuchenden aus Osteuropa in der Regel aber nicht. Für das Arbeitslosengeld I müssen sie mindestens zwölf Monate in Deutschland sozialabgabenpflichtig beschäftigt gewesen sein. Vom Auslaufen der Übergangsfrist profitieren Bürger aus Polen, Ungarn, Tschechien, Slowenien, Estland, Lettland, Litauen, Slowakei. Für die Beitrittsländer Zypern und Malta, die ebenfalls 2004 beitragen, gilt bereits die volle Arbeitnehmerfreizügigkeit. Für die erst am 1. Januar 2007 beigetretenen Rumänen und Bulgaren bleibt die Freizügigkeit eingeschränkt. Dies gilt vorerst noch bis Ende 2011. Voraussichtlich wird die Bundesregierung aber auch in diesem Fall die maximale Übergangsfrist ausschöpfen, sodass sie voraussichtlich bis Ende 2013 gelten wird "
23.04.2011 12:39 Uhr,Jahrestag der Reaktorkatastrophe in Tschernobyl,25 Jahre Leid -  und immer noch wird vertuscht,"Der Super-GAU in Tschernobyl vom 26. April 1986 hat die Welt verändert. Erst nach und nach gab die Sowjetunion bekannt, wie schlimm die Katastrophe wirklich war. Und auch 25 Jahre später werden in Weißrussland die Risiken für die Bevölkerung immer noch heruntergespielt. Von Stephan Laack, ARD-Hörfunkstudio Moskau zzt. Gomel Die Reaktorkatastrophe von Tschernobyl hat Weißrussland besonders stark getroffen. Fast ein Viertel der Gesamtfläche des Landes wurden durch radioaktiven Niederschlag kontaminiert. Zwei Millionen Menschen bekamen die Folgen der Katastrophe zu spüren: Ihre Heimat im Südosten der Republik dürfte nach Ansicht von Experten noch mindestens 300 Jahre radioaktiv belastet sein, bis die Werte wieder im halbwegs normalen Bereich liegen. Die unabhängige Journalistin Jewgenija Tschirikowa aus Gomel betrachtet dies als gezielten Versuch der Behörden, gesundheitliche Schäden herunterzuspielen: ""Die Menschen hier sterben am häufigsten an Krebs, Herzinfarkt und Schlaganfall. Aber unsere Mediziner dementieren jeden Zusammenhang mit der radioaktiven Belastung. Es gibt eine Anweisung, wonach andere Krankheiten als Schilddrüsenkrebs nicht auf radioaktive Strahlung zurückgeführt werden dürfen."" Tschirikowa erinnert an Professor Bandaschewski, der an der Universität Gomel ein eigenes Krebsregister geführt hatte. Der Wissenschaftler ging von einer weitaus größeren gesundheitlichen Gefährdung der dortigen Bevölkerung aus, als nach offizieller Lesart. Unter dubiosen Begründungen wurde er ins Gefängnis gesteckt und verließ später das Land. In seiner Heimatregion Gomel, rund 120 Kilometer von Tschernobyl entfernt, wurden nach dem Reaktorunglück 98 Dörfer komplett abgetragen und 100.000 Menschen umgesiedelt. Zudem gibt es gekennzeichnete Sperrzonen stark verstrahlter Gebiete, zu denen der Zutritt verboten ist. Dennoch ist es keineswegs so, dass das Leben in den weniger belasteten Gebieten unbedenklich ist. Zweimal jährlich müssen sich Kinder und Jugendliche vorsorglich einer ärztlichen Untersuchung unterziehen. Hinzu kommt der gesetzliche Anspruch auf einen kostenlosen 24-tägigen Erholungsurlaub im In- oder Ausland. ""Die Ärzte können uns nicht sagen, wie gefährlich es tatsächlich ist, in den betroffenen Gebieten zu leben. Aber die Tatsache, dass sich der Staat finanziell an solchen Programmen beteiligt, zeigt, dass das Leben in belasteten Gebieten den Gesundheitszustand beeinflusst. Niemand weiß genau, was letztlich die Folgen sind."" Dies betont Larissa Jakowjuk, sie arbeitet in dem Kinder-Rehabilitationszentrum Nadjeschda im Norden des Landes, das zu großen Teilen mit deutscher Unterstützung errichtet wurde. In vielen Familien sei Tschernobyl heute kein Thema mehr, sagt sie. Daher sieht Jakowjuk ihre Aufgabe auch darin, die Sensibilisierung für die Gefahren radioaktiver Strahlung aufrecht zu erhalten - auch wenn man diese nicht fühlen, nicht sehen und nicht schmecken kann. Die Kinder müssten daher immer wieder daran erinnert werden, zu Hause keine Pilze, keine Beeren, kein Obst und kein Gemüse aus dem Garten zu essen. 25 Jahre nach dem Super-GAU plant Weißrussland den Einstieg in die Atomkraft. Im Norden des Landes an der Grenze zu Litauen soll das erste Atomkraftwerk entstehen - von Menschen verlassene kontaminierte Landstriche würden da nicht ins Bild passen. "
22.04.2011 12:00 Uhr,Grenze zwischen Thailand und Kambodscha,Jahrzehntelang umstrittenes Erbe der Kolonialzeit,"Die Grenze zwischen Kambodscha und Thailand ist fast 800 Kilometer lang und in weiten Teilen umstritten. Die jüngsten Gefechte fanden an einer anderen Tempelanlage rund 100 Kilometer westlich von Preah Vihear statt, am Tempel Ta Krabei, oder Ta Kwai auf thailändisch. Die Grenze zwischen den Nachbarländern ist theoretisch durch 73 Grenzsteine markiert. Allerdings fehlen viele der Steine, oder ihr Standort ist umstritten. Die französischen Kolonialherren Kambodschas und Thailand einigten sich vor mehr als 100 Jahren auf die Wasserscheide im Dong Rak-Gebirge als Grenzverlauf. Nicht überall wurde das aber eingehalten: der Preah Vihear-Tempel liegt demnach auf thailändischem Gebiet, doch schlugen die Franzosen den Tempel auf ihren Karten Kambodscha zu. Lange protestierte Thailand nicht, ein Grund, den der internationale Gerichtshof in Den Haag 1962 in seinem Urteil zugunsten Kambodschas für seine Entscheidung nannte. Der Tempel Ta Krabei/Kwai, übersetzt Tempel des Büffelauges, gehört zu der größeren hinduistischen Ta Muen-Tempelanlage und ist wie Preah Vihear etwa 900 Jahre alt. "
22.04.2011 10:54 Uhr,Rückzahlung nach Bank-Zusammenbruch,JPMorgan entschädigt Lehman-Kunden,"Die US-Großbank JPMorgan Chase hat sich bereit erklärt, ehemaligen Kunden der Pleitebank Lehman Brothers eine Entschädigung zu zahlen. JPMorgan Chase übergibt dem Treuhänder, der das US-Brokergeschäft von Lehman Brothers abwickelt, Bargeld und Wertpapiere im Wert von mehr als 800 Millionen Dollar. Die Summe soll unter den Kunden aufgeteilt werden, die beim Zusammenbruch des Hauses im September 2008 ihr Geld verloren hatten. Treuhänder James Giddens sprach in New York von einem ""Meilenstein"". Sie helfe, wenigstens einen Teil der Verluste zu decken. Die viertgrößte US-Investmentbank Lehman Brothers war am 15. September 2008 in der Immobilienkrise zusammengebrochen und hatte das weltweite Finanzsystem ins Wanken gebracht. Weltweit verloren viele Anleger ihr Geld. Deren Forderungen belaufen sich Schätzungen zufolge auf rund 875 Milliarden Dollar. "
19.04.2011 21:10 Uhr,Internationale Geberkonferenz in Kiew,550.000.000 Euro zusätzlich für Tschernobyl,"550 Millionen Euro - diese Summe hat die internationale Staatengemeinschaft der Ukraine auf einer Geberkonferenz in Kiew zugesagt. Damit soll das Land die Folgen der Tschernobyl-Katastrophe besser bewältigen. Das Geld ist vor allem für einen neuen Sarkophag über der Ruine gedacht. Von Christina Nagel, ARD-Hörfunkstudio Moskau, zzT. Kiew Allein die Europäische Union beteilige sich erneut mit 110 Millionen Euro an den Sicherungsprojekten, betonte Barroso: ""Zwei bedeutende Projekte müssen noch zu Ende geführt werden. Der Bau eines neuen Sarkophags und einer Lagerstätte für verbrauchte Brennstäbe."" Experten gehen davon aus, dass nur fünf Prozent des Kernbrennstoffs bei der Explosion vor 25 Jahren freigesetzt wurden. 95 Prozent seien noch im Reaktor. Sollte der alte Betonmantel, der in nur sechs Monaten errichtet wurde, zusammenbrechen, wäre dies eine Gefahr - nicht nur für die Ukraine. Immer wieder wurden in Kiew internationale Standards gefordert. EU-Kommissionspräsident Barroso sprach sich für umfassende Überprüfungen aller Atomkraftwerke aus: ""Die EU führt Stress-Tests für Atomkraftwerke durch, um ein Höchstmaß an Sicherheit für die Bürger zu erreichen. Wir erwarten das auch von unseren internationalen Partnern. Es ist eine globale Aufgabe, eine globale Verantwortung."" Nur wenige sprachen heute von einem Ausstieg aus der Atomenergie. Zu ihnen gehörte der deutsche Umweltstaatssekretär Becker. Japan sei für Deutschland eine Zäsur: ""Wir in Deutschland wollen für uns selbst die Technik der Kernenergie nur noch eine begrenzte Zeit nutzen und schnellstmöglich aussteigen."" Ein Umdenken, das dem ukrainischen Präsidenten fremd ist. ""Die Forderungen, aus der Atomkraft auszusteigen, bedeuten ein Ausbremsen des wissenschaftlich-technischen Fortschritts. Seien wir ehrlich, dass sind sinnlose Träume, die realitätsfremd sind"", sagte er. "
19.04.2011 17:18 Uhr,Frage vom 19. April 2011,Würde am AKW Fukushima ein Sarkophag helfen?,"Ein Sarkophag ist ""Schönsprech"": klingt nach verziertem Steinsarg und ewiger Ruhe. Die Wahrheit – zumindest in Tschernobyl –  ist: ein Teil der 190 Tonnen Kernbrennstoff dürften noch in der Ruine liegen. Zum großen Teil zwar zu einer Art Lava geschmolzen und nun erstarrt. Aber manches ist auch in Wasser gelöst oder liegt als Staub in den zerstörten Gebäuden. Zudem besteht die theoretische Gefahr, dass in der Masse aus spaltbarem Material wieder eine Kettenreaktion beginnt. Die Situation ist bis heute nicht wirklich klar und nach wie vor sind viele Teile nicht begehbar. Der Sarkophag dort wurde unter schwierigsten Bedingungen und großer Gefahr für die Arbeiter zusammengezimmert. Wegen der hohen Strahlung ging Geschwindigkeit vor Sorgfalt. Auf die alten Fundamente wurden Wände und Platten aufgesetzt. Zum großen Teil ferngesteuert und mehr schlecht als recht abgedichtet. Das ist keine Lösung für die Ewigkeit. Diese Hülle war von Anfang an nur als Übergang gedacht und für höchstens 20 Jahre ausgelegt. Nun wird sie aber wohl 30 Jahre halten müssen. Die Gefahr: bricht sie zusammen, dann wird viel von dem radioaktiven Staub in den Kraftwerksruinen erneut aufgewirbelt und verteilt. Greenpeace rechnet mit 50 Kg radioaktiven Stoffen. Alle Versuche, die Konstruktion zu stabilisieren waren Flickwerk und nicht erfolgreich. Ein neuer, zusätzlicher Sarkophag oben drüber soll seit Jahren gebaut werden. Bei einer so genannten Geberkonferenz hat die internationale Staatengemeinschaft gerade erneut mehr als eine halbe Milliarde Euro an Hilfen für die Ukraine zugesagt. Geplant ist eine Konstruktion aus Stahl. 20.000 Tonnen schwer, 250 Meter breit gespannt und 125 Meter hoch soll ein Tunnelbogen sein, der – wegen der Strahlung – ein Stück entfernt von der Ruine gebaut und dann auf Schienen über die Trümmer gefahren werden soll. Geschätzte Kosten: 1,5-2 Milliarden Euro. Das soll dann für 50-100 Jahre halten. Es ist also längst noch keine endgültige Lösung. Niemand wagt sich bislang daran, die strahlenden Reste zu bergen und zu „entsorgen“ – wohin auch? Fazit: Ein Atomunfall ist eine gefährliche und teure Dauerlast, auch wenn wir jahrelang nicht dran denken, das Problem bleibt. Wir erinnern uns: in Fukushima lagert sehr viel mehr atomarer Brennstoff als in Tschernobyl. Und wahrscheinlich sind die Brennstäbe auch mindestens zum Teil geschmolzen und nicht mehr einfach zu entnehmen. Große Mengen stark strahlenden Wassers machen klar: es gibt Lecks und Undichtigkeiten. Die Abklingbecken sind ohnehin nicht stark gesichert. Strahlende Materialien sind überall auf dem Gelände. Früher oder später stellt sich auch hier die Frage wie es weiter gehen soll. Der Betreiber Tepco selbst sprach schon von „zuschütten“ – also einer Deckschicht aus Erde und vielleicht Beton obendrüber. Wolfgang Renneberg vom Büro für Atomsicherheit hält es für möglich, dass kleinere Hüllen über den Reaktorblöcken ausreichen. Denn im Gegensatz zu Tschernobyl dürfte das meiste Material noch in den Containments sein.  Wann der richtige Zeitpunkt dafür ist, bleibt unklar. Bei der teilweisen Kernschmelze im amerikanischen Three-Mile-Island-Kraftwerk hat es 5 Jahre gedauert, bis man in den Reaktor überhaupt nur hineinschauen konnte. "
