date,topline,headline,content13.04.2011 18:02 Uhr,Neue Internet-Interessensvertretung gegründet,Eine Lobby für digitale Bürgerrechte,"Sie wird als das ""neue Greenpeace des Internets"" gehandelt - und das obwohl sie erst heute online ging. Die ""Digitale Gesellschaft"" will künftig netzpolitische Themen massenkompatibel machen und gegenüber der Politik vertreten. Wie genau, sagt Mitbegründer Markus Beckedahl im tagesschau.de-Interview. tagesschau.de: Warum brauchen wir die ""Digitale Gesellschaft""? Markus Beckedahl: Aus zwei Gründen. Bisher schlossen viele Internetkampagnen für digitale Bürgerrechte eine ganze Reihe von Menschen aus. Es waren Kampagnen von Spezialisten für Spezialisten. Das soll sich nun ändern. Die ""Digitale Gesellschaft"" will auch die Elterngeneration und die nicht internetaffinen Kreise ansprechen - indem beispielsweise auch komplexe Themen, wie etwa die Diskussion um die Netzneutralität, anschaulicher dargestellt und kommuniziert werden. Außerdem wollen wir eine effektivere Interessenvertretung der Internetnutzer gegenüber Politik und Wirtschaft organisieren. tagesschau.de: Aber an Interessensvertretungen mangelt es doch eigentlich nicht im Netz. Zersplittert eine zusätzliche Organisation die Internet-Community nicht noch weiter? Beckedahl: Das glauben wir nicht. Wir sind ja auch nicht neu. Wir bauen auf sieben Jahren Erfahrungen mit ""netzpolitik.org"" auf - und da haben sich natürlich auch Schwachstellen in der täglichen Arbeit gezeigt. tagesschau.de: Was für Schwachstellen? Beckedahl: Wir bekommen beispielsweise tägliche neue Einladungen von Politikern, Fraktionen, Ministerien, die mit uns über Internet und Netzpolitik reden wollen. Schon aus Ressourcen-Mangel konnten wir diese Angebote gar nicht annehmen. Das ist deshalb besonders ärgerlich, weil auf eben diesen Veranstaltungen natürlich ein Haufen von Wirtschafts-Lobbyisten sitzt, die dann ihre Vorstellungen der Politik unwidersprochen vortragen können. Das wollen wir jetzt ändern. tagesschau.de: Die ""Digitale Gesellschaft"" also eine Lobby-Vertretung wie jeder andere? Beckedahl: Natürlich sind wir auch eine Interessensvertretung - aber wir wollen uns jetzt nicht in dunkle Nebenzimmer zurückziehen und der Politik unsere Ziele einflüstern. Wir wollen ein Angebot machen und orientieren uns dabei an der Umweltbewegung, die vor 30, 40 Jahren eine Vielzahl an unterschiedlichen Organisationsformen ausprobiert hat. Daraus sind mittlerweile große Organisationen wie der WWF oder Greenpeace entstanden, die sich jetzt effektiv für Umweltschutz engagieren. Ich glaube, das brauchen wir auch im Internet. tagesschau.de: Also erhebt die ""Digitale Gesellschaft"" keinen Alleinvertretungs-Anspruch? Beckedahl: Natürlich nicht. Es geht darum, im Internet verschiedene Angebote zu schaffen, um effektiver für Bürgerrechte im digitalen Zeitalter werben zu können. Aber auch darum, gegenüber der Politik diese Bürgerrechte einzufordern - denn die baut unsere Grundrechte ja immer weiter ab. tagesschau.de: Kann jeder Teil der ""Digitalen Gesellschaft"" werden? Beckedahl: Nein. Wir wollen erst mal klein anfangen, um die Strukturen zu schaffen, die dafür notwendig sind, später einmal ganz viele Menschen mitmachen zu lassen. tagesschau.de: Aber steht das nicht im Widerspruch zur Struktur des Netzes und der Art und Weise wie sich Bürgerprotest bisher online organisiert hat? Beckedahl: Auch das zeigen unsere Erfahrungen mit offenen Netzwerken in den letzten Jahren. Am Anfang wollen ganz viele mitmachen, aber im Laufe der Zeit werden die unterschiedlichen Vorstellungen der einzelnen immer deutlicher. Man streitet sich und irgendwann geht gar nichts mehr. Dann hat niemand was davon. Außerdem hindern wir ja niemanden daran andere Organisationsformen auszuprobieren. Wir versuchen es jetzt eben mal auf diesem Weg - denn wir wollen kurz- und mittelfristig Ergebnisse erzielen. Ohne groß darüber zu diskutieren, was man machen müsste. tagesschau.de: Welche Themen wollen Sie als erstes angehen? Beckedahl: Das wichtigste Thema zurzeit ist sicherlich die Wahrung der Netzneutralität. Wir wollen auch künftig von einem offenen Netz profitieren, ohne jede Einschränkung. Daneben gibt es aber natürlich eine Vielzahl von anderen Themen. Etwa die Debatte um das Urheberrecht, die Vorratsdatenspeicherung oder die Forderung nach einer maschinenlesbaren Regierung durch OpenData, in der alle öffentlichen Daten und Verträge publik gemacht werden. Außerdem fordern wir, ein Prozent der Rundfunkgebühren in eine Internet-Stiftung zu stecken, um damit partizipative Medien zu fördern. tagesschau.de: Wie finanziert sich die ""Digitale Gesellschaft""? Beckedahl: Wir sind natürlich auf Spendengelder angewiesen und entwickeln deshalb zurzeit neue Fundraising-Strategien. Hoffentlich kommt einiges zusammen. Das Interview führte Niels Nagel, tagesschau.de "
13.04.2011 16:11 Uhr,"Regierung meldet der EU Minus von 2,5 Prozent",Deutsches Defizit wieder unter drei Prozent,"Das staatliche Defizit in Deutschland soll im kommenden Jahr auf 1,5 Prozent der Wirtschaftsleistung sinken. Das sieht das aktualisierte Stabilitätsprogramm der Bundesregierung vor, das vom Kabinett beschlossen wurde. Bereits in diesem Jahr soll demnach das Defizit von Bund, Ländern, Gemeinden und Sozialversicherungen auf insgesamt 2,5 Prozent des Bruttoinlandsprodukts (BIP) sinken. Damit würde der Drei-Prozent-Grenzwert des EU-Stabilitätspakts wieder eingehalten. Die Bundesregierung werde den EU-Institutionen mitteilen, dass ""wir in diesem Jahr die Defizitgrenze bereits wieder unterschreiten werden"", sagte Finanzminister Wolfgang Schäuble (CDU) dazu im Bundestag. Auch der Schuldenstand von derzeit 83,2 Prozent des BIP werde bis 2015 wieder auf 75,5 Prozent sinken. Das entsprechende Maastricht-Kriterium sieht allerdings eine Schuldenobergrenze von 60 Prozent des BIP vor. Nach Angaben der Bundesbank kletterten die Schulden von Bund, Ländern, Gemeinden und Sozialversicherungen 2010 um 319 Milliarden Euro auf rund 2,08 Billionen Euro. Ein wesentlicher Grund für den starken Schuldenzuwachs im vorigen Jahr seien ""umfangreiche Maßnahmen zur Finanzmarktstabilisierung in Höhe von 241 Milliarden Euro"" gewesen, teilte die Bundesbank mit. Dies betreffe vor allem die Bad Banks der Hypo Real Estate (HRE) und der WestLB. Seit 2008 habe sich die Bankenrettung insgesamt mit 335 Milliarden auf den Schuldenberg niedergeschlagen. Soweit sich die Risikoaktiva später verwerten ließen, werde sich dies künftig dämpfend auf den Schuldenstand auswirken. Ab 2014 soll das gesamtstaatliche Defizit dem Stabilitätsprogramm zufolge auf 0,5 Prozent des BIP sinken. 2010 hatte das Defizit noch 3,3 Prozent betragen, 2009 lag es bei 3,0 Prozent. Bei der Gesamtverschuldung liegt Deutschland seit mehreren Jahren oberhalb der 60-Prozent-Grenze. Wegen der Überschreitung des Maastricht-Kriteriums von 3,0 Prozent während der Wirtschaftskrise hatte die Kommission 2010 ein formales Verfahren gegen Deutschland eingeleitet. Wegen der teuren Bankenrettung und milliardenschwerer Konjunkturpakete hatten Bund, Länder, Kommunen und Sozialversicherungen zusammen 82 Milliarden Euro mehr ausgegeben als sie einnahmen. "
13.04.2011 14:28 Uhr,EU-Vorschlag für neue Kraftstoffsteuer,(K)ein Grund zur Aufregung?,"Deutsche Politiker machen gegen Brüssel mobil - doch die EU-Kommission bleibt bei ihren Plänen: Sie will Kraftstoff künftig anders besteuern. Diesel könnte dann um fast 30 Cent teurer werden - der ADAC drohte bereits mit einem Aufstand. Von Martin Bohne, MDR-Hörfunkstudio Brüssel Der EU-Kommission will, dass Kraftstoffe in der Europäischen Union künftig mehr nach ökologischen Gesichtspunkten besteuert werden. Derzeit bemessen sich die Steuern zumeist an der Menge des eingesetzten Kraftstoffes. Künftig sollen sie sich am Energiegehalt und am Ausstoß an Kohlendioxyd orientieren. Denn diese Kriterien sind entscheidend für die Umweltwirkung. So würden Biokraftstoffe mit den neuen Regeln billiger werden, denn sie haben einen geringeren Energiegehalt als fossile Brennstoffe. Bei Dieselkraftstoffe hingegen sieht es anders aus. Ein Liter Diesel enthält mehr Energie als Benzin, die Steuer müsste so um knapp ein Fünftel höher sein als die für Benzin. Für Deutschland würde dies in der Tat eine Umkehrung der jetzigen Preisverhältnisse bedeuten. Denn hierzulande wird Diesel schon seit Jahrzehnten gegenüber dem Benzin steuerlich bevorzugt. Und die Autolobby hat flugs ausgerechnet, dass der Preis für einen Liter Diesel so mit der Umsetzung der Brüsseler Pläne um fast 30 Prozent steigen würde. Und fast jeder zweite Autofahrer fährt in Deutschland einen Diesel. Zweitens würden die Brüsseler Steuerpläne erst 2020, also in fast zehn Jahren, tatsächlich an den Tankstellen spürbar werden. Und drittens braucht Berlin nur Nein zu sagen und es bleibt alles beim Alten. Denn die EU-Kommission kann nur Vorschläge machen. Beschlossen werden die Gesetze von Rat der EU-Mitgliedsstaaten und vom Europäischen Parlament. Und in Steuerfragen gilt sogar das Einstimmigkeitsprinzip. Das heißt, ausnahmslos alle EU-Regierungen müssen zustimmen. Und das ist nicht sehr wahrscheinlich. "
13.04.2011 12:54 Uhr,Konzerne sprachen Preise und Marktanteile ab,EU verhängt Millionenstrafe gegen Waschmittelkartell,"Henkel muss keine Geldbuße zahlen, weil es das Kartell im Jahr 2008 bei der EU gemeldet hatte. Die beiden anderen zeigten sich einsichtig: Sie räumten ihr Vergehen ein. Ihre Strafe wurde daher um zehn Prozent gesenkt. Procter & Gamble muss demnach 211,2 Millionen Euro zahlen, Unilever 104 Millionen Euro. Die Absprachen erfolgten zwischen 2002 und 2005 und bezogen sich auf Vollwaschmittelpulver für die Maschinenwäsche. Neben Deutschland, Belgien, Frankreich, Griechenland und Italien waren auch die Niederlande, Portugal und Spanien betroffen. Procter & Gamble vertreibt die Marken Ariel, Dash und Vizir, Unilever Coral und Henkel Persil, Weißer Riese, Spee und Terra. "
13.04.2011 12:13 Uhr,Lebensmittel aus Japan,"""Gefährdung viel niedriger als nach Tschernobyl""","Die Kunden in Deutschland sind verunsichert: Welche Lebensmittel sind vom Super-GAU in Japan betroffen? Was kann man noch essen, was nicht? Die Sorge ist zwar verständlich, aber weitgehend unbegründet: Nur sehr wenige Lebensmittel werden aus Japan importiert - und selbst die sind meist unbedenklich. Zudem verschärfte die EU die Grenzwerte für japanische Lebensmittel. Von Susanna Nolte für tagesschau.de Bei den Verbraucherzentralen in Deutschland laufen die Telefone heiß. Die Leute möchten wissen, welche japanischen Lebensmittel sie noch bedenkenlos essen können, ob der Besuch im Sushi-Restaurant ein Risiko ist oder wie belastet Fisch und Meeresfrüchte aus Japan sind. Doch bisher gibt es keine nachgewiesenen Gefährdungen durch erhöhte Radioaktivität in Lebensmitteln, die aus Japan eingeführt werden - weder bei Fisch, Meeresfrüchten, Grünem Tee, Pilzen, Wasabi oder Reis noch bei Nudeln oder Sojasaucen. Deutschland importiert ohnehin nur sehr wenig Lebensmittel aus Japan. Sie spielen im Vergleich zu den gesamten Nahrungsmitteleinfuhren kaum eine Rolle. Importiert werden vor allem Spezialitäten wie Gewürze, Saucen, Tee, Backwaren oder Wein. Auch hier machen Vergleiche deutlich, wie verschwindend gering die Mengen sind: Deutschland importiert ungefährt 233 Tonnen Tee und Mate aus Japan. Gemessen an rund 57.400 Tonnen, die Deutschland insgesamt einführt, sind das lediglich 0,4 Prozent. Bei Gewürzen liegt der Anteil bei 0,1 Prozent, bei Backwaren und Getreidezubereitungen bei 0,04 Prozent und bei Wein bei 0,02 Prozent. Nima Mader, Geschäftsführer der JIK GmbH in Willich bei Düsseldorf, europaweiter Großhändler für asiatische Lebensmittel, bekommt derzeit viele Anfragen von besorgten Kunden, fast alle aus Deutschland. Mader ist spezialisiert auf alles, was es in Sushi-Bars gibt. Und davon, sagt er, sei kaum etwas direkt aus Japan. Fisch und Garnelen kämen aus Taiwan, China, Thailand oder Vietnam. Sushi-Reis bezieht das Unternehmen ausschließlich aus Italien oder den USA. Nur ein sehr kleiner Anteil der deutschen Reisimporte kommt überhaupt aus Japan. Nori-Blätter, Ingwer, Wasabi - alles aus China, sagt Mader, auch die meisten Sojasaucen würden außerhalb Japans hergestellt, zum Beispiel in den Niederlanden. Viele Produkte mit dem Aufdruck ""made in Japan"" seien dort nur verpackt, hergestellt mit Zutaten aus China, so der Asia-Großhändler. Erklärende Schilder im Schaufenster hält Christian Kutschera, Geschäftsführer der Restaurant-Kette ""Sushi-Circle"", für Panikmache. In seinen 18 Lokalen in zehn großen deutschen Städten hat er nahezu keine Reaktionen der Gäste auf mögliche Gefahren durch Radioaktivität festgestellt. 95 Prozent der Zutaten in seinen Restaurants kämen ohnehin nicht aus Japan, so Kutschera, bei den restlichen werde er möglicherweise andere Lieferanten suchen, wenn die Ware aus dem vergangenen Jahr verbraucht sei. Anrufe bekommen die Verbraucherschützer auch von Kitas und besorgten Eltern. Wie lange können ihre Kinder noch gefahrlos Fischstäbchen essen?, fragen sie. Fischstäbchen werden aus Alaska-Seelachs gemacht. Die größten Fanggebiete dieses Fisches liegen in der Beringsee, etwa 2500 Kilometer von Fukushima entfernt. Experten schließen eine Gefährdung durch erhöhte Radioaktivität dort derzeit aus. Trotz dieser Entwarnung überprüft die Fischindustrie ihre Ware gezielt auf erhöhte Strahlenbelastung. Aber ebenso wie bei anderen Lebensmitteln hat Japan auch bei Fisch keine große Bedeutung für den deutschen Markt. Deutschland bezieht überwiegend Ware aus dem Atlantik, weniger aus dem Pazifikraum. Der Anteil japanischer Einfuhren nach Deutschland ist sehr gering. Möglicherweise Preiserhöhungen bei japanischen Produkten Die Naturkost-Firma Arche aus Hilden, die sich auf japanische Lebensmittel spezialisiert hat, berichtet, ihre ""Lager würden derzeit leergefegt"". Betriebsleiterin Ute Schulze rechnet mit Preiserhöhungen für ihre Produkte, da künftige Ware zuverlässig analysiert werden müsse, so Schulze. Und die Kosten dafür blieben bei dem Unternehmen hängen. Auch beim Tee langen die Kunden im Moment zu. Von Hamsterkäufen spricht Jonathan Gschwendner von der Firma Tee Gschwendner aus Meckenheim, mit einem Anteil von 30 Prozent Marktführer im deutschen Teefachhandel. Die Ware, die derzeit über die Ladentheke gehe, so Gschwendner, seien Erträge des letzten Jahres. Im Mai beginne die Ernte 2011, dieser Tee werde ungefähr ab Ende des Jahres in den Geschäften sein. Grüntees aus Japan seien nicht vollständig ersetzbar, einige höchstens durch Ware aus China, sagt Gschwendner. Die Anbaugebiete für Tee lägen aber eher im Süden Japans, seien also von der Reaktor-Katastrophe nicht betroffen. Genauso versichert Thomas Grömer, Geschäftsführer von Aiya, in Deutschland führender Produzent im Bereich Grüntees und Matcha, auch nach dem Sommer 2011 werde auf legalem Weg in Deutschland nur unbelastete Ware verkauft. Für einen Handelsriesen wie die Metro AG aus Düsseldorf haben Lebensmittel aus Japan nur wenig Bedeutung. Zwar führt das Unternehmen in Deutschland viele Produkte aus dem asiatischen Raum, wie China, Thailand oder Vietnam, aber nur wenige aus Japan. Dazu gehören Reisschnaps und einige Sojasaucen. Im Fischbereich führt das Handelsunternehmen japanische Muscheln als Tiefkühlware. Der jetzige Bestand sei aus der Zeit vor dem 11. März 2011, so eine Sprecherin der Metro AG. Künftige Ware werde auch durch betriebliche Kontrollen auf erhöhte Radioaktivität geprüft. "
13.04.2011 00:23 Uhr,Pro & Contra,Gut für die Umwelt oder gut für den Finanzminister?,"Geht es nach Brüssel, dann wird Diesel künftig so besteuert, dass er in Deutschland teurer werden könnte. Vor allem Deutschland läuft dagegen Sturm, die EU-Kommission verteidigt ihren Vorschlag geradezu leidenschaftlich. Höhere Steuern für Diesel - ist das der richtige Weg? Ja, meint Umweltredakteur Werner Eckert. Ein klares Nein kommt dagegen von Wirtschaftsredakteurin Sabrina Fritz. Contra: "
13.04.2011 00:23 Uhr,Pro & Contra Präimplantationsdiagnostik,Menschlich oder unmenschlich?,"Die Diagnostik im Reagenzglas schafft mehr Probleme als sie löst, meint Jörg Vins von der SWR-Kirchenredaktion. Ulrike Till von der SWR-Wissenschaftsredaktion hält dagegen ein ausnahmsloses PID-Verbot für unmenschlich: In engen Grenzen erlaubt, könne die PID viel Leid ersparen. "
13.04.2011 00:23 Uhr,Contra Diesel-Steuer,"""Nur ein Gefallen für den Finanzminister""","Von Sabrina Fritz, SWR-Wirtschaftsredaktion Diesel-Fahrer zahlen doch heute schon mehr! Mit Kfz-Versicherung und  Anschaffung kommen da in zehn Jahren schnell 5000 Euro zusammen. Das ist viel Geld. Warum ist dann die Hälfte der deutschen Autofahrer überhaupt so blöd und kauft sich einen Diesel? Weil der Diesel weniger verbraucht - und das ist gut: nicht nur fürs Konto, sondern vor allem für die Umwelt. Deutsche Autohersteller sind sehr stolz darauf, dass sie Luxusautos entwickelt haben, die nur fünf Liter verbrauchen. Und dafür sollen sie nun bestraft werden? Bestraft werden auch die Dieselfahrer, denn das sind vor allem die Vielfahrer, also die, die mobil sind. Und das sollen wir doch auch sein, oder? Wenn jetzt der Diesel auch noch an der Tankstelle teurer wird, heißt das für alle, die jetzt schon einen haben: Wertverlust. Und die Autohersteller werden keine große Lust mehr haben, noch nach sparsameren Diesel-Modellen zu forschen. Höhere Dieselsteuer - damit tut Brüssel niemanden einen Gefallen - nicht dem Autofahrer und nicht der Umwelt. Nur dem Finanzminister. "
13.04.2011 00:23 Uhr,Pro Diesel-Steuer,"""Das beste Konzept für die Umwelt ""","Von Werner Eckert, SWR-Umweltredaktion Jetzt mal nicht gleich aufregen, diese Euro-Idee ist absolut logisch und hat mit Abzocke gar nichts zu tun. Erst mal ist Diesel nämlich tatsächlich ein Super-Sprit mit Energie-Mehrwert. Das macht ihn ja so populär. Aber leider belastet ein Liter Diesel die Umwelt und das Klima eben auch deutlich stärker als ein Liter Benzin. Zweitens: Diesel wird bisher praktisch subventioniert. Das wollen wir doch mal festhalten. Diesel war der Sprit der Traktoren und Lastwagen. Da kommt die niedrige Besteuerung. Aber heute ist das ganz anders. Das wissen auch unsere Berliner Regierenden. Sie haben aber mit einem ganz faulen Kompromiss darauf reagiert. Statt eben die Dieselsteuer schon vor Jahren an moderne Zeiten anzupassen, haben sie alles beim Alten gelassen und ersatzweise die Kraftfahrzeugsteuer für Dieselfahrzeuge erhöht. Das ist aber eine Auto-Abgabe. Die zahlt auch der, der gar nicht fährt. Und das ist ökologisch völlig unsinnig. Es gibt nur eines: Endlich Benzin- und Dieselsteuer in ein vernünftiges Gleichgewicht bringen. Es geht da gar nicht um Abzocke. Gegen eine einseitige Erhöhung der Dieselabgabe müssen wir uns natürlich wehren! Das richtige Konzept heißt aber: Dieselsteuer rauf, gleiche Kraftfahrzeugsteuer für alle und Benzinsteuer runter. Und da braucht auch nicht morgen einer vor Schreck tot umfallen, denn Brüssel hat vernünftigerweise eine lange Übergangszeit vorgesehen. Aber dieses Konzept gibt dann die korrekten Signale in den Markt, steuert die Entwicklung der Autos in die richtige Richtung, und das beste Konzept für die Umwelt ist dann auch das billigste für uns. "
12.04.2011 18:38 Uhr,Interview zum Streit über Flüchtlinge,"""Grenzkontrollen verhindern nicht die Einreise""","Zum Ärger der EU-Partner stellt Italien Flüchtlingen Kurzzeit-Visa aus. Doch damit könnten sie im Schengen-Gebiet nicht frei reisen, sagt der Europarechts-Experte Daniel Thym im Interview mit tagesschau.de. Dafür, aber auch für die umfassende Wiedereinführung der Grenzkontrollen fehle die rechtliche Grundlage. tagesschau.de: Italien stellt Flüchtlingen aus Tunesien vorübergehende Aufenthaltsgenehmigungen aus, mit denen die Weiterreise in andere EU-Länder ermöglicht würde. Verstößt das Land damit gegen das Schengen-Abkommen, wie es andere EU-Länder Italien vorwerfen? Daniel Thym: Rechtlich ist Italien durchaus dafür zuständig, diese Aufenthaltstitel für humanitäre Zwecke zu erteilen. Allerdings gelten diese dann nur für Italien. Das heißt, die anderen Mitgliedsstaaten sind nicht verpflichtet, den betroffenen Ausländern die Weiterreise in das Staatsgebiet ohne Weiteres zu erlauben. tagesschau.de: Das heißt, wenn die österreichische Innenministerin Maria Fekter sagt, sie werde prüfen, inwiefern das italienische Visum tatsächlich anerkannt werde, bezieht sie sich auf diese Rechtsgrundlage? Thym: Die rechtlichen Regeln, niedergelegt in den Artikeln 18 und 21 des Schengener Übereinkommens, wurden erst im Jahre 2010 angepasst. Damals hat man sichergestellt, dass solche nationalen Visa nicht automatisch für das gesamte Schengen-Gebiet gelten. Die anderen Mitgliedsstaaten bleiben also berechtigt, die Einreise unter bestimmten Umständen zu verweigern, etwa wenn die betroffene Person nicht über hinreichend Geld verfügt. tagesschau.de: Was bringt denn dann überhaupt die als Drohung wahrgenommene Ankündigung Italiens, Kurzzeit-Aufenthaltsgenehmigungen auszustellen? Thym: Das ist eine politische Drohung. Österreich und Deutschland haben die zwar die Befugnis, die Leute nicht einreisen zu lassen, können aber dieses Recht tatsächlich schwer durchsetzen. Und das weiß Italien. Dadurch dass die Grenzkontrollen abgeschafft sind, können Österreich und Deutschland faktisch wenig unternehmen. tagesschau.de: Würde damit der Umgang mit dem Problem an die Kontrolleure delegiert, die an der Grenze entscheiden müssten, ob sie jemand mit dem italienischen Aufenthaltspapier einreisen lassen oder zurückschicken? Thym: Damit unterstellen Sie, dass die Grenzkontrollen wieder eingeführt sind. tagesschau.de: An einigen Grenzen zwischen Schengen-Staaten gibt es ja durchaus Personenkontrollen. Thym: Aber nur partiell. Es gibt derzeit keine systematischen Kontrollen. Denn die Grundidee von Schengen ist, dass die Außengrenzen effektiv kontrolliert werden und die Menschen innerhalb der Schengen-Region frei reisen können. tagesschau.de: Also ist die Reaktion des deutschen Innenministers Friedrich konsequent, die Binnen-Grenzkontrollen zu verstärken, wenn Italien die Kurzaufenthaltsvisa ausstellt? Thym: Die Wiedereinführung von Grenzkontrollen unterliegt sehr strengen Regelungen, die wahrscheinlich in der jetzigen Situation nicht vorliegen. tagesschau.de: Welche Voraussetzungen müssten dafür gegeben sein? Thym: Ein Beispiel wären Terroranschläge oder deren Verhinderung im Falle großer politischer Treffen wie zum Beispiel G-8-Gipfel. tagesschau.de: Das heißt, dass Innenminister Friedrich gar keine rechtliche Grundlage für seine Ankündigung hat, vorsichtshalber die Kontrollen an den Grenzen innerhalb des Schengenraums zu verschärfen? Thym: Für eine umfassende Wiedereinführung der Grenzkontrollen müsste eine schwerwiegende Bedrohung der öffentlichen Ordnung oder inneren Sicherheit gegeben sein. Dies gilt jedenfalls für Fälle, in denen an jedem Grenzübergang wieder Beamte stehen. Doch selbst mit Grenzkontrollen könnte man die Einreise nicht immer verhindern, weil ja die Grenzzäune abgebaut sind. Ich wohne in Konstanz, da verlaufen die Grenzen zur Schweiz teils durch den Wald und die Bundespolizei hätte gar nicht die Ausrüstung vor Ort, die illegale Grenzüberschreitung von heute auf morgen umfassend zu verhindern. tagesschau.de: Der italienische Innenminister war ja sehr empört darüber, dass die anderen EU-Staaten aus seiner Sicht Italien die Solidarität bei der Bewältigung des Flüchtlingsandrangs aus Nordafrika verweigerten. Handelt es sich denn um ein nationales oder um ein europäisches Problem? Thym: Recht haben alle Beteiligten, wenn sie auf Solidarität pochen. Ebenso wie die Währungsunion kann der Schengen-Raum nur funktionieren, wenn die Mitgliedstaaten zur solidarischen Zusammenarbeit bereit sind. Doch Solidarität ist keine Einbahnstraße, sondern verlangt auch von Italien die Bereitschaft an einer gemeinschaftlichen Lösung mitzuarbeiten. Die einseitige Vergabe von Aufenthaltstiteln ohne vorherige Abstimmung ist sicher nicht solidarisch. tagesschau.de: Italien argumentiert ja, dass die Zahl der Flüchtlinge eine einzelne Nation überfordere. Thym: Bei den aktuellen Zahl kann man davon ausgehen, dass ein Land von der Größe Italiens damit eigenständig zurechtkommen kann. Das Problem ist natürlich, dass in naher Zukunft noch sehr viel mehr Wirtschaftsflüchtlinge kommen können - und der Umstand, dass Italien illegalen Einwanderern einen Aufenthaltstitel in Aussicht stellt, könnte sogar ein Anreiz darstellen, dass mehr Personen die gefährliche Überfahrt über das Mittelmeer wagen. tagesschau.de: Gibt es Vorgehensweisen, die sie vorschlagen? Thym: Langfristig muss die Lastenverteilung innerhalb der Europäischen Union besser organisiert werden, das heißt die Verteilung von Flüchtlingen, aber auch die gemeinsame Kontrolle von Außengrenzen oder die gemeinsame Organisation von Rückführungsflügen. Zudem muss man darüber nachdenken, wie man mit den Herkunfts- und Transitstaaten zusammenarbeitet, um durch wirtschaftliche Maßnahmen vor Ort und die Kooperationen beim Grenzschutz zu erreichen, dass weniger Flüchtlinge nach Europa kommen. Das Interview führte Nea Matzen, tagesschau.de "
