date,topline,headline,content10.04.2013 09:57 Uhr,Star-Investor Soros kritisiert deutsche Politik,Ja zu Eurobonds - oder raus aus der Währungsunion?,"Im Kampf gegen die Euro-Schuldenkrise sollte Deutschland nach Überzeugung von US-Starinvestor George Soros den Widerstand gegen Eurobonds aufgeben - oder aus der Währungsunion austreten. Beides sei für Europa und Deutschland besser, als weiterzumachen wie bisher, sagte er im Center for Financial Studies an der Goethe-Universität Frankfurt. Die umstrittenen Eurobonds sollen die Zinslast für Krisenstaaten senken. Für Deutschland würde die Kreditaufnahme teurer. Die Bundesregierung lehnt Eurobonds ab. Zuletzt war das Thema von der Agenda der EU verschwunden. Der frühere EZB-Chefvolkswirt Otmar Issing wies Soros' Vorstoß zurück. Gemeinschaftsanleihen seien demokratisch nicht legitimiert. Mit ihnen würde ein Land neue Staatsschulden mit dem Geld der Steuerzahler in anderen Ländern finanzieren. Soros sieht in Gemeinschaftsanleihen hingegen die Möglichkeit, die Pleitegefahr der Euroländer auszuräumen, was die Finanzierung der Krisenländer verbilligen und die Rückkehr zu Wirtschaftswachstum ermöglichen würde. Der Star-Investor Soros warnte vor der Gefahr der Eurokrise für die EU. Denn die aktuellen Ungleichgewichte seien auf Dauer politisch nicht tragbar. ""Das würde die Europäische Union zerstören. Das könnte schon im kommenden Jahr geschehen"", meinte er. Soros betonte weiter, nur ein aktives Deutschland könne die aktuelle Krise überwinden. Das Problem sei, dass Deutschland immer nur so viel wie unbedingt nötig mache, um den Euro zu retten. Das sei ein Fehler, der teuer werden könne. Die Krise werde sich wohl noch vor der Bundestagswahl verschärfen. Bis dahin könne Deutschland schon wie andere Euroländer in einer Rezession sein. Soros zeigte sich auch überzeugt, dass der Euro auch ohne Deutschland überleben könne. Die Währung würde abwerten, die Wettbewerbsfähigkeit steigen, sagte er: ""Europa könnte die drohende Depression verhindern."" Auch ohne Deutschland sei die Eurozone niedriger verschuldet als andere Währungsräume. Die Zwangsabgabe auf Sparguthaben bei zyprischen Geldhäusern als Gegenleistung für europäische Hilfszahlungen war nach Soros' Ansicht ein Fehler: ""Wenn es nach dem Aufbau einer Banken-Union und einer Rekapitalisierung der Banken geschehen wäre, hätte es eine gesunde Reform sein können."" Stattdessen komme sie zu einer Zeit, in der die Branche sehr angeschlagen sei. ""Was passiert ist, untergräbt das Geschäftsmodell der europäischen Banken, die stark von Einlagen abhängen"", betonte er. Banken müssten nun für ihre Refinanzierung höhere Risikoprämien bezahlen. Dies belaste finanziell schwächere Institute und Geldhäuser aus den hoch verschuldeten Euro-Staaten überdurchschnittlich. Dadurch werde der Aufbau einer Banken-Union zusätzlich erschwert, fügte Soros hinzu. Soros ist einer der bekanntesten Hedgefonds-Manager. Der 1930 in Ungarn geborene Investor verwaltet Milliarden-Vermögenswerte. Bekannt wurde er Anfang der 1990er-Jahre, als er massiv gegen das britische Pfund wettete. Das deutsche Vorgehen in der Schuldenkrise hatte er wiederholt attackiert. "
09.04.2013 19:20 Uhr,FAQ zum Ermittlungsverfahren,Wie geht es in Sachen Wulff weiter?,"Ex-Bundespräsident Wulff hat das Angebot der Staatsanwaltschaft ausgeschlagen, gegen eine Geldauflage einer Anklage wegen Bestechlichkeit zu entgehen. Er muss mit einem Prozess rechnen. ARD-Rechtsexperte Frank Bräutigam beantwortet die wichtigsten Fragen zum Ermittlungs- und zum möglichen Gerichtsverfahren. Von zahlreichen Vorwürfen ist aus strafrechtlicher Sicht vor allem einer übrig geblieben: Filmproduzent David Groenewold soll eine Hotelrechnung von Wulff in München über eine Summe zwischen 400 und 770 Euro übernommen haben. Im Gegenzug soll sich Wulff bei Siemens-Chef Peter Löscher für die finanzielle Förderung eines Groenewold-Filmprojekts eingesetzt haben. Wulff und Groenewold beteuern ihre Unschuld. Der ehemalige Bundespräsident bestreitet, von der Zahlung Groenewolds gewusst zu haben. Die Staatsanwaltschaft wertet dies juristisch bei Wulff als ""Bestechlichkeit"" (§332 Strafgesetzbuch), bei Groenewold - quasi spiegelbildlich - als ""Bestechung"" (§334 Strafgesetzbuch). ""Bestechlichkeit"" bedeutet, Geld als Gegenleistung für eine bestimmte, pflichtwidrige Amtshandlung anzunehmen. Ursprünglich hatte der Vorwurf ""Vorteilsannahme"" gelautet. Dafür reicht eine Zahlung an einen Amtsträger zur ""allgemeinen Klimapflege"". ""Bestechlichkeit"" ist also eine Stufe schärfer. Noch im März 2013 hatten die Staatsanwälte ihren Vorwurf rechtlich verschärft. Die zwei klassischen Möglichkeiten sind: Entweder das Verfahren einstellen, weil der Tatverdacht sich nicht bestätigt hat, der dann aus der Welt geräumt ist. Oder Anklage bei Gericht erheben, weil es aus Sicht der Staatsanwälte einen ""hinreichenden Tatverdacht"" gibt. Dann kann es zu einem Prozess kommen, in dem die Schuldfrage endgültig geklärt wird. Das Gesetz ermöglicht noch eine Art ""Mittelweg"": die Einstellung der Verfahrens gegen Zahlung einer ""Geldauflage"" nach §153a Strafprozessordnung (der Begriff ""Geldbuße"" ist hier übrigens nicht korrekt). Voraussetzung ist unter anderem, dass der Beschuldigte sowie das zuständige Gericht zustimmen, und dass ""die Schwere der Schuld nicht entgegensteht"". Aus Sicht der Staatsanwaltschaft muss für das vorgeworfene Delikt ein hinreichender Tatverdacht bestehen. Eine Einstellung nach §153a Strafprozessordnung ist also kein ""Freispruch"" im klassischen Sinne. Andererseits hat kein Gericht den Beschuldigten rechtskräftig verurteilt. Deshalb gilt er nach der Einstellung, wie im gesamten Verfahren, weiter als unschuldig. Im Fall Wulff wurde in den vergangenen Tagen häufig von einem ""Deal"" gesprochen. Umgangssprachlich kann man das so nennen. Im Strafrecht bezeichnet man mit ""Deal"" aber üblicherweise eine Absprache in einem laufenden Strafprozess vor Gericht. Das Prinzip lautet: Geständnis gegen mildere Strafe. Am Ende kommt es dann zu einer rechtskräftigen Verurteilung. Karlsruhe hatte die Justiz aufgefordert, die strengen Voraussetzungen zu beachten und solche ""Deals"" nicht im Hinterzimmer abzuschließen. Weil es im Fall Wulff noch gar keine Hauptverhandlung gibt, kommt ein ""Deal"" im klassischen Sinne hier noch nicht in Frage. Ja, sie gehören zum Justizalltag in Deutschland. §153a wurde 1974 geschaffen - ursprünglich, um kleinere Fälle ohne den großen Aufwand eines Prozesses zu erledigen. Inzwischen kommen immer wieder auch Prominente auf diese Weise um einen Prozess herum, zum Beispiel Helmut Kohl, Josef Ackermann oder Karl-Theodor zu Guttenberg nach seiner Plagiatsaffäre. Häufig gibt es dann Kritik an der vermeintlichen Möglichkeit, sich ""freizukaufen"". Andererseits sind auch die Beschuldigten oft in einer schwierigen Situation. Bevor sie einen langen Prozess riskieren, zahlen viele lieber - auch wenn sie damit zumindest auf die Möglichkeit eines ""richtigen"" Freispruchs verzichten. Im Angebot fiel die Formulierung, Wulff könne das Interesse an der Strafverfolgung durch ""Übernahme strafrechtlicher Verantwortung"" beseitigen. Das konnte man so deuten, dass ein Schuldeingeständnis verlangt wird. Die Zustimmung zur Einstellung darf rechtlich aber gerade nicht als Geständnis gewertet werden, deswegen gab es Kritik an der eher ungewöhnlichen Wortwahl. Nach Medienberichten soll die Staatsanwaltschaft klargestellt haben, dass dies nicht im Sinne eines Geständnisses gemeint gewesen sei. Der Punkt bleibt wohl strittig. Was passiert nach Ablehnung des Angebots nun als nächstes? Die Staatsanwaltschaft wird nun ziemlich sicher beim Landgericht Hannover Anklage erheben. Sie geht anhand ihrer Beweismittel von einem ""hinreichenden Tatverdacht"" aus. Die Verteidigung hatte vor einigen Tagen ja noch einen neuen Zeugen genannt, der Wulff entlasten könnte. Das scheint die Staatsanwälte aber nicht von ihrer Position abgebracht zu haben. Nein. Es gibt noch einen Zwischenschritt: Das Gericht prüft zunächst im sogenannten ""Zwischenverfahren"", ob aus seiner Sicht nach Aktenlage ebenfalls ein ""hinreichender Tatverdacht"" besteht. Bejaht das Gericht dies, nachdem der Betroffene Stellung nehmen konnte, lässt es die Anklage zu. Es kommt zum Prozess im Gerichtssaal. Dort müsste man den beiden Angeklagten ihre Schuld nachweisen (sie müssen nicht umgekehrt ihre Unschuld beweisen, das ist ein wichtiger Unterschied). Sieht das Gericht die Beweislage schon im ""Zwischenverfahren"" anders als die Staatsanwaltschaft, lehnt es die Eröffnung des Hauptverfahrens ab. Dann käme es gar nicht erst zum Prozess, und der Verdacht wäre ausgeräumt. Was bleibt der rechtliche Hauptstreitpunkt? In vielen Berichten heißt es, die Beweislage gegen Wulff und Groenewold sei sehr dünn. Vor allem die Situation beim Bezahlen der Hotelrechnung in München scheint schwer aufklärbar zu sein. Dass Groenewold Zahlungen für Wulff übernommen hat, ist rein objektiv betrachtet unstrittig. Der Streit zwischen Staatsanwaltschaft und Verteidigung dreht sich um die subjektive Seite: Gab es eine ""Unrechtsvereinbarung"" zwischen Wulff und Groenewold, und wusste Wulff von den Zahlungen? Auch solche subjektiven Dinge müssen vor Gericht bewiesen werden. Da kein Richter oder Staatsanwalt in den Kopf der Angeklagten schauen kann, wird die subjektive Seite regelmäßig anhand von Indizien hergeleitet. Das sind am Ende schwierige Wertungsfragen. Die Staatsanwaltschaft erhebt Anklage, weil zumindest sie einen hinreichenden Tatverdacht sieht. Die Nichteröffnung des Hauptverfahrens oder ein späterer Freispruch sind wegen der schwierigen Beweislage durchaus möglich. Dann wäre Wulff strafrechtlich rehabilitiert. Sicher ist ein Freispruch aber nicht. Genaue Prognosen zum jetzigen Zeitpunkt wären nicht seriös. Eine Verurteilung vorausgesetzt: §332 Strafgesetzbuch sieht Freiheitsstrafen von sechs Monaten bis zu fünf Jahren vor, in minder schweren Fällen auch Geldstrafe. Das bloße Zitieren der gesetzlichen Strafen erweckt aber häufig einen falschen Eindruck. Denn selten wird ein Strafrahmen ausgereizt, und bei Freiheitsstrafen kommt ohnehin immer Bewährung in Betracht. Außerdem geht es um einen recht geringen Betrag. Insofern ist hier größte Vorsicht angebracht. Aus meiner Sicht nicht. Dafür muss man sich in die Situation im Februar 2012 zurückversetzen. Für die Aufnahme von Ermittlungen reicht ein ""Anfangsverdacht"". Wenn zunächst die Aufhebung der Immunität nötig ist, prüfen Ermittler in der Regel besonders intensiv, ob sie wirklich einsteigen. Zumindest ""Ungereimtheiten"" gab es damals bei mehreren Reisen Wulffs. Nur in einem offiziellen Ermittlungsverfahren können Ermittler sie richtig aufklären. Eine ganz andere Frage ist dann die Bewertung der gewonnenen Ergebnisse am Schluss der Ermittlungen. Geht es bei der Summe von rund 700 Euro nicht um eine Lappalie? Für die Grundfrage, ob das Verhalten strafbar war oder nicht, spielt die Höhe des Betrages erst einmal keine Rolle. Sieht die Staatsanwaltschaft keinen hinreichenden Tatverdacht, muss sie ohne Wenn und Aber einstellen. Sieht die Justiz aber einen Verdacht oder ist später von der Schuld überzeugt, kann sie die Höhe der Summe zum Beispiel bei der Strafhöhe berücksichtigen. "
09.04.2013 16:26 Uhr,Reportage aus Syrien,Die Ignoranz des Westens - der Triumph der Islamisten,"Mit jedem Kriegstag gewinnen sie mehr Kampfkraft und mehr Anerkennung: die Nusra-Kämpfer in der syrischen Stadt Aleppo. Der Westen stuft sie als Terrororganisation ein - die notleidenden Menschen sehen das anders. Sie fühlen sich vom Westen im Stich gelassen und schöpfen durch die Al Nusra neue Hoffnung im Kampf gegen Präsident Assad. ARD-Hörfunkreporter Martin Durm war gemeinsam mit seinem Fernsehkollegen Jörg Armbruster in Aleppo unterwegs, wo Armbruster lebensgefährlich verletzt wurde. Von Martin Durm, SWR Vor einigen Monaten waren sie noch ein Phantom: berüchtigt und unsichtbar. Kaum ein westlicher Journalist hatte sie je zu Gesicht bekommen. Jetzt sieht man die islamistischen Kämpfer überall in der Stadt, vor allem in der Sha´aer-Straße, wo die Nusra-Front ihr Hauptquartier hat: Es ist eine Ruine - fünf leere, ausgebombte Stockwerke hoch. Fast täglich wird es aus dem Assad-treuen Westteil Aleppos beschossen. Westliche Regierungen haben die Nusra als Terrororganisation eingestuft. Doch in den Straßen Aleppos wird der Westen verflucht. ""Ihr lasst uns allein unter den Bomben"", ruft eine verschleierte Frau. ""Nur die Nusra schützt uns."" Und sie fügt hinzu: ""Was ist dabei, wenn sie für uns sind, und für den Islam, für Allah und Mohammed? Assad ist ein Ungläubiger. Nusra ist gut, das sind gute Leute, wir lieben sie."" Ende Januar 2012 gründeten syrische Dschihadisten die Nusra-Front als einen Ableger von Al Kaida im Irak. Anfangs gingen westliche Geheimdienste noch davon aus, dass allenfalls ein paar hundert Radikalislamisten auf Seiten der Aufständischen mitkämpfen würden. Inzwischen ist die Front auf geschätzte 8000 Kämpfer angewachsen, auch ausländische Dschihadisten gehören dazu. ""Die besten Kämpfer kommen von der Nusra"", sagt ein junger Mann. ""Niemand hilft uns. Amerika, Frankreich, Großbritannien - alle lassen uns im Stich. Ihr sagt: Nusra, das sind Terroristen, Fanatiker. Aber das ist uns egal. Wir sagen: Sie verteidigen uns gegen den Schlächter Assad."" Das eigentliche Kriegsziel der Nusra-Front reicht über Syrien hinaus. Die Al Kaida nahestehenden Dschihadisten kämpfen für ein sunnitisches Emirat, das vom Irak bis hin zum Libanon reichen soll. Ahrar al Sham, die zweite große Islamistenmiliz im syrischen Bürgerkrieg, fände sich schon mit einem nationalen Gottesstaat ab. Noch sind es islamistische Utopien. Doch immer mehr degeneriert die Revolte gegen Assad zu einem Religionskrieg zwischen sunnitischen Rebellen und einem Regime, das die alawitisch-schiitische Minderheit repräsentiert. Auf Propaganda können die Islamisten getrost verzichten. Es genügt, dass sich der Westen so verhält, wie er es seit zwei Jahren tut: Passiv, ratlos und gnadenlos ignorant, weil er den Menschen in den umkämpften Städten jede humanitäre Hilfe verweigert. Stattdessen helfen die Islamisten, die Geld aus Saudi-Arabien bekommen und es an Krankenhäuser und Obdachlose verteilen. Das Versagen des Westens ist der Triumph der Islamisten geworden. Mit jedem Kriegstag gewinnen sie mehr Kampfkraft, mehr Autorität und mehr Anerkennung. Selbst dort, wo man es gar nicht vermutet: ""Die Nusra-Kämpfer sind für uns keine Terroristen, sondern tapfere Kämpfer"", sagt Abdul Jabar Akaidi, Kommandant der Freien Syrischen Armee (FSA) in Aleppo. Wenn irgendwann einmal alles vorbei ist, Hunderttausend gestorben und Assad gestürzt, was geschieht dann? Das haben wir an einem Abend in Syrien einen Islamisten gefragt. Er war Gast in dem Haus, in dem wir wohnten, ein höflicher junger Mann, der andauernd lächelte und Tee mit uns trank: ""Was dann geschieht? Dann werden wir den Alawiten die Köpfe abschneiden, weil sie Ungläubige sind. Und dann machen wir unseren islamischen Staat."" "
09.04.2013 15:33 Uhr,FAQ zum Ermittlungsverfahren,Wie geht es in Sachen Wulff weiter?,"Der ARD-Rechtsexperte Frank Bräutigam beantwortet für tagesschau.de Fragen zum Ermittlungsverfahren gegen Ex-Bundespräsident Wulff. Von zahlreichen Vorwürfen ist aus strafrechtlicher Sicht vor allem einer übrig geblieben: Filmproduzent David Groenewold soll eine Hotelrechnung von ChristianWulff in München über 400 Euro übernommen haben. Im Gegenzug habe sich Wulff beim Siemens-Chef für die finanzielle Förderung eines Groenewold-Filmprojekts eingesetzt. Wulff und Groenewold beteuern ihre Unschuld. Der ehemalige Bundespräsident bestreitet, von der Zahlung Groenewolds gewusst zu haben. Die Staatsanwaltschaft wertet dies juristisch bei Wulff als ""Bestechlichkeit"" (§332 Strafgesetzbuch), bei Groenewold - quasi spiegelbildlich - als ""Bestechung"" (§334 Strafgesetzbuch). ""Bestechlichkeit"" bedeutet, Geld als Gegenleistung für eine bestimmte, pflichtwidrige Amtshandlung anzunehmen. Ursprünglich hatte der Vorwurf ""Vorteilsannahme"" gelautet. Dafür reicht eine Zahlung an einen Amtsträger zur ""allgemeinen Klimapflege"". ""Bestechlichkeit"" ist also eine Stufe schärfer. Noch im März 2013 hatten die Staatsanwälte ihren Vorwurf rechtlich verschärft. Die zwei klassischen Möglichkeiten sind: Entweder das Verfahren einstellen, weil der Tatverdacht sich nicht bestätigt hat, der dann aus der Welt geräumt ist. Oder Anklage bei Gericht erheben, weil es aus Sicht der Staatsanwälte einen ""hinreichenden Tatverdacht"" gibt. Dann kann es zu einem Prozess kommen, in dem die Schuldfrage endgültig geklärt wird. Das Gesetz ermöglicht noch eine Art ""Mittelweg"": die Einstellung der Verfahrens gegen Zahlung einer ""Geldauflage"" nach §153a Strafprozessordnung (der Begriff ""Geldbuße"" ist hier übrigens nicht korrekt). Voraussetzung ist unter anderem, dass der Beschuldigte sowie das zuständige Gericht zustimmen, und dass ""die Schwere der Schuld nicht entgegensteht"". Aus Sicht der Staatsanwaltschaft muss für das vorgeworfene Delikt ein hinreichender Tatverdacht bestehen. Eine Einstellung nach §153a Strafprozessordnung ist also kein ""Freispruch"" im klassischen Sinne. Andererseits hat kein Gericht den Beschuldigten rechtskräftig verurteilt. Deshalb gilt er nach der Einstellung, wie im gesamten Verfahren, weiter als unschuldig. Im Fall Wulff wurde in den vergangenen Tagen häufig von einem ""Deal"" gesprochen. Umgangssprachlich kann man das so nennen. Im Strafrecht bezeichnet man mit ""Deal"" aber üblicherweise eine Absprache in einem laufenden Strafprozess vor Gericht. Das Prinzip lautet: Geständnis gegen mildere Strafe. Am Ende kommt es dann zu einer rechtskräftigen Verurteilung. Karlsruhe hatte die Justiz aufgefordert, die strengen Voraussetzungen zu beachten und solche ""Deals"" nicht im Hinterzimmer abzuschließen. Weil es im Fall Wulff noch gar keine Hauptverhandlung gibt, kommt ein ""Deal"" im klassischen Sinne hier noch nicht in Frage. Ja, sie gehören zum Justizalltag in Deutschland. §153a wurde 1974 geschaffen - ursprünglich, um kleinere Fälle ohne den großen Aufwand eines Prozesses zu erledigen. Inzwischen kommen immer wieder auch Prominente auf diese Weise um einen Prozess herum, zum Beispiel Helmut Kohl, Josef Ackermann oder Karl-Theodor zu Guttenberg nach seiner Plagiatsaffäre. Häufig gibt es dann Kritik an der vermeintlichen Möglichkeit, sich ""freizukaufen"". Andererseits sind auch die Beschuldigten oft in einer schwierigen Situation. Bevor sie einen langen Prozess riskieren, zahlen viele lieber - auch wenn sie damit zumindest auf die Möglichkeit eines ""richtigen"" Freispruchs verzichten. Im Angebot fiel die Formulierung, Wulff könne das Interesse an der Strafverfolgung durch ""Übernahme strafrechtlicher Verantwortung"" beseitigen. Das konnte man so deuten, dass ein Schuldeingeständnis verlangt wird. Die Zustimmung zur Einstellung darf rechtlich aber gerade nicht als Geständnis gewertet werden, deswegen gab es Kritik an der eher ungewöhnlichen Wortwahl. Nach Medienberichten soll die Staatsanwaltschaft klargestellt haben, dass dies nicht im Sinne eines Geständnisses gemeint gewesen sei. Der Punkt bleibt wohl strittig. Es ist sehr wahrscheinlich, dass die Staatsanwaltschaft Anklage bei Gericht erhebt, wohl beim Landgericht Hannover. Sie geht anhand ihrer Beweismittel von einem ""hinreichenden Tatverdacht"" aus. Davon kann die Staatsanwaltschaft nicht mehr abrücken - und muss dann also ""ernst machen"". Nein. Denn es gibt einen Zwischenschritt. Das Gericht prüft zunächst im sogenannten ""Zwischenverfahren"", ob aus seiner Sicht  nach Aktenlage ebenfalls ein ""hinreichender Tatverdacht"" besteht. Das bedeutet, vereinfacht gesagt: Wahrscheinlichkeit einer Verurteilung von mehr als 50 Prozent. Bejaht das Gericht dies, lässt es die Anklage zu. Es kommt zum Prozess im Gerichtssaal. Dort müsste man den beiden Angeklagten ihre Schuld nachweisen. Sieht das Gericht die Beweislage schon im Zwischenverfahren anders als die Staatsanwaltschaft, lehnt es die Eröffnung des Hauptverfahrens ab. Dann käme es gar nicht erst zum Prozess und der Verdacht wäre ausgeräumt. Falls es zu einem Prozess kommen sollte: Viele Juristen halten die Beweislage gegen Wulff und Groenewold für dünn. Vor allem die Situation beim Bezahlen der Hotelrechnung in München scheint schwer aufklärbar zu sein. Ein Freispruch, die Rehabilitierung aus strafrechtlicher Sicht, ist also möglich, aber keinesfalls sicher. Hierzu müsste man die Ermittlungsakten im Detail kennen. Genaue Prognosen zum jetzigen Zeitpunkt wären nicht seriös. Eine Verurteilung vorausgesetzt: §332 Strafgesetzbuch sieht Freiheitsstrafen von sechs Monaten bis zu fünf Jahren vor, in minder schweren Fällen auch Geldstrafe. Das bloße Zitieren der gesetzlichen Strafen erweckt aber häufig einen falschen Eindruck. Denn selten wird ein Strafrahmen ausgereizt, und bei Freiheitsstrafen kommt ohnehin immer Bewährung in Betracht. Außerdem geht es um einen recht geringen Betrag. Insofern ist hier größte Vorsicht angebracht. Aus meiner Sicht nicht. Dafür muss man sich in die Situation im Februar 2012 zurückversetzen. Für die Aufnahme von Ermittlungen reicht ein ""Anfangsverdacht"". Wenn zunächst die Aufhebung der Immunität nötig ist, prüfen Ermittler in der Regel besonders intensiv, ob sie wirklich einsteigen. Zumindest ""Ungereimtheiten"" gab es damals bei mehreren Reisen Wulffs. Nur in einem offiziellen Ermittlungsverfahren können Ermittler sie richtig aufklären. Eine ganz andere Frage ist dann die Bewertung der gewonnenen Ergebnisse am Schluss der Ermittlungen. "
