date,topline,headline,content13.04.2013 05:40 Uhr,Politologe zum SPD-Wahlkampf,"""Die Wähler wissen nicht, wofür die SPD steht""","Vor ihrem Wahlparteitag steckt die SPD im Stimmungstief. ""Doch die Partei kann das Ruder noch herumreißen"", meint Politologe Timo Grunden. Im Interview mit tagesschau.de analysiert er das Dilemma der Sozialdemokraten und erklärt, wie sie bei den Wählern punkten könnten. tagesschau.de: Wofür steht die SPD im Wahljahr 2013? Timo Grunden: Die SPD versucht vor allem als Partei der sozialen Gerechtigkeit aufzutreten, also ihre alte Kernkompetenz zu erneuern. Denn sie weiß genau, dass sie die letzten Wahlen auch verloren hat, weil ihr die Wähler genau das nicht mehr abgenommen haben. Gleichzeitig versucht sie, auch für die Mitte attraktiv zu sein. Aus diesem Grund wurde Peer Steinbrück nominiert: als Kandidat der Mitte. Aber bislang hat die SPD es nicht geschafft, ein klares Profil zu gewinnen. Die meisten Wähler wissen gar nicht so genau, wofür die SPD steht. tagesschau.de: Beim Bundesparteitag in Augsburg soll das Wahlprogramm beschlossen werden. Warum tut sich die SPD so schwer damit, Wahlkampfthemen zu finden, die auch einschlagen? Grunden: Vor allem, weil der Kanzlerkandidat bisher mit Schadensbegrenzung in eigener Sache beschäftigt war. Das hat von den Sachthemen abgelenkt. Seine unklugen Einlassungen zum Kanzlergehalt und seinen Wein-Vorlieben haben dazu geführt, dass er nicht als glaubwürdiger Repräsentant einer sozialen SPD anerkannt wird. Zum anderen haben wir es mit einer Kanzlerin zu tun, die alles daran setzt, der SPD die Wahlkampfthemen zu nehmen: Sie übernimmt einfach die populären Forderungen von SPD und Grünen. Das ist der Versuch, die innenpolitischen Fronten zu verringern, der SPD keine Angriffsflächen zu bieten, um dann auf das Thema zu lenken, mit dem die Union die Wahl gewinnen kann, nämlich die Euro-Krise. Grunden: Nicht ganz. Natürlich hat die SPD mit Peer Steinbrücks Ausrutschern viel Zeit verloren. Erschwerend kommt hinzu, dass die Krise in Zypern und die nach wie vor schwelende Euro-Krise die öffentliche Debatte in letzter Zeit dominiert haben. Internationale Krisenzeiten sind immer Sternstunden der Exekutive: Merkel handelt, stellt Forderungen und enteilt dem Klein-Klein der Innenpolitik. Andererseits hat es die SPD noch nicht geschafft, ihre Themen zum Mittelpunkt der Auseinandersetzungen zu machen. Das ist das Hauptproblem der SPD-Kampagne, das muss sie bis zum Sommer lösen. Ihr Programm muss in das Bewusstsein der Wähler gelangen, ganz gleich, wie polarisierend ihre Forderungen sind. Wenn ihre Themen kontrovers diskutiert würden, dann hätte die SPD die Möglichkeit, Profil zu gewinnen und bestimmte Wählerschichten zu mobilisieren. tagesschau.de: Mit welchem Thema könnte die SPD denn punkten? Grunden: Arbeitsmarkt und Rente könnten immer noch zu Gewinnerthemen werden. Da wäre zum Beispiel der Mindestlohn. Die Kanzlerin versucht zwar, dieses Thema gar nicht erst zum Wahlkampfthema werden zu lassen, indem sie einen eigenen, allerdings sehr vagen Vorschlag dazu macht. Wenn der Mindestlohn aber zu einem großen Thema im Wahlkampf würde, dann hätte die SPD definitiv die besseren Karten. Im Zweifelsfall traut man ihr da mehr zu als der Union. Gleiches gilt für die Rente. Auch hier hat die Union einen eigenen Vorschlag, die ""Lebensleistungsrente"". Aber in einer echten Auseinandersetzung sähe die im Vergleich zu einer ""Mindestrente"", wie die SPD sie vertritt, doch recht schwach aus. tagesschau.de: Gibt es es noch ein anderes Thema, das als Wahlkampfschlager taugen würde? Grunden: Einen Wettkampf um das bessere Euro-Krisen-Management würde die SPD verlieren. Sie sollte stattdessen versuchen, den Wahlkampf bei den Wählern ""zu Hause"" zu gewinnen, in ihrer Lebens- und Arbeitswelt. Soziale Sicherheit, bezahlbare Mieten, gute Bildung oder eine qualitativ hochwertige Kinderbetreuung wären hier die Stichworte. Man darf die Bedeutung von Alltagsproblemen nicht unterschätzen - Eurokrise hin oder her. ""All politics is local"" lautet die Faustregel erfolgreicher Wahlkämpfer in den USA. tagesschau.de: Bei ihrem Wahlprogramm hat die SPD erstmals auch interessierte Bürger und Mitglieder mitwirken lassen: Was wünschen sich denn die SPD-Anhänger von ihrer Partei? Grunden: Für sie sind die Themen soziale Gerechtigkeit und soziale Sicherheit das wichtigste. Das weiß man aus Mitglieder- und Wählerbefragungen. Man erhofft sich, dass die SPD wirtschaftliche Kompetenz und soziale Gerechtigkeit miteinander verbindet. Das unterscheidet die SPD-Anhänger von denen der Linken, der man nicht zutraut, die sozialen Probleme mit wirtschaftlicher Kompetenz anzugehen. Die Vorschläge, die die Nichtmitglieder für das Wahlprogramm gemacht haben, hat die SPD zu elf Punkten verdichtet: Reichensteuer, sozialer Wohnungsbau und Bürgerversicherung beispielsweise. Überraschungen sind nicht darunter, diese Punkte hätten so auch vor vier oder acht Jahren in einem sozialdemokratischen Wahlprogramm stehen können. tagesschau.de: Ist Steinbrück einfach der falsche Mann für dieses Wahlprogramm, das auf soziale Gerechtigkeit setzt? Grunden: Nein, das würde ich so nicht sagen. Man hat es bisher nicht verstanden, die Stärken von Steinbrück auszuspielen. Der Kandidat stand sich bislang selber im Weg. Wenn die SPD es aber schafft, deutlich zu machen, dass sie die Partei ist, die wirtschaftliche Kompetenz mit sozialer Gerechtigkeit verbindet, dann ist Steinbrück der richtige Kandidat. Aber er konzentriert sich momentan zu sehr auf das Thema Verteilungsgerechtigkeit, anstatt den Wählern der Mitte mal zu signalisieren, dass die SPD auch etwas für sie im Angebot hat. Steinbrück wäre ein Kandidat, der sozialdemokratische Themen mit  Werten und Erwartungen ""bürgerlicher"" Mittelschichtsmilieus verbinden könnte. Auch diese Wählerschichten wollen zum Beispiel ""Recht und Ordnung"" im Arbeitsmarkt. Auch die Mittelschichten müssen erleben, wie ihnen im Hinblick auf Arbeitsverhältnisse, Zeit und Einkommen immer mehr Flexibilität abverlangt wird, ohne dass sie dafür einen Gegenwert erhalten. Es geht diesen Wählern also weniger um direkte Verteilungsfragen als um ein Minimum an sozialer Sicherheit und vor allem Planungssicherheit für das eigene Arbeits- und Familienleben. tagesschau.de: Von wem muss sich die SPD vor allem abgrenzen? Von der Union oder doch eher von Grünen und Linkspartei? Grunden: Die SPD führt immer einen Mehrfrontenkampf, das ist ihr großes Problem. Sie hat zwei Konkurrenten auf der linken Seite, Linkspartei und Grüne. Und mit Union und FDP führt sie den Kampf um die Wechselwähler der Mitte. Sich vor allem auf eine Seite zu konzentrieren, wäre falsch, das muss sozusagen arbeitsteilig erfolgen. tagesschau.de: Und wie kann man das schaffen? Grunden: Steinbrück war zwar von Anfang an nicht der glaubwürdigste Vertreter für soziale Gerechtigkeit, da hätte man jemand anderen nominieren müssen. Aber man hat ihn nominiert, weil er auch ungebundene Wähler und Mittelschichten ansprechen kann - und die braucht man für einen Wahlsieg. Für das Thema soziale Gerechtigkeit müssten jetzt aber andere aus der Partei einstehen, die das besser und glaubwürdiger können. Hannelore Kraft beispielsweise als Ministerpräsidentin in NRW, die diesen Wertekomplex glaubwürdig vertritt und die auch dafür sorgen könnte, dass die SPD in NRW den dringend benötigten Vorsprung vor der Union erhält. Denn wenn die SPD NRW nicht deutlich gewinnt, gewinnt sie auch keine Bundestagswahl - gleiches gilt im Übrigen auch für Niedersachsen. tagesschau.de: Es bleiben noch gut fünf Monate bis zur Bundestagswahl: Kann die SPD, kann Steinbrück das Ruder noch herumreißen? Grunden: Noch ist die Wahl für die SPD nicht verloren. Bei den Wahlen 2005 und 2009 hatten wir über 40 Prozent von so genannten Spätentscheidern unter den Wählern. Die entscheiden sich in den letzten vier bis sechs Wochen, wen sie wählen oder ob sie überhaupt zur Wahl gehen. Bei den Wahlkämpfen 2002 und 2005 hat die SPD in den letzten Wochen das Ruder nochmal herum gerissen. Auch wenn es 2005 dann doch nicht ganz gereicht hat. Und dann kommt es auf eine entscheidende Frage an: Worüber glauben die Wähler zu entscheiden, wenn sie ihr Kreuz machen? Wenn sie glauben, über innen- und sozialpolitische Themen zu entscheiden, dann hat die SPD noch gute Chancen, die Wahl zu gewinnen. Wenn am Ende doch die Euro-Krise im Mittelpunkt steht, dann hat die Kanzlerin mit ihrer Partei die besseren Aussichten. Das Interview führte Sandra Stalinski, tagesschau.de "
13.04.2013 03:22 Uhr,Treffen der Euro-Finanzminister,Grünes Licht für Zypern-Hilfe und Banken-Aufsicht,"Die Euro-Finanzminister haben bei ihrem Treffen in Dublin das Hilfsprogramm für Zypern und die damit verbundenen Auflagen im Grundsatz beschlossen. Damit seien jetzt die Voraussetzungen gegeben, um die Zustimmung der nationalen Parlamente einzuholen, sagte Eurogruppen-Chef Jeroen Dijsselbloem. Das Programm sieht Hilfskredite in Höhe von zehn Milliarden Euro für das hoch verschuldete Mittelmeerland vor. Neun Milliarden Euro stammen von den Europartnern, der Rest vom Internationalen Währungsfonds (IWF). Das Programm muss noch vom Bundestag und anderen nationalen Parlamenten abgesegnet werden. Vor dem Treffen hatte Dijsselbloem klargestellt, dass der Rahmen für die Hilfskredite nicht angehoben werde, obwohl Zyperns Finanzlücke größer ist als zunächst angenommen. Anstatt 7,5 Milliarden Euro muss das Land selbst nun nach Angaben der Regierung in Nikosia mehr als 13 Milliarden Euro aufbringen. Dies soll unter anderem durch eine Beteiligung von Bankkunden an der Rettungsaktion, Privatisierungen und Einsparungen erreicht werden. Der aktuell höhere Finanzbedarf ist laut EU-Währungskommissar Olli Rehn auf die schwache zyprische Konjunktur und die Bankenrestrukturierung zurückzuführen. Die Finanzlage des Landes habe sich wegen der schwachen wirtschaftlichen Entwicklung verschlechtert. Außerdem schlage die Schließung und Umstrukturierung der beiden Großbanken zu Buche. Deshalb könnten die 23 Milliarden Euro nicht mehr mit den 17 Milliarden Euro verglichen werden, um die Zypern ursprünglich gebeten hatte, sagte Rehn weiter. Wie stark die Rezession in Zypern in den kommenden Jahren ausfallen werde, sei außerdem derzeit schwer zu sagen. Zyperns Präsident Nikos Anastasiades will unterdessen von der EU mehr Hilfe bei der Rettung seines Landes vor einer Staatspleite. In einem Brief an die Spitzen der EU wolle er um zusätzliche Unterstützung ""angesichts der kritischen Momente als Ergebnis der Finanzkrise, aber auch der Maßnahmen, die uns aufgezwungen wurden"" bitten, sagte er. Den Brief wollte er noch heute an Kommissionspräsident José Manuel Barroso, Ratspräsident Herman Van Rompuy und EZB-Chef Mario Draghi schicken. Zur Art der möglichen zusätzlichen Hilfe sagte Anastasiades nichts. Ein zyprischer Regierungssprecher betonte, dabei gehe es nicht um eine Aufstockung des Hilfspakets, sondern um mehr Unterstützung für die Wirtschaft der Landes. Anastasiades habe Subventionen und Gelder aus dem EU-Kohäsionsfonds gemeint. Die Äußerungen des Präsidenten waren zunächst als ein Antrag für mehr EU-Kredite verstanden worden. In der Vergangenheit hatte die Euro-Gruppe mehrfach Hilfsprogramme für angeschlagene Euro-Staaten wie Griechenland an eine schlechtere Wirtschaftsentwicklung anpassen müssen. Dieses Risiko wollte Bundesfinanzminister Wolfgang Schäuble auch im Fall Zypern nicht ausschließen. ""Das Leben ist immer voller Risiken, aber wir haben in den letzten drei Jahren bewiesen, dass wir sorgfältig mit den Risiken umgehen und verantwortliche Lösungen treffen"", sagte er. Die Euro-Länder geben Irland und Portugal zudem mehr Zeit für die Rückzahlung der Milliarden-Hilfskredite aus dem Euro-Rettungsfonds EFSF. Die Laufzeiten sollten um sieben Jahre verlängert werden, erklärte Dijsselbloem. Über das Thema war seit Monaten intensiv verhandelt worden. Die beiden Krisenländer strebten diese Entscheidung an, weil sie Tilgungs- und Zinslasten auf einen längeren Zeitraum verteilen wollen. Die Entscheidung muss nun noch in nationalen Parlamenten von Eurostaaten gebilligt werden. Portugal habe außerdem zugesagt, rasch neue Einsparungen zu beschließen, sagte Dijsselbloem weiter. Das Verfassungsgericht des Landes hatte einen Teil der bislang vorgesehenen Kürzungen vergangene Woche als verfassungswidrig eingestuft. Die Troika von EU-Kommission, Europäischer Zentralbank und IWF werde die neuen Sparmaßnahmen prüfen, sagte er. Die EU-Staaten einigten sich zudem einstimmig auf die gemeinsame Bankenaufsicht. Sie bestätigten damit einen Grundsatz-Kompromiss, der bereits mit dem EU-Parlament gefunden worden war. Die Aufsicht für Banken des Eurogebiets soll bis nächstes Jahr bei der Europäischen Zentralbank eingerichtet werden und das Vertrauen internationaler Anleger in europäische Geldhäuser erhöhen. Die Aufsicht ist das Kernstück des Riesenvorhabens einer europäischen Bankenunion. "
12.04.2013 17:51 Uhr,Leistungen und Gegenleistungen,Das steckt im Hilfspaket für Zypern,"Das Rettungspaket für Zypern steht. Kredite in Höhe von zehn Milliarden Euro fließen demnach nur, wenn der Bankensektor schrumpft und Vermögende zur Kasse gebeten werden. Aber auch die Liste der Sparauflagen für Zypern ist lang. Einige Kürzungen treffen die Bürger hart. Ein Überblick der wichtigsten Punkte: Hilfskredite: Bis zu zehn Milliarden Euro umfasst das Hilfspaket der internationalen Geldgeber. Neun Milliarden Euro soll der Euro-Stabilitätsmechanismus ESM zur Verfügung stellen. Der Internationale Währungsfonds will sich mit einem Kredit über eine Milliarde Euro beteiligen. Das erste Geld floss im Mai 2013 - nach der notwendigen Zustimmung des Bundestags und anderer nationaler Parlamente. Von den zehn Milliarden Euro Kredithilfen sollen 4,1 Milliarden Euro für die Tilgung von Krediten und die Rückzahlung auslaufender Staatsanleihen verwendet werden. 3,4 Milliarden Euro sind reserviert, um die Lücken in Zyperns Haushalten der kommenden Jahre zu schließen. Die restlichen 2,5 Milliarden Euro sollen dazu dienen, den Bankensektor jenseits der beiden größten Institute - der Bank of Cyprus und der Laiki Bank - mit neuem Kapital auszustatten. Ausdrücklich festgelegt wurde, dass die Hilfskredite nicht als Kapitalhilfen für die Laiki Bank und die Bank of Cyprus verwendet werden dürfen. Das für den Umbau dieser beiden Banken notwendige Geld müssen deren Eigner und Großanleger aufbringen. Kapitalbedarf: Zypern benötigt laut neuen Kalkulationen vom April 2013 insgesamt 23 Milliarden Euro bis zum Jahr 2016. Das sind 5,5 Milliarden Euro mehr als die ursprünglich veranschlagten 17,5 Milliarden Euro. Diese Steigerung im Vergleich mit der Schätzung vom November 2012 wurde mit der schlechteren wirtschaftlichen Entwicklung und den hohen Kosten der Reform des Bankensektors begründet. Die Euro-Finanzminister lehnte es aber ab, die zugesagten Hilfen von zehn Milliarden Euro aufzustocken. Das bedeutet, dass Zypern selbst die restlichen 13 Milliarden Euro beisteuern muss - unter anderem durch Kürzungen im Haushalt, Steuererhöhungen, Privatisierungen und die Beteiligung von Bankkunden und -eignern an den Umbaukosten des Bankensektors. Abgabe auf Bankeinlagen: Die ursprünglich vorgesehene Abgabe auf Guthaben aller Bankkunden in Zypern ist vom Tisch. Die Einigung sieht ausdrücklich vor, dass Vermögen bis zu 100.000 Euro nicht angetastet werden. Um trotzdem den von den Euro-Staaten geforderten Eigenbeitrag Zyperns aufbringen zu können, werden Bankkunden mit großen Guthaben deutlich stärker zur Kasse gebeten. Kunden der Bank of Cyprus zahlen auf ihre Vermögen, die über der 100.000-Euro-Grenze liegen, de facto eine Abgabe von 37,5 Prozent. Die Bankkunden erhalten im Gegenzug Anteile der Bank of Cyprus. Sie werden damit gezwungenermaßen Anteilseigner der Bank und tragen mit ihren Einlagen zur geforderten Erhöhung des Eigenkapitals der Bank bei. Möglicherweise werden die Verluste der Großanleger allerdings noch höher sein. Denn weitere 22,5 Prozent der Guthaben, die die Marke von 100.000 Euro übersteigen, werden zunächst eingefroren und notfalls ebenfalls zur Rettung der Bank eingezogen. Das Geld wird möglicherweise noch herangezogen, um die angestrebte Kernkapitalquote von neun Prozent bei der Bank of Cyprus zu erreichen. Reform des Bankensektors: Bis 2018 soll der zyprische Bankensektor so weit schrumpfen, dass die Größe der Branche in Relation zu Wirtschaftsleistung dem EU-Durchschnitt entspricht. Zu diesem Zweck wird die Laiki Bank, das zweitgrößte Geldhaus des Landes, aufgespalten und abgewickelt. Abgesicherte Kunden-Einlagen bis 100.000 Euro werden zusammen mit dem überlebensfähigen Teil an die Bank of Cyprus übertragen. Einlagen der Laiki-Kunden in Höhe von mehr als 100.000 Euro werden in eine Bad Bank ausgelagert. Diese wird langfristig abgewickelt. Die betroffenen Laiki-Kunden könnten dabei alle Einlagen verlieren, die in die Bad Bank ausgelagert werden. Die Bank of Cyprus muss als größtes Institut des Landes eine massive Schrumpfkur hinnehmen. Zudem wurden alle griechischen Filialen der größten zyprischen Banken abgespalten. Die Piräus Bank übernahm die 312 Zweigstellen für 524 Millionen Euro. Die dortigen Großkunden mussten sich nicht an den Restrukturierungskosten des Bankensektors auf Zypern beteiligen. Schuldentragfähigkeit: Die Staatsverschuldung wird mit dem Hilfsprogramm deutlich steigen. Die Gesamtschuldenlast wird den Prognosen zufolge bis 2016 auf etwa 122 Prozent des Bruttoinlandsprodukts wachsen. Anschließend soll sie wieder fallen und 2020 bei 104 Prozent des Bruttoinlandsprodukts liegen. Steuern: Wegen der notwendigen Sanierung der Staatsfinanzen müssen sich die Zyprer auf höhere Steuern einstellen. Die Mehrwertsteuer wird von 17 auf 19 Prozent angehoben. Die Unternehmenssteuer steigt von 10,0 auf 12,5 Prozent. Die Steuer auf Kapitalerträge verdoppelt sich laut den Plänen. Privatisierungen: Um die Einnahmen zu erhöhen, muss Zypern auch Staatsfirmen und Beteiligungen privatisieren. Das soll bis zu 1,4 Milliarden Euro einbringen. Zudem sollen Goldreserven im Wert von 400 Millionen Euro verkauft werden. Einschnitte für die Bürger: Auf die Zyprer kommen Kürzungen von Löhnen und Renten zu. Das Mindestalter für eine Rente ohne Abzüge steigt um sechs Monate. Wer früher in Rente geht, muss für jeden Monat einen Abschlag von 0,5 Prozent in Kauf nehmen. Für Regierungsbeamte wird das gesetzliche Rentenalter um zwei Jahre angehoben. Bereits eingeleitet wurden Kürzungen der Löhne im öffentlichen Dienst. Eine Reihe von Kosten im Gesundheitswesen soll auf die Patienten abgewälzt werden, um das Defizit des Staates zu verringern. Auch verschiedene Sozialleistungen werden gestrichen. Bedeutung für deutsche Steuerzahler: Solange Zypern Kredite aus dem bestehenden Krisenfonds ESM erhält und diese auch zurückzahlen kann, hat das Hilfspaket keine Auswirkungen auf die deutschen Staatsfinanzen. Erst wenn Zypern zahlungsunfähig würde und seine Kredite nicht mehr bedienen könnte, müssten die deutschen Steuerzahler einspringen. In diesem Fall müsste der ESM mit seinem Stammkapital die Verluste auffangen - Deutschland hat von allen Staaten den größten Anteil am ESM-Kapital. "
12.04.2013 15:44 Uhr,Straßenverkehrsordnung reformiert,Es wird eng für Parksünder,"Sich den Parkschein sparen und zur Not fünf Euro Strafe zahlen - diese Rechnung geht künftig nicht mehr auf. Denn mit der neuen Straßenverkehrsordnung erhöhen sich die Bußgelder für Verkehrssünder - nicht nur für Autofahrer. Die wichtigsten Neuerungen im Überblick von tagesschau.de. Von Sandra Stalinski, tagesschau.de Für Verkehrssünder brechen härtere Zeiten an: Regelverstöße werden künftig teurer, sowohl für Auto- als auch für Radfahrer. Denn am 1. April tritt nicht nur eine Neufassung der Straßenverkehrsordnung (StVO), sondern auch ein neuer Bußgeldkatalog (BKatV) in Kraft. Besonders hart trifft das die Parksünder: Bislang konnte es sich durchaus lohnen, bewusst auf einen Parkschein zu verzichten und stattdessen fünf Euro Verwarngeld in Kauf zu nehmen. Weil das mittlerweile auch die Länder und Kommunen gemerkt haben, wurden die Verwarngelder erstmals seit dem Jahr 1990 angepasst. Wer ab sofort ohne oder mit abgelaufenem Parkschein parkt, muss künftig zehn statt bisher fünf Euro zahlen. Wer länger als 30 Minuten überzieht, zahlt je Stunde nochmal fünf Euro drauf: 15 Euro für bis zu einer Stunde länger parken als erlaubt, 20 Euro für bis zu zwei Stunden, 25 Euro für bis zu drei Stunden und 30 Euro für noch längere Verstöße. Der Höchstsatz von 35 Euro gilt nach wie vor beim Zuparken von Feuerwehreinfahrten oder Behindertenparkplätzen. Auch Radfahrer sollten fortan besser aufpassen: Wer in einer Einbahnstraße in die falsche Richtung fährt, zahlt je nach Situation künftig 20 bis 35 Euro statt bisher 15 bis 30 Euro. Wer einen Radweg in falscher Richtung benutzt, wird mit 20 statt bisher 15 Euro zur Kasse gebeten. Bestraft werden kann unter Umständen auch die Nichtbenutzung eines bestehenden Radwegs, nämlich dann, wenn dieser mit einem blauen Schild mit Fahrradsymbol ausgeschildert ist. Dann ist seine Benutzung verpflichtend. Fahren ohne Licht kostet Radler künftig 20 statt zehn Euro. Der Allgemeine Deutsche Fahrrad-Club (ADFC) freut sich über die Verbesserungen für Radler. ""Wenn Städte und Gemeinden die neue Straßenverkehrsordnung konsequent umsetzen, stärken sie den Radverkehr und machen ihn sicherer"", sagt der Vorsitzende Ulrich Syberg. Vor allem wegen der Fahrradstraßen und Schutzstreifen auf der Fahrbahn müssten Autofahrer sich in Zukunft darauf einstellen, dass mehr Radfahrer auf der Fahrbahn unterwegs seien. Um die Verkehrsregeln eindeutiger und einfacher zu machen, werden einige Verkehrsschilder abgeschafft, andere kommen hinzu. Beispielsweise gibt es ab sofort ein schwarz-weißes Zusatzzeichen, mit dem Inline-Skaten auf Radwegen zugelassen werden kann. Die alten Schilder dürfen übergangsweise noch bis 31. Oktober 2022 stehen bleiben. Ob das Reduzieren der Schilder Geld einspart oder womöglich sogar vorerst zu mehr Kosten führen wird, ist nicht ganz klar. Der ""Komplett-Abbau"" eines Schildes koste etwa 75 Euro ohne Fahrtkosten, heißt es in der Verordnung. Da aber niemand weiß, wie viele Schilder in Deutschland aufgestellt sind und wie viele davon entfernt werden können, sei die ""Gesamtkostenersparnis nicht quantifizierbar"". Und auch speziell für Frauen ändert sich etwas mit der neuen StVO - zumindest sprachlich. Denn die Verfasser der neuen Verordnung bemühen sich um eine geschlechtsneutrale Sprache. Aus ""Radfahrern"" sind ""Rad Fahrende"" geworden, aus ""Fußgängern"" ""zu Fuß Gehende"" und aus ""Rollstuhlfahrern"" ""Fahrende von Rollstühlen"". Zur gewollten Vereinfachung der Verordnung trägt diese Änderung nicht gerade bei, was den Verfassern auch Spott einbringt: Unter ihnen müsse wohl ein Studienabbrecher der Germanistik gewesen sein, vermutet Volker Lempp vom Auto Club Europa (ACE). Einzig die Polizistinnen haben in der Neufassung einen schwereren Stand. Denn in Paragraph 36 heißt es: ""Die Zeichen und Weisungen von Polizeibeamten sind zu befolgen."" Ob das gleiche für die weiblichen Beamten gilt, bleibt laut Lempp also offen. "
12.04.2013 14:11 Uhr,Debatte über Ausgabenstopp in Portugal,Ein ganzes Land im Standby-Modus,"Das portugiesische Finanzministerium muss jetzt wegen des Haushaltslochs alle öffentlichen Ausgaben genehmigen. Kritiker befürchten, die Behörden würden quasi lahmgelegt. Doch der Ausgabenstopp ist nur vorübergehend - bis zu den neuen Sparmaßnahmen. Und die dürften hart ausfallen. Von Reinhard Spiegelhauer, ARD-Hörfunkstudio Madrid Die Aufregung war ziemlich groß, als der Ministeriumserlass bekannt wurde: Neue öffentliche Ausgaben müssen in Portugal ab sofort vom Finanzministerium genehmigt werden - eine Sofortmaßnahme angesichts des aktuellen Haushaltsloches. Damit werde seine Arbeit unmöglich, klagt Luis Pires da Silva vom Amt für Lebensmittelsicherheit und Wirtschaftskriminalität: ""Wenn wir wegen des Stopps kein Benzin mehr kaufen und keine Mautgebühren zahlen können, liegt unsere Arbeit praktisch brach."" Portugal sei in eine Art Standby-Modus versetzt worden, kommentierten portugiesische Medien - und Finanzminister Vitor Gaspar floh vor den Reporter-Mikrofonen. An der traditionsreichen Universität von Coimbra protestierten Studenten gegen den radikalen Ausgabenstopp: ""Das betrifft ganz unmittelbar die Verwaltung, aber es wird bis in die öffentlichen Universitäten weiter wirken."" Der Rechnungshof hält einen Ausgabenstopp hingegen für gerechtfertigt. ""Man muss genau schauen, wo es Verschwendung gibt, um die Qualität der öffentlichen Dienstleistungen bewahren zu können"", sagt Präsident Guilherme Oliveira Martins. Der Stopp sei eine vorübergehende Maßnahme, erklärte nun ein Regierungssprecher - bis die Regierung neue Sparmaßnahmen beschlossen habe, um das Haushaltsloch zu stopfen, das zwischen einer und eineinhalb Milliarden Euro betragen dürfte. Inzwischen versuchte die staatliche Haushaltsbehörde, die Gemüter zumindest in Sachen Ausgabenstopp etwas zu beruhigen: Natürlich würden Löhne und Gehälter weiter ausgezahlt, müssten Wasser- und Stromrechnungen weiter beglichen werden - und auch Betriebskosten wie Benzin fallen nicht unter den Erlass. Portugiesische Medien spekulieren jedenfalls munter weiter über die Folgen der Maßnahme: Reparaturkosten, beispielsweise für Streifenwagen, müssten jedenfalls genehmigt werden - und theoretisch könne ein streikender Kopierer nun ganze Gerichtsverfahren zum Stillstand bringen. "
