date,topline,headline,content22.04.2013 18:13 Uhr,Tarifkonflikt für 33.000 Beschäftigte,Warnstreik legt Lufthansa lahm,"Ein Warnstreik des Bodenpersonals hat den Flugbetrieb der Lufthansa weitgehend zum Erliegen gebracht. Wegen der Arbeitsniederlegungen strich die Fluglinie fast alle der mehr als 1700 geplanten Verbindungen innerhalb Deutschlands und Europas. Betroffen sind etwa 150.000 Passagiere. Nur wenige Dutzend Starts konnten durchgeführt werden. Keine Einschränkungen gab es bei der Lufthansa-Tochter Germanwings. Für Dienstag rechnet die Lufthansa wieder mit einem nahezu planmäßigen Flugbetrieb. ""In den nächsten Tagen sind nur noch geringfügige Auswirkungen des heutigen Streiks zu erwarten"", teilte das Unternehmen mit. Der Einsatz der Frühschicht an den deutschen Stationen sei gesichert. . Lufthansa empfiehlt allen Reisenden dennoch, sich frühzeitig vor Antritt der Reise auf www.lufthansa.com unter ""Aktuelle Fluginformationen"" und unter ""Meine Buchungen"" zu informieren, ob ihr Flug stattfindet, verspätet oder gestrichen ist. Darüber hinaus hat Lufthansa für Anrufe aus Deutschland die kostenfreie Telefonnummer 0800 850 60 70 geschaltet. Zum befürchteten Chaos an den deutschen Flughäfen kam es trotz der vielen Annullierungen nicht. Die Strategie der Lufthansa, die Fluggäste per E-Mail oder SMS über den Warnstreik zu informieren, zeigte Wirkung. Die meisten Passagiere kamen erst gar nicht zum Flughafen. Viele nutzten das Angebot, kostenlos umzubuchen oder innerhalb Deutschlands die Züge der Deutschen Bahn zu nutzen. Ein Bahnsprecher berichtete, dass mehr Fahrgäste als sonst unterwegs gewesen seien. Die Züge seien am Morgen vor allem zwischen Nürnberg und Frankfurt in beiden Richtungen voll gewesen. Die Gewerkschaft ver.di, die zu der zweiten Welle von Warnstreiks im aktuellen Tarifkonflikt aufgerufen hatte, zeigte sich zufrieden mit den Aktionen. Etwa 12.000 Mitarbeiter der Lufthansa hätten die Arbeit niedergelegt. ""Gemeinsam machen wir deutlich, dass wir die absurden Forderungen nach Lohnsenkungen nicht hinnehmen werden, sondern uns dagegen zur Wehr setzen"", sagte Christine Behle, die für ver.di die Tarifverhandlungen mit der Fluglinie führt. Lufthansa protestierte vehement gegen das Vorgehen der Gewerkschaft. ""Das sind Streikaktionen in einer Taktung, wie wir sie noch nicht hatten"", sagte Lufthansa-Personalvorstand Stefan Lauer. Für die Kunden und das Unternehmen sei das ein unerträglicher Zustand. ""Den Passagieren zu vermitteln, dass wir erneut einen Streik haben, wird zunehmend schwieriger."" Der Imageschaden für die Fluggesellschaft sei ""irreparabel"". Hintergrund der Warnstreiks ist der aktuelle Tarifstreit um die Gehälter von rund 33.000 Beschäftigten bei Lufthansa Cargo, Lufthansa Technik, Lufthansa Systems sowie der Lufthansa-Mitarbeiter am Boden und in der Kabine. Ver.di fordert 5,2 Prozent mehr Geld und Jobgarantien für die Mitarbeiter. Lufthansa hatte ein Angebot vorgelegt, das abgestufte Gehaltserhöhungen für verschiedene Beschäftigtengruppen vorsieht. Jobgarantien sollen demnach davon abhängen, ob es zu einer Einigung in Fragen wie längeren Arbeitszeiten kommt. Ver.di hatte das Angebot als nicht verhandlungsfähig bezeichnet. Die nächste Verhandlungsrunde steht in einer Woche an. "
22.04.2013 17:14 Uhr,Interview mit Steuerfahnder,"""Gier führt zum Diebstahl an der Gemeinschaft""","Nach der Selbstanzeige von Uli Hoeneß sieht sich die Opposition bestärkt im ""Nein"" zum Steuerabkommen mit der Schweiz. Wachsende Gier erlebe er in allen Berufsgruppen, sagt Steuerfahnder Frank Wehrheim im Gespräch mit tagesschau.de. Er bezweifele, dass Hoeneß alle Gelder versteuert habe. Der FC-Bayern-Präsident habe sich vermutlich als ""letzte Zuflucht"" selbst angezeigt. tagesschau.de: Die Opposition ist stolz, das Steuerabkommen mit der Schweiz im Bundesrat gestoppt zu haben, weil Uli Hoeneß sonst nicht aufgeflogen wäre. Hat sie Recht? Frank Wehrheim: Die Opposition hätte Recht, wenn das Geld unter dem Namen Uli Hoeneß angelegt war. Dann wäre sein Name nicht den deutschen Steuerbehörden gemeldet worden, sondern nur die Summe der Gelder, die sich auf seinem Konto befinden. tagesschau.de: Für wie wahrscheinlich halten Sie es, dass das Geld nicht auf den Namen Hoeneß angelegt war und damit nicht unter das Steuerabkommen fallen würde? Wehrheim: Meine Erfahrung als Steuerfahnder lehrt mich, dass bei Geldern dieser Größenordnung meist eine Liechtenstein-Stiftung oder ein Singapur-Trust eingebaut ist. Das kann ich mir auch in diesem Fall vorstellen. Dann wäre seine Bemerkung ""Ich wollte meine Gelder mit dem Steuerabkommen legalisieren"" nur eine Schutzbehauptung. tagesschau.de: Was hätte das Steuerabkommen mit der Schweiz im Fall Hoeneß dem Fiskus eingebracht? tagesschau.de: Hoeneß selbst sagt, es handele sich um versteuertes Geld. Er habe lediglich keine Kapitalertragssteuer gezahlt  – wie viel wäre das gewesen bei einem angenommenen Vermögenswert von 18 bis 20 Millionen Euro? Wehrheim: In Deutschland zahlen Sie auf Zinserträge seit 2009 etwa 25 Prozent plus Solidaritätszuschlag. Im Fall einer Selbstanzeige werden die Steuererklärungen der vergangenen zehn Jahre noch einmal überprüft. Alles muss nachversteuert werden plus der Säumniszinsen. Da kommt einiges zusammen. tagesschau.de: Wie läuft so ein Geldtransfer in die Schweiz konkret? Wehrheim: Bei so einem Mann wie Hoeneß wurden die Steuererklärungen ja bestimmt geprüft. Die Frage ist also, welchen Weg er wählte, um das Geld ins Ausland zu bringen. Einige bedienen sich da fiktiver Geschäftsverbindungen. Das heißt, man lässt sich aus dem Ausland Rechnungen schreiben, die dann dem eigenen oder einem Stiftungskonto in der Schweiz zugeführt werden. Man kann natürlich auch versteuertes Geld in Deutschland abheben und dann über die Grenze tragen. Aber bei diesen großen Summen ist das eher ungewöhnlich. Und das hätte ja dann der Finanzverwaltung eigentlich auffallen müssen, wenn solche großen Summen aus dem Vermögen abgezogen werden. tagesschau.de: Haben die Behörden vielleicht bei diesem ja politisch und gesellschaftlich sehr einflussreichen Mann die Augen zugedrückt? Wehrheim: Ich kann mir nicht vorstellen, dass meine früheren Kollegen in  Bayern da die Augen zudrücken. Zwar haben die bayerischen Fahnder das Image, dass sie nicht ganz so genau prüfen wie ihre Kollegen in anderen Bundesländern. Aber eine direkte Einflussnahme auf die Akten kann ich mir nicht vorstellen. So etwas gab es damals unter Franz Josef Strauß - aber diese Zeiten sind ja lang vorbei. tagesschau.de: Hoeneß ist stets als Vorbild und Moralist aufgetreten. Nun hat auch er offenbar versucht, Steuern zu hinterziehen. Wie beurteilen Sie das psychologisch: Was treibt so viele Menschen, die ja genug auf dem Konto haben, zu solchen Aktionen? Steuervermeidung hat sich zu einem Sport entwickelt, und es gibt ja mittlerweile ganze Branchen, die Menschen dabei helfen, Steuern zu senken oder Steuern zu vermeiden. Das ist nach deutschem Steuerrecht vielfach ganz legal. Eine Person wie Hoeneß hat schier unbegrenzt viele Möglichkeiten, seine Lebenshaltungskosten - Dinge wie Restaurantbesuche, Einladungen, Investitionen, Autos, Reisen - von der Steuer abzusetzen. Dass so jemand dann zusätzlich noch den Weg in die Illegalität wählt, ist wirklich verwunderlich und zeigt die Demoralisierung unserer Gesellschaft. tagesschau.de: Laut Paragraph 371 der Abgabenordnung befreit die Selbstanzeige von der Strafe. Hoeneß muss die Steuern zwar nachzahlen, wird aber nicht strafrechtlich verfolgt. Wie sinnvoll ist das? tagesschau.de: Auch bei Hoeneß könnte es einen Zusammenhang geben zwischen seiner Selbstanzeige und einem kurz zuvor erschienenen Artikel im ""Stern"" über Steuerhinterziehung in der Fussball-Bundesliga. Für wie wahrscheinlich halten Sie das? Wehrheim: Ich halte das für sehr wahrscheinlich, dass auch er die Selbstanzeige als letzte Zuflucht gewählt hat, um straffrei zu bleiben. tagesschau.de: Sollte man die Selbstanzeige abschaffen? Wehrheim: Die Selbstanzeige bietet den Fahndern die Möglichkeit, Aufschlüsse über Steuerhinterziehungen einer ganzen Branche zu bekommen. Insofern hat sie auch ihren Nutzen. tagesschau.de: Könnte der Fall Hoeneß dann also vielleicht Neues über Steuerhinterziehung im Sport aufdecken? Wehrheim: Wenn ein Teil seiner Gelder nicht versteuert war, sondern aus Kanälen kommt, die mit Sport zu tun haben, dann könnte das in der Tat wichtige Praktiken im Sport zutage fördern. Und das könnte dann zu Ermittlungen bei anderen Firmen oder Personen führen. tagesschau.de: Welche Handhabe brauchen die deutschen Fahnder, um  die großen Fische bei der Steuerhinterziehung besser an Land  zu ziehen? tagesschau.de: Und brauchen wir Abkommen mit Steuerparadiesen wie der Schweiz? Wehrheim: Dieses Abkommen mit der Schweiz, was nicht zustande gekommen ist, hatte in der Tat nur begrenzten Wert. Wir brauchen Abkommen, auf deren Grundlage die Vermögenswerte deutscher Bürger im Ausland direkt gemeldet werden. Die USA setzen so etwas gerade mit vielen Ländern durch. Das müsste uns auch gelingen. Das Gespräch führte Simone von Stosch, tagesschau.de. "
22.04.2013 17:12 Uhr,Unterstützung für Opposition in Syrien,EU lockert Ölembargo für Assad-Gegner,"Die EU-Außenminister haben beschlossen, den Einfuhrstopp von Öl aus Syrien aufzuheben - allerdings soll nur der Treibstoff aus den Quellen der syrischen Rebellen eingeführt werden, um den Kampf gegen Assad zu unterstützen. Oppositionelle kontrollieren kleine Anlagen im Osten des Landes. Von Christoph Prössl, NDR-Hörfunkstudio Brüssel ""Das fördert den wirtschaftlichen Aufbau, und das ist ganz sicherlich auch eine Stärkung der demokratischen Opposition"", sagte Bundesaußenminister Guido Westerwelle. ""Denn damit sehen die Menschen in Syrien, dass es eine wirkliche Alternative zum Regime von Assad gibt."" Die Regelungen gelten erst einmal bis Ende Mai. Bis dahin müssen die Außenminister der Europäischen Union über ein neues Embargo entscheiden. Damit geht die EU einen Schritt weiter bei ihren Bemühungen, die Opposition zu stärken. Gestern hatten die USA und Deutschland der Opposition mehr Geld zugesagt. Allerdings nicht ohne Bedingungen: ""Die nationale Koalition, also die entscheidende Vertretung der Opposition, hat sich ohne Wenn und Aber glasklar, so wie von uns gefordert, von jeder Form von Extremismus und Terrorismus distanziert"", sagte Westerwelle. Waffenlieferungen an die Opposition lehnt der Außenminister weiterhin ab. Großbritannien und Frankreich sprechen sich seit Monaten dafür aus. Westerwelle musste jedoch einräumen, dass das Waffenembargo Ende Mai auslaufen könnte, wenn beispielsweise Frankreich und Großbritannien einer Verlängerung nicht zustimmen. In diesem Fall könnten die beiden Länder die Nationale Koalition auch mit Waffen unterstützen. Die Außenminister sprachen auch über die Verhandlungen zwischen Serbien und dem Kososvo. Die beiden Staaten hatten am Freitag eine Einigung erzielt. Im Kern geht es um die Rechte der serbischen Minderheit im Kosovo. Die Europäische Kommission ist zufrieden und empfiehlt die Aufnahme von Beitrittsverhandlungen mit Serbien. Mit dem Kosovo soll ein Assoziierungsabkommen geschlossen werden. "
22.04.2013 15:23 Uhr,Defizitzahlen für 2012 veröffentlicht,576 Milliarden Euro neue Schulden in der EU,"Trotz einiger Fortschritte bei der Haushaltssanierung wächst die Verschuldung der EU-Staaten rasant. Allein die 17 Länder der Eurozone steigerten ihre Schuldenlast im vergangenen Jahr um 375 Milliarden Euro. Nach Angaben der EU-Statistikbehörde Eurostat summierte sich der Schuldenberg in der Eurozone Ende 2012 auf rund 8,6 Billionen Euro. EU-weit sind es sogar elf Billionen Euro - etwa 576 Milliarden Euro mehr als ein Jahr zuvor. Den Überschuss verdankt Deutschland dabei vor allem den Sozialversicherungen, die 17 Milliarden Euro mehr einnahmen, als sie ausgaben. Auch die Kommunen vermeldeten ein Plus. Im Bundeshaushalt ergab sich dagegen ein Minus von 12,2 Milliarden Euro. Auch die Länder verbuchten erneut ein Milliardendefizit. Trotzdem steht Deutschland insgesamt vergleichsweise gut da. Denn von den anderen 26 EU-Staaten verstießen 17 im vergangenen Jahr gegen die Stabilitätsvorgaben, wonach die Neuverschuldung bei maximal drei Prozent des Bruttoinlandsprodukts liegen darf. Von den Euro-Staaten rissen zwölf diese Hürde, darunter alle Länder, die derzeit von Hilfsprogrammen des Euro-Rettungsschirms profitieren. In einigen Fällen lag das Defizit deutlich über den Vorgaben, die mit den Geldgebern vereinbart worden waren. Das höchste Defizit leistete sich im vergangenen Jahr Spanien. Das Minus stieg im Vergleich zum Vorjahr deutlich auf 10,6 Prozent des Bruttoinlandsprodukts. Griechenlands Defizitquote wuchs ebenfalls, und zwar auf 10,0 Prozent. Irland senkte dagegen die Neuverschuldung deutlich und kam auf eine Defizitquote von 7,6 Prozent. Portugal kam auf 6,4 Prozent und Zypern auf 6,3 Prozent. Auch andere Staaten kämpfen mit anhaltenden Schuldenproblemen. Frankreich, die zweitgrößte Volkswirtschaft der Eurozone, verfehlte die Stabilitätskriterien deutlich. Das Defizit im Haushaltsjahr 2012 lag bei 4,8 Prozent. Der Schuldenberg des Landes summiert sich auf 90,2 Prozent des Bruttoinlandsprodukts. Bei diesem Kriterium liegt die zulässige Obergrenze bei 60 Prozent. Diese Marke verfehlt auch Deutschland seit Jahren und kam 2012 auf eine Gesamtschuldenlast von 81,9 Prozent. Das sind mehr als 2,6 Billionen Euro. In der Eurozone insgesamt entspricht die Staatsverschuldung mittlerweile 90,6 Prozent des Bruttoinlandsprodukts. Dennoch meldete Eurostat einige Fortschritte bei der Sanierung der Staatsfinanzen, denn die Neuverschuldung fiel 2012 etwas niedriger aus als 2011. Acht Euro-Staaten verbuchten aber ein höheres Defizit als ein Jahr zuvor. "
22.04.2013 13:57 Uhr,Fragen und Antworten zu Weltraummüll,Gefährliche Geschosse im All,"Alte Satelliten, verlorene Werkzeuge, kleinste Metallteilchen - um die Erde kreist eine schier unglaubliche Menge Weltraummüll. 300 Experten beraten bis Donnerstag auf einer ESA-Tagung über das Problem. Aber warum ist der Schrott so gefährlich? Und was kann man dagegen tun? Von Jan Friese, WDR-Wissenschaftsredaktion Astronauten schicken ihre Abfälle heute in der Regel mit den Versorgungskapseln zurück, sie sind also das kleinere Problem. Aber seit den Anfängen der Raumfahrt, seit dem Wettlauf zum Mond, wächst der Müllberg im All. In rund 55 Jahren Raumfahrtgeschichte hat sich da alles Mögliche angesammelt - von ehemaligen Raketentreibstufen, über jede Menge alter Spionage-, Telekommunikations- und anderer Satelliten, bis hin zu ein paar Werkzeugen, die bei Außenreparaturen verloren wurden. Das Weltall ist zwar unendlich groß - aber nicht die Umlaufbahnen um unsere Erde. Da gibt es nur eine Reihe von Umlaufbahnen, in verschiedenen Höhen, die wir nutzen können. Und wenn auf diesen Bahnen überall Trümmer oder tote Satelliten ihre Kreise ziehen, ist das - grob vereinfacht gesagt - wie auf einer mehrspurigen Autobahn, auf der Reifenteile oder liegengebliebene Fahrzeuge die Strecke zu einem Hindernisparcours machen. Und es ist eine Menge Schrott und Müll im All. In konkreten Zahlen sprechen die europäische Weltraumorganisation ESA und die amerikanische NASA von weit mehr als 20.000 Objekten, die mindestens so groß wie ein Päckchen Streichhölzer sind. Kleinere Schrottfragmente gehen in die Hunderttausende und bei wirklich winzigen Bruchstücken - also solchen, die kleiner als ein Zentimeter sind - sind es hunderte Millionen. Darunter fällt zum Beispiel Metallstaub. Das große Problem dabei ist, dass die meisten Teile im Schnitt mit 20.000 bis 25.000 Kilometern pro Stunde unterwegs sind, manche sogar noch schneller. Das ist ungefähr 20 mal schneller als eine Gewehrkugel. Jedes Objekt ist also ein Geschoss - Metallstaub kann Solarpanele beschädigen und schon eine kleine Schraube könnte einen Satelliten irreparabel schädigen oder auch Astronauten gefährden. Nur zum Teil. Für uns auf der Erde ist das eher ein geringes Risiko. Wenn etwas zurück zu Erde stürzt, verglüht es in den allermeisten Fällen in den oberen Luftschichten oder verschwindet irgendwo in den Weiten der Meere, Wälder oder Wüsten. Gefährlicher sind die Trümmer für Satelliten und natürlich für Astronauten. Daher versucht man möglichst viele der Objekte permanent zu verfolgen, um zu sehen, welche von ihnen gefährlich werden könnten. Das macht man vor allem mit Radaranlagen, Weltraumspähern. So eine Anlage steht zum Beispiel in Wachtberg bei Bonn. Das Problem dabei: Viele Müll- und Trümmerteile sind einfach zu klein, um sie rechtzeitig zu entdecken. Die Internationale Raumstation ISS hat daher in einigen ihrer Module eine doppelwandige Schutzhülle, die Geschosse auffangen soll, die kleiner als ein Zentimeter sind. Bei großen, verfolgbaren Objekten weicht die ISS aus, geht auf eine andere Höhe. Und in Notfällen, wenn relativ plötzlich ein Geschoss entdeckt wird, gehen die Astronauten in die angedockte Sojus-Kapsel, die im schlimmsten Fall dann als Fluchtkapsel, also als Rettungsboot dienen soll. Schutz wird ein Thema sein, es geht aber auch um die Zuwachsraten und die Möglichkeit der Erfassung. Der Weltraummüll wird nämlich immer mehr, unter anderem auch dadurch, dass immer wieder Trümmerstücke zusammenstoßen und dabei neue Trümmerwolken erzeugen. Mit jeder dieser Trümmerwolken steigt das natürlich Risiko für weiterer Kollisionen. Da befürchten manche Experten einen regelrechten Dominoeffekt und einige auch, dass vielleicht in einigen Jahrzehnten bestimmte Umlaufbahnen gar nicht mehr genutzt werden könnten, einfach weil sie so ""zugemüllt"" sind. Deshalb wird auf der Konferenz auch darüber debattiert werden, welche internationalen Vereinbarungen nötig sind und welche Techniken und Möglichkeiten es geben könnte, den Weltraumschrott aktiv zu entfernen. Konkrete Pläne gibt es, fertige Systeme nicht. Besonders vielversprechend scheinen derzeit die Konzepte für eine Art Abschleppsatellit. Der würde beispielsweise an ausgedienten Satelliten andocken und sie mit Schubdüsen in eine so genannte Friedhofsbahn schieben oder bugsieren. Das ist eine Flugbahn, in der der Satellit kontrolliert abstürzt und in der Erdatmosphäre verglüht oder über unbewohntem Gebiet niedergeht. Es ist geplant im Jahr 2018 bei der Mission DEOS solche Systeme zu testen. Die gern zitierte Fliegerregel ""runter kommen sie alle"" gilt im Weltraum nur sehr bedingt. Unterhalb einer Höhe von 500 Kilometern stürzen die Objekte langsam zurück und verglühen meist nach mehreren Monaten oder wenigen Jahren. Die bevorzugten Umlaufbahnen für viele Satelliten sind aber wesentlich höher. Objekte, die dort kreisen, bleiben Jahrhunderte in der Umlaufbahn oder sogar Jahrtausende, wie zum Beispiel Telekommunikationssatelliten in der geostationären Umlaufbahn. Und der Weltraummüll bleibt genauso lange oben. Nicht nur, aber dort drängt er. Der Mensch hat längst aber auch auf fremden Planeten seine Spuren hinterlassen. Vor allem auf dem Mond und dem Mars haben wir eine Menge altes Gerät zurückgelassen. Auch der Marsrover ""Curiosity"" wird irgendwann dazu gehören, wenn er den Geist aufgibt. Dazu kommen die Überreste der Kapseln und der Landetechnik, bei den verschiedenen Missionen. Diese Reste liegen dort zum Teil verstreut, wie Wegwerfverpackungen. Das hat aber natürlich zwei Seiten: Für die einen sind es menschliche Abfälle auf fremden Planeten, für andere historische Hinterlassenschaften. Die NASA will zum Beispiel, dass die Mondlandefähre von ""Apollo 11"", die ersten Fußabdrücke im Mondsand von Neil Armstrong, die späteren Mondautos und eine ganze Menge mehr unter internationalen Denkmalschutz gestellt werden, damit sie durch künftige Weltraummissionen nicht zerstört werden. "
19.04.2013 21:02 Uhr,Durchbruch bei Verhandlungen unter EU-Vermittlung,Serbien und Kosovo wollen Streit beenden,"Serbien und das Kosovo haben sich grundsätzlich auf eine Normalisierung ihrer Beziehungen verständigt. Zuvor hatte die EU-Außenbeauftragte Ashton vermittelnde Gespräche mit den Regierungschef der Balkanländer, Dacic und Thaci, geführt. Ashton sprach von einem wichtigen Schritt - weg von der Vergangenheit und hin zu Europa. Von Birgit Schmeitzner, BR-Hörfunkstudio Brüssel Viele Monate hat es gedauert - jetzt, nach zehn Verhandlungsrunden, konnte EU-Chefdiplomatin Catherine Ashton den ersehnten Erfolg melden: Die Regierungschefs von Serbien und dem Kosovo, Ivica Dacic und Hashim Thaci, haben ihre Initialen unter ein Abkommen gesetzt. Das bedeutet, der Text ist paraphiert, gilt aber juristisch noch nicht als endgültig unterzeichnet. Ashton sprach dennoch von einem wichtigen Schritt für die beiden Balkanländer - weg von der Vergangenheit und hin zu Europa. Sowohl Ashton als auch der für Erweiterung zuständige EU-Kommissar Stefan Füle dankten den Verhandlungsführern für deren Entschlossenheit. Der kosovarische Ministerpräsident Thaci sagte, das Abkommen werde dabei helfen, die Wunden der Vergangenheit zu heilen. Sein serbischer Kollege Dacic fügte - deutlich zurückhaltender - hinzu, er werde Ashton am Montag schriftlich über die endgültige Entscheidung seiner Regierung informieren. Konkrete Einzelheiten des ausgehandelten Abkommens wurden zunächst nicht bekannt gegeben. Und so ist noch unklar, wie man die letzten großen Knackpunkte gelöst hat. Wer ist für Polizei und Justiz im Nordkosovo zuständig? Welche Rolle sollen NATO-Soldaten dort spielen? Eine Frage, die NATO-Generalsekretär Anders Fogh Rasmussen nur vage beantworten wollte. Er beglückwünschte die Verhandlungspartner zu der Einigung. Anschließend teilte Rasmussen mit, das Militärbündnis mit seiner Kosovo-Truppe KFOR sei bereit, die Umsetzung zu unterstützen. Die Vereinbarung werde der Region mehr Frieden und Sicherheit bringen. Das ist eine Hoffnung, die der Generalsekretär der Vereinten Nationen, Ban Ki Moon teilt. Ban bezeichnete die unter europäischer Vermittlung erzielte Einigung als Meilenstein. Ahnliches war auch in europäischen Hauptstädten zu hören: In Paris ist von einer Wende die Rede, in Berlin sprach der deutsche Außenminister Westerwelle von einem historischen Schritt, der von Weitsicht zeuge. Westerwelle wird sich am Montag mit seinen Kollegen in Luxemburg treffen und die Fortschritte bewerten. Serbien hofft darauf, dass dann schon die Empfehlung für Beitrittsverhandlungen ausgesprochen wird. Für einen solchen Schritt ist es aus Sicht der Europäer unerlässlich, dass Serbien die Beziehungen zu seiner ehemaligen Provinz Kosovo normalisiert und gemeinsame Regeln für die serbische Minderheit im Nordkosovo akzeptiert. Nun kommt es maßgeblich darauf an, wie und wie schnell das Abkommen in die Realität umgesetzt wird. Und das dürfte schwierig sein, hatte doch die serbische Minderheit im Kosovo vorab jede Einigung abgelehnt. Das Kosovo hatte sich vor fünf Jahren von Serbien abgespalten und als unabhängig erklärt. Der Zwist zwischen den beiden Ländern gilt als der größte Hemmschuh für die sowohl von Serbien als auch vom Kosovo erwünschte Annäherung an die Europäische Union. "
