date,topline,headline,content19.12.2018 05:52 Uhr,Harter Brexit,Wie die EU das Schlimmste verhindern will,"Wenn Großbritannien ungeregelt die EU verlässt, hat das auch für Europa drastische Folgen. Die EU bereitet sich auf den Notfall vor - und wappnet sich für eine mögliche Finanzkrise. Zuletzt war es ein Wechselbad der Gefühle für die EU-Regierungschefs. Schafft der schon fertig ausgehandelte Scheidungsvertrag die Hürde in London oder nicht? Das wird sich erst im Januar zeigen, wenn das britische Unterhaus über den Brexit-Vertrag samt Übergangsfrist und Kostenausgleich mit der EU entscheiden soll. Theresa May kämpft für ein Ja. Doch in Brüssel gibt es Zweifel, ob das gelingt. Nachdem das britische Parlament über Notfall-Maßnahmen beraten hat, zieht jetzt die EU-Kommission nach. Das Ziel ist es, administrativ vorbereitet zu sein für den Fall, dass Großbritannien am 29. März 2019 einfach so aus der EU kippt. ""Dann gibt es einen großen Knall und es wird sehr teuer für uns"", warnt der Europaabgeordnete Elmar Brok (CDU). Seine Kollegin Terry Reintke von den Grünen ist sich sicher: ""Theresa May hält sich noch an einem Strohhalm fest. Sie hofft, dass sich noch etwas bewegt in Brüssel und sie die Skeptiker im Parlament besänftigen kann."" Bisher ist das nicht geschehen. Lange hat die EU-Kommission nicht über Notfallpläne für den harten Brexit sprechen wollen - aus Angst vor Verunsicherung. Das ändert sich jetzt. Inzwischen hat sich gezeigt: Nationale Regierungen und die Wirtschaft allein können nicht genügend für den Krisenfall vorsorgen - zu eng sind die Volkswirtschaften verflochten, zu viele Lieferketten und Verträge binden beide Seiten an Leistungs- und Zahlungsverpflichtungen. Die gründen auf EU-Recht, und das könnte über Nacht nicht mehr gelten in Großbritannien. Dann wären auch alle Handelsverträge und sonstige Geschäftsverbindungen zumindest anfechtbar. EU-Beamte warnen hier vor einem ""rechtsfreien Raum"" und wollen gegensteuern. Geplant ist ein Richtlinienpaket für den besonders empfindlichen Finanzmarkt. Hier sollen Versicherungen, Verträge, Verbindlichkeiten und Aktiengeschäfte ""abgesichert"" werden. Das heißt: Die EU soll für deren Bestand und Erfüllung zumindest eine formale Garantie übernehmen, in dem sie die Gültigkeit anerkennt. Das müsste aber dann auch die britische Regierung tun - ein ""Moratorium"" soll diese gegenseitige Rechtsverbindlichkeit herstellen. Es ist ein kompliziertes Verfahren und Neuland für die EU-Juristen, denn Brüssel begibt sich damit auf das Feld möglicher Milliarden-Verluste auf Kosten der Steuerzahler, die sie sich von den Briten nicht mehr zurückholen könnte. Trotzdem soll auf diese Weise noch Schlimmeres verhindert werden: eine Finanzkrise. Vor einem möglichen Banken-Crash und Börsenproblemen hatte zuletzt vor allem die britische Regierung beim jüngsten Treffen der EU-Finanzminister in Brüssel gewarnt und damit große Unsicherheit ausgelöst. Das Notfallpaket reicht aber auch in den Alltag hinein: Der Flugverkehr mit und über Großbritannien soll weiterlaufen, EU-Führerscheine sollen weiter in Großbritannien benutzt werden können. Noch unklar ist, was mit EU-Studenten und ihren Anerkennungen in Großbritannien und umgekehrt passiert. Sonst könnte so manche Prüfung umsonst geschrieben werden. Auch Züge sollen nicht ausfallen. Das könnte mit der Bahn auch in Deutschland passieren, wo britische Anbieter einige Regionalstrecken bedienen. Diese Verträge mit den Bundesländern sollen ebenfalls abgesichert werden. Sonst bleibt noch vieles unklar. Denn das Ganze kann nicht nur die EU-Kommission entscheiden. Die Mitgliedsländer und das Europaparlament müssen zustimmen. Für derartige Verfahren werden normalerweise zwölf Monate anberaumt. Die Brexit-Notfallpläne sollen aber schon beschlossen und verkündet vorliegen, wenn das britische Parlament im Januar Nein sagen sollte zum Scheidungsvertrag. Einen Ausweg gibt es dann noch: Die britische Regierung zieht den Scheidungsantrag zurück (Exit vom Brexit). Das wäre ohne Probleme bis zum Scheidungstermin möglich, wie der Europäische Gerichtshof unlängst feststellte. Die anderen EU-Länder müssten das hinnehmen. Eine Möglichkeit wäre aber auch ein Aufschub um wenige Wochen, bis vielleicht eine neues britisches Parlament dem Scheidungsvertrag zustimmt. Das ist eher unwahrscheinlich angesichts der knappen Zeit. Denn spätestens bis zur Europawahl muss eine Entscheidung her - an dieser Wahl nehmen die Briten schon nicht mehr teil. Wären sie dann noch in der EU, könnte womöglich die gesamte Wahl angefochten werden, warnen Europarechtler: ""Das einzige, was klar ist, dass spätestens Ende Januar das britische Parlament eine Entscheidung treffen muss"", warnt der CDU-Europapolitiker David McAllister, ""so oder so ...""  "
18.12.2018 20:31 Uhr,Haushaltsstreit,Italien meldet Einigung mit der EU,"Im Haushaltsstreit hat Italien mit der EU-Kommission nach Angaben des Finanzministeriums eine Einigung erzielt. Das vorgesehene Defizit in Italiens Haushaltsentwurf für 2019 soll laut Zeitung ""La Repubblica"" auf 2,04 Prozent gesenkt werden. Italien hat sich mit der Europäischen Union im Haushaltsstreit offenbar geeinigt. Nach übereinstimmenden italienischen Medienberichten bestätigte der italienische Finanzminister Giovanni Tria die Einigung über seinen Sprecher. Das vorgesehene Defizit im Haushaltsentwurf Italiens für 2019 soll der Zeitung ""La Repubblica"" zufolge auf 2,04 Prozent gesenkt werden. Der erste Entwurf sah noch ein Defizit von 2,4 Prozent vor, was die Kommission als Verletzung der EU-Haushaltsregeln abgelehnt hatte. Die Kommission bestätigte eine Einigung jedoch nicht. Die Kommissare würden am Mittwoch diskutieren, sagte eine Sprecherin der Brüsseler Behörde. Die EU-Kommission hatte den Haushaltsentwurf der Regierung in Rom im Oktober zurückgewiesen, weil sie in ihm einen klaren Verstoß gegen die EU-Regeln sah. Daher leitete sie erste Schritte für ein Defizitverfahren ein. In der vergangenen Woche legte Italien einen neuen Plan mit einem geringeren Defizit vor. Daraufhin gab es intensive Verhandlungen zwischen beiden Seiten. "
18.12.2018 17:49 Uhr,Syrische Stadt Hajin,Zäher Kampf um letzte IS-Bastion,"Seit Monaten läuft die Schlacht um eine der letzten IS-Hochburgen in Syrien. Ein Sieg ist für die Kämpfer des SDF-Bündnisses zum Greifen nah. Doch ausgerechnet jetzt droht ein Zweifrontenkrieg. In einer Sumpfebene gut 200 Kilometer entfernt von der Front bei Hasakah hoffen sie, endlich sicher zu sein. Wochenlang hat es geregnet, es ist bitter kalt. Etwa 4000 Menschen leben dort in Zelten und im Freien, darunter viele Kinder. Es gibt keine Schule, keine Betreuung, keine Perspektive. Vor vier Wochen habe eine Hilfsorganisation das letzte Mal Lebensmittel und Trinkwasser gebracht, erzählen die Geflüchteten. Nun neigten sich die Vorräte dem Ende. Und doch sei ein Leben unter diesen erbärmlichen Umständen sehr viel besser als das, was sie unter der Terrormiliz IS hätten erleiden müssen. ""Sie haben uns als menschliche Schutzschilde missbraucht, damit sie nicht aus der Luft von Kampfjets angegriffen werden können"", sagt Abed. ""Überall haben sie Minen gelegt und wollten keinen mehr entkommen lassen."" Im Euphrat-Tal läuft die letzte Schlacht gegen die selbsternannten Gotteskrieger. 5000 sollen es noch sein - Kämpfer aus Syrien, aber auch aus vielen anderen Ländern, die offenbar entschlossen sind, ihre letzte Bastion bis zum Tod zu verteidigen. Das könnte auch daran liegen, dass IS-Chef Abu Bakr al-Bagdadi in ihren Reihen vermutet wird. Noch im August hatte er sich mit einer Audiobotschaft an seine Anhänger gewandt und Hoffnung auf eine Wende im Krieg zum Ausdruck gebracht. Für Ahmed wäre das ein Albtraum. Vor seiner Flucht musste er traumatische Erfahrungen mit IS-Kämpfern machen: ""Sie greifen Frauen in den Straßen auf, fesseln sie, halten sie zehn Tage in Haft, töten sie"", berichtet er. ""Sie haben uns nichts zu essen gegeben, die Lebensmittelläden zerstört. Sie sind Verbrecher, dreckige Diebe, sie haben uns alles weggenommen."" Anderswo fallen sie plündernd über Dörfer her, wie Abed erzählt. ""Sie haben Schläferzellen. Manchmal tauchen sie aus dem Nichts auf und verschwinden dann wieder."" Die kurdisch-arabischen Kämpfer des SDF-Bündnisses liefern sich seit Monaten erbitterte Gefechte um die letzten Terrornester des IS. Ihr Widerstand ist zäh, der Vormarsch mühsam und verlustreich. Immer wieder starten IS-Milizen gefährliche Attacken aus dem Hinterhalt. Weit über 50 kurdische Kämpfer sind in den vergangenen Wochen ums Leben gekommen. ""Sie haben Sprengfallen und Minen an jeder Ecke platziert"", erzählt SDF-Kommandeur Zanar Auaz. ""Wir kommen voran, aber langsam und müssen vorsichtig sein, um zivile Opfer zu vermeiden."" Etwa 80 Prozent der einstigen IS-Hochburg Hajin haben SDF-Einheiten befreit. Ganze Straßenzüge liegen nun in Trümmern, sind menschenleer. Noch immer kontrolliert die Terrormiliz etliche Dörfer in der Umgebung. Auch dort droht ein blutiger Häuserkampf, wie SDF-Kämpfer Refaat al-Ebeid glaubt: ""IS-Kämpfer versuchen jeden Tag, unsere Einheiten anzugreifen und die Dörfer wieder zurückzuerobern. Aber wir halten mit aller Macht dagegen."" Ein Sieg würde auch das vorläufige Ende eines beispiellosen Feldzuges gegen die Terrormiliz in Syrien markieren. Mithilfe der USA vertrieb die SDF die Dschihadisten aus dem Norden und Osten des Landes. Nun aber droht ein Zweifrontenkrieg. Türkische Truppen stehen an der Grenze. Der türkische Präsident Recep Tayip Erdogan hat mit einer Offensive gedroht. Er sieht in den syrischen Kurden den verlängerten Arm der verbotenen Arbeiterpartei PKK und will sie von der Grenze vertreiben. ""Diese Drohungen helfen dem IS"", sagt Zanar Auaz. ""Ausgerechnet jetzt, wo wir in der Schlacht um Hajin vorankommen, droht die Türkei mit einer Offensive in Nordsyrien."" Das sind schlechte Nachrichten für Tausende Menschen in Syrien, die noch immer unter der IS-Herrschaft leiden. Dass die Befreier nun selbst unter Beschuss geraten, ist für viele hier unbegreiflich. "
18.12.2018 16:19 Uhr,Nach der Verschärfung,Wie kommen Emissions-Grenzwerte zustande?,"Die EU hat die Grenzwerte für Kohlendioxid verschärft. Wer legt die Grenzwerte fest und nach welchen Richtlinien? Und wie sehr schaden sie der Wirtschaft? Fragen und Antworten. Kohlendioxid gilt als Haupt-Klimakiller. Stickoxid aus Dieselmotoren bedroht die individuelle Gesundheit. Für beides gibt es weltweit unterschiedliche Grenzwerte. Das hat mit unterschiedlichen Interessen zu tun: Die EU hält Kohlendioxid für die größte Gefahr, die USA hingegen Stickoxid aus Dieselmotoren. Deshalb gibt es in den USA strengere Werte für Diesel, aber weniger strenge für Kohlendioxid-Emmissionen. In der EU war es lange umgekehrt, weil auf die weit verbreitete Dieseltechnik Rücksicht genommen wurde. Bis der in Amerika aufgedeckte Dieselskandal Europa unter Druck setzte. Bei der Dieseltechnik gibt es Verschärfungen und jetzt auch neue strenge Kohlendioxid-Grenzwerte bis zum Jahr 2030. Grundlage hier ist die Klima-Prognose der Vereinten Nationen. Hier wurde ausgerechnet, wie viel Prozent Reduktion weltweit nötig sind, um die Erderwärmung abzubremsen. Aber das ist erst mal nur ein abstrakter Wert. Der konkrete Wert ist immer Verhandlungssache und kann nicht einfach weltweit verpflichtend vorgeschrieben werden. Wie und wo reguliert wird, bestimmen nicht Naturwissenschaftler und Klima-Experten, sondern unterschiedliche Interessen, für die ein Kompromiss gesucht werden muss. Denn einseitige Lösungen lassen sich gesellschaftlich kaum durchsetzen. So war es auch in der EU. Das Europa-Parlament wollte möglichst nah dran sein an den Klima-Warnern. Deutschland und die EU-Kommission wollten nicht zu streng sein. Herausgekommen ist ein Mittelweg. Europa ist ehrgeizig beim Klimaschutz - deshalb liegt der Fokus auf dem Treibhausgas Kohlendioxid. Die Politik richtet sich nach den Bedürfnissen der jeweiligen Industrien, um Arbeitsplätze zu erhalten. Eine Rolle bei der Festlegung von Grenzwerten spielt neben der Klima-Prognose die Wettbewerbsfähigkeit bestimmter Industrien, die von Regulierungen betroffen sind. Harte Regulierungen können ein Wettbewerbsnachteil sein, sagen die Hersteller. Umweltschützer hingegen sagen, dass harte Regulierungen ein Druckmittel sind, um neue Techniken zu entwickeln. Die Innovationen sind gut für die Wettbewerbsfähigkeit. Auch hier stand am Ende ein Mittelweg, ein politischer Kompromiss. Weil Kompromisse auch bei Grenzwerten geschlossen und gesellschaftlich ausgehandelt, akzeptiert und befolgt werden müssen, hat man sich auf folgende Vorgehensweise geeinigt: In einigen Jahren will die EU prüfen, was die neuen Grenzwerte bewirken und wie sich die Wirtschaft entwickelt. Mit dem Ziel, notfalls nachzubessern. Nach oben oder nach unten. Auch das ist am Ende wieder Verhandlungssache.  "
18.12.2018 14:11 Uhr,CO2-Pläne der EU,"Ein Grenzwert, zwei Meinungen","Für Umweltministerin Schulze sind sie gut fürs Klima, Wirtschaftsminister Altmaier sieht die verschärften CO2-Grenzwerte der EU hingegen mit Sorge. VW reagierte bereits. Bundesumweltministerin Svenja Schulze lobt die CO2-Pläne der EU. ""Das ist ein gutes Ergebnis, das uns bei Klimaschutz und Zukunftsjobs voranbringen kann"", sagt die SPD-Politikerin. Die Autoindustrie müsse sich zwar anstrengen, die Ziele seien aber erreichbar, sie könnten sogar einen Innovationsschub bringen. Für Verbraucher sieht die Umweltministerin den Vorteil, dass die neuen Autos sparsamer im Verbrauch sein würden. Anders schätzt Schulzes Kabinettskollege Peter Altmaier von der CDU die Lage ein. Er bezeichnete die EU-Ziele als ""sehr ambitioniert"", er habe sich für ""realistische Grenzwerte eingesetzt, die man auch erreichen kann."" Auch der Parlamentarische Staatssekretär aus dem Verkehrsministerium, Enak Ferlemann von CDU, reagierte enttäuscht. ""Wir hätten uns sicherlich etwas anderes gewünscht"", sagte er im Deutschlandfunk. Für Deutschland bedeute die Entscheidung, noch stärker auf E-Autos zu setzen. ""In der Perspektive müssen wir ja so oder so los vom Öl"", betonte Ferlemann. Die Autobranche mit Hunderttausenden Jobs allein in Deutschland und die Bundesregierung wollten ursprünglich weniger scharfe CO2-Ziele. Aus Sicht der IG Metall sind die neuen verschärften Klimaschutzziele für Europas Autobauer eine unmittelbare Bedrohung für viele Tausend Jobs in der deutschen Kernbranche. Gewerkschaftschef Jörg Hofmann sagte: ""Es wird Vabanque mit den Arbeitsplätzen der Beschäftigten gespielt."" In Brüssel sei ""wieder gezockt"" und ""ohne Strategie und Umsetzungskonzept eine neue Zielzahl verkündet"" worden. ""Die Bundesregierung hat hier die Interessen des Industriestandorts Deutschland völlig unzureichend vertreten."" Lob kam hingegen von den Grünen. Es müsse eine Antriebswende geben, sagte der Grünen-Politiker und Vorsitzende des Verkehrsausschusses, Cem Özdemir, dem SWR. ""Ich glaube, wir sind nicht blöder als die Japaner oder Chinesen. Das müssen die Spitze der Automobilindustrie und die Bundesregierung kapieren."" Nach dem Willen der EU sollen Neuwagen bis 2030 erheblich klimafreundlicher werden. Der CO2-Ausstoß soll zwischen 2021 und 2030 um 37,5 Prozent sinken. Für leichte Nutzfahrzeuge wurde eine CO2-Reduktion um 31 Prozent vereinbart. Für beide Fahrzeugklassen soll bis 2025 ein Rückgang um 15 Prozent als Zwischenetappe erreicht sein. Auf diese Ziele hatten sich Unterhändler der EU-Staaten und das Europaparlament geeinigt. Der Verband der Automobilindustrie (VDA) reagierte mit scharfer Kritik. ""Diese Regulierung fordert zu viel und fördert zu wenig"", meinte VDA-Präsident Bernhard Mattes. ""Niemand weiß heute, wie die beschlossenen Grenzwerte in der vorgegebenen Zeit erreicht werden können."" Nirgends sonst gebe es ähnlich strikte CO2-Ziele. Somit werde Europas Autoindustrie im internationalen Wettbewerb belastet. VW reagierte bereits und kündigte einen noch stärkeren Konzernumbau als bislang geplant an. Mit der Verschärfung des Flottenziels müsse der Konzern den Anteil der E-Autos am Gesamtabsatz bis 2030 auf über 40 Prozent hieven, sagte Konzernchef Herbert Diess. Wenn Verbrennungsmotoren entfallen, müssten auch die VW-Werke umgebaut werden und Batteriezellfabriken entstehen. Die österreichische Umweltministerin Elisabeth Köstinger wies Kritik der Autohersteller an den künftigen Klimavorgaben für Neuwagen zurück. Die für 2030 vorgesehenen Kohlendioxid-Werte seien ""ambitioniert, aber machbar"", sagte die Politikerin. Österreich hat derzeit den EU-Vorsitz und hatte die Verhandlungen geleitet. Bisher ist in der EU festgelegt, dass Neuwagen im Flottendurchschnitt 2021 nicht mehr als 95 Gramm Kohlendioxid pro Kilometer ausstoßen sollen. Von dieser Basis aus soll die Senkung folgen. Der europäische Durchschnitt lag zuletzt bei 118,5 Gramm. "
18.12.2018 13:51 Uhr,AfD-Politiker in Südafrika,Schießtraining mit Rassisten,"Auf einer Dienstreise nach Südafrika hat sich der AfD-Politiker Bystron laut Report Mainz mit Vertretern einer rassistischen Organisation getroffen. Mit ihnen absolvierte er ein Schießtraining. Bystron sieht darin kein Problem. Der AfD-Bundestagsabgeordnete Petr Bystron hat sich in Südafrika mit Vertretern der rassistischen Organisation ""Suidlanders"" getroffen. Das ergaben Recherchen von Report Mainz. Bystron, der im Bundestag Obmann des Auswärtigen Ausschusses ist, verteidigte sein Treffen mit der Organisation. Er habe keine Berührungsängste mit den ""Suidlanders"". ""Ich habe das so empfunden, dass das eine Organisation von überwiegend weißen Farmern ist, die Angst haben um ihr Leben und die sich organisieren, um zu überleben, sollte es zum schlimmsten Fall kommen."" Auf seiner Reise nach Südafrika habe er neben den ""Suidlanders"" auch Vertreter der Regierungspartei ANC und von Nichtregierungsorganisationen getroffen. Während der Reise, die vom Bundestag finanziert wurde, absolvierte Bystron auch ein Schießtraining. Auf die Frage, ob er auch selbst geschossen habe, sagte er: ""Natürlich. Ich bin Jäger. Haben Sie nie geschossen?"" Die ""Suidlanders"" sind ein Zusammenschluss von ausschließlich weißen Südafrikanern. ""Wir glauben, es wird einen Rassenkrieg geben in Südafrika. Das ist nicht zu vermeiden"", sagte Simon Roche, der Sprecher der ""Suidlanders"" gegenüber der ARD. ""Man kann Öl und Wasser nicht mischen. Unter den jetzigen Umständen kann man in Südafrika keine Zivilisation erbauen."" Nach Einschätzung von Gareth Newham vom südafrikanischen Institute for Security Studies in Pretoria handelt es sich bei den ""Suidlanders"" um einen Zusammenschluss von völkischen Rassisten: ""Ihre Ideologie ist die Überlegenheit der weißen Rasse"", sagte Newham. ""Ihr einziger Existenzgrund ist die angebliche Verteidigung gegen die Schwarzen. Man kann sie eindeutig als rassistische völkische Organisation beschreiben."" Die Gruppe glaubt, dass ein Genozid an der weißen Bevölkerung bevorstehe. Sie wollen sich mit Waffengewalt gegen einen solchen angeblichen Angriff wehren. Dafür absolvieren sie paramilitärische Trainings. In der Vergangenheit zeigten sich Vertreter der ""Suidlanders"" auch mit dem Ku Klux Klan. Der Verein steht unter Beobachtung der südafrikanischen Sicherheitsbehörden. SPD-Politiker Burkhard Lischka kritisierte den Besuch. ""Mir bleibt da die Spucke weg, dass eine solche Reise aus Steuerzahlermitteln finanziert wurde."" Das Treffen zeige das doppelte Spiel der AfD. Auf der einen Seite fasse man Unvereinbarkeitsbeschlüsse mit extremistischen Organisationen, auf der anderen Seite treffe man sich öffentlich mit Vertretern. ""Das zeigt ein weiteres Mal, dass in der AfD inzwischen der völkisch-nationalistische Flügel in erheblichem Maße das Zepter schwingt. Auch hier in der Bundestagsfraktion - Petr Bystron ist ein weiteres Beispiel dafür."" Lischka forderte eine Beobachtung der Partei durch den Verfassungsschutz. "
18.12.2018 13:19 Uhr,CO2-Pläne der EU,Die Autoindustrie ist entsetzt,"Die Autoindustrie kritisiert den Kompromiss der EU für schärfere CO2-Grenzwerte. Auch die Grünen sind unzufrieden. Brüssel will den CO2-Ausstoß von Neuwagen bis 2030 erheblich senken. Der europäische Autoherstellerverband hält die Pläne der EU für unrealistisch, Abgaswerte von Neuwagen bis 2030 deutlich zu senken. ""Diese Regulierung fordert zu viel und fördert zu wenig"", erklärte der Verband der Automobilindustrie. Nirgends sonst in der Welt gebe es ähnlich scharfe Ziele. Die europäische Automobilindustrie werde im internationalen Wettbewerb stark belastet. Nun seien Arbeitsplätze in Gefahr. Die österreichische Umweltministerin Elisabeth Köstinger wies Kritik der Autohersteller an den künftigen Klimavorgaben für Neuwagen zurück. Die für 2030 vorgesehenen Kohlendioxid-Werte seien ""ambitioniert, aber machbar"", sagte die Politikerin. Österreich hat derzeit den EU-Vorsitz und hatte die Verhandlungen geleitet. Bundesumweltminsterin Svenja Schulze bewertet das Vorhaben als Nachweis, dass die EU in der Lage sei, etwas gegen den Klimwandel zu tun. Weitere Schritte seien aber notwendig, so die SPD-Politikerin. Kritischer schätzt Bundeswirtschaftsminister Peter Altmaier die Lage ein. Der CDU-Politiker bezeichnete die EU-Ziele als ""sehr ambitioniert"", er habe sich für ""realistische Grenzwerte, die man auch erreichen kann"", eingesetzt. Die Bundesregierung hatte eine Absenkung um 30 Prozent angepeilt. Dagegen gehen den Grünen die EU-Pläne nicht weit genug. Die Umweltexpertin der Partei, Rebecca Harms, sprach von einem Armutszeugnis. Sie räumte aber ein, dass der Kompromiss das Beste sei, ""was mit den Regierungen der EU-Mitgliedsstaaten zu erreichen war"". Nach dem Willen der EU sollen Neuwagen bis 2030 erheblich klimafreundlicher werden. Der CO2 Ausstoß soll zwischen 2021 und 2030 um 37,5 Prozent sinken. Für leichte Nutzfahrzeuge wurde eine CO2-Reduktion um 31 Prozent vereinbart. Für beide Fahrzeugklassen soll bis 2025 eine Minderung um 15 Prozent als Zwischenetappe erreicht sein. Das geht aus einer Einigung von Unterhändlern der EU-Staaten und des Europaparlaments hervor. Der CDU-Europaabgeordnete Jens Gieseke betonte: ""Wir brauchen Grenzwerte, die nicht nur auf dem Papier, sondern auch in der Realität zu erreichen sind."" Schärfere Grenzwerte könnten für Autofahrer auch Vorteile mit sich bringen. Der europäische Verbraucherverband BEUC unterstreicht, dass niedrige CO2-Werte auch weniger Verbrauch bedeuten und Fahrer bei neuen sparsamen Modellen Sprit und Geld sparen können. Zu schaffen sind die neuen Zielwerte nur, wenn Hersteller neben Diesel und Benzinern immer mehr Fahrzeuge ohne Emissionen wie reine Elektroautos verkaufen. Dafür müssen sie aber ihre Produktion umbauen. Bisher ist in der EU festgelegt, dass Neuwagen im Flottendurchschnitt 2021 nicht mehr als 95 Gramm Kohlendioxid pro Kilometer ausstoßen sollen. Von dieser Basis aus soll die Senkung folgen. Der europäische Durchschnitt lag zuletzt bei 118,5 Gramm. "
18.12.2018 09:59 Uhr,Kosovo,"Ein beruhigter, kein gelöster Konflikt","Auf den ersten Blick ist die Lage im Kosovo stabil. Doch Spannungen zwischen Albanern und Serben sind geblieben. Sie könnten wieder wachsen, auch weil die Aussichten auf eine EU-Mitgliedschaft sinken und Russland mehr Einfluss nimmt. Von Darko Jakovljevic, ARD-Studio Wien "
17.12.2018 21:37 Uhr,Einigung in Brüssel,EU verschärft CO2-Grenzwerte für Neuwagen,"Die EU hat sich auf schärfere CO2-Grenzwerte für neue Autos bis 2030 geeinigt. Neuwagen sollen bis dahin rund 37,5 Prozent weniger CO2 ausstoßen. Zwischenziel ist ein Minus von 15 Prozent bis 2025. Neue Autos müssen bis 2030 erheblich klimafreundlicher werden: Der Kohlendioxid-Ausstoß von Neuwagen soll um 37,5 Prozent im Vergleich zu 2021 sinken. Auf diesen Kompromiss einigten sich die Unterhändler der EU-Staaten und des Europaparlaments nach Angaben der österreichischen Ratspräsidentschaft in Brüssel. Für leichte Nutzfahrzeuge wurde eine CO2-Reduktion um 31 Prozent vereinbart. Für beide Fahrzeugklassen soll bis 2025 eine Minderung um 15 Prozent als Zwischenetappe erreicht sein. Bisher ist in der EU festgelegt, dass Neuwagen im Flottendurchschnitt 2021 nicht mehr als 95 Gramm Kohlendioxid pro Kilometer ausstoßen sollen. Von dieser Basis aus soll die Senkung folgen. Der europäische Durchschnitt lag zuletzt bei 118,5 Gramm. Die Vorgaben sind deutlich schärfer, als die Autoindustrie und die Bundesregierung dies ursprünglich wollten. Die EU-Staaten hatten Anfang Oktober für eine Senkung des CO2-Werts bei neuen Autos und leichten Nutzfahrzeugen um durchschnittlich 35 Prozent plädiert. Deutschland trug das Ziel damals mit, obwohl die Bundesregierung und die EU-Kommission nur 30 Prozent Minderung wollten. Das Europaparlament ging mit einer Forderung von minus 40 Prozent in die Verhandlungen. Die Vorgaben sollen helfen, die Klimaziele der Europäischen Union insgesamt zu erreichen und die Emissionen aus dem Straßenverkehr zu drücken. Die Entscheidung ist für die Autoindustrie von großer Bedeutung. Zu schaffen sind die neuen Zielwerte nur, wenn Hersteller neben Diesel und Benzinern immer mehr Fahrzeuge ohne Emissionen wie reine Elektroautos verkaufen. Dafür müssen sie aber ihre Produktion umbauen. Die Bundesregierung befürchtet Jobverluste, falls der Umstieg auf neue Antriebe zu schnell vollzogen wird. Befürworter strenger Werte meinen dagegen, so könnten europäische Autobauer in der Konkurrenz zu China bestehen und neue Jobs schaffen. "
