date,topline,headline,content12.12.2018 20:18 Uhr,Haushaltsstreit mit der EU,Italien macht Zugeständnisse,"Im Haushaltsstreit mit der Europäischen Union hat Italien eine Senkung des Defizits auf 2,04 Prozent für 2019 vorgeschlagen. Die EU hatte zuvor mit Milliardenstrafen gedroht. Italien macht im Haushaltsstreit mit der EU-Kommission Zugeständnisse. Die Neuverschuldung soll im kommenden Jahr 2,04 Prozent der Wirtschaftsleistung betragen statt wie bisher geplant 2,4 Prozent, sagte Ministerpräsident Giuseppe Conte nach einem Treffen mit EU-Kommissionschef Jean-Claude Juncker in Brüssel. Der EU-Wirtschaftskommissar Pierre Moscovici hatte zuvor erklärt, die EU-Kommission könne ""flexibel sein, aber im Rahmen der Regeln"". ""Ich fordere heute weder Sanktionen gegen Italien noch gegen Frankreich. Ich suche nach Lösungen"", sagte Moscovici bei einer Podiumsdiskussion. Die seit Juni amtierende Regierung aus der populistischen Fünf-Sterne-Bewegung und der fremdenfeindlichen Lega-Partei plante ursprünglich mit einem Defizit von 2,4 Prozent im Haushalt 2019. Die EU-Kommission hatte diesen Etatplan zurückgewiesen und Italien mit einem Strafverfahren gedroht. An dessen Ende könnten Strafen in Milliardenhöhe stehen. Ob der EU nun dieser neue Vorschlag reicht, ist unklar. Die EU-Kommission sieht aber Chancen für eine gütliche Lösung. ""Guter Fortschritt wurde erzielt"", sagte eine Sprecherin der Brüsseler Behörde. ""Die Europäische Kommission wird nun die Vorschläge, die sie an diesem Nachmittag erhalten hat, analysieren."" Der stellvertretende Ministerpräsident Matteo Salvini hatte zuletzt sogar mit dem Ende der EU gedroht, falls die Juncker-Kommission, die von Frankreichs Präsidenten Emmanuel Macron geplante massive Neuverschuldung für 2019 akzeptiert, Italiens Haushaltsentwurf aber weiterhin ablehnt. Der französische EU-Wirtschafts- und Währungskommissar Moscovici betonte, Frankreichs Haushalt sei mit dem italienischen nicht zu vergleichen. Die französischen Altschulden seien deutlich geringer. "
12.12.2018 17:07 Uhr,Euroschau,Keine Zinserhöhung in Sicht,"In Kürze endet das Anleihe-Kaufprogramm der EZB. Damit wäre der Weg für eine Zinswende frei. Doch schwache Inflations- und Konjunkturzahlen könnten höhere Zinsen verhindern. Auf dieses Urteil hatte man im Frankfurter Eurotower sehnsüchtig gewartet. Denn es ist ganz nach dem Geschmack der Währungshüter: Der Europäische Gerichtshof (EuGH) beschloss diese Woche, dass die umstrittenen Anleihekäufe der EZB rechtens und keine verbotene Staatsfinanzierung seien. Genau dies hatten Kritiker den Währungshütern immer wieder vorgeworfen. Nicht ganz ohne Grund. Zumindest äußerte auch das Bundesverfassungsgericht gravierende Bedenken gegen das Verfahren. Doch Karlsruhe wollte nicht entscheiden und schob den schwarzen Peter nach Luxemburg ab. Jetzt liegt die Materie wieder auf dem Tisch der obersten deutschen Richter. Sie können das Urteil des EuGH zwar nicht kippen. Sie könnten aber zu dem Schluss kommen, dass die Bundesbank sich aus dem Programm zurückziehen sollte. Das würde die Frage aufwerfen, ob der deutsche Anteil rückabgewickelt werden müsste. Das Urteil des Europäischen Gerichtshofes kommt wenige Tage vor dem offiziellen Ende des Kaufprogramms. Kurz vor Silvester ist Schluss mit dem Neu-Erwerb von Anleihen. Dann hat die EZB Staats- und Unternehmensanleihen im Wert von rund 2,6 Billionen Euro gekauft. In Luft löst sich das Programm natürlich nicht auf: Die Anleihen bleiben weiterhin im Bestand der EZB. Das Geld auslaufender Anleihen wird wieder in neue Papiere investiert. Somit existiert das Programm auf dem jetzigen Niveau weiter, es wird aber nicht mehr erweitert. Ziel der Maßnahme war und ist die Stabilisierung der europäischen Konjunktur, um angemessene Inflationsraten zu erreichen. In den Hochzeiten der Krise ging es auch darum, Deflation zu vermeiden - also eine Spirale immer weiter sinkender Preise. Dieses Phänomen hätte extrem negative Folgen für die Wirtschaft gehabt. Das offizielle Ende des Kaufs neuer Anleihen ist dennoch von zentraler Bedeutung. Denn aus Sicht der EZB ist es die Grundvoraussetzung dafür, das Zinsniveau neu zu justieren. Die Hoffnungen der Sparer, Banken und Versicherungen waren daher groß, dass es im kommenden Jahr wieder anziehende Zinsen gibt. Doch im Frankfurter Eurotower tritt man schon seit längerem wieder auf die Bremse. Bereits auf der Ratssitzung im lettischen Riga im Juni dieses Jahres wurde beschlossen, die Zinsen auf jeden Fall bis nach dem Sommer kommenden Jahres bei null Prozent zu belassen. Vor September passiert also gar nichts. Danach dürfte der EZB-Rat erst einmal die Negativzinsen für Banken aus dem Weg räumen. Eine Anhebung der Leitzinsen wäre frühestens auf der Sitzung im Oktober 2019 möglich. Das dürfte auch die Inflationsrate erneut dämpfen. Schon jetzt zeichnet sich ab: Das von der EZB angestrebte und derzeit auch erreichte Inflationsziel von rund zwei Prozent wird nicht zu halten sein. Einer der großen Preistreiber, die Notierungen für Rohöl, schwächen sich seit Wochen ab. Handelsstreitigkeiten zwischen den USA und China, der Brexit und die Konflikt zwischen der EU und Italien dürften ein Übriges tun, um die Konjunktur zu schwächen und damit auch die Inflationsrate. Dann hätten die Befürworter einer ultra-lockeren Geldpolitik ein wunderbares Argument, die Zinswende auf den Sankt-Nimmerleins-Tag zu schieben. Wer will schon in einen Konjunktur-Abschwung hinein die Zinsen erhöhen, wenn die Inflationsrate unterhalb des Zielwertes liegt? Es sieht also nicht gut aus für Europas Sparer, denen die Null-Zins-Politik ihre Rücklagen und ihre Altersvorsorge zerfrisst. Es sieht nicht gut aus für Europas Banken, die ein normales Zinsniveau für attraktive Geschäfte und damit auch für Solidität und Arbeitsplätze benötigen. Und es sieht nicht gut aus für Versicherungen und Pensionskassen, bei denen ein Großteil der privaten Absicherung für das Alter hinterlegt ist, die aber mit Null-Zinsen die versprochenen Gewinne nicht erwirtschaften können. Insgesamt hat die EZB zu lange gezögert, um den Beginn einer einigermaßen normalen Geldpolitik mit angemessenem Zins-Niveau einzuleiten. Jetzt steht sie vor dem Dilemma, dass ihr die Möglichkeit dazu schon wieder aus den Händen gleitet. Dabei muss die EZB selbst größtes Interesse an der Rückkehr zu normalen Verhältnissen haben. Denn kommt es zu einer Rezession, also einem deutlichen Abschwung der Wirtschaft, stehen die Währungshüter mit leeren Händen da. Sie haben an der Zinsfront keinen Puffer mehr. Sie können die Zinsen nicht weiter senken, weil sie schon auf null Prozent sind. Sie könnten sie im Fall einer neuen schweren Krise zwar ins Negative drehen. Doch damit würde die Finanz- und Wirtschaftswelt endgültig auf den Kopf gestellt. Die Währungshüter stehen im kommenden Jahr also vor großen Herausforderungen. Die Gestaltung der Geldpolitik dürfte in Zukunft noch schwerer werden. Zu tragen haben das die Bürgerinnen und Bürger der Eurozone, deren Sparvermögen schrumpft. Kurz nach dem Jahrestag der Lehman-Pleite und den Schlaglichtern auf die wirklichen Verursacher der schweren Wirtschafts- und Schuldenkrise, die letztendlich die Not-Politik der EZB ausgelöst haben, ist das eine bittere Erkenntnis. "
12.12.2018 16:34 Uhr,Anschlag in Straßburg,Was bislang bekannt ist,"Drei Menschen sind bei Schüssen am Rande des Straßburger Weihnachtsmarktes getötet worden. Inzwischen haben die Behörden mehr Informationen über den mutmaßlichen Täter. Was weiß man über die Tat? Ein Mann eröffnete nach Behördenangaben gegen 20 Uhr am Dienstagabend in der Nähe des Weihnachtsmarktes das Feuer mit einer Handfeuerwaffe und stach mit dem Messer auf Menschen ein. Soldaten, die den Weihnachtsmarkt bewachten, hätten den Mann angeschossen und verletzt, hieß es von der Polizeigewerkschaft. Ein Militärsprecher sagte, der Verdächtige habe gezielt Zivilisten ins Visier genommen. Der französische Innenminister Christophe Castaner sagte, der mutmaßliche Täter habe an drei verschiedenen Orten in der Stadt ""Terror"" verbreitet. Zwischen 20 und 21 Uhr habe er sich zweimal einen Schusswechsel mit Sicherheitskräften im Patrouilleneinsatz geliefert. Laut dem Sender France Info entkam er anschließend mit einem Taxi, das er gestohlen hatte. Bei dem tödlichen Anschlag sind zwei Menschen ums Leben gekommen. Eine weitere Person sei hirntot, sagte der Antiterror-Staatsanwalt Heitz. Zwölf Menschen wurden verletzt, sechs von ihnen sehr schwer. Unter den Opfern ist ein Tourist aus Thailand, bestätigte das Außenministerium in Bangkok. Kurz nach den Schüssen hatten die Polizeigewerkschaft und der Bürgermeister von Straßburg noch von insgesamt vier Todesopfern gesprochen. Ein italienischer Journalist liegt im Koma, berichten italienische Medien. Er könne nicht operiert werden, weil ein Projektil in der Nähe des Schädels und der Wirbelsäule stecke. Der mutmaßliche Täter heißt Chérif Chekatt, ist 29 Jahre alt und wurde in Straßburg geboren. Seine Eltern stammen aus Algerien, er hat sechs Geschwister. Auch nach seinem Bruder Sami wird gefahndet. Die beiden französischen Staatsbürger wohnten nach Informationen aus Sicherheitskreisen zuletzt in Straßburg. C. verbrachte in seinem Leben bislang mehr als fünf Jahre im Gefängnis. In Frankreich laufen mehrere Ermittlungsverfahren gegen Chekatt - darunter wohl auch eine Mordermittlung. Immer wieder ist er in den vergangenen Jahren in Frankreich, aber auch in Deutschland wegen Straftaten wie Diebstahl und Raub aufgefallen. Chekatt hat laut SWR-Informationen einen mit dem Hauptschulabschluss vergleichbaren Schulabschluss gemacht, aber keine Ausbildung. Nach der Schule arbeitete er demnach bei der Gemeinde, seit 2011 war er allerdings arbeitslos. 2012 brach er laut dpa nachts in eine Zahnarztpraxis in Mainz ein und stahl Geld sowie Zahngold. 2016 hebelte er demnach nachts die Tür einer Apotheke im badischen Engen auf, konnte aber noch in der Nacht mit Hilfe eines Polizeihubschraubers gefasst werden. Er hatte sich auf einen Baum geflüchtet. Das Amtsgericht Singen verurteilte ihn deshalb, er saß 2016 und 2017 in Deutschland in Haft und galt als reisender Serienstraftäter. Im Prozess in Singen gab er an, keine Ausbildung zu haben und seit 2011 arbeitslos zu sein. Laut Behörden wurde er auch in Luxemburg kriminell auffällig. Seine DNA sei bei einem versuchten Einbruchsdiebstahl im Jahr 2012 am Tatort gefunden worden, sagt ein Sprecher der Regierung in Luxemburg. Gegen ihn wurde auch ein Strafverfahren eingeleitet. Die Ermittler gehen von einem terroristischen Hintergrund aus. Zeugen des Straßburger Anschlags haben den Angreifer ""Allahu Akbar"" (Allah ist groß) rufen hören, sagte der Antiterror-Staatsanwalt Heitz. Angesichts des Zielorts, seiner Vorgehensweise und der Zeugenaussagen habe die Antiterrorabteilung der Pariser Staatsanwaltschaft die Ermittlungen übernommen. Zuvor war bekannt geworden, dass der Täter auf der Sicherheitsakte ""Fiche S"" geführt worden sei - einer Liste von Personen, die verdächtigt werden, radikalisiert zu sein. Das Motiv für den Angriff auf den Straßburger Weihnachtsmarkt könnte auch Rache gewesen sein, heißt es in Sicherheitskreisen. Möglicherweise habe der 29-Jährige auf den Versuch seiner Festnahme am Dienstagmorgen wegen eines mutmaßlich versuchten Tötungsdeliktes spontan reagiert. Die Polizei traf ihn dort nicht an, fand aber Waffen. Den französischen Sicherheitsbehörden sei keine Vorbereitung eines Anschlags in Straßburg bekannt gewesen. Die Polizei riegelte Teile von Straßburg ab. Die Behörden forderten die Öffentlichkeit auf, in den Gebäuden zu bleiben. Einige Personen mussten stundenlang in Restaurants ausharren. Auch Abgeordnete des EU-Parlaments und Tausende Menschen in einem Sportstadion mussten vorerst dort bleiben. Frankreichs Präsident Emmanuel Macron leitete um Mitternacht ein Treffen im Krisenzentrum des Innenministeriums. Ermittler nahmen vier Menschen aus dem Umfeld des 29 Jahre alten Tatverdächtigen Chekatt in Gewahrsam, sagte der Antiterror-Staatsanwalt Heitz. In Frankreich gilt nun die höchste Terrorwarnstufe. Zusätzliche Sicherheitskräfte sollen nach Straßburg geschickt werden. Laut Behörden sind derzeit Hunderte Sicherheitsbeamte und zwei Hubschrauber in die Suche nach dem mutmaßlichen Täter eingebunden. Die Bundespolizei kontrolliert den Grenzverkehr zwischen Deutschland und Frankreich. Der Weihnachtsmarkt von Straßburg bleibt heute geschlossen. Das Auswärtige Amt in Berlin verschärfte seine Reisehinweise für Frankreich. Reisende werden gebeten, ""besonders vorsichtig zu sein und den Anweisungen von Sicherheitskräften unbedingt Folge zu leisten."" Mit Informationen von Kirsten Tromnau, SWR "
12.12.2018 14:15 Uhr,Abstimmung der Tories,Wie läuft das Misstrauensvotum ab?,"Stürzt May oder nicht? Das dürfte schon heute Abend feststehen. Wie läuft die Vertrauensabstimmung ab? Wer stimmt ab? Und was passiert, wenn May verliert? Zunächst handelt es sich um ein parteiinternes Misstrauensvotum gegen Theresa May. Dabei geht es formell um den Vorsitz der Tories - wie die konservative Partei in Großbritannien kurz genannt wird. Sollte sie diesen verlieren, wäre aber auch ihr Posten als Premierministerin nicht mehr zu halten. Im ersten Schritt müssen 15 Prozent der konservativen Parlamentsabgeordneten in einem Brief an den zuständigen Ausschuss ein Vertrauensvotum fordern. Die Tories zählen im Unterhaus 316 Abgeordnete. Daher bedarf es 48 Stimmen für das Verfahren. Nach Aussagen des Ausschussvorsitzenden Graham Brady wurde die Mindestgrenze nun erreicht. Hinter dem Misstrauensantrag stehen wohl hauptsächlich die Brexit-Hardliner in ihrer Fraktion um den erzkonservativen Hinterbänkler Jacob Rees-Mogg. Das Misstrauensvotum wird in geheimer Wahl abgehalten. Alle konservativen Parlamentarier können abstimmen. Um May zu stürzen, sind derzeit mindestens 159 Abgeordnete nötig. Sollte May das Votum überstehen, kann sie für zwölf Monate nicht mehr herausgefordert werden - zumindest nicht von ihrer eigenen Partei. Andere Parteien könnten hingegen einen weiteren Misstrauensantrag stellen. Die Abgeordneten sollen bereits heute Abend abstimmen - und zwar zwischen 19 Uhr und 21 Uhr (MEZ). Das Ergebnis soll unmittelbar danach verkündet werden - vermutlich gegen 22 Uhr. Sollte May das Tory-Vertrauensvotum verlieren, würde ihr Nachfolger durch einen parteiinternen Wettbewerb bestimmt. Der Sieger würde Premierminister. Eine Neuwahl ist nicht vorgeschrieben. Bei mehreren Kandidaten müssten die konservativen Abgeordneten zunächst in geheimer Abstimmung das Feld verkleinern. Dabei würden in jeder Runde die Bewerber mit den wenigsten Stimmen aussortiert. Zwischen den beiden letzten verbliebenen Kandidaten müssten dann die Tory-Mitglieder im Land in einer Urwahl entscheiden. Dieser Prozess würde mehrere Wochen dauern. Das jüngste Beispiel war 2016. Damals trat Premierminister David Cameron nach dem Brexit-Referendum zurück. Fünf Kandidaten bewarben sich. Übrig blieben May und die damalige Staatssekretärin Andrea Leadsom. Leadsom zog ihre Bewerbung zurück, so dass May freie Bahn hatte. Beim Thema Brexit herrscht derzeit ohnehin Chaos. Hier Voraussagen zu treffen, ist also schwer. Mit großer Wahrscheinlichkeit ausschließen kann man aber, dass ein Sturz Mays keine Auswirkungen auf den Brexit hätte. Dafür spricht alleine schon der ohnehin enge Zeitplan. Denn das Austrittsdatum ist der 29. März 2019. Ob bis dahin alle Posten, die durch einen Sturz May freiwerden können, neu besetzt sind, ist fraglich. Justizminister David Gauke deutete auch schon an, dass Großbritannien den EU-Austritt verschieben muss, sollte May ihre Vertrauensabstimmung verlieren. Nach Einschätzung von ARD-Korrespondent Jens-Peter Marquardt würden mit einer solchen Verschiebung auch die Chancen derjenigen steigen, die das Land in der EU halten wollen. "
12.12.2018 13:17 Uhr,Rechtlicher Hintergrund,Was ist das Werbeverbot für Abtreibungen?,"In der Debatte über Paragraf 219a wird einiges durcheinandergebracht. Was genau bedeutet eigentlich das Werbeverbot für Abtreibungen? Und worum geht es rechtlich? Fragen und Antworten. Die Überschrift des Paragrafen, über den so hitzig diskutiert wird, lautet ""Werbung für den Abbruch der Schwangerschaft"". Nach dem Gesetzeswortlaut des § 219a StGB ist es unter anderem verboten, öffentlich, in einer Versammlung oder durch Verbreiten von Schriften eigene oder fremde Dienste zur Vornahme oder Förderung eines Schwangerschaftsabbruchs anzubieten oder anzupreisen, wenn dies entweder in grob anstößiger Weise geschieht oder um einen Vermögensvorteil zu erlangen. Hier unterliegt sie, wie sehr viele, die das Thema gerade diskutieren, einem Irrtum. Damit es sich um ""Werbung"" handelt, ist es nicht erforderlich, dass man die Frauen zum Schwangerschaftsabbruch auffordert, also sie dazu animiert oder jede Abtreibung gutheißt. Es reicht vielmehr, dass man sachlich über die Möglichkeiten informiert und gleichzeitig angibt, dass man selbst die Leistung für Geld anbietet. Damit ist jeder öffentliche Hinweis auf die Bereitschaft zur Vornahme von Schwangerschaftsabbrüchen strafbar, solange die ärztliche Leistung nicht entgeltfrei angeboten wird. So steht es im Gesetz, weil es der Gesetzgeber bisher so gewollt hat. Nein, sachliche Information ist möglich und erlaubt. Auch Ärzten. Sie darf nur nicht mit der Auskunft verbunden werden, dass man selbst gegen Geld Schwangerschaftsabbrüche anbietet. Die Allgemeinmedizinerin Hänel bot und bietet in leicht abgeänderter Form auch heute noch im Internet und damit öffentlich ihre ärztliche Hilfe und hierfür geeignete Verfahren zur Vornahme eines Schwangerschaftsabbruchs gegen Honorar an. Neben den allgemeinen Informationen wird der Weg zur Praxis beschrieben und den Frauen wird mitgeteilt, dass sie eine Kostenübernahmebescheinigung oder Bargeld mitbringen müssten. Das ist nach der Definition des Gesetzes Werbung. Deshalb konnten die Gerichte gar nicht anders, als Hänel zu verurteilen. Das Landgericht Gießen bestätigte die Verurteilung des Amtsgerichts von einer Geldstrafe von 40 Tagessätzen zu 150 Euro. Gegen das Urteil hat Hänel Revision eingelegt, so dass nun auch noch das Oberlandesgericht Frankfurt über den Fall entscheiden wird. Viele behaupten, das Verbot sei nicht mit der Verfassung vereinbar. Zum einen verletze es die Informationsfreiheit der schwangeren Frauen aus Artikel 5 des Grundgesetzes, weil die sich nicht ungehindert informieren könnten. Zum anderen die Berufsfreiheit der Ärzte aus Artikel 12. Das Landgericht Gießen war hingegen nicht der Meinung, dass ein Verstoß gegen die Verfassung vorliegt. Andernfalls hätte das Gericht das Verfahren aussetzen und die Sache dem Bundesverfassungsgericht vorlegen müssen. Das Landgericht war vielmehr der Ansicht, die Frauen hätten auch mit dem Werbeverbot genügend Möglichkeiten, sich bei Ärzten persönlich, bei Beratungsstellen oder auch im Internet zu informieren. Die Berufsausübung werde zwar durch das gesetzliche Werbeverbot eingeschränkt, dies sei aber gerechtfertigt. Das Werbeverbot stehe in einem Gesamtkonzept des Gesetzgebers, um das ungeborene Leben zu schützen. Ärzte sollen nicht in einen Wettbewerb um Schwangerschaftsabbrüche treten. Es ist nicht ausgeschlossen, dass die Sache doch noch zum Bundesverfassungsgericht kommt. Es ist zumindest das erklärte Ziel der Ärztin Hänel. Aber ob Karlsruhe die Sache anders sieht, darf zumindest bezweifelt werden. Die Menschenwürde der ungeborenen Kinder hat das Verfassungsgericht immer hochgehalten. Und der Spielraum des Gesetzgebers, diese zu schützen,  dürfte hier weit sein. Der Gesetzgeber könnte den Paragrafen 219a komplett abschaffen. Allerdings würde das Werbeverbot dann nicht nur für Ärzte fallen. Und: Es wäre dann auch anstößige Werbung für Abtreibungen möglich. Wahrscheinlicher ist deshalb eine Änderung des Gesetzes. Die könnte zum Beispiel so aussehen, dass die sachliche Information durch Ärzte auch dann erlaubt ist, wenn sie mit dem Hinweis verbunden ist, dass der Arzt die Schwangerschaftsabbrüche (natürlich gegen Entgelt) selbst anbietet. Die Ärztin Hänel führt viele Argumente dafür ins Feld. Im Internet würden den Falschinformationen fundamentaler Abtreibungsgegner sonst nichts entgegengesetzt werden. Außerdem würden die oft unterfinanzierten Beratungsstellen, etwa im katholischen Bereich, keinen Hinweis auf Abtreibungsärzte geben. Für Frauen sei es deshalb schwer, die entsprechenden Ärzte zu finden. Nein, auch wenn manche sich das wünschen. Mit den gesetzlichen Regelungen zur Abtreibung selbst hat das nichts zu tun. Schwangerschaftsabbrüche sind grundsätzlich verboten. Innerhalb der ersten zwölf Wochen der Schwangerschaft sind sie nach einer vorherigen Beratung straffrei. Diese Regelung hat das Bundesverfassungsgericht gebilligt. Die völlige Straffreiheit von Schwangerschaftsabbrüchen würde hingegen nach mehreren Urteilen aus Karlsruhe gegen das Grundgesetz verstoßen. "
