date,topline,headline,content07.12.2018 19:07 Uhr,CDU-Chefin Kramp-Karrenbauer,Keine Experimente,"Die CDU ist keine Revoluzzerpartei. Sie ist eine Profi-Staatspartei. Keine Experimente. Daher ist die Wahl Kramp-Karrenbauers auch folgerichtig. Merkels Plan könnte aufgehen. Die CDU ist schon eine merkwürdige Partei. Sie grummelt eher leise, Streit gibt es, wenn überhaupt, nur in Hinterzimmern. Dort, wo es oft auch um die Macht geht. Ein offener Kampf um die Macht ist der CDU fremd, 1971 war ein Unfall. Sie möchte in Ruhe regieren. Revoluzzertum ist ihre Sache nicht. Die CDU ist auch schwer zu begeistern. Wäre die CDU ein Schiff, es wäre ein ziemlich dickes. Doch jetzt wurden auf diesem Schiff die Fenster weit aufgerissen, frische Luft kommt rein - und die CDU ist völlig aus dem Häuschen. Ein bisschen staunt sie in diesen Tagen auch über sich selbst, sie erkennt sich selbst kaum wieder. Dass innerparteiliche Demokratie, Debatte, Diskurs so belebend sein können. Nun ist es beileibe nicht so, dass Angela Merkel die Partei 18 Jahre lang autokratisch geführt hätte. Aber dass sie mutig vorangegangen wäre, Debatten angestoßen, die Basis einbezogen, auch mal offenen Streit riskiert hätte - all das ist nicht ihr Politkstil. Sie rückte die CDU in die linke politische Mitte, übernahm dabei auch sozialdemokratische Positionen, modernisierte die Partei. Das alles ging gut, solange Merkel der CDU die Macht sicherte. Visionen waren nie Merkels Stärke, aber irgendwann wurde die Raute zum Programm - 2013 reichte das noch, in diesen Zeiten aber ist das zu wenig. Die CDU hat keine Antworten mehr auf drängende gesellschaftliche Fragen, keine Strategie gegen Populisten, keine Ideen für die Zukunft. Die Wähler wandern ab - zur AfD, zu den Grünen. Die inhaltliche Leere zeigte sich besonders deutlich im Scheitern der Jamaika-Verhandlungen. Mit letzter Kraft rettete man sich in einen müden GroKo-Aufguss, Aufbruchstimmung kam nie auf. Dafür viel Unzufriedenheit mit der Chefin bis hin zu offener Kritik und eine wachsende Sehnsucht nach einem Neuanfang. Die CDU war Merkel überdrüssig geworden. Merkel hat erkannt, erkennen müssen, dass jetzt andere ran müssen, um die Partei wieder stark zu machen. In ihrer letzten - und wohl kürzesten - Rede als CDU-Chefin weist sie der Partei auch den Weg in die Zukunft. Es ist eine außergewöhnliche Merkel-Rede, kein rhetorisches Feuerwerk - aber selbstbewusst, ehrlich, leise Spitzen an den richtigen Stellen, phasenweise frech und selbstironisch. Sogar ganz merkel-untypisch emotional. Merkel versöhnt sich mit ihrer Partei - und die Partei versöhnt sich mit ihrer langjährigen Vorsitzenden. ""Danke, Angela, aber jetzt geht es um die Zukunft."" Als Annegret Kramp-Karrenbauer dies heute sagt, weiß sie noch nicht, dass sie kurz darauf diejenige sein wird, die die Partei in die Zukunft führen soll. Der Satz ist der verbale Spagat zwischen Nähe und Distanz zu Merkel. Die CDU hat sich für Kramp-Karrenbauer entschieden, für die Generalsekretärin, die akribische Parteiarbeiterin mit dem Ohr an der Basis, die Wahlsiegerin aus dem Saarland, die erfahrene Regierungschefin. Die CDU hat sich für Kramp-Karrenbauer entschieden und gegen Friedrich Merz. Zwei Wahlgänge waren nötig, am Ende stand es 51,7 zu 48,2 Prozent. 35 Stimmen Unterschied. Dabei kannte man Drama bislang hauptsächlich von SPD-Parteitagen. Revoluzzertum liegt die CDU nicht. Insofern ist die Entscheidung für Kramp-Karrenbauer folgerichtig. Man wollte etwas Neues, aber keinen Bruch mit der Merkel-Ära. Ihr Vermächtnis soll bewahrt, aber nicht abgewickelt werden. Die Entscheidung für AKK, wie sie kurz genannt wird, ist eine Entscheidung der Vernunft, für ein ""Weiter so, aber anders"". Für mehr CDU pur, aber in einer Kultur des Ausgleichs. Für den großen Umbruch bei der CDU steht Kramp-Karrenbauer nicht. Friedrich Merz' zweite Karriere als Hoffnungsträger der Konservativen in der CDU ist schon wieder jäh vorbei. Er hätte zwar gerne gewonnen, die vergangenen Wochen hätten aber trotzdem viel Spaß gemacht, sagte er - und ließ offen, ob er bleibt oder wieder geht. Für das Präsidium der Partei kandidiert er nicht. Anders als Merz hat der zweite unterlegene Kandidat, Jens Spahn, seine politische Zukunft noch vor sich. Trotz Platz 3 geht er auch als Gewinner vom Platz. Seine 15 Prozent im ersten Wahlgang sind mehr als nur ein Achtungserfolg. Nun will er ""auf jeden Fall im Team bleiben"". Für Kramp-Karrenbauer kommt es nun zunächst darauf an, die unterschiedlichen Strömungen in der Partei wieder zu einen. Denn die Konflikte in der CDU sind ja nicht weggewahlkämpft in den Regionalkonferenzen, im Gegenteil: Sie sind nur noch deutlicher zutage getreten. Wertkonservative, Sozialliberale, Wirtschaftsliberale - Kramp-Karrenbauer muss Brückenbauerin sein. Nun ist die CDU auch eine Profi-Staatspartei, die Gefahr einer Spaltung in unterschiedliche Flügel dürfte überschaubar sein. Auch Streit mit der Kanzlerin droht mit AKK an der Parteispitze vermutlich erstmal nicht. Beide Frauen verstehen sich, gehen loyal miteinander um. Bei Merz war bis zum Schluss nicht klar, ob er wirklich um den CDU-Vorsitz kämpft oder gegen Merkel. Ihr Plan, bis zum Ende der Legislaturperiode Chefin einer Großen Koalition zu bleiben, wäre mit Merz als CDU-Chef definitiv schwieriger umzusetzen gewesen als mit der Saarländerin. Die Gefahr einer vorgezogenen Bundestagswahl ist mit AKK als CDU-Chefin zumindest nicht größer geworden. Merkels Wagnis, Parteiamt und Kanzlerschaft nun doch zu trennen, um wenigstens einen Teil ihrer Macht über die Zeit zu retten - es könnte klappen. Aber niemand sollte Kramp-Karrenbauer unterschätzen. Sie will die Partei wieder stärken - auch und gerade gegen die Regierung. Schluss mit dem Klischee des Kanzlerwahlvereins, den Schwung der Regionalkonferenzen, die Diskussionsfreude, die Mitgliederbeteiligung will sie bewahren und ausbauen. Auch wird sie andere Akzente setzen als Merkel, ihre gesellschaftspolitischen Vorstellungen sind konservativer, in der Flüchtlings- und Ausländerpolitik setzte sie zuletzt auf harte Töne, die Sozialpolitik ist ihr wichtig. Entscheidend aber wird sein, ob sie die CDU als Volkspartei der Mitte stärken und letztlich auch Wahlen gewinnen kann. ""Wir sind kein politischer Gemischtwarenladen"", warnt sie. ""Wir sind so etwas wie das letzte Einhorn in Europa - die letzte große existierende Volkspartei."" Nächstes Jahr muss die CDU drei Landtagswahlen im Osten bestehen. Das Einhorn muss kämpfen. "
07.12.2018 15:34 Uhr,Letzte Rede als CDU-Chefin,"""Es war mir eine Ehre""","Sachlich und ""knochentrocken"", aber auch emotional und selbstironisch: Angela Merkel hat ihre letzte Rede als CDU-Chefin gehalten. Der Applaus war freundlich, aber nicht frenetisch. Nur nicht zu emotional werden. Bei ihrer letzten Rede als CDU-Vorsitzende gibt die Frau, die die Partei 18 Jahre lang geführt hat, die Tonart selber vor: ""Typisch Merkel - knochentrocken!"" Merkel schlägt einen Bogen vom Motto, das sie ihrem ersten Parteitag im Jahr 2000 gab - ""Zur Sache"" hieß es damals - zur Vorgabe für den heutigen Parteitag, das so sachlich ausfällt, wie es ihrem Naturell entspricht: ""'Zusammenführen und zusammen führen!' - mein letztes Motto als CDU-Vorsitzende. Und wieder typisch Merkel: Wo steht hier Deutschland? Nirgends! Wo steht hier Zukunft? Nirgends! Wo steht hier etwas von gestalten, von Werten, von Sicherheit? Nirgends!"" Die CDU im Jahr 2018, so Merkel, ist nun einmal nicht mehr die CDU der 1980er- und 1990er-Jahre. Und sie selbst ist es gewesen, die die Christdemokraten auf den neuen, in die Zukunft weisenden Weg geführt hat - das vor allem macht sie deutlich. Damals noch mit der rot-grünen Bundesregierung und der Unterstützung für die Hartz-Gesetze, die dann in ihrer Ägide in deutlich niedrigere Arbeitslosenzahlen umgemünzt wurden. Später dann mit der Abschaffung der Wehrpflicht, dem Mindestlohn, dem Elterngeld und dem Kita-Ausbau. ""Und liebe Freunde, wir haben auch die große Herausforderung bestanden, 2015 in einer humanitären Notlage viele Menschen bei uns aufzunehmen und trotzdem dafür zu sorgen, dass gesteuert und geordnet wurde. Ich erinnere nur an das EU-Türkei-Abkommen"", so Merkel. Der Beifall fällt etwas spärlicher aus an dieser Stelle. Das Fremdeln vieler Delegierter mit ihrer Chefin ist auch drei Jahre nach der Flüchtlingskrise noch hör- und sichtbar. Als Merkel nach gut einer halben Stunde zum Ende ihrer Rede kommt, hat sie die Namen ihrer potentiellen Nachfolger kein einziges Mal erwähnt. Heute geht es um das Fazit ihrer Amtszeit an der Spitze der Partei und die Delegierten applaudieren minutenlang freundlich und dankbar, wenn auch nicht frenetisch. ""Und jetzt ist es an der Zeit, ein neues Kapital aufzuschlagen. Heute, in dieser Stunde, in diesem Moment bin ich von einem einzigen, alles überragenden Gefühl erfüllt: von dem Gefühl der Dankbarkeit. Es war mir eine große Freude. Es war mir eine Ehre!"" Fast fröhlich lächelnd winkt Merkel eine Weile in den Saal und nimmt dann wieder Platz auf ihrem Stuhl im Tagungspräsidium. Was sie in diesem Augenblick empfindet, wird nicht klar deutlich und lässt die Delegierten spekulieren: ""Ich glaube, dass sie ein Stück weit wehmütig ist."", ""Unglaublich menschlich. Man merkt, dass sie sich tatsächlich noch einmal eine Menge Gedanken über diese 18 Jahre als Parteivorsitzende gemacht hat."" und ""Sie spricht eben dafür, dass man zusammenhalten muss, dass wir in der Mitte bleiben sollen. Und das ist für mich schon ein klares Signal!"" "
06.12.2018 22:21 Uhr,ARD-DeutschlandTrend,Die Union legt wieder zu,"Kurz vor der Entscheidung über die Merkel-Nachfolge an der CDU-Spitze gewinnt die Union in der Sonntagsfrage des ARD-DeutschlandTrends vier Punkte hinzu. Die Arbeit der Regierung wird wieder besser bewertet. Auf dem Parteitag werden es die 1001 Delegierten sein, die über die Nachfolge von Angela Merkel als CDU-Chefin entscheiden. Es könnte eine knappe Wahl werden. Wenn es nach den CDU-Anhängern ginge, ergäbe sich aktuell folgendes Bild: 47 Prozent wünschen sich, dass Annegret Kramp-Karrenbauer den Job übernimmt. Das ist ein Punkt mehr als im Vormonat. Für Friedrich Merz als neuen Vorsitzenden sprechen sich 37 Prozent der CDU-Anhänger aus, sechs Punkte mehr als im November. Jens Spahn wünschen sich unverändert nur zwölf Prozent der CDU-Anhänger als neuen Parteichef. Das hat eine Umfrage von infratest dimap für den ARD-DeutschlandTrend ergeben. Merkel wird zwar den CDU-Vorsitz abgeben, will aber weiter Kanzlerin bleiben. Auch die Mehrheit der Deutschen wünscht sich das: Aktuell sprechen sich 57 Prozent der Befragten dafür aus, dass Merkel die vollen drei Jahre bis zur nächsten Bundestagswahl im Amt bleiben soll. Das ist ein Prozentpunkt mehr als im November und acht Prozentpunkte mehr als im Januar. Damals standen die Sondierungsgespräche zu einer erneuten Regierung mit der SPD unmittelbar bevor. Aktuell sind 39 Prozent der Deutschen der Ansicht, dass Merkel vorzeitig für einen Nachfolger oder eine Nachfolgerin Platz machen sollte (-2 im Vgl. zum Vormonat). Die Arbeit der Bundesregierung wird von den Deutschen etwas besser bewertet als noch in den vergangenen Monaten: Aktuell sagen 36 Prozent der Befragten, dass sie sehr zufrieden beziehungsweise zufrieden mit der Arbeit des Kabinetts sind - das sind elf Punkte mehr als im Vormonat. Eine deutliche Mehrheit von 64 Prozent ist jedoch weiterhin weniger beziehungsweise gar nicht zufrieden mit der Arbeit der Bundesregierung. Auch mit der Arbeit der Bundeskanzlerin sind im Vergleich zum Vormonat mehr Befragte zufrieden: 57 Prozent sind mit Merkels Arbeit sehr zufrieden bzw. zufrieden (+7 Prozentpunkte im Vergleich zum Vormonat). Finanzminister Olaf Scholz (SPD) kommt auf 46 Prozent Zustimmung (+2), Wirtschaftsminister Peter Altmaier (CDU) auf 43 Prozent (-1). Mit der Arbeit von Außenminister Heiko Maas (SPD) sind aktuell 41 Prozent der Befragten sehr zufrieden bzw. zufrieden (-4). Die Linken-Fraktionsvorsitzende Sahra Wagenknecht verliert 5 Punkte und kommt auf 35 Prozent Zustimmung. Der Grünen-Vorsitzende Robert Habeck erreicht mit 31 Prozent (+3 im Vgl. zu Oktober) einen neuen Höchstwert im ARD-DeutschlandTrend. Mit der Arbeit des FDP-Vorsitzenden Christian Lindner sind 30 Prozent (-3 im Vgl. zum Vormonat) zufrieden bzw. sehr zufrieden. Gesundheitsminister Jens Spahn (CDU) erreicht 27 Prozent Zustimmung (-1) und SPD-Vorsitzende Andrea Nahles 25 Prozent (-1). Die Grünen-Vorsitzende Annalena Baerbock verliert zum Vormonat 6 Punkte und ist mit 23 Prozent Zustimmung aktuell fast gleichauf mit Bundesinnenminister Horst Seehofer (22 Prozent, +2). Mit der Arbeit der AfD-Fraktionsvorsitzenden Alice Weidel sind 11 Prozent der Befragten sehr zufrieden bzw. zufrieden (-1). Wenn am Sonntag Bundestagswahl wäre, käme die Union auf 30 Prozent, vier Punkte mehr als im Vergleich zum Vormonat. SPD und AfD sind beide stabil bei 14 Prozent. Die FDP bleibt bei acht Prozent. Damit liegt sie gleichauf mit der Linkspartei, die einen Punkt einbüßt. Die Grünen verlieren drei Punkte und landen bei 20 Prozent. Im polnischen Kattowitz findet zurzeit die UN-Klimakonferenz statt, bei der Delegierte aus 197 Ländern über die Umsetzung des Pariser Abkommens beraten. Ziel ist es, den Temperaturanstieg im Vergleich zum vorindustriellen Zeitalter auf unter zwei Grad zu begrenzen. 55 Prozent der Deutschen sind eher nicht überzeugt, dass die internationale Staatengemeinschaft die Probleme, die aus dem Klimawandel resultieren, bewältigen kann. 30 Prozent sind davon überhaupt nicht überzeugt. Nur 14 Prozent sind voll und ganz oder eher überzeugt davon, dass die Staatengemeinschaft die Probleme in den Griff bekommen kann. Wie stehen die Bürger zu konkreten Maßnahmen zum Klimaschutz? 92 Prozent der Befragten sind der Ansicht, dass der Ausbau erneuerbarer Energien eine sinnvolle Maßnahme ist, um den Klimawandel zu begrenzen. 90 Prozent halten strengere Umweltschutzauflagen für die Industrie für sinnvoll. 69 Prozent sagen, ein schnellerer Ausstieg aus der Kohle bei der Stromerzeugung sei sinnvoll. Knapp zwei Drittel (62 Prozent) betrachten höhere Preise für Flugreisen als eine sinnvolle Maßnahme. Nur 26 Prozent der Befragten halten es für sinnvoll, die Anschaffung und den Unterhalt von Autos mit Verbrennungsmotoren teurer zu machen. Wenn man nach der Veränderung des eigenen Verhaltens mit Blick auf den Klimaschutz fragt, ergibt sich ein differenziertes Bild: Eine deutliche Mehrheit von 77 Prozent gibt an, dass sie beim Einkauf von Waren des täglichen Bedarfs ihr Verhalten mit Blick auf den Klimaschutz bereits geändert hat. Bei der Nutzung des Autos sagen das 46 Prozent, bei der Wahl des Stromanbieters 42 Prozent. Bei der Nutzung des Flugzeugs geben 25 Prozent an, dass sie ihr Verhalten geändert haben. 40 Prozent sagen, dass sie ihr Verhalten nicht geändert haben. 34 Prozent der Befragten sagen übrigens, dass sie kein Flugzeug nutzen. "
06.12.2018 20:19 Uhr,US-Lehrerin schockiert Klasse,Ein Grinch am Lehrerpult,"Bei den Kindern ist die Vorfreude auf Weihnachten wohl am größten. Da ging es einer 1. Klasse in den USA nicht anders. Bis ihre Lehrerin sich als echter Christmas-Muffel entpuppte. Der Vorfall ereignete sich in der 1. Klasse der Cedar Hill Grundschule in Montville im Bundesstaat New Jersey. Eine Lehrerin, die seit mehreren Jahren als Vertretung unterrichtet, fragte die 22 Erstklässler, welches Fest demnächst gefeiert werde. ""Weihnachten!"", antworteten die Kinder begeistert. Doch was dann passierte, muss nach Schilderungen mehrerer Eltern die sechs- und siebenjährigen Kinder zutiefst verstört haben. Die Lehrerin, die in der Facebook-Gruppe der Eltern nur ""Ms. M"" oder ""Grinch"" genannt wird, erklärte den verblüfften Kindern: Es gebe gar keinen Weihnachtsmann Kris Kringle. Auch keine Weihnachtselfen. Und Rentiere könnten gar nicht fliegen - alles Humbug. In Wahrheit kämen die Geschenke unterm Weihnachtsbaum nicht von Santa Claus und seinen Gehilfen vom Nordpol, sondern von ihren Eltern. Als Reaktion auf die erschrockenen Gesichter der Erstklässler legte die Lehrerin noch nach: Auch den Osterhasen gebe es nicht wirklich. Und die Zahnfee, die Geld unter das Kissen legt, wenn Kinder ihre Milchzähne verlieren - auch sie sei bloß eine Erfindung der Eltern. Unter den Eltern der Grundschulkinder sorgte der Vorfall für einen wahren Proteststurm. Ihre Tochter sei in Tränen aufgelöst nach Hause gekommen, schrieb eine Mutter auf Facebook und forderte: ""Zerstört uns nie wieder unsere Weihnachtsstimmung!"" Andere berichten von Besuchen beim Weihnachtsmann in der Shopping-Mall und anderen verzweifelten Versuchen, den Schaden zu begrenzen. Der Leiter der Cedar Hill-Grundschule, Michael Raj, entschuldigte sich öffentlich: Als vierfacher Vater sei ihm bewusst, wie sensibel das Thema Weihnachtsmann sei. Die Leiterin des Schulbezirks, Rene Rovtar, ging einen Schritt weiter: Der Vorfall habe sie ""besorgt und entmutigt"". Die Vertretungslehrerin dürfe künftig in ihrem Schulbezirk nicht mehr unterrichten. Der regionalen Zeitung ""Jersey Journal"" war das Thema sogar einen Leitartikel wert. Es sei richtig gewesen, dass die Lehrerin für ihr wenig einfühlsames Vorgehen büßen müsse. Schließlich sei die Kontroverse um den Weihnachtsmann seit 1897 ein für alle Mal geklärt. Und dann zitierte der Zeitungskommentar aus der berühmten Antwort des Kolumnisten Francis Church an die achtjährige Virginia: ""Wie dunkel wäre die Welt, wenn es keinen Weihnachtsmann gäbe. Sie wäre so dunkel, als gäbe es keine Virginia. Es gäbe keinen Glauben, keine Poesie - gar nichts, was das Leben erst erträglich machte. Der Weihnachtsmann lebt, und er wird ewig leben. Sogar in zehnmal zehntausend Jahren wird er da sein, um Kinder wie Dich und jedes offene Herz mit Freude zu erfüllen. Frohe Weihnacht, Virginia!"" "
06.12.2018 17:47 Uhr,EU-Grenzschutz,Frontex-Ausbau verzögert sich,"Die EU will ihre Außengrenzen besser schützen. Dafür sollten bis 2020 Tausende neue Frontex-Beamte sorgen. Doch daraus wird nichts - das mussten die EU-Innenminister jetzt einsehen. Eine europäische Grenzschutzpolizei - schnell wird sie nicht kommen. Die Innenminister haben den ehrgeizigen Plan der EU-Kommission abgelehnt. Die Brüsseler Behörde hatte vorgeschlagen, dass die EU-Grenzschutzagentur Frontex von derzeit rund 2000 auf 10.000 Mitarbeiter aufgestockt werden soll - und das bis 2020. Der österreichische Innenminister Herbert Kickl von der rechtspopulistischen Partei FPÖ hält das für unrealistisch. ""Es muss natürlich schon so sein, dass die Dinge, die wir auf den Weg bringen, dann auch machbar sind, und von den Mitgliedsstaaten getragen werden."" Man habe in den Gesprächen festgestellt, dass der Aufbau bis 2020 die ""Dimension des Machbaren"" sprenge. Deshalb schlägt sein Land vor, Frontex erst bis 2027 auf 10.000 Mitarbeiter aufzustocken. Denn das Ziel eines strengeren Außengrenzschutzes teilen alle EU-Länder. Aber jetzt, wo es konkret darum geht, dass die EU-Länder Personal, Geld und Ausrüstung stellen sollen, rudern sie zurück. Den meisten EU-Ländern geht das zu schnell. Denn Polizisten, die bis 2020 an den Außengrenzen der EU, zum Beispiel in Spanien, Italien oder Griechenland eingesetzt werden sollen, stehen dann nicht mehr im Heimatland zur Verfügung. Bundesinnenminister Horst Seehofer unterstützt die Pläne, Frontex zu verstärken. Aber nicht schon 2020, sondern erst 2025. ""Das wäre für mich ein machbarer Zeitplan, um die vorgeschlagenen 10.000 Grenzschützer zu erreichen"", sagte Seehofer. ""Wenn der Außengrenzschutz gewährleistet ist, könnten wir die Binnengrenzschutzkontrollen in Deutschland beenden."" Die Innenminister berieten auch über die Reform des europäischen Asylrechts. Sie besteht aus sieben Gesetzesvorschlägen. Darin geht es zum Beispiel um die Unterbringungsbedingungen für Flüchtlinge und eine europäische Fingerabdruckdatei. Bei den meisten dieser Gesetze sind sich die EU-Länder grundsätzlich einig. Der große Knackpunkt ist die Flüchtlingsverteilung innerhalb Europas. Sie kommt seit Jahren nicht voran, weil einige Regierungen, zum Beispiel in Polen, Ungarn und Österreich, eine Umverteilung von Flüchtlingen auf alle EU-Länder ablehnen. Die EU-Kommission hatte deshalb vorgeschlagen, das Asylpaket aufzuschnüren, damit zumindest Teile der Reform, bei denen sich alle einig sind, noch vor der Europawahl Ende Mai nächsten Jahres verabschiedet werden können. Deutschland hat bislang die Position vertreten, dass die Flüchtlingsverteilung ein Kernstück der Asylreform ist. Heute sprach sich auch Bundesinnenminister Seehofer dafür aus, dass das Asylpaket geöffnet werden soll. ""Es ist immer besser, wenn man einen Teil gemeinschaftlich erreicht, als wenn insgesamt überhaupt kein Fortschritt erzielt wird."" Lange Monate hatte sich der Bundesinnenminister nicht in Brüssel blicken lassen. Nun, beim letzten Treffen der europäischen Innenminister in diesem Jahr, war er dabei. Zur Begründung sagte Seehofer: Er komme immer dann, wenn Wichtiges anstehe. Dass die vorherigen Treffen unwichtig waren, diese Einschätzung werden wohl viele seiner europäischen Kollegen nicht teilen. "
06.12.2018 14:24 Uhr,Streit zwischen Bund und Ländern,Kraftakt Digitalpakt,"Wie kann der Digitalpakt nach der gestoppten Grundgesetzänderung umgesetzt werden? Aus Sicht der Länder gibt es andere Wege, die Milliarden für die Schulen freizugeben. Städte und Wirtschaft pochen auf eine rasche Einigung. Weil sich die Bundesländer gegen eine Grundgesetzänderung ausgesprochen haben, wächst die Sorge, dass die damit verbundenen Gelder für die Digitalisierung von Schulen nicht wie geplant ausgezahlt werden können. Kommunen und Wirtschaft appellierten an Bund und Länder, sich noch rasch zu einigen. ""Die Enttäuschung bei Eltern sowie Schülerinnen und Schülern wäre riesengroß, wenn der Digitalpakt scheitern würde"", sagte der Hauptgeschäftsführer des Deutschen Städtetages, Helmut Dedy, dem RedaktionsNetzwerk Deutschland. Bund und Länder müssten sich ""unbedingt zusammenraufen"". Erste Hinweise, wie eine Annäherung zustande kommen könne, gebe es bereits, sagte Dedy. Er bezog sich damit auf den Vorschlag, über die Aufteilung von Kosten zwischen Bund und Ländern bei weiteren Projekten außerhalb des Digitalpakts ab 2020 erneut zu verhandeln. Der Pakt umfasst fünf Milliarden Euro vom Bund für die Länder in den kommenden fünf Jahren und soll die Digitalisierung der Schulen vorantreiben. Gekauft werden sollen unter anderem Laptops, Notebooks und Tablets. Da Bildungspolitik Sache der Länder ist, hatte der Bundestag eine Grundgesetzänderung beschlossen, die der Bundesrat nun in der Form nicht mittragen will. Die Ministerpräsidenten stören sich vor allem daran, dass ab 2020 Programme des Bundes für die Länder zur Hälfte durch diese mitfinanziert werden sollen. Dann könnten ärmere Länder, die ihren Anteil nicht aufbringen können, das Bundesgeld gar nicht beanspruchen, befürchten die Landesregierungen. Der Deutsche Industrie- und Handelskammertag (DIHK) unterstrich, wie wichtig die Freigabe der Gelder sei: ""Für unsere Unternehmen, die sich bei der Ausbildung engagieren, ist eine schnelle Einigung beim Digitalpakt sehr wichtig. Denn insbesondere die Berufsschulen müssten lieber gestern als morgen ausgebaut werden"", sagte DIHK-Präsident Eric Schweitzer der Deutschen Presse-Agentur. Der DIHK sehe allein für Investitionen in den Berufsschulen einen Finanzierungsbedarf in Höhe von 2,5 Milliarden Euro - das sei die Hälfte der angekündigten fünf Milliarden Euro für die Digitalisierung aller Schulen in Deutschland. Aus Sicht der Länder besteht trotz der gestoppten Grundgesetzänderung die Möglichkeit, Gelder des Bundes für die Schulen auszuzahlen. ""Es gibt heute schon im Grundgesetz eine Möglichkeit, aus den Gemeinschaftssteuern den Ländern das Geld zu geben, damit in den Schulen die Digitalisierung vorankommt"", sagte NRW-Ministerpräsident Armin Laschet in den tagesthemen. Die baden-württembergische Kultusministerin Susanne Eisenmann kritisierte die Rolle des Bundes in dem Streit. ""Der Bund hat die Grundgesetzänderung angestrebt, weil er nicht nur Geld geben und Technologien fördern will, sondern weil er in die Bildungshoheit der Länder eingreifen will"", sagte sie. Wichtig sei, dass jetzt schnelles Internet samt technischer Ausstattung an die Schulen komme. Die Kultusministerkonferenz gab nach einem Treffen bekannt, dass sie den ausgehandelten Digitalpakt Schule begrüße. Aber der vom Bundestag verabschiedete Vorschlag für eine Änderung des Grundgesetzes in seiner vorliegenden Form sei keine tragfähige Basis für die weitere Zusammenarbeit von Bund und Ländern. Die Verschiebung der bisherigen Finanzverteilung zu Lasten der Länder für alle künftigen gemeinsamen Projekte gefährde jede künftige Kooperation und die verfassungsrechtlich festgelegte Aufgabenverteilung zwischen Ländern und Kommunen. Der Vorsitzende der Kultusministerkonferenz, Thüringens Bildungsminister Helmut Holter, forderte von der Bundesregierung einen Kompromiss. Ursprünglich sollte bei dem Treffen in Berlin eine Bund-Länder-Vereinbarung zum Digitalpakt unterzeichnet werden, dies fällt wegen des Streits aber aus. Am 14. Dezember wollen die Länder den Vermittlungsausschuss von Bundestag und Bundesrat anrufen. "
