date,topline,headline,content14.09.2019 04:27 Uhr,Britischer Ex-Premier Cameron,"""Zweites Referendum könnte helfen""","Unter Camerons Ägide hatte Großbritannien über den Austritt aus der EU abgestimmt. Nun sagte der Ex-Premierminister, ein erneutes Referendum könnte die Brexit-Blockade lösen. Die ursprüngliche Abstimmung verteidigte er. Der frühere britische Premierminister David Cameron sieht ein zweites Brexit-Referendum als Möglichkeit, den festgefahrenen Streit über den EU-Austritt Großbritanniens zu lösen. Ein Brexit ohne Abkommen sei nicht gut und sollte vermieden werden, sagte Cameron in seinem ersten Interview seit seinem Rücktritt vor gut drei Jahren. Unter seiner Ägide fand im Juni 2016 das Referendum statt, bei dem sich 52 Prozent für einen EU-Austritt und 48 Prozent dagegen aussprachen. Als Folge des Ergebnisses gab Cameron, der für einen Verbleib war, sein Amt ab. Er verteidigte die Volksabstimmung. Sie sei nötig gewesen, um das Verhältnis Großbritanniens zur EU neu auszuloten. Die vorherrschende Ungewissheit beunruhige ihn aber sehr, sagte Cameron der ""Times"". Es müsse irgendein Weg gefunden werden, die Blockade zu lösen. Dabei könne ein zweites Referendum helfen. Der derzeitige Premierminister Boris Johnson will den Brexit notfalls auch ohne Vertrag am 31. Oktober vollziehen. Um dieses Ziel zu erreichen, hat er die britischen Abgeordneten in eine Zwangspause geschickt. Zudem schloss er Gegner seines Kurses aus der konservativen Partei aus. Cameron - selbst Tory - kritisierte dieses Vorgehen. ""Ich habe beides nicht unterstützt."" Das Parlament verabschiedete aber ein Gesetz, das Johnson von einem EU-Ausstieg ohne Zustimmung des Parlaments zu einem Vertrag abhalten soll. Zuletzt hakte es im Ringen um einen geregelten Brexit vor allem an der Irland-Frage. Dort würde sich nach einem Brexit eine EU-Außengrenze befinden. Der umstrittene ""Backstop"" soll dort Kontrollen verhindern. "
13.09.2019 21:11 Uhr,Brexit spaltet Gesellschaft,Großbritannien im Glaubenskrieg,"Der Brexit spaltet nicht nur die Politik, sondern auch die britische Gesellschaft. Immer erbitterter wird der Streit geführt, immer tiefer werden die Gräben zwischen Gegnern und Befürwortern. Mehr als drei Jahre ist es her, dass der Brexit in Großbritannien einschlug. Und immer noch entzweien sich wegen des Austritts aus der EU Kollegen, Freunde und Verwandte. Jetzt traf es sogar Premierminister Boris Johnson, als dessen Bruder sich aus der Regierung verabschiedete: Der EU-freundliche konservative Abgeordnete und Staatssekretär Jo Johnson wollte die konfrontative Brexit-Politik seines Bruders nicht länger mittragen. Mit Johnson ist jetzt auch in Großbritannien ein Populist an der Regierung, der demonstrativ mit den politischen Gepflogenheiten bricht. Regeln, die auf der britischen Insel als ""good chap theory"" bekannt sind, und vor dem Missbrauch von Gewohnheitsrecht und ungeschriebenen Konventionen schützen sollen. Den Ausdruck habe einst ein Kabinettssekretär geprägt, erläutert der Verfassungshistoriker Peter Hennessy. Mit der ""good chap theory"" ist gemeint, dass Leute an der Spitze von Regierung und Verfassung ihre Grenzen kennen, dass sie denen nie zu nahe kommen, sie schon gar nicht brechen. Doch genau das hat Boris Johnson getan. Dessen offene Missachtung der Konventionen und sein opportunistischer Umgang mit Fakten zeigten sich, als Johnson dem Parlament eine Zwangspause verpasste, um ein Verbot des harten Brexit zu verhindern. Und als er, als ihm das misslang, 21 Abweichler aus der eigenen Fraktion ausschloss. Eine Strategie, mit denen die neue Führung die konservative Partei zu einer ""Brexit-Sekte"" umformen wolle, beklagen gemäßigte Tories. Die Hardliner dagegen wollen nicht nur den Austritt aus der EU, sie wollen ihn am liebsten gleich mit der Kettensäge. Diese Polarisierung geht längst über die Regierungspartei hinaus. Denn auch in der oppositionellen Labourpartei ist der Riss zwischen Brexit-Gegnern und Befürwortern kaum noch zu übertünchen. Davon profitieren die Liberaldemokraten, die sich klar für den Verbleib in der EU aussprechen. Der Brexit habe mit dem politischen Schema von einst - links die Labourpartei, rechts die Tories - aufgeräumt, meint der ""Times""-Journalist Ian Martin: ""Es hat einige Zeit gedauert, bis Politiker, Beobachter und Wähler sich daran gewöhnt haben. Nun entsteht etwas völlig Neues."" Für oder gegen Brexit - auch in der Bevölkerung stehen sich die beiden Lager inzwischen zunehmend unversöhnlich gegenüber. Im Laufe von nur drei Jahren hätten sich in der Bevölkerung unglaublich starke politische Haltungen für oder gegen den Brexit entwickelt, erläutert der Politikwissenschaftler Rob Ford. Vier von fünf Wählern fühlen sich heute einer der beiden Seiten zugehörig, weitaus mehr als einer Partei. Das sei äußerst ungewöhnlich. Ungewöhnlich ist auch, dass die Spannungen auf der Straße zunehmen. Bei Demonstrationen für und gegen Johnsons kompromisslosen Brexit-Kurs muss inzwischen immer wieder die Polizei eingreifen. Appelle wie der des konservativen Politikers Nicholas Soames klingen fast schon wie aus der Zeit gefallen: Das Unterhaus möge zum Geist des Kompromisses, der Demut und des gegenseitigen Verständnisses zurückfinden, damit die Abgeordneten sich endlich wieder den wichtigen Dingen zuwenden können, die wegen des Streits um den Brexit so sehr vernachlässigt worden sind. Der Appell des Churchill-Enkels dürfte ungehört verhallen. Auch Soames ist dem Krieg in der Konservativen Partei zum Opfer gefallen, weil er sich für einen geregelten Brexit stark gemacht hatte. Der Kampf um den Ausstieg aus der EU geht weiter und erschüttert Großbritannien in seinen Grundfesten. "
13.09.2019 17:55 Uhr,Ermittlungen eingestellt,Tschechiens Regierungschef aus dem Schneider,"Die Ermittlungen wegen Betrugs mit EU-Subventionen gegen Tschechiens Ministerpräsident Babis sind endgültig eingestellt. Das letzte Wort hat allerdings der Generalstaatsanwalt. Haben sich Andrej Babis und mehrere Mitverdächtige des Betrugs schuldig gemacht, in dem sein Wellnessressort ""Storchenest"" zeitweilig aus dem Agrofert-Konzern ausgegliedert wurde, um an zwei Millionen Euro Fördergelder der EU heranzukommen? Fünf Jahre hat diese Frage Polizei und Staatsanwälte beschäftigt. Und am Ende steht ein Nein - soweit es die Anklagebehörde in Prag angeht. ""Der leitende Staatsanwalt hat sich die Entscheidung des zuständigen Staatsanwalts zu eigen gemacht und ist zu dem Schluss gekommen, dass die Ermittlungen eingestellt werden"", sagt Alex Cimbala, der Sprecher der Anklagebehörde in Prag. Es habe zwar ursprünglich den Verdacht gegeben, dass bei den EU-Subventionen betrogen worden sei. Aber: ""Nach den Ermittlungen ist die Staatsanwaltschaft zu dem Schluss gekommen, dass zum Zeitpunkt der Antragstellung das Kriterium eines kleinen und mittleren Unternehmens erfüllt war."" Denn aus einem Fördertopf für diese Kategorie von Unternehmen kamen die zwei Millionen Euro, um die es bei Babis Wellnessressort ""Storchennest"" geht. Auf die personellen und familiären Verbindungen zwischen beiden Firmen, so die Prager Staatsanwälte, komme es nicht an. Ministerpräsident Babis reagierte umgehend und erleichtert: ""Mir war von Anfang an klar, dass das Ganze Unsinn ist. Und ich bin froh, dass die Staatsanwälte den Mut hatten, so zu entscheiden."" Für die Opposition im Parlament ist der Ausgang der Ermittlungen sicher eine Enttäuschung, auch wenn offiziell Haltung gewahrt bleibt. ""Ich respektiere es, aber es bleibt ein bitterer Beigeschmack"", sagt Marek Vyborny, der Chef der Christdemokraten. Und fügt hinzu: ""Ich bin überzeugt, dass sich Andrej Babis und weitere Führungsleute von Agrofert unethisch verhalten haben."" Aber sich dabei eben nicht strafbar gemacht haben - trotz der vielen Merkwürdigkeiten während der Ermittlungen, von denen die merkwürdigste die angeblichen psychischen Erkrankungen mitverdächtigter Familienmitglieder von Babis waren. Für den Regierungschef ergeben sich nun vielleicht neue politische Optionen. Sollte es bei der Einstellung des Verfahrens bleiben, wäre ein wesentliches Hindernis für neue Regierungsbündnisse beseitigt. Die Mitte-Rechts-Parteien hatten immer erklärt, mit einem Premier, gegen den strafrechtlich ermittelt wird, würden sie nicht in eine Regierung gehen. Das könnte sich nun ändern, und die Kommunisten könnten als Mehrheitsbeschaffer überflüssig werden. Die Entscheidung der Anklagebehörde wird nun allen Verfahrensbeteiligten zugestellt. Und auch Generalstaatsanwalt Pavel Zeman wird Post aus Prag bekommen. Er hat nun drei Monate Zeit, um zu entscheiden, ob die Einstellung des Verfahrens durch die Prager Kollegen Bestand hat oder nicht. "
13.09.2019 16:06 Uhr,John Bercow,Der angriffslustige Mr. Speaker,"Der britische Parlamentssprecher findet deutliche Worte. Das mussten auch Theresa May und Boris Johnson erfahren. Im Brexit-Streit kämpft Bercow mit großem Einsatz für das Parlament. Er werde jetzt noch eine persönliche Erklärung abgeben. Mit diesen Worten meldete sich der Speaker des Unterhauses ausgerechnet in einer ganz entscheidenden Stunde des Parlaments zu Wort. Vor der erneuten Abstimmung über vorgezogene Neuwahlen. Vor der Zwangspause für die Abgeordneten. Und an dem Tag, als der Sieg des Parlaments über den Premierminister mit der königlichen Unterschrift unter das Gesetz gegen einen ungeregelten Austritt aus der EU manifest wurde. Ausgerechnet an diesem Tag sorgte John Bercow für die fettesten Schlagzeilen: Er werde sich vor vorgezogenen Neuwahlen, aber spätestens am 31. Oktober vom Amt des Speakers zurückziehen. Er habe immer versucht, die Rückversicherung für die einfachen Abgeordneten zu sein, so der Inhalt der persönlichen Erklärung. Vor allem die Opposition klatschte danach langanhaltend Beifall, in einem Parlament, in dem eigentlich nie geklatscht wird. Doch der konservative Bercow hat als Sprecher, als Präsident des Unterhauses, Geschichte geschrieben, und Labour-Oppositionsführer Jeremy Corbyn dankte ihm dafür, ein ganz vorzüglicher Speaker gewesen zu sein. Bercow ist klein, nur 1,67 Meter groß, was einen seiner zahlreichen Kritiker mal dazu brachte, ihn als ""scheinheiligen, dummen Zwerg"" zu bezeichnen. Doch wenn er die ""Honourable Gentlemen"", die ehrenwerten Abgeordneten ihrer Majestät, zur Ordnung rief, dann wurde Bercow ganz groß. Der 56 Jahre alte Sohn eines Taxifahrers mit jüdisch-rumänischen Wurzeln inszenierte die Debatten seiner Kammer als große Show und wurde so, als sich die internationale Aufmerksamkeit nach dem Brexit-Referendum auf Westminister richtete, zum Weltstar. Zwischenrufer nahm er auch gern mal persönlich aufs Korn. So riet er mal einem Abgeordneten, er solle sich beruhigen und Yoga betreiben. In den Brexit-Debatten wuchs der Mann geradezu über sich hinaus. Bercow nutzte gnadenlos die Chance, die ihm eine Regierung ohne Mehrheit bot, um das Parlament zu stärken. Das bekam erst Theresa May zu spüren, und jetzt Boris Johnson. Er beschnitt den traditionell großen Einfluss der Regierung auf das Geschehen im Unterhaus und machte so die Opposition stärker. Als die Brexiters sich über einen angeblichen Bruch mit den Traditionen des britischen Parlaments empörten, entgegnete Bercow nur cool: ""Wenn wir uns immer nur an die Tradition hielten, wäre keinerlei Veränderung möglich."" Bercow hielt auch sonst nicht viel von Traditionen. Als er vor zehn Jahren das Amt übernahm, schnitt er erst einmal alte Zöpfe ab: Die Parlamentsbeamten müssen jetzt keine Perücken mehr tragen. Für viele seiner konservativen Parteifreunde wurde Bercow zum roten Tuch. Einer von ihnen ertappte ihn am Steuer eines Autos, auf dem ein Anti-Brexit-Aufkleber prangte. Doch Bercow wies den Vorwurf der Parteilichkeit mit den Worten zurück, das sei das Auto seiner Frau und die habe er nicht unter Kontrolle: Bercows Frau Sally glänzte übrigens einst in der englischen Promi ""Big Brother""-Sendung. Das Paar war auch wochenlang in den Klatschspalten, als Sally mit dem Vetter des Parlaments-Speakers fremd ging. Bercow ist sicher kein einfacher Mann. Mitarbeiterinnen warfen ihm vor, er habe sie angepöbelt. Und er musste zugeben, dass er einmal leise vor sich hinmurmelnd die damalige Fraktionsvorsitzende der Konservativen ein ""dummes, nutzloses Weib"" genannt habe. Gefeiert wurde Bercow dagegen, als er vor dem anstehenden Staatsbesuch Donald Trumps einen Auftritt des US-Präsidenten vor beiden Häusern des Parlaments in London ablehnte. Bercow wollte eigentlich bereits im vergangenen Sommer das Amt des Speakers abgeben. Doch er machte einfach weiter,  weil er - so seine Begründung - den Brexit-Prozess zu Ende bringen wolle. Vielleicht hat er aber auch nur Spaß daran, seine Parteifreunde ein bisschen zu ärgern und der Opposition ein bisschen zu helfen. Bis zum 31. Oktober wird er jetzt jedenfalls noch Johnson ärgern, und alles dafür tun, dass es an diesem Tag nicht zu einem ungeregelten Austritt Großbritanniens aus der EU kommt. "
13.09.2019 11:40 Uhr,Streit um No-Deal-Brexit,Bercow warnt Johnson vor Rechtsbruch,"Ungewöhnlich deutlich sagt Parlamentssprecher Bercow dem britischen Premier den Kampf an. Sollte Johnson versuchen, ohne Deal aus der EU auszusteigen, werde er ""kreativ"", damit das Parlament einen Rechtsbruch verhindere. Der scheidende Präsident des britischen Unterhauses, John Bercow, hat Premierminister Boris Johnson vor einer Missachtung des Gesetzes gegen einen ungeregelten Brexit gewarnt. ""Das wäre das fürchterlichste Vorbild, das man für den Rest der Gesellschaft abgeben könnte"", sagte er bei einer Rede in London. Versuche, einen Rechtsbruch im Namen des Brexit-Votums zu rechtfertigen, seien vergleichbar mit einem Bankräuber, der seine Beute an eine Wohltätigkeitsorganisation spenden wolle, so Bercow. Das Parlament werde das nicht zulassen. Bercow versicherte, dass er seine ""Kreativität"" einsetzen werde, um sicherzustellen, dass Johnson das Gesetz nicht ignoriert. Am Montag war das Gesetz in Kraft getreten, das den Premierminister dazu zwingt, eine Verlängerung der am 31. Oktober auslaufenden Brexit-Frist zu beantragen, sollte nicht rechtzeitig ein Abkommen mit der EU vom Unterhaus gebilligt sein. Johnson lehnt das aber kategorisch ab und will ""lieber tot im Graben"" liegen. Nach Einschätzung der Regierung könnte aber ein No-Deal unter anderem zu Lebensmittel- und Medikamentenknappheiten und anderen schweren Verwerfungen führen. Bercow spielt immer wieder eine zentrale Rolle im Machtkampf zwischen dem Parlament und der Regierung. Er erlaubte den Abgeordneten mehrfach, entgegen den Konventionen, die Kontrolle des Parlamentskalenders zu übernehmen und damit gegen den Willen der Regierung Gesetzesvorlagen einzubringen. Die von Johnson auferlegte umstrittene fünfwöchige Zwangspause des Parlaments kritisierte er scharf. Bercow will am 31. Oktober sein Amt abgeben. Das britische Parlament befindet sich seit Dienstagnacht in einer Zwangspause und soll erst wieder am 14. Oktober zusammentreten. Ein schottisches Berufungsgericht hält diese fünfwöchige Zwangspause für unrechtmäßig. Viele Abgeordnete vermuten, Johnson wolle das Parlament mit der Pause schlicht kaltstellen, um einen No-Deal-Brexit durchziehen zu können. Johnson sagt hingegen, er habe die Zwangspause erlassen, um bei einer neuen Parlamentssitzung im Oktober eine neue innenpolitische Agenda starten zu können. Er erklärte am Donnerstag, dass er ""sehr hart arbeite"", um ein neues Abkommen mit der EU zu erzielen. Die EU ließ über Parlamentspräsident David Sassoli mitteilen, Großbritannien habe ""keine Alternativen und irgendetwas vorgeschlagen, das rechtlich glaubwürdig und umsetzbar gewesen ist"". "
13.09.2019 09:52 Uhr,Öffentlicher Nahverkehr,Kaputtgesparter Klimaretter?,"Für eine Verkehrswende müsste der ÖPNV verbessert werden. Doch in vielen Städten sind Bahnen, Schienen und Infrastruktur marode. Verkehrsforscher drängen auf einen radikalen Wandel. Volker Wiebels von der Stadt Mülheim an der Ruhr formuliert es diplomatisch: ""Gemessen am Fahrgastaufkommen ist der ÖPNV in Mülheim an der Ruhr entwicklungsfähig."" Es sollen ganze Linien verschwinden, der Takt soll ausgedünnt werden und die Stadt will Haltestellen der U-Bahn abschaffen. Der Grund für die Sparpläne der Stadt: Der Öffentliche Personennahverkehr (ÖPNV) bedeutet für Mülheim in Nordrhein-Westfalen hohe Ausgaben. ""Der ÖPNV kostet unserer Stadt circa 60 Millionen Euro im Jahr. Als Kommune freuen wir uns über jede Unterstützung bei der Erfüllung unserer Aufgaben"", sagt Wiebels. Blicke man in die nahe Zukunft, werde der Zustand der Infrastruktur und die Erfüllung der Brandschutzauflagen in den nächsten Jahren weiter hohe Kosten verursachen. Aber wie soll eine Verkehrswende gelingen, wenn systematisch am ÖPNV gespart wird? ""Aus unserer Sicht wurde in den vergangenen Jahren zu wenig in die Infrastruktur, aber auch die Modernisierung der Fahrzeugflotte investiert"", kritisiert Daniel Rieger vom Naturschutzbund Deutschland (NABU). Der Verkehrsexperte appelliert an die Bundesregierung: ""Die Verkehrswende ist nicht nur eine Aufgabe der Städte und Kommunen, sie ist in wesentlichen Teilen eine Bundesaufgabe."" 10,4 Milliarden Fahrgäste sind im ÖPNV in Deutschland im Jahr unterwegs, Tendenz steigend. Der Hauptgeschäftsführer der Deutschen Städtetages, Helmut Dedy, sagt: ""Die kommunale Verkehrsinfrastruktur ist dramatisch unterfinanziert, es gibt hier einen Investitionsstau von über 38 Milliarden Euro."" Er fordert zusätzliche Mittel von 20 Milliarden Euro in den kommenden zehn Jahren, um den ÖPNV in den Städten zukunftsgerecht aufzustellen. Aber es brauche nicht nur mehr Geld, sondern auch ein Umdenken, sagt NABU-Experte Rieger. ""Das Auto ist ein Fremdkörper in der Stadt und muss konsequent zurückgedrängt werden"", erklärt er und fordert weniger Parkplätze und deutlich höhere Parkgebühren in den Städten. Gleichzeitig sollten sichere Fuß- und Radwege, ein günstiger und zuverlässiger ÖPNV sowie die Anbindung insbesondere der Randlagen dabei helfen, dass Menschen in Zukunft häufiger den ÖPNV nutzen. Thorsten Koska vom Wuppertal Institut ergänzt, dass bei den Verkehrsplanern in den vergangenen Jahren zu viele Stellen abgebaut wurden. ""In den Kommunen, aber auch auf Landesebene, fehlt es nun an Verkehrsplanern, die die vielen notwendigen Projekte einer Verkehrswende schnell auf den Weg bringen können"", sagt er. Damit die Menschen häufiger das eigene Auto stehen lassen, müssen die Städte radikal umdenken. ""Man muss den Platz für das Auto reduzieren"", ist Koska überzeugt. Eine Radspur oder Busspur ersetze dann eine Auto-Fahrbahn, eine Abstellanlage für zehn Fahrräder einen Parkplatz für Autos. ""Wir müssen darüber nachdenken, wie wir den begrenzten öffentlichen Raum in den Städten neu aufteilen"", sagt Städtetag-Hauptgeschäftsführer Dedy. Noch werde dem Auto in der Stadt viel Platz zugestanden. Ein Umbau kostet die Städte Geld, aber es wäre laut NABU eine sinnvolle Investition. ""Am Ende käme uns der Klimawandel mit seinen Folgewirkungen ohnehin um ein Vielfaches teurer zu stehen. Von daher kann nur von einer guten Investition gesprochen werden"", so Rieger vom NABU. Die Bürger in Mülheim scheinen die Sparpläne nicht gutzuheißen. Bei Bürgerversammlungen haben sie immer wieder deutlich gemacht, dass sie Sorge haben, abgehängt zu werden. Das wäre am Ende nicht nur schlecht für die Bürger der Stadt - sondern auch für das Klima. "
13.09.2019 04:05 Uhr,Brexit-Verhandlungen,"Bewegung beim ""Backstop""?","Er gehört zu den entscheidenden Streitpunkten beim Brexit: der ""Backstop"". Nun deutet sich eine Lösung für den Streitpunkt an. Neu ist die allerdings nicht - ausgeschlossen aber auch nicht. Wenn es Boris Johnson ernst ist mit einem geregelten Ausstieg aus der EU, dann muss er vor allem eines klären: Wie wollen die Briten Binnenmarkt und Zollunion verlassen, zugleich aber die Rückkehr von Grenzkontrollen zwischen Irland und Nordirland verhindern? Denn die EU beharrt auf einer Garantieklausel für eine offene Grenze in Irland. Johnson deutete jüngst eine Lösung an: ""Wir wollen keine Kontrollen an der Grenze zwischen Irland und Nordirland, die sind nicht nötig"", so der britische Premier Anfang der Woche beim Besuch in Dublin. Nun wird wieder eine Regelung hervorgeholt, die Johnsons Vorgängerin Theresa May mit der EU erwogen hatte: ein ""Backstop"", der nur für die irische Insel gilt. ""Wenn wir zum ursprünglichen Plan zurückkehren, wäre noch viel Spielraum"", meint die irische Europa-Abgeordnete Mary McGuiness. ""Aber es gibt politische Empfindlichkeiten. Und deshalb wüsste ich gern, ob das Unterhaus dafür stimmen würde."" Der Vorschlag scheiterte an konservativen Brexit-Hardlinern und an der nordirischen DUP, die die konservative Regierung im Unterhaus stützt. ""Die Unionisten wollen nicht, dass die Provinz anders behandelt wird als der Rest des Vereinigten Königreichs"", bekräftigte der DUP-Politiker Nigel Dodds jetzt noch mal. Aber seit Johnson Brexit-Abweichler aus der Konservativen Fraktion ausschließen ließ, hat er selbst mit der Regionalpartei keine Mehrheit mehr und muss deshalb keine Rücksicht auf sie nehmen. Johnsons Brexit-Unterhändler soll in Brüssel schon die Möglichkeit gesamtirischer Produktstandards in Landwirtschaft und Lebensmittelindustrie und die Verlagerung von Kontrollen in die irische See angesprochen haben. Weitere Ideen in Richtung eines auf die irische Insel begrenzten ""Backstop"" könnten der Regierung Johnson wohl die Stimmen von Labour-Abgeordneten einbringen, die ihre frühere Ablehnung inzwischen bereuen. Ob sie Brüssel weit genug gehen, bleibt abzuwarten. Bisher sind dort offenbar noch keine ernstzunehmenden britischen Initiativen angekommen. Welchen Schaden ein harter Brexit anrichten könnte, hat die Notfallplanung der britischen Regierung gezeigt. ""Ein harter Brexit könnte Nordirland 45.000 Arbeitsplätze kosten, sieben Prozent der Stellen in der Privatwirtschaft"", sagt Glynn Roberts, Chef der nordirischen Einzelhändervereinigung, über die Auswirkungen auf die Provinz. ""Er würde auch unserer Versorgungskette schwer schaden."" Irlands Regierungschef Leo Varadkar und sein britischer Kollege bekannten sich in Dublin dazu: Nordirland sei ist in den Jahrzehnten seit Inkrafttreten des Karfreitagsabkommens wohlhabender und friedlicher geworden. Schlagbäume und Grenzkontrollen könnten die Wiederkehr des Bürgerkriegs einleiten. "
12.09.2019 19:49 Uhr,Oberverwaltungsgericht,Fahrverbote in Köln wohl unumgänglich,"Ein großflächiges Dieselfahrverbot wird es in Köln nicht geben, Straßensperrungen sind aber möglich. Denn das OVG Münster hat der Stadt heute strenge Vorgaben gemacht. Keine Dieselfahrverbotszonen in der Stadt Köln, aber möglicherweise Straßensperrungen an vier wichtigen Straßen: Dazu könnte es nach dem Urteil des Oberverwaltungsgerichts Münster vom Donnerstag (12.09.2019) kommen. Begründung: Nach derzeitigem Stand könnten die vorgeschriebenen Messwerte nur mit Sperrungen erreicht werden. Die sind im Luftreinhalteplan der Stadt aber nicht vorgesehen, Konsequenz: Stadt und Bezirksregierung müssen nachbessern. Vor dem OVG hatte das Land Nordrhein-Westfalen geklagt. Es ging um ein Urteil des Kölner Verwaltungsgerichtes, das Fahrverbotszonen in Köln festschrieb - so wie es die Deutsche Umwelthilfe (DUH) verlangt hatte. Diese Fahrverbotszonen ordnete das OVG nicht mehr ausdrücklich an. Es stellte aber auch fest, dass es ohne Straßensperrungen für Dieselfahrzeuge nicht gehen würde: An verschiedenen Stellen sei der vorgeschriebene 40-Mikrogramm Grenzwert für Stickoxide deutlich überschritten worden. Konkret nannte das Gericht vier Straßen: den Clevischen Ring, den Neumarkt, die Luxemburger und die Justinianstraße. Dort könnten den Prognosen zufolge der Grenzwert nur mit Streckenfahrverboten eingehalten werden. Für andere Messstellen dagegen sei ein solches Verbot nicht zwingend geboten. Das OVG betonte, dass solche Fahrverbote unter Berücksichtigung aller Umstände verhälntismäßig sein müssten. Die Bezirksregierung müsse auch prüfen, welche Fahrzeuge ausgenommen werden könnten, ohne die Grenzwerte zu überschreiten. Stadt und Bezirksregierung wollten das Problem ohne Fahrverbote in den Griff bekommen. Ein am 1. April in Kraft getretener neuer Luftreinhalteplan verzichtete weiterhin auf diesen drastischen Schritt. Stattdessen sollte die Luftverschmutzung mit alternativen Maßnahmen gesenkt werden. Außerdem gilt ein Fahrverbot für Lkw, die Köln nur durchqueren wollen. Das OVG hat jetzt eine Nachbesserung festgeschrieben. Die deutsche Umwelthilfe hatte insgesamt gegen die Luftreinhaltepläne von 14 Städten in NRW geklagt. Nach den Urteilen gegen Aachen und Köln folgen noch weitere zwölf Verhandlungen, betroffen sind unter anderem Essen, Dortmund, Bonn, Bielefeld und Bochum. "
