date,topline,headline,content
30.09.2019 23:59 Uhr,Archiv,EU-Nachrichten September 2019,
30.09.2019 19:32 Uhr,Anhörung der EU-Kommissare,Umbauten im Team von der Leyen,"Es hatte sich abgezeichnet: Im Team der künftigen EU-Kommissionspräsidentin von der Leyen wird es wegen möglicher Interessenskonflikte Wechsel geben. Ungarn hat schon einen Ersatzkandidaten, Rumänien sucht noch. Es holpert zwar bei der Besetzung der neuen EU-Kommission. Aber es scheint so, als ließen sich die Personalsorgen Ursula von der Leyens womöglich schneller lösen als gedacht. Nach dem vorzeitigen Aus für den umstrittenen Kommissarsanwärter aus Ungarn, Laszlo Trocsanyi, hat die Regierung in Budapest bereits einen Alternativkandidaten vorgestellt. Sie nominierte EU-Botschafter Oliver Varhelyi, wie von der Leyens Sprecher bestätigte. Der 47-jährige gelernte Jurist gilt als ausgewiesener Brüssel-Insider und ist derzeit EU-Botschafter seines Landes. Ein EU-Vertreter wird mit den Worten zitiert, der erste Eindruck sei positiv, da er nicht nur als Ständiger Vertreter Ungarns in Brüssel gearbeitet habe, sondern auch schon direkt bei der EU-Kommission. Der Rechtsausschuss des EU-Parlaments hatte den ursprünglichen Bewerber Ungarns für den Posten des Erweiterungskommissars zuvor als ""ungeeignet"" abgelehnt. Er wurde nicht einmal mehr für die offizielle Anhörung im jeweiligen Fachausschuss zugelassen. Bei Trocsanyi sorgte eine mögliche Verquickung seiner Tätigkeiten als Rechtsanwalt und Justizminister für Bedenken. Auch seiner rumänischen Schicksalsgenossin, Rovana Plumb, hatte das Gremium wiederholt gravierende Interessenskonflikte und Unklarheiten finanzieller Art bescheinigt. Als Reaktion zog die rumänische Regierung ihre umstrittene Kandidatin inzwischen zurück. Es werde einen neuen Personalvorschlag geben, kündigte Premierministerin Viorica Dancila an. Der SPD-Abgeordnete Tiemo Wölken verteidigte das Vorgehen des Rechtsausschusses des Europaparlaments: ""Ich bedauere, dass wir diese Entscheidung überhaupt treffen mussten und Frau von der Leyen diese Kandidaten nicht von vornherein abgelehnt hat."" Diese mangelnde Durchsetzungsfähigkeit gegenüber den EU-Staaten lasse eine schwache EU-Kommission befürchten. Der Grünen-Politiker Sergey Lagodinsky sagte: ""Wir finden, dass die EU eine Kommission ohne Interessenskonflikte verdient. Dieser Verantwortung sind wir heute gerecht geworden."" Trocsanyi nannte die Entscheidung in einer Erklärung auf Twitter hingegen eine ""schreiende Ungerechtigkeit"" sowie einen klaren Verstoß gegen das Recht und grundsätzliche Prinzipien der Demokratie. Wenn die Rechte eines Anwalts verletzt würden, habe er keine andere Wahl, als vor dem zuständigen Gericht zu klagen, schrieb der ehemalige ungarische Justizminister weiter. Bevor die neue Kommission ihr Amt antreten kann, müssen sich alle 26 Kandidaten für die Kommission jeweils dreistündigen Anhörungen in den zuständigen Parlamentsausschüssen stellen. Bis zum 8. Oktober sind fast täglich mehrere Anhörungen vorgesehen. Auch im Verlauf dieser Prüfung können noch Kandidaten ausgetauscht werden. Sollte es aus Bukarest bald eine brauchbare Ersatznominierung geben, stehen die Chancen allerdings gut, dass der Terminplan für die neue EU-Kommission nicht allzu sehr durcheinander gerät. Nach bisheriger Planung sollten die Befragungen der künftigen Kommissare kommenden Dienstag abgeschlossen sein. Die entscheidende Vertrauensabstimmung im EU-Parlament ist für 23. Oktober vorgesehen, der Amtsantritt für ""Team Von der Leyen"" am 1. November. Mit Informationen von Holger Romann, ARD-Studio Brüssel "
30.09.2019 18:36 Uhr,Sammelklage gegen VW,Zweifel bei einer zentralen Frage,"Mit einer Musterklage versuchen Hunderttausende Dieselfahrer, von VW eine Entschädigung zu bekommen. Das Gerichtsverfahren hat begonnen - und zeigt, wie schwierig die Urteilsfindung wird. Ob es am stürmischen Wetter liegt? Die 300 Plätze in der Stadthalle Braunschweig sind jedenfalls höchstens zur Hälfte gefüllt. Kamerateams wuseln vor der Richterbank und vor den Plätzen der Anwälte beider Seiten. Einige betroffene Dieselkäufer sind da, außerdem zahlreiche Journalisten. Mehr als 400.000 Autofahrer haben sich der Musterfeststellungsklage angeschlossen. Der Bundesverband der Verbraucherzentrale übernimmt dabei quasi stellvertretend die Rolle des Klägers. Das Musterverfahren soll grundlegende Punkte klären. In einem zweiten Schritt müsste dann jeder Betroffene noch eine konkrete Summe einklagen. Um genau 10.06 Uhr kommt der Senat mit zwei Richtern und einer Richterin in den Saal. Besonders viel Vorgeplänkel gibt es nicht. ""Wir wollen mitteilen, was unsere vorläufigen Gedanken sind"", beginnt der Vorsitzende Richter Michael Neef. Gemeint sind Gedanken zu den rechtlichen Knackpunkten der Klage. Denn die Musterfeststellungsklage gibt nur den Rahmen für das Verfahren vor. Die inhaltlichen Fragen sind in (fast) jedem Dieselverfahren gleich. Vertragliche Ansprüche sieht Neef nicht, denn die Kläger haben ihre Autos ja meistens nicht direkt bei VW gekauft, sondern beim Händler. Aber im Bürgerlichen Gesetzbuch (BGB) steht ja noch eine Menge mehr. Hat VW die Autokäufer - wie es in §826 BGB steht - sittenwidrig vorsätzlich geschädigt und muss daher grundsätzlich zahlen? Viele Oberlandesgerichte aus ganz Deutschland haben dazu gesagt: Ja, das muss VW. Diese Urteile zitiert Neef. Ins Protokoll nimmt er auf, solche Ansprüche werden ""sehr ernsthaft in Betracht zu ziehen sein"". Ein gutes Zeichen für die Verbraucher? Da ist Vorsicht angebracht. Denn der Vorsitzende Richter sagt auch, dass es eine Menge Gegenargumente gebe. Vor allem hat er Zweifel bei einer zentralen Frage: Wenn die Kunden Schadensersatz bekommen sollen, wo genau liegt eigentlich ihr Schaden? Wie und ab wann wird der berechnet? Immerhin würden die Autos weiter genutzt - und könne da nicht auch das Softwareupdate eine Rolle spielen, das bei fast allen Autos aufgespielt wurde? Andere Gerichte hatten bei diesem Punkt keine Probleme. Aber so offensichtlich sei das eben nicht, sagt Neef. Und noch einen umstrittenen Punkt gibt es, der sich direkt im Portemonnaie der Betroffenen auswirken kann. Falls den Kunden am Ende doch Schadensersatz zustehen sollte, dann müsste man ihnen wohl etwas davon abziehen, so die vorläufige Einschätzung des Gerichts. Denn die Kunden hätten das Auto ja die ganze Zeit genutzt. Das bedeutet aber auch: Je länger sich ein Gerichtsverfahren hinzieht, desto länger nutzt man sein Auto und desto geringer kann die Summe am Ende werden. Wie alle anderen strittigen Punkte wird diese Frage über kurz oder lang nicht nur die Braunschweiger Richter, sondern auch den Bundesgerichtshof und den Europäischen Gerichtshof für eine abschließende Klärung beschäftigen. Könnte man das nicht abkürzen, zum Beispiel mit einem Vergleich? Das bringt der Vorsitzende von sich aus ins Spiel. Richter sollen in jedem Stadium des Verfahrens auf einen Vergleich hinwirken. VW bleibt dabei, das sei derzeit ""kaum vorstellbar"", weil es so viele unterschiedliche Fallkonstellationen gebe. Man einigt sich im Gerichtssaal darauf, möglichst schnell die genaue Zahl der eingetragenen Kläger beim Bundesamt für Justiz abzufragen, damit die wirtschaftliche Dimension eines Vergleichs zumindest ansatzweise absehbar wäre. Stand jetzt scheinen die Chancen eher schlecht zu stehen, aber das Thema kommt auf Wiedervorlage. Am 18. November ist der zweite Verhandlungstag geplant. "
30.09.2019 13:00 Uhr,Anhörung im EU-Parlament,Kommissare auf dem Grill,"Die künftigen EU-Kommissare stellen sich ab heute dem Parlament. Die Rumänin Plumb und der Ungar Trocsanyi wurden gar nicht erst zu den Anhörungen zugelassen. Schon früher ließen die Abgeordneten Bewerber durchfallen. Der Ton kann ganz schön ruppig werden, wenn es bei den Anhörungen der künftigen EU-Kommissare zur Sache geht. Ähnlichkeiten mit öffentlichen Hearings in Amerika, etwa vor dem US-Senat, sind kein Zufall. Um das rund dreistündige Kreuzverhör durch die EU-Abgeordneten heil zu überstehen, genügt es nicht, freundlich zu lächeln und mit ausreichend Fachwissen zu glänzen. Die angehenden Kommissionsmitglieder müssen auch zeigen, dass sie persönlich und politisch integer sind und für die europäische Sache brennen. Ganz unabhängig von Herkunft, Geschlecht oder Parteibuch, wie der Fraktionschef der Christdemokraten, Manfred Weber, betont. ""Deswegen kann ich die Kommissare nur bitten, ihre Hausaufgaben zu machen, zu lernen und sich fitzumachen für die Anhörungen. Wir werden sie grillen."" Dass die flapsige Bezeichnung ""grillen"" keine leere Floskel ist, beweist der Blick ins Archiv: Regelmäßig kam es bei früheren Anhörungen vor, dass ein Bewerber den Abgeordneten aus dem einen oder anderen Grund missfiel und noch auf der Zielgeraden strauchelte. So wie vor fünf Jahren Alenka Bratusek, die ehemalige Ministerpräsidentin von Slowenien. Bei ihr kam heraus, dass sie sich, kurz vor ihrem Abschied aus der Regierung, schnell noch selbst für die neue Kommission von Jean-Claude Juncker empfohlen hatte. An ein prominenteres Opfer aus der Ära Barroso erinnert sich Jaume Duch, Sprecher des Europaparlaments. ""Den Beweis, dass das keine banale Pflichtübung ist, finden wir in der Geschichte der Anhörungen"", sagt er. ""Ich glaube, jeder erinnert sich noch an die Krise rund um die Hearings von 2004, als das Parlament entschied, die Kandidatur des italienischen Bewerbers Buttiglione zurückzuweisen."" Gemeint ist Rocco Buttiglione, ein italienischer Christdemokrat mit besten Verbindungen zum Vatikan, dessen Geschichte bei EU-Kennern bis heute für ein anzügliches Grinsen sorgt. Unter dem damaligen Regierungschef Silvio Berlusconi war der distinguierte Jura-Professor mit der Nickelbrille Europa- und Kulturminister gewesen. Als Justizkommissar in spe rutschten ihm dann aber ein paar abfällige Bemerkungen über Homosexuelle und Frauen heraus, die seine Brüssel-Karriere beendeten. Sexismus, gepaart mit Homophobie - in Buttigliones Heimat seinerzeit noch ein Kavaliersdelikt, in Brüssel ein No-Go. Italien musste seinen Personalvorschlag zurückziehen und entsandte den seriöseren Franco Frattini. Das EU-Parlament hatte gedroht, Barrosos gesamter Mannschaft beim entscheidenden Vertrauensvotum die Gefolgschaft zu verweigern. Etwas weniger Wirbel verursachten zwei andere Fälle: Die Lettin Ingrida Udre etwa wurde 2004 abgelehnt, weil sie sich zu euroskeptisch geäußert hatte. Der Ungar Laszlo Kovacs durfte das ihm zugedachte Portfolio Energie nicht übernehmen, weil er von der Materie offensichtlich zu wenig verstand. 2009 folgte schließlich die Causa Rumjana Schelewa: Die Bulgarin sollte in der Kommission für internationale Hilfsprojekte und Krisenmanagement zuständig sein, galt jedoch von Anfang an als Fehlbesetzung, zum einen wegen mangelnder Fachkompetenz, zum anderen wegen eines privaten Interessenskonflikts. Schelewa hatte versucht, dubiose Finanzgeschäfte ihres Ehemanns zu verheimlichen. Das Parlament war ""not amused"" und senkte den Daumen - Wiederholung 2019 nicht ausgeschlossen, warnt der Grüne Daniel Freund. Er wünscht sich, dass die von von der Leyen versprochene unabhängige Ethikbehörde, die sowohl die Abgeordneten im europäischen Parlament als auch die Kommissare überwachen soll, möglichst schnell auf den Weg gebracht wird. ""Sowohl in der Kommission als auch im Parlament sehen wir ja, dass immer wieder Fälle auftreten, und die sollten möglichst unpolitisch abgearbeitet werden."" Die Geschichte der Anhörungen zeigt: Ein bis zwei Wackelkandidaten erwischt es fast jedes Mal. Schon allein deshalb, weil das EU-Parlament gerne die Muskeln spielen lässt. Auch im ""Team von der Leyen"" müssen sich einige Kandidaten auf eine scharfe Befragung einstellen. Allerdings, auch das lehrt die Erfahrung: Bewerber aus größeren Mitgliedsstaaten kommen meist mit einem blauen Auge davon. Und völlig unparteiisch sind die selbsternannten ""Grillmeister"" in den Ausschüssen nicht. "
30.09.2019 11:09 Uhr,Flüchtlingslager Moria,"Feuer, Tote und Gewalt auf Lesbos","Das Flüchtlingslager Moria auf Lesbos ist völlig überfüllt - die Zustände sind für viele untragbar. Nach dem Tod einer Frau und ihres Kindes bei einem Feuer droht die Lage zu eskalieren. Bilder und Informationen aus dem Lager Moria vom Sonntagabend gibt es viele, doch die wenigsten Informationen sind inzwischen offiziell bestätigt worden. Die Verantwortlichen verweisen auf die noch laufenden Ermittlungen. Im Internet sind kurze Videos veröffentlicht. Es sind Aufnahmen von dichten Qualmwolken über dem Registrierungszentrum auf der griechischen Insel Lesbos, Bilder von ausgebrannten Wohncontainern. Insgesamt acht Wohncontainer brannten aus. Der Bürgermeister der Insel Lesbos, Stratos Kytelis hat bestätigt, dass zwei Menschen - eine Mutter mit ihrem Kind - nicht mehr aus den Flammen gerettet werden konnten. ""Es kann nicht sein, dass Tausende Migranten bei uns im überfüllten Flüchtlingslager weiter leiden müssen. Sie müssen so schnell wie möglich aufs Festland gebracht werden - so kann es nicht weitergehen"", fügte er hinzu. Nach Augenzeugenberichten haben sich während des Feuers junge Migranten als Gruppe zusammengeschlossen und sind gewaltsam - unter anderem mit Steinen auch gegen Feuerwehrautos vorgegangen, die die Feuer löschen wollten. Die Löscharbeiten wurden den Berichten zufolge von gewaltsam protestierenden jungen Migranten immer wieder behindert. Ein Inselbewohner, der nur wenige Kilometer vom Flüchtlingslager Moria entfernt lebt, hat Verständnis für den Protest einiger Migranten gestern Abend. Nicht aber dafür, dass eine Art Mob - bestehend aus jungen Migranten - gewalttägig sogar gegen die Feuerwehr wurde, als diese zu löschen begann. ""Die neue Regierung muss sich jetzt endlich richtig schnell bewegen, sie muss dafür sorgen, dass die Leute richtig schlafen können, essen und sich waschen können"", sagte der Bewohner. Schließlich seien von der Europäischen Union immer wieder auch Geld nach Griechenland überwiesen worden, um die Infrastruktur in den Camps zu verbessern. Die seit Juli regierende konservative Regierung unter Ministerpräsident Kyriakos Mitsotakis hat schnelle Besserung und die Umsetzung von ""ganz neuen Plänen"" versprochen. Davon ist auf den fünf griechischen Inseln mit Registrierungszentren nur wenig bis gar nichts zu spüren. Für heute hat die Regierung zu einer Krisensitzung beim Minsterpräsidenten eingeladen. Beobachter wie Manos Stefanakis, Zeitungsherausgeber auf der Insel Samos, kritisieren, dass die Regierung nicht schon längst mit guten Maßnahmen reagiert hat: Relativ schnell hat die Regierung in Athen am Abend entschieden, mehr Polizei nach Lesbos zu schicken. 100 Bereitsschaftspolizisten sind zum Teil nach einem Fussballspiel in der griechischen Hauptstadt abgezogen worden. Sie haben die Lage im Camp trotz der weiterhin aggressiven Stimmung vor allem unter männlichen jungen Migranten im Moment nach eigenen Angaben im Griff. Für viele Familien und auch alleinreisende Frauen sind die Zustände im völlig überfüllten Lager Moria jedoch untragbar geworden. Es gibt kaum Möglichkeiten, sich unbeobachtet zu waschen oder auf die Toilette zu gehen. Auch unter den Migranten ist die Stimmung nach Schilderungen einiger Nicht-Regierungsorganisationen, die im Lager arbeiten dürfen, äußerst gereizt und aggressiv. Die vergangene Nacht haben deshalb Hunderte Menschen außerhalb des Registrierungszentrums im Freien verbracht. Das geht im Moment noch bei Temperaturen von nur knapp unter 20 Grad in der Nacht. Wenn im Oktober die ersten Herbststürme mit starkem Regen über die Ägäis ziehen, so warnen Inselbewohner und Bürgermeister, könnte die Lage rund um das Flüchtlingslager vollständig aus dem Ruder laufen. "
27.09.2019 22:31 Uhr,Deutsche Einheit,Der Osten hinkt weiter hinterher,"30 Jahre nach dem Mauerfall ist die ostdeutsche Wirtschaft zu kleinteilig, es fehlt an Firmenzentralen. Das geht aus dem Jahresbericht der Deutschen Einheit hervor. Es gebe aber auch positive Entwicklungen. Wie der Ostbeauftragte der Bundesregierung in seinem Jahresbericht zum Stand der Deutschen Einheit schreibt, hinkt die ostdeutsche der westdeutschen Wirtschaft auch 30 Jahre nach dem Mauerfall hinterher. Dem Bericht des Thüringer CDU-Politikers Christian Hirte zufolge geht die unterschiedliche Leistungskraft vor allem auf strukturelle Faktoren zurück. Dazu zähle die Kleinteiligkeit der ostdeutschen Wirtschaft, ein Mangel an Konzernzentralen und die ländlich geprägte Siedlungsstruktur. Den Bericht stellt Hirte heute in Berlin vor. Konkret bemängelt der Ostbeauftragte, dass kein einziges Ost-Unternehmen im Börsenleitindex DAX-30 notiert sei. Auch habe nahezu kein Großunternehmen seine Zentrale in Ostdeutschland. Viele Unternehmen dort gehörten zu westdeutschen oder ausländischen Konzernen. Im Mittelstand wüchsen Unternehmen überdurchschnittlich stark. ""Genau das wollen wir künftig stärker fördern."" Es seien mehr Investitionen in Innovationen nötig. Die Firmen müssten sich internationaler aufstellen. Zudem müssten strukturschwache Regionen stärker gefördert werden, schreibt Hirte in dem Bericht. Es sollten nicht nur im Zuge des Kohleausstiegs neue Verwaltungen und Behörden vor allem im Osten angesiedelt werden. ""Der Staat darf sich nicht großflächig aus ländlichen Regionen zurückziehen."" Dass der Osten heute wirtschaftlich schlechter aufgestellt ist als der Westen, liege nicht an der Situation ab 1990 - sondern daran, dass die DDR wirtschaftlich marode war. ""Ich halte das für einen hanebüchenen Unsinn, dass der Eindruck erweckt wird, der Westen habe ab 1990 quasi den Osten überrannt und ausgebeutet"", sagte Hirte. Natürlich seien im Zuge der Privatisierung auch Unternehmen im Osten unter die Räder gekommen. Ich will gar nicht behaupten, dass wir alles richtig gemacht hätten."" Hirte sagte weiter: ""Aber dass die Treuhand schuld ist an den Problemen, die wir heute haben, das halte ich für völlig falsch."" Wenn Linke und AfD meinen, das sei alles vom bösen Westen verursacht worden, sei das Geschichtsklitterung. Die Linke-Fraktion will einen parlamentarischen Untersuchungsausschuss zur Treuhand, die eine zentrale Rolle bei der Umwandlung der DDR-Planwirtschaft in eine Marktwirtschaft hatte. Linke-Fraktionschef Dietmar Bartsch hatte gesagt, der Schaden, den die Treuhand angerichtet habe, sei bis heute eine wesentlich Ursache für den ökonomischen Rückstand des Ostens und für politischen Frust. Die Linke braucht für einen Untersuchungsausschuss die Zustimmung anderer Fraktionen. Unterstützung kam bisher nur von der AfD. Umweltgefahren seien ""in erstaunlich kurzer Zeit"" beseitigt, besonders umweltbelastende Produktionsanlagen stillgelegt worden. Umwelt- und Energietechnologien seien in Ostdeutschland heute überdurchschnittlich stark vertreten und in zunehmendem Maße bedeutsam für die wirtschaftliche Entwicklung, heißt es in dem Jahresbericht weiter. Zugleich aber seien viele Menschen im Osten ""veränderungsmüde"" und fühlten sich nach wie vor als Bürger zweiter Klasse. Es gebe nach wie vor viele Bürger, die meinten, dass der Osten kollektiv und individuell benachteiligt werde, sagte Hirte. ""Das resultiert daraus, dass die Ostdeutschen das Pech hatten, 40 Jahre auf der falschen Seite der Geschichte gestanden zu haben."" Es habe aber einen massiven Aufholprozess gerade in den vergangenen Jahren gegeben. Löhne und Renten seien überproportional gestiegen. Die verfügbaren Einkommen seien auf einem vergleichbaren Niveau mit dem Westen, weil die Lebenshaltungskosten niedriger seien. "
27.09.2019 21:23 Uhr,Gespräche im Weißen Haus,Der Präsident am Telefon - wer hört mit?,"Wer hört eigentlich mit, wenn der US-Präsident mit anderen Staatsoberhäuptern telefoniert? Und warum gibt es keine Aufnahmen von den Gesprächen? Antworten auf die wichtigsten Fragen. Wenn der US-Präsident mit dem Regierungschef eines anderen Landes telefoniert, dann hören in der Regel einige seiner engsten Mitarbeiter und natürlich die Übersetzer mit - manchmal auch der Vizepräsident oder bestimmte Minister. Die sitzen dann alle im Situation Room, einem besonders abhörsicheren Konferenzraum im West Wing des Weißen Hauses. Das Telefonat des Präsidenten erfolgt ebenfalls über eine spezielle abhörsichere Leitung und es wird nicht mitgeschnitten. Stattdessen gibt es drei besonders vertrauenswürdige Mitarbeiter, die eifrig mitschreiben und versuchen, so viele Sätze wie möglich wörtlich zu notieren. Nach dem Telefonat gleichen sie ihre Notizen ab und verfassen ein Transkript. Das ist dann zwar keine wortwörtliche Abschrift, aber eine möglichst genaue Inhaltswiedergabe des Telefonats. Das Transkript des Präsidenten-Telefonats geht an das Büro des Nationalen Sicherheitsberaters. Dort wird entschieden, ob das endgültige Memo viel Wortlaut behalten soll oder ob es eher eine abstrakte Inhaltsangabe wird. Das fertige Memo wird dann an Regierungsverantwortliche wie Minister, Botschafter oder Geheimdienstmitarbeiter verteilt, die über den Inhalt des Telefonats Bescheid wissen sollten. Wenn es um ein Gespräch mit einem ausländischen Regierungschef geht, wird meist auch der Geheimdienst CIA informiert. Alles in allem erfahren also regelmäßig zwischen 20 und 30 Regierungsmitarbeiter, was der Präsident mit anderen Regierungschefs bespricht. Theoretisch könnte er das natürlich. Aber das wäre extrem ungewöhnlich. Als bekannt wurde, dass Donald Trump bei einem Treffen mit Wladimir Putin in Helsinki darauf bestand, mit Putin und der Übersetzerin allein zu sein, sorgte dies für erhebliche Aufregung in Washington. Weil niemand, nicht einmal seine engsten Mitarbeiter, wussten, was Trump mit Putin besprochen hatte. Und Trump selbst wollte anschließend keine genaue Auskunft darüber geben. Einen Audiomitschnitt der Telefonate des Präsidenten gibt es nicht. Die Gefahr wäre viel zu groß, dass solche Mitschnitte dann doch Beine bekommen und in den Medien landen. Anfang der 1970er-Jahre ließ der damalige US-Präsident Richard Nixon all seine Telefonate und Gespräche mitschneiden. Das wurde ihm dann in der Watergate-Affaire zum Verhängnis. Spätestens seitdem gilt: keine Audio-Mitschnitte im West Wing. "
