date,topline,headline,content09.09.2019 05:08 Uhr,Studie zu Grundschulen,Lehrermangel offenbar noch gravierender,"Der Lehrermangel an Grundschulen wird laut Bertelsmann-Studie weiter zunehmen - auf 26.300 Frauen und Männer bis zum Jahr 2025. Die Zahl liegt deutlich über der Schätzung der Kultusminister. Der Lehrermangel an den Grundschulen in Deutschland wird in den nächsten Jahren deutlich größer als erwartet. Das zeigt eine Studie der Bertelsmann-Stiftung, die heute veröffentlicht wird. Demnach liegt die Zahl der Lehrer, die bis 2025 fehlen, mit mindestens 26.300 deutlich höher als bisher prognostiziert. Die Kultusminister waren im vergangenen Oktober 2018 noch von 15.300 fehlenden Grundschullehrern ausgegangen. ""Schon in den nächsten Jahren wird der Lehrermangel an den Grundschulen in einigen Bundesländern dramatisch ansteigen"", sagt Bildungsforscher Dirk Zorn. Gemeinsam mit dem Erziehungswissenschaftler Klaus Klemm hat er für die Bertelsmann-Stiftung die neue Studie erstellt. Wie kann es sein, dass die Schätzung der Kultusministerkonferenz (KMK) so viel niedriger ausfällt? ""Die Diskrepanz von 11.000 weiteren benötigten Lehrern bis 2025 geht auf einen doppelt so starken Anstieg der Schülerzahlen zurück"", erklärt Zorn. Die KMK geht von deutlich weniger Schülern aus als die beiden Forscher, die sich für ihre Analyse auf die neueste Bevölkerungsschätzung des Statistischen Bundesamtes vom Juni dieses Jahres stützen. ""Knapp 170.000 Schüler mehr als von der Kultusministerkonferenz bislang berechnet werden in der Grundschule im Jahr 2025 zu erwarten sein"", so die Wissenschaftler. Das Statistische Bundesamt hat mehrere Varianten dieser Prognose ausgegeben, die sich auf unterschiedliche Annahmen über die Entwicklung der Geburten, Bevölkerungswanderung und Lebenserwartung stützen. Klemm und Zorn haben die ""Variante 2"" des Statistischen Bundesamts zugrunde gelegt, die als moderat gilt und eine konstante Geburtenrate voraussetzt. Für ihre Berechnung des Lehrerbedarfs unterstellen Klemm und Zorn zudem, dass sich das Zahlenverhältnis von Schülern zu Lehrern nicht verändert. Im Ergebnis liegen die Zahlen weit über den von der KMK verwendeten Zahlen. Jörg Dräger, Vorstand der Bertelsmann-Stiftung, hält es für eine ""Herkulesaufgabe"", den Lehrermangel zu bewältigen. ""Die Zahl der Schülerinnen und Schüler wächst dynamischer als angenommen"", sagt er. Gleichzeitig dauere es noch etliche Jahre, bis die zusätzlich eingerichteten Studienplätze für das Lehramt an Grundschulen auch mehr Absolventen hervorbringen. ""Wir brauchen daher schnelle Lösungen, um gute Bildung für alle gewährleisten zu können."" Der Präsident der KMK, Alexander Lorz (CDU), spricht ebenso von einer Herausforderung in einem bereits sehr angespannten Lehrermarkt. Dräger fordert zudem: ""Zukünftig sollten die Bedarfsprognosen jährlich aktualisiert werden, um schneller auf die demographische Entwicklung reagieren zu können."" Nur so ließen sich Überraschungen vermeiden und mehr Zeit für politische Reaktionen gewinnen. Zorn nennt das bisherige Berechnungssystem der KMK träge. Er fordert eine Vereinheitlichung der Prognose-Methodik. ""Die eigentliche Rechen- und Prognose-Arbeit findet in den 16 Bundesländern statt"", sagt er. Und diese Arbeit sei sehr unterschiedlich. Nur wenige Bundesländer, darunter Bayern, hätten schon vor längerer Zeit entschieden, ihre Prognosen jährlich zu aktualisieren. KMK-Präsident Lorz verweist darauf, dass die KMK im letzten Jahr beschlossen habe, die Prognosen nun ebenfalls jährlich zu aktualisieren. Die Bertelsmann-Stiftung sei ihnen mit den aktuellen Zahlen zuvorgekommen. Die KMK-Statistiker gingen von einer ähnlichen Größenordnung aus. Um den Schulbetrieb aufrechtzuerhalten, müssen viele Bundesländer Akademiker als Lehrer einstellen, die gar kein Lehramt studiert haben. Diese Quer- und Seiteneinsteiger unterrichten oft zum ersten Mal in ihrem Leben. Entsprechend gelte es, so Dräger, diese Lehrkräfte umfassend berufsbegleitend zu qualifizieren und mit Mentorenprogrammen erfolgreich zu integrieren. In Berlin wurden zum laufenden Schuljahr an den Grundschulen knapp 70 Prozent aller Neueinstellungen mit Quer- und Seiteneinsteigern besetzt. Bundesweit sei der Anteil von Quer- und Seiteneinsteiger an allen Neueinstellungen von unter drei Prozent auf über 13 Prozent angestiegen. ""Und diese Entwicklung dürfte sich in den nächsten Jahren weiter fortsetzen"", sagt Zorn. Einig sind sich die Experten, dass Quer- und Seiteneinsteiger benötigt werden, um den Mangel in den kommenden Jahren abzufangen. Allerdings müsse das Personal qualifiziert werden, fordert auch KMK-Präsident Lorz: ""Wenn man schon darauf zurückgreifen muss, dann ist es wichtig, dass wir ihnen pädagogische Qualifizierung mitgeben."" "
09.09.2019 03:47 Uhr,Taifun in Japan,"""Faxai"" fegt über Tokio hinweg","Heftige Sturmböen und Regenfälle im Großraum Tokio: Taifun ""Faxai"" hat in der japanischen Metropole für Schäden und Verkehrsbeeinträchtigungen gesorgt. Mindestens zwei Menschen starb, mehrere wurden verletzt. Taifun ""Faxai"" hat im Großraum Tokio für Schäden gesorgt. Mindestens zwei Menschen kamen ums Leben, teilte Regierungssprecher Yoshihide Suga mit. Laut örtlichen Medien gab es zudem mehr als 30 Verletzte. Auf Fernsehbildern waren umherfliegende Gegenstände und beschädigte Autos zu sehen. Der morgendliche Verkehr in der japanischen Hauptstadt war beeinträchtigt, nachdem ""Faxai"" die Metropole in der Nacht durchgerüttelt hatte. Mehrere Bahnverbindungen nach Tokio wurden gesperrt, auf einigen Linien fuhren die Züge mit reduzierter Geschwindigkeit. Auch mehr als hundert für Montag geplante Flüge wurden abgesagt. Japan wird jedes Jahr von mehreren Taifunen getroffen. Laut der Nachrichtenagentur Reuters ist es jedoch ungewöhnlich, dass die Unwetter die Hauptstadt treffen. Der japanische Sender NHK berichtet, dass ""Faxai"" der stärkste Sturm in Tokio seit mehreren Jahren war. In fast einer Million Haushalten in Tokio und der Nachbarprovinz Shizuoka fiel zeitweise der Strom aus. Der Taifun bewegte sich laut der nationalen Wetterbehörde mit einer Geschwindigkeit von 25 Kilometern in der Stunde in nordöstlicher Richtung weiter. Nahe seinem Zentrum wurden Windgeschwindigkeiten von 216 Kilometern pro Stunde gemessen. Der Wetterdienst warnte vor starken Windböen, Überschwemmungen und Erdrutschen. In den Präfekturen Chiba und Kanagawa sollten nach einer Evakuierungsanordnung 5000 Einwohner ihre Häuser verlassen, wie der Sender NHK berichtete. Die Behörden empfahlen außerdem 390.000 weiteren Menschen in der Region, sich in Sicherheit zu bringen. In der südwestlich von Tokio gelegenen Präfektur Shizuoka wurden rund zehn Häuser beschädigt und mehrere Autos durch die Luft geschleudert, wie örtliche Medien berichteten. "
09.09.2019 03:04 Uhr,Brexit-Streit,Johnsons zweiter Neuwahl-Anlauf,"Dem britischen Premier Johnson droht eine weitere Niederlage: Das Unterhaus stimmt heute über seine Neuwahlpläne ab. Zuvor will er in Irland über ""Hightech"" statt ""Backstop"" beraten. Zum Auftakt dieses bedeutenden Tages ist Boris Johnson zunächst einmal in Dublin, wo er mit seinem irischen Amtskollegen Leo Varadkar zusammentrifft. Es sind die ersten direkten, offiziellen Gespräche der beiden Regierungschefs auf bilateraler Ebene - Gespräche, die Johnson nun aus einer Position der Schwäche führen muss. Varadkar hat die Erwartungen vor dem Treffen bereits stark gedämpft. Er erwartet keinen Durchbruch. Sollte es noch eine Einigung geben, dann werde das auf dem EU-Gipfel im Oktober sein. Der irische Premier drängt Johnson dazu, die ""Hightech""-Lösung voranzutreiben, die angeblich eine Alternative zum ""Backstop"" sein könnte. Großbritanniens Außenminister Dominic Raab hält daran fest, dass es diese Alternative gibt. Dann, so Raab, könnten Hightech-gestützte Warenkontrollen jenseits der Grenze stattfinden, kleinere Unternehmen könnten von Kontrollen ausgenommen werden. Gespräche darüber fänden statt. Premier Varadkar spricht auch von Kontrollen in Häfen und an Flughäfen, aber Kontrollen in Grenznähe, glaubt er, wird es trotzdem geben. Der irischen Wirtschaft hat erst vor wenigen Tagen noch einmal in aller Deutlichkeit gesagt, worauf sie sich einstellen muss: Auch wenn es bei dem Treffen in Dublin keinen Durchbruch geben wird, dürfte die erste Tageshälfte für Johnson die bessere sein. Denn zurück in London muss er mit einer weiteren Niederlage rechnen. Die Regierung will zum zweiten Mal einen Antrag auf Neuwahlen ins Unterhaus einbringen, dürfte dafür aber keine Mehrheit bekommen. Die Oppositionsparteien haben sich schon abgesprochen, diesen Antrag nicht mitzutragen. Den Liberaldemokraten wäre ein zweites Referendum ohnehin wichtiger als eine Neuwahl, wie der stellvertretende Parteichef Ed Davey erklärt: Ob die Abstimmung über Neuwahlen heute der letzte Akt im Unterhaus sein wird, bevor für die Abgeordneten die Zwangspause beginnt, ist nach wie vor unklar. Sie könnte heute beginnen, muss es aber nicht. Wie sich die nächsten Tage gestalten, ist noch weitgehend offen. "
08.09.2019 15:21 Uhr,Brexit-Machtkampf,Welche Optionen Johnson noch hat,"Der britische Premierminister Johnson steckt in der Klemme - oder? Kann der kalkulierende Polit-Zocker den Brexit-Machtkampf doch noch gewinnen? Ein paar Optionen hat er noch - ein Überblick. Immer wieder wird spekuliert, ob Premierminister Boris Johnson das vom Parlament beschlossene Gesetz gegen den No-Deal-Brexit einfach solange ignorieren könnte, bis Großbritannien am 31. Oktober automatisch und ohne Vertrag die EU verlässt. Hellhörig wurden Johnsons Gegner, als er kürzlich vor Reportern sagte, das Gesetz sehe nur ""theoretisch"" eine Brexit-Verschiebung vor. Berichten zufolge bereiten sie sich schon für einen Rechtsstreit vor. ""Er ist genauso an das Rechtsstaatsprinzip gebunden wie jeder andere in diesem Land"", sagte ehemalige Generalstaatsanwalt Dominic Grieve der BBC. ""Wenn er sich nicht daran (an das Gesetz) hält, kann er vor Gericht verklagt werden. Das Gericht würde nötigenfalls eine Verfügung erlassen, die ihn dazu verpflichtet. Hält er sich nicht an die Verfügung, könnte er ins Gefängnis geschickt werden."" Theoretisch könnte Johnson auch versuchen, ein Inkrafttreten des Gesetzes zu verhindern, indem er sich weigert, es Königin Elizabeth II. zur Billigung vorzulegen. Doch auch das dürfte vor Gericht enden. Will Johnson doch noch eine Neuwahl vor dem 31. Oktober erreichen, könnte er zu einem ungewöhnlichen Mittel greifen und einen Misstrauensantrag gegen die eigene Regierung stellen. Eine Mehrheit hat Johnson ohnehin nicht mehr. Die Opposition hätte es sicherlich schwer, diesen Antrag nicht mitzutragen. Das Problem für Johnson ist, dass damit eine 14-Tages-Frist ausgelöst wird, in der die Opposition versuchen könnte, eine Alternativregierung auf die Beine zu stellen. Das dürfte zwar schwierig werden, weil sich die Oppositionsparteien alles andere als einig sind und beispielsweise die Liberaldemokraten bereits abgelehnt haben, für Labour-Chef Jeremy Corbyn als Interimsregierungschef zu stimmen. Doch wenn die Alternative ein möglicher No-Deal-Brexit wäre, könnten sie sich vielleicht doch zusammenraufen. Denkbar wäre auch, dass ein unabhängiger Kandidat die Rolle übernimmt, wie Ken Clarke, der kürzlich von Johnson aus der Tory-Fraktion ausgeschlossene Alterspräsident des Unterhauses. Sollte innerhalb der zwei Wochen keine alternative Regierung gebildet werden, würde es zur Neuwahl kommen. Da aber zwischen Auflösung des Parlaments und dem Urnengang 25 Arbeitstage liegen müssen, wäre der Wahltermin frühestens wenige Tage vor dem geplanten EU-Austritt am 31. Oktober möglich. Alternativ könnte Johnson auch versuchen, das Wahlgesetz zu ändern oder ein maßgeschneidertes Gesetz zu verabschieden, das ihm eine Wahl ermöglicht. Doch dafür braucht er eine Mehrheit in beiden Kammern des Parlaments - die er nicht mehr hat. Um sein Versprechen nicht zu brechen, könnte Johnson auch als Premierminister zurücktreten. Fraglich wäre, wer dann von Königin Elizabeth II. mit der Regierungsbildung beauftragt werden würde. Johnsons Konservative könnten nicht mehr beanspruchen, eine Mehrheit im Unterhaus zu haben. Trotzdem wären sie weiter stärkste Fraktion. Sollte sich die Opposition jedoch mit vereinten Kräften auf Corbyn oder einen anderen Kandidaten einigen, könnte es einen Regierungswechsel geben. Johnson müsste darauf setzen, dass es bald zur Neuwahl kommt. Theoretisch könnte der Interimspremier aber auch erst einmal weiterregieren und beispielsweise einen weicheren Brexit mit enger Anbindung an die EU durchsetzen, bevor er eine Neuwahl in die Wege leitet. Sollte Johnson sich bei einer Wahl später nicht durchsetzen, würde er als britischer Premierminister mit der kürzesten Amtszeit aller Zeiten in die Geschichte eingehen. Johnson könnte versuchen, doch noch eine Einigung mit der EU zu finden. In der Kürze der Zeit wären kaum größere Änderungen möglich. Doch eine Variante lag bereits auf dem Tisch: Die in Großbritannien verhasste Garantieklausel für eine offene Grenze zwischen dem britischen Nordirland und dem EU-Mitglied Irland (Backstop) könnte auf Nordirland beschränkt werden. Statt Kontrollen zwischen den beiden Teilen der irischen Insel würde notfalls an den Häfen zwischen Nordirland und dem Rest des Vereinigten Königreichs kontrolliert. Johnsons Vorgängerin Theresa May hatte diesen Vorschlag Brüssels im vergangenen Jahr noch empört abgelehnt. ""Kein britischer Premierminister könnte dem je zustimmen"", hatte May gesagt. Der Vorschlag untergrabe den britischen Binnenmarkt und bedrohe die verfassungsmäßige Integrität des Vereinigten Königreichs. May hatte neben der Sorge um den Zusammenhalt ihres Landes aber noch einen weiteren wichtigen Grund: Ihre Regierung hing von der Unterstützung der nordirischen Protestantenpartei DUP ab, die ihre Minderheitsregierung stützte. Johnson ist nach dem Rauswurf der Brexit-Rebellen selbst mit den DUP-Abgeordneten weit entfernt von einer Mehrheit. Er könnte darauf hoffen, dass ihm Labour-Abgeordnete aushelfen. Manch ein Beobachter sieht in dem harten Vorgehen Johnsons gegen die proeuropäischen Rebellen auch eine Warnung an die Brexit-Hardliner. Wer sich weigert, für einen Deal zu stimmen, wird aus der Fraktion geworfen und darf bei einer baldigen Neuwahl nicht mehr für die Tories antreten, könnte die Botschaft lauten. Ob das für eine Mehrheit ausreichen würde, ist fraglich. Johnson müsste zudem befürchten, dass die Geschassten zur Brexit-Partei von Nigel Farage überlaufen oder zumindest, dass Farage davon profitieren könnte. Der britische Regierungschef könnte auch versuchen, die EU zu einer Ablehnung seines Antrags auf Brexit-Verschiebung zu bewegen. Die No-Deal-Gegner haben bereits versucht, das in ihrem Gesetz gegen den ungeregelten Brexit weitgehend auszuschließen. Beispielsweise ist dort der genaue Wortlaut des Briefs vorgegeben, den der Premier an EU-Ratspräsidenten Donald Tusk schreiben soll. Die Dauer der Verlängerung ist auf drei Monate festgelegt, doch sollte die EU einen anderen Zeitraum vorschlagen, könnte die Regierung das nur mit Zustimmung des Parlaments ablehnen. Als denkbar gilt auch, dass Johnson versuchen könnte, einen EU-Staat zu einem Veto zu bewegen. Infrage käme beispielsweise Ungarn, dessen Ministerpräsident Viktor Orban Johnson gewogen sein dürfte. Doch ob das gelingen wird, gilt als fraglich. Bislang war es den 27 verbliebenen EU-Staaten gelungen, in Sachen Brexit fast immer mit einer Stimme zu sprechen. (Quelle: dpa) "
08.09.2019 09:51 Uhr,Rücktritt von Ministerin Rudd,Ein weiterer Rückschlag für Johnson,"Die harte Gangart von Premier Johnson hat nun auch Arbeitsministerin Rudd zum Rücktritt getrieben. Sie spricht von ""politischem Vandalismus"". Die Opposition sieht die britische Regierung kurz vor dem Zusammenbruch. Boris Johnson hat in dieser Woche schon zahlreiche Rückschläge einstecken müssen. Aber es kommen immer noch neue hinzu. Jetzt verliert er seine Arbeitsministerin Amber Rudd, eine angesehene Politikerin und eine, die sich auch über den Wechsel von Theresa May zu Boris Johnson im Kabinett gehalten hatte. Nun aber gibt sie ihr Ministeramt auf. Zur Begründung sagte Rudd in der BBC: ""Ich wusste und habe akzeptiert, dass der Premier die Möglichkeit haben soll, den No-Deal auf dem Tisch zu lassen. Was ich erwartet hatte, war, dass die Regierung eine große Anstrengung unternehmen würde, einen Deal zu bekommen. Im Moment wird viel Vorbereitung für den No-Deal betrieben und nicht genügend für einen Deal getan."" Rudd selbst hatte beim Referendum 2016 für den Verbleib in der EU gestimmt und lehnt einen No-Deal-Brexit ab. Der Kurs von Boris Johnson beim Brexit ist aber nur ein Grund, weshalb sie nun geht. ""Obendrein habe ich 21 meiner Kollegen, gute starke konservative Abgeordnete mit richtigen, moderaten, fortschrittlichen Werten, ausgeschlossen gesehen aus der Partei."" Mit dem Rauswurf hat die Parteiführung darauf reagiert, dass 21 Tory-Rebellen im Unterhaus mit der Opposition gestimmt hatten um das Anti-No-Deal-Gesetz auf den Weg zu bringen und durchzusetzen. Zu denen, die danach geschasst wurden, gehören unter anderem Ken Clarke - das dienstälteste Tory-Mitglied im Parlament - und Nicholas Soames, der Enkel von Kriegspremier Winston Churchill. Männer, die jahrzehntelang der Partei angehörten. Dieses harte Vorgehen hat Schockwellen in der konservativen Partei ausgelöst. Rudd nennt es einen Angriff auf Anständigkeit und Demokratie, dem sie nicht einfach zuschauen könne. Mit Rudds Rücktritt wächst der Druck auf Boris Johnson enorm. Erst am Donnerstag hatte der Rücktritt seines Bruders Jo Johnson für Aufsehen gesorgt. Er gehörte der Regierung als Staatssekretär an, und es wurde bei seinem Abgang überaus deutlich, dass er mit dem Kurs seines Bruders und Premiers so unzufrieden ist, dass er nun das Staatsinteresse über die familiäre Loyalität stellt. Die Oppositionsparteien sehen angesichts der aktuellen Entwicklung die Regierung vor dem Zusammenbruch. Gleichzeitig wappnen sich die No-Deal-Gegner für alle Eventualitäten. Denn das Misstrauen dem Premier gegenüber sitzt tief. Der Labour-Abgeordnete Hilary Benn sagte: ""Ich bin sehr betroffen und beunruhigt über die Tatsache, dass der Premier landauf landab erzählt, dass er niemals eine Fristverlängerung beantragen wird. Entweder ist dieses Land ein Rechtsstaat oder nicht."" Johnson sagte zudem, dass die Regierung theoretisch an das No-Deal-Gesetz gebunden sei, das gerade das Parlament passiert hat und am Montag in Kraft treten soll. Was, fragen sich Johnsons Kritiker, soll denn theoretisch bedeuten? Der Premier sei doch an Gesetze gebunden. Bisher ist nicht klar was Johnson mit diesem theoretisch genau zum Ausdruck bringen wollte. Aber die No-Deal-Gegner befürchten, dass Johnson das Gesetz am Ende einfach ignorieren könnte. Sie konsultieren deshalb einmal mehr Juristen, die nun die möglichen Folgen abklären sollen. "
08.09.2019 04:34 Uhr,Die EU und der Iran-Deal,Machtlos in Brüssel,"Verzweifelt kämpft die EU um das Atomabkommen mit dem Iran. Doch gegen den Willen der USA ist das fast unmöglich. Auch der Iran fühlt sich nicht mehr an das Abkommen gebunden. Seit die USA das Atomabkommen mit dem Iran vor mehr als einem Jahr verlassen haben, kämpft die EU verzweifelt um den Erhalt des Deals. Klar ist: Sie kann die Vereinbarung mit Teheran, die sie selbst maßgeblich mit ausgehandelt hat, nur retten, wenn das Mullah-Regime weiterhin wirtschaftliche Vorteile daraus zieht. Doch das erscheint angesichts der wieder in Kraft gesetzten US-Sanktionen so gut wie unmöglich. Konsequenz: Stück für Stück zieht sich auch der Iran aus seinen Verpflichtungen zurück. ""Wir sind entschlossen, alles dazu beizutragen, dieses Abkommen aufrechtzuerhalten"", betonte Bundesaußenminister Heiko Maas schon im Frühjahr 2018. Und an dieser Position hat sich seither nichts geändert, auch wenn sich die Lage inzwischen deutlich zugespitzt hat. Deutschland und die vier übrigen Garantiemächte des 2015 geschlossenen Atomabkommens - Großbritannien, Frankreich, Russland und China - wollen den Iran weiter mit allen Mitteln bei der Stange halten, auch gegen den ""maximalen Druck"" aus Washington. Dahinter steckt die begründete Sorge, ein endgültiges Scheitern der auf Englisch JCPOA genannten Vereinbarung könnte im Nahen Osten ein nukleares Wettrüsten auslösen. Ein Szenario, so EU-Chefdiplomatin Federica Mogherini, das niemand wünschen könne. Das JCPOA sei ein Schlüsselelement der globalen Sicherheitsarchitektur zum Zweck der Nichtverbreitung von Atomwaffen, erinnert sie. Und es sei eine bedeutende Leistung multilateraler Diplomatie, seinerzeit einstimmig unterstützt vom Weltsicherheitsrat durch UN-Resolution 2231. Allen Beteiligten ist freilich bewusst: Gegen den Willen der Vereinigten Staaten grenzt eine Rettung des Iran-Deals an eine ""Mission impossible"". Schließlich hat US-Präsident Donald Trump unmissverständlich klargemacht, dass jeder, der die wieder in Kraft gesetzten Wirtschaftssanktionen unterlaufe, mit ""ernsten Konsequenzen"" rechnen muss. Länder oder Firmen, die weiterhin mit dem Iran Geschäfte machten, würden von den USA ebenfalls mit Strafen belegt. Um sich aus der Zwickmühle zu befreien, hat die EU, genauer gesagt die sogenannten E3-Gruppe, bestehend aus Deutschland, Frankreich und Großbritannien, schon vor Monaten INSTEX gegründet, eine Art halb-staatliche Handelsgesellschaft mit Sitz in Paris, die wie eine Tauschbörse funktioniert. Das Prinzip: Warenlieferungen in den Iran werden nicht in Dollar oder Euro bezahlt, sondern mit dem Gegenwert etwa des exportierten Erdöls verrechnet. Statt in Devisen laufen Transaktionen per Gutschrift ab, abgekoppelt vom globalen Bankensystem und damit unter dem Radar der US-Regierung. ""Das ist eine Voraussetzung dafür, um auf der anderen Seite vom Iran einfordern zu können, dass er eben nicht in die militärische Uran-Anreicherung einsteigt"", sagte Maas. ""Das ist ein Schritt der deutlich macht, dass wir auch innerhalb der Europäischen Union geschlossen und entschlossen unseren Weg gehen."" Was der Minister verschweigt: Der Trick der Europäer, die US-Blockade zu unterlaufen, hat seine Wirkung bis jetzt weitgehend verfehlt. So ist es der im Januar gegründeten Zweckgesellschaft INSTEX nicht gelungen, die Milliardenverluste der iranischen Wirtschaft auch nur annähernd auszugleichen. Nicht zuletzt, weil sich der Handel momentan noch auf humanitäre Güter beschränkt. Auch halten sich Russland und China mit einer Beteiligung zurück. Als Konsequenz hat der Iran damit begonnen, schrittweise gegen zentrale Auflagen des Nuklearabkommens zu verstoßen. So wird der erlaubte Grenzwert für angereichertes Uran inzwischen wieder überschritten. Ebenso die Menge des gelagerten Kernbrennstoffs. Seit diesem Wochenende unterliegt nun auch die iranische Atomforschung keinerlei Kontrollen mehr, was ein EU-Sprecher harsch kritisierte. Die wiederholte Aufforderung, die Maßnahmen noch einmal zu überdenken und zur Vertragstreue zurückzukehren, blieb in Teheran bislang ungehört. Das inzwischen dritte 60-Tage-Ultimatum der iranischen Regierung an die Adresse der EU läuft. Trotzdem gibt man sich in Brüssel und Berlin zuversichtlich, den so wichtigen Deal doch noch retten zu können. Hoffnung schöpfte man zuletzt aus dem Blitzbesuch des iranischen Außenministers beim G7-Gipfel in Biarritz. Konkrete Aussichten auf Entspannung, etwa durch ein Treffen der Präsidenten Trump und Rouhani, gibt es derzeit allerdings nicht. Im Gegenteil: Am Persischen Golf droht der Atomstreit seit Wochen in einen handfesten Konflikt umzuschlagen. Die USA haben ihre Militärpräsenz in der Region verstärkt, der Iran provoziert mit Übergriffen auf westliche Tanker in der Straße von Hormus. Mit vagen Versprechen und frommen Appellen scheint eine weitere Eskalation kaum aufzuhalten. "
