date,topline,headline,content19.09.2019 08:57 Uhr,Lithiumvorkommen in Portugal,"Der Aufstand gegen das ""Weiße Gold""","Die Aussichten für die strukturschwache Region könnten blendender nicht sein: Durch den Abbau von Lithium würden im Norden Portugals zahlreiche Arbeitsplätze entstehen. Nur - die Anwohner wehren sich. Es ist noch alles völlig offen: Keiner weiß, ob und wenn ja, wann in der Gegend Lithium abgebaut wird. Aber Aida Fernandes hat schon eine klare Meinung dazu: ""Auf immer und ewig: Nein. Unsere Antwort ist Nein, das ist der Wille der Bevölkerung. Und wir werden alles tun, unseren und den Willen der Betroffenen durchzusetzen."" So klingt eine Kampfansage. Fernandes gehört zu einer Bürgerinitiative, die sich in Covas do Barroso gegründet hat, einem kleinen Dorf im Norden Portugals, nahe der spanischen Grenze. Hier sollen die Abbaugebiete entstehen: Eine Fläche von 700 Hektar soll dann von bis zu 600 Quadratmeter großen Löchern durchpflügt sein, die 150 Meter tief in die Erde reichen. Für Fernando Queiroga eine schlimme Vorstellung. Er ist Landrat der Region: ""Der Landkreis Boticas ist aufgrund der gegenwärtigen Erkenntnisse absolut gegen den Lithiumabbau. Vor allem wegen der Auswirkungen auf die Umwelt."" Die Ablehnung des Landrats ist erstaunlich. Schließlich ist diese Region besonders strukturschwach. Viele Menschen haben die Gegend verlassen, um anderswo Arbeit zu finden. Der Lithiumabbau könnte für Steuereinnahmen und Arbeitsplätze sorgen, die hier so dringend gebraucht werden. Aber die Sorgen um die Umwelt überwiegen - nicht ohne Grund. Tatsächlich muss für ein Kilo Lithium etwa eine Tonne Granit zerkleinert und ausgewaschen werden. Das geht nur mit teils aggressiven Chemikalien. Für die ersten Erderkundungsarbeiten wurden schon Waldstücke gerodet, Straßen für Bagger angelegt und Erde ausgehoben. All das in einer Gegend, die erst vor einem Jahr zum ""Landwirtschaftlichen Welterbe"" erklärt wurde. Nelson Gomes, Vorsitzender der Bürgerinitiative: ""Wir haben diese Auszeichnung von der Welternährungsorganisation wegen der Qualität unserer landwirtschaftlichen Produkte bekommen, wegen unserer nachhaltigen Landwirtschaft. All das steht jetzt auf dem Spiel."" Die betroffene Region heißt Trás-os Montes - übersetzt: Hinter den Bergen. Und tatsächlich fühlen sich viele Menschen hier seit langem isoliert, abgehängt und den  Regierenden in Lissabon ausgeliefert. Das hat seine Geschichte: In der Gegend gibt es mehrere verlassene Gold- und Uranminen, die Narben in der Landschaft hinterlassen haben. Die Regierung ließ Stauseen gegen den Willen der Bevölkerung anlegen, um Menschen fernab von hier mit Wasser zu versorgen. Heute regiert hier das Misstrauen. Landrat Queiroga: Der Landrat will, dass die Einwohner der Gegend über den Lithiumabbau das letzte Wort haben sollen. João Galamba sitzt im Zentrum von dem, was der Landrat ""Imperium"" nennt. Er ist Staatssekretär im Umweltministerium und für das Projekt verantwortlich. Die Regierung hat neun mögliche Orte für den Lithiumabbau gefunden, sie sollen jetzt international ausgeschrieben werden. Für Galamba ist das eine Investition in eine Zukunft, die auf erneuerbaren Energien beruht. Portugal, so der Staatssekretär, will in dieser Zukunft nicht nur Rohstofflieferant sein, sondern das Lithium auch selbst weiterverarbeiten: ""Die Bergwerke und eine Lithium-Raffinerie bedeuten Tausende von Arbeitsplätzen und Investitionen von mehreren Hundert Millionen Euro."" Natürlich solle die Umwelt so gut es geht geschützt werden, sagt Galamba. Und selbstverständlich würden die Gemeinden der Gegend auch am Gewinn beteiligt. Doch die Menschen dort bleiben skeptisch. ""Sicher wollen wir Arbeitsplätze schaffen und die Landflucht stoppen,"" sagt Orlando Alves, Landrat des Nachbarkreises Montalegre. Aber nicht um jeden Preis. ""Nichts ist uns wichtiger als die Erhaltung unserer Umwelt, unserer intakten Landschaft und unserer landwirtschaftlichen Qualitätsprodukte. Das ist uns heilig!"" Bauer Armando Teixeira ist da ganz seiner Meinung. Er lebt in einem kleinen Dorf bei Montalegre und ist einer von wenigen Einwohnern. Auch seine beiden Söhne haben die Gegend längst verlassen. Die Lithium-Pläne der Regierung bereiten auch ihm Sorgen: ""Ich weiß nicht wirklich, was das werden soll. Es wäre schön, wenn die jungen Leute hier Arbeit hätten, aber die werden wohl viele Löcher graben und alles verändern, und das könnte die Umwelt beeinflussen."" Alle warten hier nun auf Umweltstudien, die in den kommenden Wochen erscheinen sollen. Dass sie aber noch vor den Parlamentswahlen am 6. Oktober veröffentlicht werden, ist unwahrscheinlich. Sollten die Studien negativ ausfallen, könnten sie das Vorhaben der Regierung noch stoppen. Sollte die Regierung ihre Pläne trotzdem durchziehen, so Landrat Quieroga, bekäme sie es mit der Wut der Menschen von hier zu tun: ""Wir hier in der Region Barroso wollen nicht betrogen werden. Wir sind zwar gastfreundlich und offen. Aber nur zu unseren Freunden. Wer uns betrügen will, der bekommt Ärger."" "
19.09.2019 04:30 Uhr,Geplante Freihandelszone,Österreich wird Mercosur-Pakt wohl kippen,"Im österreichischen Nationalrat haben Abgeordnete gegen das geplante Mercosur-Abkommen zwischen der EU und dem südamerikanischen Staatenbund gestimmt. Damit wird der Pakt in Brüssel wohl am Widerstand aus Wien scheitern. Österreich wird das geplante und ohnehin umstrittene Freihandelsabkommen der Europäischen Union mit dem südamerikanischen Staatenbund Mercosur wohl kippen. Der EU-Unterausschuss im Nationalrat votierte gegen das Abkommen, wie die österreichische Nachrichtenagentur APA berichtete. Damit wird die Regierung zu einem Nein zum EU-Mercosur-Abkommen auf EU-Ebene verpflichtet und dem Pakt ein Riegel vorgeschoben, denn Entscheidungen im EU-Rat müssen einstimmig erfolgen. Mit dem Ende Juni vereinbarten Mercosur-Abkommen wollen die Europäische Union und vier südamerikanische Länder die größte Freihandelszone der Welt aufbauen. Das soll Unternehmen in der EU jährlich vier Milliarden Euro an Zöllen ersparen und die Exporte ankurbeln. Der Deal muss allerdings von den nationalen Parlamenten der Mitgliedsstaaten gebilligt werden. Wegen der Brände im Amazonas und der Politik des brasilianischen Präsidenten Jair Bolsonaro hatten unter anderem SPD- und Grünen-Politiker den Stopp des Abkommens gefordert. Bundesentwicklungsminister Gerd Müller (CSU) hatte allerdings dafür plädiert, an dem neuen Freihandelsabkommen festzuhalten. Beim G7-Gipfel in Biarritz Ende August drohten Frankreich und Irland angesichts der Brände mit einem Veto, sollte Brasilien sich nicht zu einem stärkeren Schutz des Waldes bekennen. Auch Luxemburg erklärte laut ""Spiegel"", ""die Prozedur auf Eis zu legen"". Zum Mercosur gehören Argentinien, Brasilien, Paraguay und Uruguay. Die Verhandlungen liefen bereits seit 2000. Der Staatenbund Mercosur ist mit einer Bevölkerung von mehr als 260 Millionen Menschen einer der großen Wirtschaftsräume der Welt. Die EU kommt sogar auf mehr als 512 Millionen Einwohner. "
19.09.2019 02:32 Uhr,Migrantenlager in Libyen,Suleiman will nach Europa,"Eine Familie aus dem Sudan hat Tausende Kilometer durch die Wüste hinter sich gebracht. Nun sitzt sie im Bürgerkriegsland Libyen fest - und kennt nur ein Ziel: nach Europa, um jeden Preis. Ein bisschen Schatten weiß Suleiman zu schätzen. Er hat unter dem Dach einer Lagerhalle am Rande der libyschen Hauptstadt Tripolis Schutz gesucht. Hier lebt der Sudanese mit seiner Frau und seinen sieben Kindern - zusammen mit mehreren anderen Migrantenfamilien. Sie haben ein paar Decken gespannt, die vor allzu neugierigen Blicken schützen. Mehr besitzt Suleiman nicht. ""Manchmal kommen Leute vorbei und schenken uns Nudeln oder Lebensmittel. Ich habe schon versucht, Arbeit zu finden, aber das ist schwierig"", erzählt er. ""Ich habe Angst davor, arbeiten zu gehen und nicht zurückzukommen. Einem meiner Söhne ist das passiert: Er hat gearbeitet und wurde festgenommen."" Seit einigen Monaten leben Suleiman und seine Familie unter dem Dach der Lagerhalle, trocknen ihre Wäsche auf einem unbenutzten Parkplatz. Die Familie hat sich beim Flüchtlingshilfswerk der Vereinten Nationen registrieren lassen, aber Hilfe bekommt sie nicht. Wasser holen Suleiman und seine Frau in großen Behältern aus einer Moschee in der Nachbarschaft. Ein täglicher Kampf ums Überleben - doch Suleiman hat sein Ziel vor Augen. Eine Bekannte von Suleiman hat ihr Kind bei der Flucht übers Mittelmeer verloren. Trotzdem überlegt der Familienvater, den Weg übers Wasser zu wagen. Regelmäßig legen Boote mit Migranten von der libyschen Küste ab - mit Kurs auf Europa. Die libysche Küstenwache versucht, ihre Flucht zu verhindern und die Menschen zurück an Land zu bringen. Keine einfache Aufgabe, sagt Brischelle Ammar Abdelbary, Kommandeur der ersten Flotte: ""Die Flüchtlinge sehen uns mal als ihre Retter, wenn sie sich in einer sehr schwierigen Situation befinden, und mal als die Zerstörer ihres Traums, nach Europa zu gelangen. Sie spüren meist nicht, in welche Gefahr sie sich bringen."" Wer in libyschen Gewässern aufgegriffen und zurück ans Ufer gebracht wird, landet in der Regel in einem der berüchtigten Internierungslager. Die Hilfsorganisation Ärzte ohne Grenzen hat vor Kurzem erneut auf die erbärmlichen Zustände dort aufmerksam gemacht: Die Räume seien teilweise nicht belüftet, die hygienischen Verhältnisse katastrophal. Die Organisation forderte, im Mittelmeer gerettete Migranten nicht mehr in das Bürgerkriegsland zurückzubringen. Suleiman kennt die Risiken - und hat schon versucht, Libyen auf dem Landweg zu verlassen. ""Ich habe versucht, nach Tunesien zu fliehen, aber sie haben mich festgenommen"", sagt er. ""Wir waren von fünf Uhr nachmittags bis vier Uhr morgens unterwegs. Meine kleine Tochter ist fünf Jahre alt, sie ist die ganze Zeit mitgelaufen. Jetzt muss ich alles daransetzen, anders nach Europa zu kommen."" In sein Heimatland Sudan zurückzukehren, das kommt für Suleiman nicht infrage. Er stammt aus Kurdufan, einer bergigen Region. Omar al-Baschir, der vor Kurzem gestürzte Langzeitherrscher, hatte sie stark vernachlässigt: Es gebe keine Straßen, keine Schulbildung, keine Gesundheitsversorgung, keine Perspektive, sagt Suleiman: ""Ich habe mich zur Migration entschieden, um meine Kinder zu retten. Trotz aller Gefahren und Risiken, die einem begegnen."" Er hoffe, dass Gott seinen Kindern eine bessere Zukunft beschere: ""In Kurdufan gibt es keine Schulen, gar nichts. Es ist eine Einöde. Bis heute wissen die Menschen dort nicht, was eine Wasserleitung ist. Ich will die Zukunft meiner Kinder sichern."" "
19.09.2019 01:27 Uhr,Unternehmen und der Brexit,"""Ein Spiel mit dem Feuer""","Die deutsche Industrie warnt, der Brexit-Kurs in London sei ""ein Spiel mit dem Feuer"". Es könnte auch hier eine hohe fünfstellige Zahl von Arbeitsplätzen betroffen sein. "
18.09.2019 16:33 Uhr,Nach der Wahl,Patt in Israel - und nun?,"Zwei Politikern kommt in Israel nun eine besondere Bedeutung zu: Präsident Rivlin muss entscheiden, wen er mit der Regierungsbildung beauftragt. Ex-Verteidigungsminister Lieberman könnte der ""Königsmacher"" sein. Es war bereits die zweite Parlamentswahl in Israel innerhalb eines halben Jahres. Nötig geworden war sie, weil es Benjamin Netanyahu im April trotz einer Mehrheit im rechts-religiösen Lager nicht gelungen war, eine Koalition zu schmieden. Auch nach dieser Wahl wird das kompliziert. Für eine Mehrheit im Parlament wären 61 Sitze nötig. Nach den bislang vorliegenden Ergebnissen liegen die beiden führenden Parteien gleichauf: Netanyahus Likud kommt ebenso auf 32 Sitze wie das Mitte-Bündnis Blau-Weiß von Oppositionsführer Benny Gantz. Zusammen mit seinen Verbündeten aus dem religiösen und ultranationalistischen Lager käme Likud auf 56 Sitze, Blau-Weiß und deren Verbündete auf 55. Für eine Mehrheit fehlen also fünf beziehungsweise sechs Sitze. Eine Schlüsselrolle bekommt wohl Ex-Verteidigungsminister Avigdor Lieberman. Seine Partei ""Unser Haus Israel"" gewann laut den vorläufigen Ergebnissen mindestens neun Sitze. ""Unser Haus Israel"" ist zwar - ebenso wie Netanyahus Likud - rechtsgerichtet. Doch es gibt einen wesentlichen Unterschied, der in der aktuellen israelischen Politik eine extrem große Rolle spielt: Netanyahu umgarnt die Ultraothodoxen, Lieberman lehnt eine Zusammenarbeit mit ihnen strikt ab und kämpft gegen einen zu starken Einfluss strengreligiöser Parteien auf gesellschaftspolitische Themen. Daran war auch im April die Bildung einer Koalition gescheitert. Konkreter Streitpunkt damals: Wehrdienst auch für strengreligiöse Juden. Dass sie von der Wehrpflicht ausgenommen sind, dass viele Ultraorthodoxe nicht arbeiten, dass diese kinderreiche und häufig arme Bevölkerungsgruppe vom Sozialstaat profitiert und ihre Politiker gleichzeitig mit religiösen Regeln den Alltag der säkularen Mehrheit mitbestimmen wollen, stört viele Israelis, so die Einschätzung von Soziologin Larissa Remennick. Ganz besonders genervt seien aber die russisch-stämmigen jüdischen Einwanderer und ihre Nachkommen. Und eben die sind Liebermans Kernwählerschaft. Der 61-Jährige gehört selbst zu den russischsprachigen Einwanderern. Er lebt in einer israelischen Siedlung im besetzten Westjordanland. Als ""einzig wahre Lösung"" sieht Lieberman die Bildung einer ""breiten Einheitsregierung"" mit seiner Partei, dem Likud und Blau-Weiß. Religiöse Parteien sollen davon ausdrücklich ausgeschlossen werden. Auch Blau-Weiß-Chef Gantz spricht sich für eine große Koalition aus. Fraglich ist aber, wer sie anführen soll. Im Wahlkampf hatte Gantz deutlich gemacht, dass er eine Koalition mit Netanyahu an der Spitze ausschließt. Als Grund führt er die Korruptionsvorwürfe gegen Netanyahu an. Dem langjährigen Ministerpräsidenten droht eine Anklage. Präsident Reuven Rivlin berät in den kommenden Tagen mit allen Parteichefs und wird dann entscheiden, wer den Regierungsauftrag bekommt. Üblicherweise erhält den Auftrag der Vorsitzende der Fraktion mit den meisten Stimmen. Der hat dann vier Wochen Zeit, eine Regierungskoalition zu bilden. Rivlin will aber vermeiden, dass Israel in Kürze schon wieder wählen muss. Deshalb vermuten Beobachter, dass er Gantz in jedem Fall den Vorzug geben könnte. Denn im Frühjahr war es Netanyahus Likud, der für die Auflösung des Parlaments stimmte - und damit verhinderte, dass Rivlin einem anderen Kandidaten den Auftrag für die Regierungsbildung geben konnte. Möglich wäre auch, dass Rivlin es dem Likud und Blau-Weiß überlässt, selbst eine Vereinbarung auszuarbeiten. Orientieren könnten sie sich dabei an einer großen Koalition aus dem Jahre 1984. Damals wurde erst Schimon Peres von der Arbeitspartei zwei Jahre lang Regierungschef, danach übernahm Likud-Chef Izchak Schamir für zwei Jahre. Es ist diesmal ein Kopf-an-Kopf-Rennen. Die offizielle Mitteilung der Ergebnisse durch den israelischen Wahlausschuss dauerte wegen besonderer Sorgfalt bei der Auszählung daher länger als üblich. Der Wahlausschuss teilt die Ergebnisse stets in Prozent mit. Danach kam Blau-Weiß nach der Auszählung von 63,1 Prozent der Stimmen auf 25,7, der Likud auf 25 Prozent. Medien rechnen das direkt in Mandate um. Ein Teil der Stimmen, unter anderem die der Soldaten, wird erst am Donnerstag ausgezählt. Ein endgültiges Ergebnis soll erst in der kommenden Woche vorliegen. "
18.09.2019 12:11 Uhr,Brexit-Machtkampf,Was macht Johnson jetzt?,"Das Gesetz brechen, zurücktreten oder weiter provozieren: Viele Optionen hat der britische Premierminister Johnson nicht mehr, wenn er Großbritannien zum 31. Oktober aus der EU führen will. Kommt am Ende doch der Deal? Immer wieder wird spekuliert, ob Premierminister Boris Johnson das vom Parlament beschlossene Gesetz gegen den No-Deal-Brexit einfach solange ignorieren kann, bis Großbritannien am 31. Oktober automatisch und ohne Vertrag die EU verlässt. Hellhörig wurden Johnsons Gegner, als er kürzlich vor Reportern sagte, das Gesetz sehe nur ""theoretisch"" eine Brexit-Verschiebung vor. Berichten zufolge bereiten die Gegner sich schon für einen Rechtsstreit vor. Über diese Aussichten sagte der ehemalige Generalstaatsanwalt Dominic Grieve der BBC: ""Er ist genauso an das Rechtsstaatsprinzip gebunden wie jeder andere in diesem Land. Wenn er sich nicht daran (an das Gesetz) hält, kann er vor Gericht verklagt werden. Das Gericht würde nötigenfalls eine Verfügung erlassen, die ihn dazu verpflichtet. Hält er sich nicht an die Verfügung, könnte er ins Gefängnis geschickt werden."" Zumindest ist es sehr unwahrscheinlich, dass eine Neuwahl noch vor dem geplanten EU-Austritt am 31. Oktober abgehalten werden kann. Vorstellbar wäre zwar, dass sich die Opposition darauf einigt, Johnson durch ein Misstrauensvotum zu entmachten und sich auf eine Übergangsregierung einzulassen. Dazu aber kann es erst kommen, wenn das Parlament ab dem 14. Oktober wieder zusammentreten darf, also zwei Wochen vor dem offiziellen Austrittstermin. Für eine Neuwahl wäre die Zeit dann zu knapp, nicht aber für die Bildung einer Übergangsregierung mit einem Premier, der die parteiübergreifende Zustimmung mehrerer Fraktionen und Abweichler aus der Konservativen Partei hat. Sie könnte diesen - anstelle von Johnson - um eine Fristverlängerung bitten. Nicht viel. Die Initiative liegt jetzt ausschließlich bei der Regierung und Premierminister Johnson. Der hat bereits angekündigt, dass er weiter mit der EU über ein aus seiner Sicht besseres Abkommen verhandeln will. Sollte sich Johnson mit der EU entgegen aller Erwartungen doch auf einen abgeänderten Vertrag einigen, müsste dieser nach Ende der Zwangspause durch das Parlament bestätigt werden, damit es noch zu einem geregelten Austritt aus der EU kommen kann. Experten gehen davon aus, dass Johnson die Zeit vor allem für Wahlkampf nutzen wird. Die Parlamentarier sind zwar in den Wochen ihrer Suspendierung zur Untätigkeit gezwungen, es zeichnet sich jedoch ab, dass sie das nicht einfach hinnehmen wollen. In einem öffentlichen Brief haben bereits 50 Abgeordnete diverser Fraktionen von Tories und Labour über Liberale bis zu den Schottische Nationalisten angekündigt, eine Art alternatives Parlament abzuhalten. Treffen könnten sie sich zum Beispiel im Church House von Westminister, einem historischen Veranstaltungsgebäude. ""Ein alternatives Parlament könnte die Regierung weiterhin in die Verantwortung nehmen und diesen überaus schädlichen Brexit bekämpfen"", schreiben die Parlamentarier. Inwiefern diese Treffen aber über einen symbolischen Charakter hinausgehen können, ist offen. Um sein Versprechen nicht zu brechen, Großbritannien am 31. Oktober aus der EU zu führen, könnte Johnson auch als Premierminister zurücktreten. Fraglich wäre, wer dann von Königin Elizabeth II. mit der Regierungsbildung beauftragt würde. Johnson Konservative können nicht mehr beanspruchen, eine Mehrheit im Unterhaus zu haben. Trotzdem wären sie weiter stärkste Fraktion. Sollte sich die Opposition jedoch mit vereinten Kräften auf Labourchef Jeremy Corbyn oder einen anderen Kandidaten einigen, könnte es einen Regierungswechsel geben. Johnson müsste darauf setzen, dass es bald zur Neuwahl kommt. Außerdem denken Oppositionspolitiker laut britischen Medienberichten über eine Amtsenthebung nach. Ein entsprechendes Gesetz wurde seit dem 19. Jahrhundert zwar nicht mehr angewendet und gilt als veraltet. Sollte Johnson aber das No-No-Deal-Gesetz ignorieren, könnte das Unterhaus wegen schwerer Pflichtverletzung ein Amtsenthebungsverfahren einleiten. Dafür müsste eine Mehrheit der Abgeordneten das ""Impeachement"" unterstützen. Dann könnte Johnson vor Gericht gestellt werden. Ironie des Schicksals: Johnson selbst unterstützte 2004 die Initiative für ein Impeachment-Verfahren gegen den damaligen Regierungschef Tony Blair wegen des Irak-Kriegs. Im Daily-Telegraph plädierte er für die Idee in einer Kolumne mit dem Titel: ""Isn't it time to impeach Blair over Iraq?"" Johnson könnte versuchen, in letzter Sekunde doch noch eine Einigung mit der EU zu finden. In der Kürze der Zeit wären kaum größere Änderungen möglich. Doch eine Variante lag bereits auf dem Tisch: Die in Großbritannien verhasste Garantieklausel für eine offene Grenze zwischen dem britischen Nordirland und dem EU-Mitglied Irland (Backstop) könnte auf Nordirland beschränkt werden. Notfalls müssten dann an den Häfen zwischen Nordirland und dem Rest des Vereinigten Königreichs Warenkontrollen durchgeführt werden. Großbritannien hätte aber die Freiheit, ohne Rücksicht auf die EU Handelsabkommen zu schließen, beispielsweise mit den USA. Nach den aktuellen Plänen ginge das nicht. Johnsons Vorgängerin Theresa May hatte diesen Vorschlag Brüssels im vergangenen Jahr noch empört abgelehnt. ""Kein britischer Premierminister könnte dem je zustimmen"", hatte May gesagt. Der Vorschlag untergrabe den britischen Binnenmarkt und bedrohe die verfassungsmäßige Integrität des Vereinigten Königreichs. Voraussetzung dafür wäre aber auch, dass die EU sich eine Änderung einlässt. Bislang hatte die EU erklärt, zwar offen für Vorschläge zu sein, das mit London ausgehandelte Austrittsabkommen aber ""verteidigen"" zu wollen. Es sei ""der bestmögliche Deal"". ""Never say never"" - das gilt in Sachen Brexit mehr denn je. Das in den vergangenen Tagen von der Opposition durchgeboxte No-No-Deal-Gesetz zwingt Johnson, bei der EU um eine Fristverlängerung bis Ende Januar 2020 zu bitten - es sei denn, er hat bis Mitte Oktober einen neuen Kompromiss mit der Europäischen Union erzielt. Von Johnson kommen dazu widersprüchliche Aussagen. Mal will er sich daran halten, mal wieder nicht. Nur: Schickt er den von der Opposition schon vorgeschriebenen Brief nicht an die EU, verstößt er gegen ein geltendes Gesetz. Die Opposition arbeitet schon daran, die Bitte um eine Fristverlängerung dann auf anderem Weg nach Brüssel zu schicken oder Johnson einfach durch ein Misstrauensvotum abzusetzen. Ganz anders sieht es aus, sollte es zu einer Fristverlängerung und danach zu vorgezogenen Neuwahlen in Großbritannien kommen. Dann geht das ganze Spiel wieder von vorn los: Je nachdem, wer die Wahl gewinnt, ist der No-Deal wieder durchaus möglich. Der britische Regierungschef könnte auch versuchen, eine Ablehnung der Brexit-Verschiebung durch die EU zu provozieren. Spekuliert wird, das Johnson dem Schrieb zur Fristverlängerung an die EU Mitte Oktober noch einen zweiten Brief beilegen könnte, aus dem hervorgeht, dass er die Verlängerung eigentlich nicht will. Er könnte Brüssel auch damit drohen, wichtige Entscheidungen zu blockieren. Als denkbar gilt auch, dass Johnson versuchen könnte, einen EU-Staat zu einem Veto zu bewegen. Infrage käme beispielsweise Ungarn, dessen Ministerpräsident Viktor Orban Johnson gewogen sein dürfte. Doch bislang ist es den 27 verbliebenen EU-Staaten gelungen, in Sachen Brexit fast immer mit einer Stimme zu sprechen. "
