date,topline,headline,content
14.12.2021 22:14 Uhr,WM-Viertelfinale,Deutsche Handballerinnen scheitern an Spanien,"Der Traum von der ersten WM-Medaille seit 14 Jahren ist für Deutschlands Handball-Frauen geplatzt. Die DHB-Auswahl verlor am Dienstagabend (14.12.2021) im Viertelfinale der Weltmeisterschaft gegen Gastgeber Spanien mit 21:26 (10:14) und kehrt ohne das ersehnte Edelmetall in die Heimat zurück. Beste Werferin für das Team von Bundestrainer Henk Groener war vor 2.000 Zuschauern in Granollers Rückraumspielerin Julia Maidhof mit sechs Toren. Doch das reichte nicht, weil einmal mehr zu viele Chancen leichtfertig vergeben wurden. ""Wir haben super angefangen, das Spiel mit eigenen Fehlern aber wieder aus der Hand gegeben. Dann sind wir den Spanierinnen nur noch hinterhergelaufen"", analysierte Groener. Nach der schwachen Vorstellung bei der deftigen 16:32-Pleite gegen Dänemark zum Abschluss der Hauptrunde hatte sich die deutsche Mannschaft geschworen: Das passiert uns nicht noch einmal. Diese Einstellung war von der ersten Sekunde an zu spüren. Die Abwehr stand zunächst wie eine Mauer und ließ den Spanierinnen kaum eine Lücke. Zudem gab Torfrau Dinah Eckerle in der Anfangsphase mit einigen Paraden zusätzliche Sicherheit. Der Lohn war eine schnelle 3:0-Führung nach fünf Minuten, die Spaniens Trainer Jose Ignacio Prades zu einer frühen Auszeit veranlasste. Der erste Treffer im Spiel gelang dem WM-Gastgeber erst nach acht Minuten. Zwar lief auch bei der deutschen Auswahl im Angriff nicht alles nach Wunsch, doch dank der überzeugenden Defensivleistung wurde der Vorsprung zunächst konstant bei drei bis vier Toren gehalten. Mitte der ersten Halbzeit schlichen sich dann jedoch einige technische Fehler ein, so dass Spanien auf 5:7 verkürzen konnte. ""Wir schmeißen die Bälle vorne zu einfach weg"", monierte Groener in der Auszeit. Doch der Flow war dahin - und die Führung beim 8:8 (22. Minute) auch. Kurz darauf lag das deutsche Team erstmals im Spiel zurück. Nun schwächelten die DHB-Frauen in der Deckung und liefen sich bei eigenen Angriffen immer wieder an der spanischen Abwehr fest. Zu allem Überfluss vergab Alina Grijseels beim Stand von 9:12 auch noch einen Siebenmeter. So ging es mit einem Vier-Tore-Rückstand in die Pause. Nach dem Wechsel rückte Katharina Filter für Eckerle ins deutsche Tor. Die Beach-Europameisterin gab mit einigen Paraden den dringend benötigten Rückhalt. Schritt für Schritt kämpfte sich das DHB-Team ins Spiel zurück - ohne den Rückstand zunächst entscheidend verkürzen zu können. Aber Körpersprache und Wille stimmten. Mitte der zweiten Halbzeit keimte beim 17:19 noch einmal Hoffnung - die wenig später nach einem 3:0-Lauf Spaniens wieder dahin war. Das DHB-Team steckte zwar zu keiner Zeit auf, vergab aber weiter reihenweise beste Chancen und konnte die Wende damit nicht mehr erzwingen. Am Ende der WM-Reise gab es somit Frust statt Jubel. Dänemarks Handball-Frauen hatten zuvor erstmals seit 2013 das WM-Halbfinale erreicht. Der dreimalige Olympiasieger setzte sich im Viertelfinale gegen Brasilien mit 30:25 (14:13) durch. Im Kampf um den Einzug ins Endspiel treffen die Däninnen nun auf den Gewinner der Partie Frankreich gegen Schweden, die am Mittwoch ausgetragen wird. Quelle: sportschau.de "
14.12.2021 22:08 Uhr,EU-Ministerrat zu Türkei,Beitrittsverhandlungen bleiben eingefroren,"Bereits seit mehreren Jahren liegen die EU-Beitrittsverhandlungen mit der Türkei auf Eis. Und daran wird sich aus Sicht von Brüssel vorläufig auch nichts ändern. Ein Grund: die türkische Außenpolitik. Die EU-Beitrittsverhandlungen mit der Türkei bleiben nach einem einstimmigen Beschluss des Ministerrates eingefroren. ""Der Rat stellt mit Bedauern fest, dass die Türkei sich immer weiter von der Europäischen Union entfernt"", heißt es in einer Erklärung. Die Öffnung beziehungsweise der Abschluss weiterer Verhandlungskapitel könne nicht in Betracht gezogen werden. Konkret kritisieren die EU-Staaten, dass die türkische Außenpolitik zunehmend mit den Prioritäten der EU kollidiere. Als Beispiel wird Libyen genannt, wo Regierungstruppen illegale Waffenlieferungen aus der Türkei bekommen haben sollen. Zudem werden Verstöße der Türkei gegen Zollunion-Vereinbarungen mit der EU angeprangert. Beim Thema Demokratie, Menschenrechte und Grundrechte bekräftigte der Ministerrat die bekannten Vorwürfe. Die weiteren Rückschritte in diesen Bereichen seien zutiefst besorgniserregend. Dies gelte auch für die Meinungsfreiheit und die mangelnde Unabhängigkeit der Justiz. Die Zivilgesellschaft und ihre Organisationen müssten unter anhaltendem Druck in einem zunehmend schwierigen Umfeld agieren. Die 2005 begonnenen EU-Beitrittsverhandlungen mit der Türkei liegen bereits seit mehreren Jahren auf Eis. Als ein Grund dafür, dass die Gespräche noch nicht endgültig beendet wurden, gilt die Bedeutung des Landes für den Kampf gegen illegale Migration nach Westeuropa. Es soll deswegen auch in Zukunft von EU-Finanzhilfen profitieren. Dazu heißt es in der Erklärung: Weitere EU-Unterstützung für Flüchtlinge und Gastgemeinden werde rechtzeitig sichergestellt. "
14.12.2021 21:19 Uhr,Lauterbach in den tagesthemen,"""Wir haben zu wenig Impfstoff""","Um die Impfkampagne weiter vorantreiben zu können, braucht es mehr Corona-Impfstoff. Doch es gibt offenbar nicht genug. Der Mangel habe viele überrascht - auch ihn, sagte Gesundheitsminister Lauterbach in den tagesthemen. Die Corona-Impfkampagne könnte schon sehr bald ins Stocken geraten. Bundesgesundheitsminister Karl Lauterbach bestätigte in den tagesthemen, dass die Reserven und Bestellungen für das 1. Quartal nicht ausreichen. Dies sei das Ergebnis seiner Impfstoffinventur. ""Diesen Impfstoffmangel zu beseitigen, daran arbeite ich bereits seit Tagen"", so der SPD-Politiker. ""Aber in der Tat, wir haben zu wenig Impfstoff. Das hat viele überrascht - mich auch"". Die Impfstoffbeschaffung laufe nun ""über alle Kanäle, die zur Verfügung stehen. Wir können hier nichts auslassen. Ich nutze auch die Kanäle, die wir direkt zu den Unternehmen haben, aber es muss alles EU-konform funktionieren"", erklärte Lauterbach. ""Wir müssen hier an Geschwindigkeit gewinnen, von daher bin ich auf mehreren Ebenen unterwegs, schon seit dem Wochenende."" Der neue Gesundheitsminister hatte sich am Freitag gemeinsam mit Bundeswehrgeneral Carsten Breuer einen Überblick über die in Deutschland vorrätigen Mengen an Coronaimpfstoffen verschafft. Bundeskanzler Olaf Scholz hatte Breuer kürzlich zum Leiter des Corona-Krisenstabs im Kanzleramt ernannt. Der Generalmajor soll sich auf diesem Posten vor allem mit der Beschaffung und Verteilung von Impfstoffen befassen. Lauterbach hatte am Nachmittag bereits seine Kolleginnen und Kollegen aus den Bundesländern über den Impfstoffmangel im kommenden Jahr informiert. Bei dem Treffen wurde außerdem beschlossen, dass zusätzliche Tests bei Corona-Zugangsregeln für Geimpfte mit Booster-Auffrischimpfung vorerst weitgehend wegfallen. Allerdings soll in ""medizinischen und pflegerischen Einrichtungen"" zum Schutz besonders gefährdeter Personengruppen weiterhin auch von Geboosterten ein negatives Testergebnis verlangt werden. Die Erleichterungen beim Zugang nach dem Modell 2G plus sollen aber spätestens nach zwei Monaten überprüft werden. In den tagesthemen warb Lauterbach für bundeseinheitliche Regeln bei der Booster-Impfung. Er werde sich auf jeden Fall dafür einsetzen. Aus seiner Sicht seien vier Monate zwischen der zweiten und der dritten Impfung angemessen. ""Klar ist, dass eine einheitliche Regelung richtig wäre. Klar ist auch, dass sie medizinisch keinen Sinn macht, bevor nicht vier Monate vergangen sind."" Der Gesundheitsminister spielte damit auf den Vorstoß Nordrhein-Westfalens an, Booster-Impfungen bereits nach vier Wochen anzubieten. Das sei jedoch wenig sinnvoll, sondern allenfalls die Vervollständigung der Impfung derjenigen, ""deren Immunantwort auf die Impfung nicht komplett antwortet. Da kann eine dritte Impfung schon einem Monat nach der zweiten Impfung sinnvoll sein."" Mit Blick auf die hochansteckende Omikron-Variante erwartet Lauterbach Empfehlungen des neuen Expertenrats. Auch ob die Infektionszahlen bald wieder nach oben gehen, könne er nicht voraussagen. Ideal sei es, wenn die Delta-Variante so stark wie möglich zurückgedrängt und zugleich so viele Menschen wie möglich geboostert würden. ""Wir können davon ausgehen, dass die Impfung nur nach der Booster-Impfung wirklich gut wirkt gegen die Omikron-Variante."" Ganz abwenden könne man die Omikron-Welle aber vermutlich nicht, so Lauterbach. ""Wir müssen uns wahrscheinlich mit Omikron hier in Europa und somit auch in Deutschland auseinandersetzen."" Über die Ausbreitung der Variante mache sich auch der Krisenstab Gedanken. Das es wegen Omikron zu neuen Kontaktbeschränkungen noch vor Weihnachten kommen könnte, wollte Lauterbach nicht gänzlich ausschließen. Er hoffe, dass es nicht nötig sein werde, wolle aber auch nicht spekulieren. ""Ich möchte dem Expertenrat nicht vorgreifen. Wir schließen nichts aus, wir reagieren sehr flexibel."" Doch grundsätzlich werde die wissenschaftliche Evidenz, ""eine viel größere Rolle für die Bundesregierung spielen als in der Vergangenheit"". Das bedeute: ""Wenn die Empfehlungen so wären, dass man radikale Schritte empfiehlt, dann würden wir die auf jeden Fall auch in Erwägung ziehen."" "
14.12.2021 20:10 Uhr,Innenausschuss des Bundestages,Geschlossen gegen einen AfD-Vorsitz,"Der Bundestags-Innenausschuss sorgt für Streit - genauer seine noch unbesetzte Spitze. Nach Zugriffsrecht geht die an den AfD-Politiker Hess. Doch die anderen Parteien könnten dem einen Strich durch die Rechnung machen. ""Empörend!"" und ""Niemals!"" - das Urteil von Union und Linkspartei ist eindeutig. Sie wollen nicht, dass die andere Oppositionspartei AfD künftig den Vorsitz des Innenausschusses des Bundestags übernimmt. Der AfD-Bundestagsabgeordnete Martin Hess soll nach dem Willen seiner Fraktion künftig den Bundestagsinnenausschuss leiten. Der 50-jährige Polizist aus Baden-Württemberg wurde von der AfD im Bundestag für den Posten nominiert. Für Linken-Fraktionschefin Amira Mohamed Ali wäre ein Vorsitzender vonseiten der AfD ""ein fatales Zeichen"". Sie stellt klar: ""Die Linke wird niemals einen Kandidaten der AfD für ein solches Amt unterstützen."" Und der Fraktionschef der Union, Ralph Brinkhaus, erklärt: ""Mir fehlt momentan die Fantasie, mir vorzustellen, wie es sein kann, dass jemand von der AfD diesen Ausschussvorsitz tatsächlich bekleiden kann."" Nach der Bundestagswahl ist nun der Innenausschuss neu zu besetzen. Heute wird der Vorsitz gewählt. Es ist einer der größten Ausschüsse im Parlament. Die Mitglieder beraten Gesetze, die für die Innere Sicherheit bedeutsam sind, auch über Themen wie Einwanderung oder Asyl. Der Ausschuss prüft durchaus auch, ob der Verfassungsschutz richtig arbeitet. Es ist die oder der Vorsitzende, die einen Ausschuss auch nach außen vertreten. Nach einer Sitzung äußern sich die Vorsitzenden zuerst vor den Mikrofonen und Kameras. Dass die AfD bei sensiblen Sicherheitsfragen im Ausschuss den Ton angeben könnte, stößt auch bei der CSU auf Widerstand. Zuletzt hatte sie den Ausschussvorsitzenden gestellt. CSU-Landesgruppenchef Alexander Dobrindt weist auf die große Verantwortung des Vorsitzes für die Funktionsfähigkeit und die Themenauswahl des Ausschusses hin. ""Ich bin empört darüber, dass es nicht gelungen ist, diesen Ausschussvorsitzenden anders zu besetzen als durch ein AfD-Mitglied."" Für Mohamed Ali von der Linkspartei ist klar: ""Die Ampel trägt dafür die volle Verantwortung."" Es wäre den Parteien der Koalition möglich gewesen, diesen Ausschussvorsitz selbst zu besetzen. Erst in der vergangenen Legislaturperiode hatte der Bundestag das Verfahren eingeführt, dass die Fraktionen nach ihrer Größe Zugriff auf die Vorsitze der Ausschüsse erhalten. Grüne und FDP haben sich mit ihrem jeweils ersten Zugriff die Ressorts Außen, Europa und Verteidigung gesichert. Damit war der Weg frei für die AfD beim Innenausschuss. Warum die Grünen dem Europa-Ausschuss Vorrang gegeben haben, begründet Fraktionschefin Britta Haßelmann so: ""Die erste Priorität war, den Europa-Ausschuss zu ziehen, weil klar ist, dass auch dort sehr viel innen,- europa- und außenpolitische Entscheidungen getroffen werden."" Nun hofft AfD-Kandidat Hess, dass er den Vorsitz im Innenausschuss erhält. Er selbst hält sich für geeignet. Nach seiner Nominierung sagt er, er wolle entschlossen etwaigen Sicherheitsbedenken entgegentreten, die in Medien und von politischen Gegnern geäußert würden. Er sei ehemaliger Polizeihauptkommissar und habe 27 Jahre Diensterfahrung. Er denke, Fachkompetenz könne in Zeiten wie diesen in diesem wichtigen Amt nicht schaden. ""Ich bin mir der Bedeutung des Amtes und auch der Herausforderung vollumfänglich bewusst"", sagt Hess. Er versichert, er werde die Funktion neutral und überparteilich ausüben - im Fall seiner Wahl. Doch die AfD ahnt, dass es ihr mit ihrem Kandidaten für den Innenausschuss so ergehen könnte wie bei der Besetzung des Bundestagspräsidiums. Dort fielen die Personalvorschläge der AfD regelmäßig durch. AfD-Fraktionschefin Alice Weidel warnt die anderen Parteien mit Blick auf die Wahl im Innenausschuss: ""Wir sehen mit größter Irritation, dass bereits jetzt durch die anderen Parteien und Fraktionen eine Drohkulisse aufgebaut wird, unsere Kandidaten neben dem Bundestagsvizepräsidenten durchfallen zu lassen."" Die anderen Parteien könnten den Kandidaten der AfD wohl tatsächlich durchfallen lassen. Normalerweise sind die Vorsitzenden der Ausschüsse nach dem Zugriffsprinzip gesetzt. Doch könnte es diesmal in den Ausschüssen entgegen dem üblichen Verfahren auch zu Abstimmungen über den Vorsitz kommen. Sprich: So könnten die anderen Parteien die AfD-Vorsitz theoretisch verhindern. Es gebe keinen Automatismus, dass ein Kandidat für den Vorsitz auch von den Ausschussmitgliedern gewählt wird, deutet FDP-Fraktionschef Christian Dürr an. Ein Ausschussvorsitzender präsentiere das Parlament auch nach außen. Es komme auf die persönliche, aber auch auf die fachliche Eignung an. ""Es müssen also Personen aus der Mitte des Hauses sein, die dazu in der Lage sind. Insofern werden wir uns das an der Stelle genau anschauen."" Genau anschauen werde sich auch die SPD den Kandidaten, kündigt ihr Fraktionschef Rolf Mützenich an. Er verweist auf das Thema AfD und Verfassungsschutz: ""Wir wissen ja auch, dass die AfD in einzelnen Bundesländern unter Beobachtung steht."" Mützenich fügt hinzu, dass ein Ausschuss auch ohne die Wahl eines Vorsitzenden arbeitsfähig sei. Das Mandat der Abgeordneten sei frei, betont Mützenich und lässt damit seinen Parteigenossen freie Hand, den AfD-Mann im Ausschuss nicht zu wählen. "
14.12.2021 19:18 Uhr,EU-Verkehrspolitik,Brüssels Pläne für die Schiene,"Mehr Verbindungen, mehr Passagiere, mehr Tempo - aber weniger kompliziert: Die EU-Kommission will das EU-weite Schienennetz ausbauen und stärker nutzen. Noch sieht die Wirklichkeit aber anders aus. Über bestens ausgebaute Trassen bringen moderne Züge Passagiere und Fracht schnell und sicher in alle großen Städte des Kontinents. Ein Mausklick genügt, um das Trans-Europa-Ticket zu buchen, was den Zug zur besseren Alternative zu Auto und Flugzeug macht. Das ist Europas schöne neue Bahnwelt, wie sie sich die EU-Kommission vorstellt. Die Wirklichkeit sieht anders aus: Obwohl die Zahl der Bahnreisenden gestiegen ist, waren nur sieben Prozent der in den vergangenen 18 Jahren zurückgelegten Bahnkilometer Fahrten über EU-Grenzen hinweg. Brüssel will Verbindungen ausbauen, um mehr Fahrgäste und Güter auf die Schiene zu bringen, sagt der stellvertretende Kommissionschef Frans Timmermans. Er erklärt: ""Unser Paket enthält auch viele konkrete Vorteile für unsere Bürgerinnen und Bürger. Um den internationalen Zugverkehr voranzubringen, verkürzen wir Reisezeiten und erleichtern den Aufbau eines wettbewerbsfähigen Netzes in Europa."" Passagiere sollen leichter günstige Tickets finden und mehr Rechte bei Störungen bekommen. Die Kommission will eine EU-weite Mehrwertsteuerbefreiung für Zugfahrkarten prüfen. Die Fahrpläne sollen so ausgestaltet werden, dass schnellere grenzüberschreitende Verbindungen möglich werden. Auf den wichtigen Trassen durch Europa sollen Passagierzüge mindestens 160 Kilometer pro Stunde oder schneller fahren. Die Reisezeit zwischen Kopenhagen und Hamburg könnte sich dadurch um zwei Stunden auf 2,5 Stunden verkürzen. Flughäfen sollen leichter für Zugreisende erreichbar sein, um kürzere Flüge überflüssig zu machen. ""Es gibt immer noch vier Flüge pro Tag zwischen Brüssel und Amsterdam und es gibt einen Zug. Die Leute nehmen das Flugzeug, weil es bequemer ist wegen des Gepäcks oder der Anschlussflüge. Indem wir Passagieren mehr Komfort anbieten, können sie eine Wahl treffen, die unseren Klimazielen eher entspricht"", erläutert Timmermans. Beim Güterverkehr ist eine Mindestgeschwindigkeit von 100 Kilometern pro Stunde vorgesehen. An den Grenzen soll er maximal 15 Minuten warten müssen. Das Ziel: Den Hochgeschwindigkeitsverkehr auf der Schiene bis 2030 zu verdoppeln und bis 2050 zu verdreifachen. Zwischen Porto und Vigo ganz im Westen Europas und Budapest und Bukarest im Südosten des Kontinents sollen neue Hochgeschwindigkeitsverbindungen entstehen. Das wird nach den Worten von EU-Transportkommissarin Adina Valean bis zur Mitte des Jahrhunderts zusätzlich 247 Milliarden Euro kosten, aber auch rund 850.000 neue Arbeitsplätze schaffen. ""Dieses Netzwerk ist für Europas Wirtschaft, was Arterien und Venen für den Körper sind. Sind sie beschädigt, arbeitet der Körper nicht"", sagt Valean. Auch die Ladeinfrastruktur für Pkw und Lkw soll ausgebaut werden: Auf Europas Autobahnen soll für E-Autos alle 60 Kilometer eine Ladesäule stehen, für wasserstoffbetriebene Fahrzeuge alle 150 Kilometer. Damit die EU ihr Klimaziel erreicht, muss der Ausstoß von Treibhausgasen aus dem Transport bis 2050 um 90 Prozent gegenüber dem Wert von 1990 sinken. Die Europa-CDU spricht von einer guten Balance zwischen Forderungen der Industrie und der Mitgliedstaaten. Die Grünen fordern ein Ende des Tarifdschungels bei Bahntickets und den Ausbau des Nachtzugnetzes. Einen kleinen Schritt hat die EU schon unternommen hin zur neuen Bahnwelt: Am Morgen ist in Paris der erste Nachtzug aus Wien seit 2007 eingetroffen. "
14.12.2021 19:14 Uhr,Flughafen Jerusalem,Traum vom Fliegen auf heiklem Terrain,"Einst herrschte am Flughafen Jerusalem Jetset-Hochbetrieb, dann legte Israel ihn still. Minister Frej schlägt nun eine Wiedereröffnung vor, von der auch die Palästinenser profitieren sollen. Die Stadt Jerusalem hat andere Pläne. Die Douglas DC-3 hat es dem Palästinenser Abu Alexbis heute angetan: ihre elegante Form, die mächtigen Doppelsternmotoren. Die DC-3 flog regelmäßig von Jerusalem nach Beirut im Libanon. Vor etwa 60 Jahren war das. Und Abu Alex fertigte die Flüge als Mitarbeiter am Flughafen von Jerusalem ab. Rief sie auf, in die Abflughalle zu gehen. Zählte die Passagiere in den Fliegern der ""Air Liban"" durch. Heute ist Abu Alex 82 Jahre alt. In seiner Wohnung in Ost-Jerusalem sitzt er vor einem schweren Aktenordner: Darin hat er Fotos, Tickets und Bordkarten aufgehoben. Ein Foto zeigt ihn mit Sonnenbrille, Mütze und in einer eleganten Uniform. Es war jene Zeit, als Fliegen luxuriös und sehr teuer war. Ost-Jerusalem war damals unter der Kontrolle Jordaniens. Es gab Flüge in die gesamte arabische Welt und sogar in den Iran und nach Afghanistan. ""Wenn ich mir diese Fotos anschaue, dann bin ich erst einmal stolz"", sagt Abu Alex. ""Es ist wie in einem Traum. Ich kann gar nicht glauben, dass ich das bin auf den Fotos."" 1967, im Sechstagekrieg, besiegte Israel mehrere arabische Länder, eroberte unter anderem das Westjordanland und Ost-Jerusalem. Aus israelischer Sicht wurde der Ostteil der Stadt befreit. Aus jordanischer und palästinensischer Sicht war es eine schmerzhafte Niederlage. Auch der Flughafen von Jerusalem kam unter israelische Kontrolle. ""Wir haben damals etwas sehr Wertvolles verloren"", sagt Abu Alex. Ein Flughafen sei ja nicht wie ein Supermarkt oder eine Bushaltestelle. ""Es ist ein Tor zur Welt. Und ein Tor ins Heilige Land."" Fluglinien aus dem westlichen Ausland wie zum Beispiel die Lufthansa landeten hier nie, weil die Kontrolle des Gebietes durch Jordanien und seit 1967 durch Israel völkerrechtlich nie anerkannt wurde. Israel führte hier bis zum Jahr 2001 Inlandsflüge durch. Doch während der zweiten Intifada und aus Furcht vor Beschuss durch militante Palästinenser wurde der Flughafen aus Sicherheitsgründen geschlossen. Der Glanz der luxuriösen Fliegerei ist heute verblasst. Im verlassenen Terminal liegen Glasscherben und ein vergilbter Zettel aus der Bedienungsanleitung für ein Instrumentenlandesystem. Eldad Brin erforscht diesen manchmal gespenstisch anmutenden Ort. Der Israeli wurde in Jerusalem geboren und ist promovierter Geograph. Heute sei der Flughafen nur noch ein Schatten, eine leere Hülle der Vergangenheit, sagt er. Brin hat sich auf die 1960er-Jahre spezialisiert, die Blütezeit des Airports: ""Der jordanische Teil Jerusalems war viel kleiner als der israelische. Er war ziemlich arm"", sagt der Forscher. ""Es gab aber eine kleine, palästinensisch-jordanische Elite. Die hat den Flughafen regelmäßig genutzt."" Zum Skifahren in Damaskus? Auf ein Konzert in Kairo? Manche Bewohner Ost-Jerusalems hätten die Anreise per Flugzeug erledigt. Eldad Brin ist in seinem Element, wenn er durch das Terminalgebäude läuft. Wenn er die Wendeltreppe mit dem eleganten Geländer sieht, die alte VIP-Lounge mit der Holzvertäfelung. Glücklich sieht er aber nicht aus, wenn er auf den Verfall blickt. ""Es bricht einem das Herz. Weil man sich denkt: Wie hätte dieser Ort hier heute aussehen können?"" Ohne den Konflikt zwischen Israelis und Arabern, zwischen Israelis und Palästinensern, meint Brin, könnte es hier doch einen internationalen Flughafen geben. ""Und der könnte uns allen dienen."" Genau das schlägt jetzt ein Mitglied der neuen israelischen Regierung vor: Esawi Freij will den Flughafen wieder in Betrieb nehmen. Er ist arabischer Israeli und Minister für regionale Zusammenarbeit. Freij nennt den Flughafen einen ""Schatz"", von dem alle Seiten profitieren könnten. Die Palästinenser, die im von Israel besetzten Westjordanland leben, sollen ein eigenes Terminal bekommen - so der Plan. Kann der Flughafen wirklich wiedereröffnet werden? Der Geograph Brin winkt ab: ""In einem so kleinen Land, in dem der Flughafen Ben Gurion sehr nah ist, gibt es wirklich keine Rechtfertigung für einen weiteren Flughafen."" Außerdem gebe es im Jerusalemer Stadtteil Kufr Aqab, der vom Kontrollturm aus zu sehen ist, mittlerweile viele hohe Häuser - Brin hat Sicherheitsbedenken. Die Stadt Jerusalem hat ohnehin ganz andere Pläne für das Areal: 9000 Wohneinheiten sollen hier für ultra-orthodoxe Israelis entstehen - mitten in Ost-Jerusalem, umgeben von palästinensischen Vierteln. Nicht nur die US-Regierung befürchtet, dass eine palästinensische Hauptstadt in Ost-Jerusalem damit endgültig ein Ding der Unmöglichkeit wird. Manche israelische Politiker wollen genau das erreichen. Die Pläne wurden vor kurzem gestoppt. Vorerst. Brin glaubt: Irgendwann wird das Vorhaben dennoch umgesetzt. Gut findet er das nicht. Von der früheren Besucherterasse hat man einen Blick auf das Vorfeld des Flughafens. Die akkurat gepflanzten Palmen könnten etwas Pflege gebrauchen. Und auch sonst herrscht hier Tristesse, wo sich einst elegant gekleidete Gäste einen Drink genehmigten. ""Der heutige Zustand des Flughafens ist sehr symbolisch. So sehen die Chancen auf einen Frieden zwischen Israelis und Palästinensern aus"", sagt Brin. Er hat einen Vorschlag, was auf dem so sensiblen Terrain entstehen könnte: Das gleiche wie auf dem Berliner Flughafen Tempelhof, der heute ein Areal für Kultur und Erholung ist. Brin entwirft in seinem Kopf ein restauriertes Flughafengelände, ein Café und einen Park. Für Israelis und Palästinenser. ""Es könnte Teil einer utopischen Blase der Koexistenz im Norden Jerusalems werden"", sagt er. ""Aber hey, ich denke, dass es nie passieren wird."" "
