date,topline,headline,content14.12.2021 14:31 Uhr,Energieversorgung,"Was tun, wenn der Gasanbieter kündigt?","Wegen der hohen Gaspreise stellen derzeit nahezu täglich Versorger Lieferungen ein und kündigen Verträge. Für Betroffene oft ein Schock. Was die Verbraucher tun müssen und worauf sie achten sollten. Der starke Anstieg der Gaspreise treibt immer mehr Anbieter in den Ruin. Ihr Geschäftsmodell bricht zusammen, ihren Kunden müssen sie kündigen. Zuletzt hat es den Versorger gas.de mit seiner Marke Grünwelt Energie getroffen. Er hat alle Gaslieferverträge gekündigt und die Versorgung eingestellt. Als Grund nennt er die ""nie dagewesenen Preisexplosion"" auf dem europäischen Markt für Erdgas. Für Betroffene ist das mitten im Winter eine beängstigende Situation. Doch eigentlich besteht kein Grund zur Sorge, weil die Verbraucher automatisch von der Ersatzversorgung übernommen werden. ""Die örtlichen Grundversorger übernehmen in solchen Fällen die Belieferung, ohne dass eine Lücke entsteht. Es wird also niemand aufgrund der Kündigung in einer kalten Wohnung sitzen müssen"", sagt Lenia Baga, Juristin bei der Verbraucherzentrale Schleswig-Holstein. Der Grundversorger ist immer das Unternehmen, das in einem bestimmten Netzgebiet die meisten Kunden beliefert. Oft, aber nicht immer, sind das die örtlichen Stadtwerke oder andere städtische Firmen. Verbraucher haben nun die Möglichkeit, dem Grundversorger fristlos zu kündigen und in einen günstigeren Tarif zu wechseln - sofern sie denn einen solchen Anbieter finden. Weil die Konditionen der zahlreichen Anbieter höchst unterschiedlich sein können, empfehlen Verbraucherschützer, Vergleichsportale wie Check 24 oder Verivox zu Hilfe zu nehmen. Allerdings sollten die Suchenden genau hinschauen: Viele Anbieter werben mit Bonuszahlungen, die den Tarif im ersten Jahr besonders günstig machen. Entfällt der Bonus im zweiten Jahr, steigen die Preis mitunter rapide. Wer bereit ist, jedes Jahr den Versorger zu wechseln, kann sich bewusst für einen Bonustarif entscheiden. Wer langfristig bei einem Anbieter bleiben möchte, schaut sich besser die Tarifkonditionen ohne Boni an. Verbraucherschützer empfehlen zudem, einen Vertrag mit Preisgarantie abzuschließen. Der Anbieter garantiert dem Kunden dann für eine bestimmte Laufzeit einen festen Preis. Eine Verpflichtung, sich einen neuen Gasversorger zu suchen, wenn der alte die Lieferungen einstellt und kündigt, gibt es übrigens nicht. Falls die Betroffenen nicht innerhalb von drei Monaten einen neuen Lieferanten finden, bleiben sie automatisch beim Grundversorger. Kunden, denen der Liefervertrag gekündigt wurde - wie jetzt im Fall von Grünwelt -, sollten aber darauf achten, ihre Einzugsermächtigung schriftlich zu widerrufen und den Dauerauftrag bei der Bank zu stornieren. Ganz wichtig ist auch, dass die von einer Kündigung betroffenen Verbraucher den Zählerstand zum Bezugsende selbst ablesen und dem Lieferanten sowie dem Grundversorger mitteilen. Das Unternehmen gas.de hat angekündigt, die Kundenbeziehungen sachgerecht abzuwickeln und mit den Endabrechnungen ausstehende Guthaben sowie vereinbarte Neukundenboni auszuzahlen. Betroffene sollten jetzt unbedingt ihren aktuellen Zählerstand ablesen, diesen dem Anbieter melden und für sich dokumentieren. "
14.12.2021 14:31 Uhr,Negativpreis von Foodwatch,"""Goldener Windbeutel"" geht an REWE","REWE hatte Hähnchenfleisch als ""klimaneutral"" beworben - die Organisation Foodwatch wirft dem Konzern Täuschung vor und vergibt ihren Negativpreis ""Goldener Windbeutel"" an die Supermarktkette. REWE hält das für unberechtigt. Der Negativpreis ""Goldener Windbeutel"" der Verbraucherorganisation Foodwatch geht in diesem Jahr an REWE. Rund 28 Prozent der 63.000 online abgegebenen Stimmen entfielen auf ein angeblich klimaneutrales Hähnchenbrustfilet der Eigenmarke Wilhelm Brandenburg. ""REWE rechnet Fleisch mit falschen CO2-Zertifikaten klimafreundlich und täuscht damit umweltbewusste Verbraucher:Innen"", kritisierte Manuel Wiemann von Foodwatch. Das Produkt werde nicht emissionsfrei hergestellt. Außerdem schütze ein in diesem Zusammenhang betriebenes Partnerschaftsprojekt in Peru zur Kompensation von Treibhausgasen weder den dortigen Wald noch das Klima. Nach eigenen Angaben kompensiert REWE die bei der Produktion des Hühnchenfleischs entstandenen Emissionen mit einem Wald-Projekt in Peru, das von dem Anbieter Climate Partner angeboten wird. Laut Foodwatch erfüllt dieses Projekt aber nicht die grundlegenden Anforderungen an Kompensationsprojekte. Es sei grundsätzlich irreführend, Fleischprodukte als ""klimaneutral"" zu bewerben, kritisierte Foodwatch weiter. Drei Viertel aller Treibhausgasemissionen in der Landwirtschaft entfallen laut Foodwatch auf die Tierhaltung. Die Supermarktkette REWE nannte die Verleihung des Negativpreises ""unberechtigt"". Sie beruhe auf falschen Behauptungen von Foodwatch über das Kompensationsprojekt, erklärte REWE gegenüber der Nachrichtenagentur AFP. Eine Überprüfung durch unabhängige Dritte habe die Behauptungen von Foodwatch ""zweifelsfrei widerlegt"". Auch sei die Verpackung des Produkts überarbeitet worden. In der veränderten Verpackung werde das Hähnchen-Brustfilet weiter vertrieben. Mit dem Goldenen Windbeutel zeichnet Foodwatch jedes Jahr die ""dreisteste Werbelüge des Jahres"" aus. Neben REWE waren außerdem Produkte der Marken Danone (Volvic Mineralwasser), Darboven (Mövenpick Kaffeekapseln), Katjes und Naturally Pam by Pamela Reif nominiert. Foodwatch forderte eine klare Regulierung von ""nachhaltigen"" Werbeversprechen. ""Mit diesem Greenwashing muss Schluss sein"", forderte Wiemann. ""Grüne Werbelügen auf unökologischen Produkten müssen gestoppt werden"". "
14.12.2021 14:07 Uhr,Meeresfische in der EU,"Gefangen, verendet, weggeworfen","Verwüstete Meeresböden, gestörte Ökosysteme, als ""Beifang"" verendete Tiere - Recherchen von Report Mainz zeigen: Tierschutz beim Fischfang spielt so gut wie keine Rolle. München - Viktualienmarkt: Die Auslagen in den Fisch-Delikatessgeschäften sehen auch in diesem Weihnachtsgeschäft wieder sehr gut aus. Rotbarben, frisch gefangen aus dem Ärmelkanal sind im Angebot, daneben Wolfsbarsch, Hummer und Flügel von einem Rochen. Dem Gourmet läuft das Wasser im Mund zusammen. Doch woher kommen diese Fische genau, wie wurden sie gefangen? Eine Aktivistin der Tierrechtsgruppe SOKO Tierschutz ist dem nachgegangen. Anfang November fährt sie in die Normandie und schafft es, einen Schiffseigner davon zu überzeugen, sie mitsamt ihrer Kameraausrüstung auf einem Trawler mitzunehmen. Fünf Tage ist die Aktivistin im Ärmelkanal und der Nordsee unterwegs. Im Drei-Stunden-Rhythmus wird gefischt. Man wolle Seezungen rausholen, erzählen ihr die Seeleute. Doch schon bald wird klar: die Netze, die reingeholt werden, sind voll mit jungen Haien, Rochen, Schollen und vielen Krustentieren. Etliche Fische sind auch viel zu klein, um später verkauft zu werden. Beifang nennt man das - und der ist groß. Im Interview mit Report Mainz erzählt die Aktivistin: ""Sie fischen, so viel sie können. Bei unserer Fahrt haben sie zehn Tonnen Fisch rausgeholt, der marktfähig war. Zehn Tonnen vermarktungsfähiger Fisch, das heißt, sie haben viel mehr rausgeholt, was keinen Wert hatte."" Doch wieviel ist das ""mehr"" an Beifang, das aus dem Meer rausgeholt wird? Report Mainz zieht deshalb eine Fischereiexpertin zu Rate: Iris Ziegler von der Organisation Sharkproject. Die Gruppe beobachtet das Schicksal von Haien, Rochen und dem sogenannten Beifang seit Jahren und sieht diese Entwicklung äußerst kritisch. ""Tatsächlich ist, dass gerade der Beifang bei dieser Fischerei oftmals die Hauptmasse des Fangs ist. Nur - man will ihn nicht, weil er wertlos ist. Und für was? Für eine Scholle? Eine Seezunge, die wir dann am Schluss auf unserem Teller haben"", sagt sie. ""Aber wenn man sich diese Massen anschaut, dann können sie abschätzen, wie viel jeden Tag aus unseren Meeren sinnlos an Leben rausgeholt wird. Und das fehlt dem Ökosystem."" Die Meerestiere werden mit einer bestimmten Fangmethode aus dem Meer geholt. Es ist die sogenannte Grundschleppnetzfischerei. Das Netz wird dabei bis auf den Meeresgrund heruntergelassen und dann hinter dem Boot hergezogen. Das Netz fängt alles ein, was sich auf dem Meeresboden befindet. Der wird dabei regelrecht umgepflügt. Was bleibt, ist eine Spur der Verwüstung und es wird alles gefangen, was ins Netz kommt. Darunter befinden sich vom Aussterben bedrohte Arten ebenso wie viel zu kleine Fische. Auch die Brut wird mitgefangen. Landen diese Tiere erst einmal an Bord, werden sie aussortiert, verenden und werden als tote Masse ins Meer zurückgeworfen. Skarkproject schätzt, dass etwa die zehnfache Menge an Beifang herausgeholt wird, im Vergleich zu dem Fisch, den man verkaufen kann. Report Mainz hat mit diesem Problem auch das zuständige EU-Kommissariat für Umwelt und Fischerei konfrontiert. Doch dessen Pressestelle verweist lediglich auf die Regelungen in der Fischereiverordnung. Darin sind die Fangquoten geregelt und - weil die Trawler immer mehr Fisch aus den Meeren herausholen, als sie schließlich anlanden und verkaufen, hat sie eine Anlandeverpflichtung in die Verordnung eingefügt. Damit ist klar: Fischtrawler müssen alles anlanden, was sie fangen. ""Bezüglich dieser sogenannten Anlandeverpflichtung müssen die Mitgliedstaaten ihr Möglichstes tun, um unerwünschte Fänge zu reduzieren. Sie besteht aber erst seit dem 1. Januar 2019. Es ist daher noch zu früh, um die Wirksamkeit dieser Maßnahme zu beurteilen,"" heißt es in der Stellungnahme des EU-Kommissariats. Doch schon heute greife diese Vorschrift nicht, stellt der deutsche Abgeordnete Martin Häusling fest. Er ist ein Kritiker der EU-Fischereipolitik. ""Es wird nicht überwacht, es wird nicht umgesetzt,"" sagt er im Interview mit Report Mainz. ""Wir brauchen ein Kontrollsystem auf den Schiffen. Also warum haben wir keine Kameras auf den Schiffen? Warum haben wir auf größeren Schiffen auch keine Kontrolleure, die da mitfahren? Das wird von der Fischerei-Industrie nach wie vor torpediert, und das kann eigentlich die Europäische Union nicht akzeptieren."" Der Aktivistin der Tierrechtsgruppe SOKO Tierschutz gelingt es schließlich auch zu filmen, wie die Fische nach dem Fang verarbeitet werden. Über ein Förderband werden sie in einen Raum transportiert, in dem die Meerestiere geschlachtet werden. Aufnahmen, die die Aktivistin hier gedreht hat, zeigen, wie etwa ein noch lebender Rochen oder ein junger Hai noch lebend aufgeschlitzt und ausgenommen werden. Für Friedrich Mülln von SOKO Tierschutz, der das gesamte Bildmaterial ausgewertet hat, ist dies Alltag in der Fischerei. Tiere würden ohne Betäubung aufgeschlitzt und ohne Betäubung die Innereien herausgerissen. Danach würden die Tiere teilweise noch erheblich länger leben. Für Mülln ist das eine ""unfassbare Schande für die Europäische Union."" Das zuständige EU-Kommissariat, damit konfrontiert, erklärt: Im Klartext: Da sich hierfür die Mitgliedstaaten miteinander abstimmen müssen, wird in den nächsten Jahren in Sachen Tierschutz wohl nicht viel passieren. Eine fatale Perspektive. "
14.12.2021 13:58 Uhr,Sinkende Nachfrage,IEA rechnet mit Öl-Überschuss,"Die Internationale Energieagentur rechnet für das kommende Jahr nicht mehr mit einer Ölknappheit. Gleichzeitig belasten Corona-Sorgen um die neuen Omikron-Variante die Preise. Die Internationale Energieagentur (IEA) rechnet nicht mehr mit Ölknappheit. Im Gegenteil: Schon jetzt sei ein Überschuss an Erdöl festzustellen, der sich im kommenden Jahr weiter ausweiten werde, erklärte die IEA in Paris. Die IEA ist eine Kooperationsplattform, die sich mit Energietechnologien beschäftigt. Schon jetzt sei ein Überschuss an Erdöl festzustellen, der sich im kommenden Jahr ausweiten werde, erklärte die Agentur. Die dringend benötigte Entspannung für die belasteten Rohölmärkte sei unterwegs. Schon in diesem Monat werde das weltweite Ölangebot die globale Nachfrage übersteigen. Das Angebot profitiere von einer wachsenden Förderung des Ölverbunds Opec+, der Freigabe strategischer Reserven durch große Volkswirtschaften und einer steigenden Produktion in den USA, Kanada und Brasilien. Die Nachfrage hingegen werde durch einen geringeren Kerosinverbrauch im Flugverkehr gedämpft. Die vielerorts steigenden Corona-Infektionen dürften die Erdölnachfrage zwar bremsen, nicht jedoch komplett abwürgen, erwartet die IEA. Heute legten die Ölpreise nach Einbußen im frühen Handel leicht zu: Zuletzt kostete ein Barrel (159 Liter) der Nordseesorte Brent 74,61 US-Dollar, also etwas mehr als am Vortag. In den vergangenen Tagen war der Handel am Erdölmarkt anfällig für Schwanken. Zwar holten die Rohölpreise etwa die Hälfte ihres Rückgangs vom November bereits wieder auf. Doch die Sorge vor den Auswirkungen der neuen Corona-Variante Omikron belastet die Erholung und sorgt für Vorsicht an den Finanz- und Rohstoffmärkten. "
14.12.2021 13:43 Uhr,Fangquoten für die Nordsee,"Mehr Hering, weniger Seelachs","Seelachs, Kabeljau und Scholle gehören zu den beliebtesten Speisefischen. Weil ihre Bestände in der Nordsee zurückgehen, legte die EU nun entsprechend niedrigere Fangquoten fest. Hering darf dagegen mehr gefischt werden. Ab Januar gelten neue Fangquoten in der Nordsee. Das betrifft auch deutsche Fischer. Sie dürfen künftig 22 Prozent mehr Hering fangen, jedoch 25 Prozent weniger Seelachs als dieses Jahr. Die Fangquote für Kabeljau wurde um zwei Prozent leicht gesenkt. Auch für Scholle sinken die zulässigen Fänge um zehn Prozent. Nahezu unverändert bleiben die Fangmengen für deutsche Fischer mit Blick auf Schellfisch, arktischen Kabeljau und Schwarzen Heilbutt bei Grönland im kommenden Jahr. Diese Entscheidung fiel bei einem Treffen der EU-Landwirtschaftsminister. Der neue Bundesagrarminister Cem Özdemir von den Grünen zeigte sich zufrieden und sprach von einem ausgewogenen Kompromiss. Er hätte sich mit Blick auf Kabeljau in der Nordsee ""ein etwas ambitionierteres Vorgehen"" gewünscht, sagte er. Umweltschützer sehen diesen Bestand ebenfalls besonders kritisch. ""Alle Zeichen stehen auf Zusammenbruch"", kritisierte der WWF. Es werde immer noch mehr gefischt, als von Wissenschaftlern empfohlen. Auch die US-amerikanische Umweltschutzorganisation Oceana kritisiert, dass ein Drittel der nun festgelegten Fangbeschränkungen zu hoch sei. Rupert Howes, Chef der Organisation MSC, die ein Siegel für nachhaltige Fischerei herausgibt, betont, wie wichtig ein anständiges Management der Bestände ist und kritisiert, dass mehrere Fischbestände stärker als von Forschern empfohlen gefischt werden. Es gebe aber Besserung: ""Im Jahr 2005 wurden nur 25 Prozent der europäischen Bestände nachhaltig befischt, heute sind es fast 60 Prozent."" Die EU-Staaten legen jedes Jahr die zulässigen Gesamtfangmengen für bestimmte Gewässer fest. Auf dieser Basis entfallen auf die einzelnen Länder durch festgeschriebene Verteilungsschlüssel die jeweiligen nationalen Fangmengen. Grundlage der Verhandlungen ist eine Vorlage der EU-Kommission, die in erster Linie auf wissenschaftlichen Empfehlungen beruht. Viele Fischbestände befinden sich in eher schlechtem Zustand. Im Oktober hatten sich die EU-Fischereiminister auf Fangquoten für die Ostsee geeinigt. Wegen des weiterhin schlechten Zustands der Bestände dürfen Fischer kommendes Jahr in weiten Teilen der Ostsee keinen Hering und Dorsch fangen, außer wenn sie als Beifang ins Netz geraten. Für die von der EU und Großbritannien geteilten Gewässer gab es noch keine Einigung. ""Trotz unserer größten Bemühungen, die Beratungen rechtzeitig abzuschließen, sind diese mit dem Vereinigten Königreich über die Fischfangquoten für 2022 noch im Gange"", sagte EU-Umweltkommissar Virginijus Sinkevicius. Mit Großbritannien solle ""so schnell wie möglich"" eine Einigung gefunden werden. "
14.12.2021 13:16 Uhr,Opposition in Belarus,18 Jahre Haft für Tichanowskajas Mann,"In Belarus ist der Ehemann von Oppositionsführerin Tichanowskaja zu 18 Jahren Haft verurteilt worden. Dem Blogger Sergej Tichanowski wurde die Organisation von Massenunruhen vorgeworfen. Sergej Tichanowski, der Ehemann von Oppositionsführerin Swetlana Tichanowskaja, ist in Belarus zu 18 Jahren Haft verurteilt worden. Er wurde im Zusammenhang mit den Massenprotesten gegen Machthaber Alexander Lukaschenko schuldig gesprochen. Der 43-jährige Blogger müsse wegen ""Vorbereitung und Organisation von Massenaufständen"" unter besonders harten Haftbedingungen ins Straflager, meldete die staatliche belarussische Nachrichtenagentur Belta unter Berufung auf das Gericht der Stadt Gomel. Der bekannte Blogger war kurz nach Bekanntgabe seiner Kandidatur für die Präsidentschaftswahl im vergangenen Jahr festgenommen worden. Seine fünf Mitangeklagten wurden zu Gefängnisstrafen zwischen 14 und 16 Jahren verurteilt. Nach der Urteilsverkündung twitterte Tichanowskaja, dass Lukaschenko sich öffentlich an seinen stärksten Gegnern räche. ""Aber die ganze Welt schaut zu. Wir werden nicht aufhören"", betonte sie. Am Vormittag hatte sie bereits eine emotionale Videobotschaft in sozialen Netzwerken veröffentlicht. ""Ich werde weiterhin diesen Mann verteidigen, den ich liebe und der zu einem Anführer für Millionen von Belarusen geworden ist"", sagte sie. Sie werde alles dafür tun, um den Moment ihres Wiedersehens ""in einem neuen Belarus"" zu beschleunigen. Einen Schuldspruch gegen ihren Mann bezeichnete sie als ""illegal"". Tichanowski wollte bei der Präsidentschaftswahl im August 2020 gegen Lukaschenko antreten. Kurz nach Bekanntgabe seiner Kandidatur wurde er jedoch festgenommen, seine Frau Swetlana trat daraufhin an seine Stelle. Trotz massiver Betrugsvorwürfe wurde Lukaschenko nach der Wahl zum Sieger erklärt. Dies löste beispiellose Massenproteste aus. Sie wurden gewaltsam niedergeschlagen, tausende Regierungskritiker wurden festgenommen oder flohen ins Exil, darunter auch Tichanowskaja. "
14.12.2021 13:13 Uhr,Indiens neuer Tempelbezirk,Modis One-Man-Show am heiligen Fluss,"In Rekordzeit hat Premier Modi einen Tempelbezirk im größten indischen Bundesstaat Uttar Pradesh errichten lassen. Kurz vor den Wahlen ist Modi nun gekommen, um ihn einzuweihen - für die Muslime im Land ein Affront. Die Menschen jubeln dem Premierminister zu. Doch der Politiker Narendra Modi beginnt seine Rede eher wie ein Priester. ""Überall ist Lord Shiva, Sieg der Mutter Annapurna, Sieg der Mutter Ganga"" - mit religiösen Formeln beginnt die Rede des Premierministers hier in Varanasi am heiligen Fluss Ganges. Innerhalb von zweieinhalb Jahren hat Modi einen neuen Tempelbezirk errichten lassen - um den bedeutenden alten Kashi-Vishvanath-Tempel herum. Hohe Mauern, weite Höfe - und ein Korridor vom Ganges hoch zum Tempel. ""In unseren heiligen Schriften heißt es, dass man von allen Fesseln befreit wird, sobald man Kashi betritt"", so Modi weiter. ""Der Segen von Lord Vishweshwara, eine übernatürliche Energie, erweckt unsere innere Seele, sobald wir hierherkommen."" Umgerechnet 40 Millionen Euro hat das religiöse Bauwerk gekostet. Bis zu 70.000 gläubige Hindus pro Tag können nun zunächst ihr rituelles Bad im Ganges vollziehen und dann am Kashi-Tempel beten. Varanasi ist der Wahlbezirk von Premier Modi. Hier finden voraussichtlich im Februar und März die Wahlen zum Landesparlament von Uttar Pradesh statt, dem mit 200 Millionen Einwohnern größten indischen Bundesstaat, den Modis hindu-nationalistische Partei BJP schon bisher regiert. Ein Premier, der einen Hindu-Tempel mit religiösem Pomp eröffnet, das ist für die 40 Millionen Muslime in Uttar Pradesh ein Signal der Ausgrenzung. Wenn Modi über die muslimischen Herrscher in Indiens Geschichte spricht, befürchten sie, er meint auch die Gegenwart. Die Invasoren haben diese Stadt angegriffen und versucht, sie zu zerstören, so Modi weiter in seiner Rede. Die Geschichte der Grausamkeiten des Herrschers Aurangzeb und seines Terrors sei Zeugnis davon. Er habe versucht, die Zivilisation mit dem Schwert zu verändern, die Kultur mit Fanatismus zu zerstören. Aber der Boden dieses Landes sei anders als der Rest der Welt. Die Politik von Modis Lager verheiße für die heilige Stadt Varanasi nichts Gutes, so der Dozent Amitabh Bhattacharya von der örtlichen Universität BHU Varanasi. Hindus und Muslime hätten über lange Zeit in großer Harmonie miteinander gelebt. Diese wunderschöne Harmonie oder Lebensart sei auf gewisse Weise gestört, bedroht oder zumindest geschwächt, so Bhattacharya. Die Eröffnung des neuen Kashi-Tempelbezirks durch den indischen Regierungschef sehen nicht nur Muslime als Affront, sondern auch liberale Hindus wie Amitabh Bhattacharya. Wenn es religiöser Hass sei, so Bhattacharya, dann sei es eine Gefahr für die Kultur dieser Stadt. Denn diese Stadt sei im Grunde eine Stadt des Friedens. Und es sei die Stadt der Toleranz. Intoleranz sei kein Bestandteil der Kultur von Varanasi. Und was für die Stadt gelte, gelte auch für ganz Indien, sagt Bhattacharya. Doch er habe Hoffnung, sagt er. ""Auch diese politische Aggression ist eine sterbliche Realität. Diese neue Philosophie und ihre Philosophen werden auch irgendwann gehen müssen. Früher oder später. Lasst uns hoffen, dass es bald ist."" "
14.12.2021 13:09 Uhr,Heinsberg-Studie zu Coronavirus,Falsche Rechnung mindert Aussagekraft,"Die Heinsberg-Studie zur Dunkelziffer der Corona-Infektionen basiert auf einer grob falschen Berechnung. Mehrere Wissenschaftler bestätigten dem SWR: Ein wesentlicher Faktor fehlt. Die sogenannte Heinsberg-Studie erhielt bundesweit besondere Aufmerksamkeit: Wissenschaftler der Universität Bonn hatten in dem von der Epidemie besonders betroffenen Ort Gangelt im Kreis Heinsberg (Nordrhein-Westfalen) eine groß angelegte Untersuchung durchgeführt. Aus den Ergebnissen könne man die Sterblichkeitsrate des Coronavirus erstmals ""ziemlich genau beziffern"", erklärte der Virologie-Professor und Studienleiter Hendrik Streeck. Die Forscher hatten bei der Veröffentlichung betont, dass sie anhand dieser berechneten Sterblichkeitsrate auch eine konkretere Dunkelziffer der tatsächlich Infizierten schätzen könnten. Demnach wären in Deutschland sehr wahrscheinlich bereits rund 1,8 Millionen Menschen infiziert. Diese anscheinend präzise Schätzung ist nach Recherchen des SWR aber nicht haltbar. Mehrere Wissenschaftler haben auf Anfrage des SWR die fehlerhafte Hochrechnung der Zahlen des Ortes Gangelt auf Deutschland bestätigt. Demnach muss man als Ergebnis der Schätzung eine deutlich weitere Spanne für die Dunkelziffer angeben. Die Zahl der möglichen Infizierten in Deutschland läge dann, so die vom SWR befragten Wissenschaftler, wahrscheinlich mindestens bei knapp einer Million, könne aber auch bis zu fünf Millionen Menschen umfassen. Die korrekte Nachberechnung anhand der veröffentlichten Studien-Daten ergibt eine deutlich ungenauere Dunkelziffer-Schätzung, als sie vom Studienleiter der Öffentlichkeit gegenüber präsentiert wurde. Die Berechnung der Infektionssterblichkeit hat zwei Unsicherheitsfaktoren, die berücksichtigt werden müssen: die Zahl der Infizierten und die Zahl der Verstorbenen. Der Tübinger Statistikprofessor Philipp Berens sieht hier ein schweres Versäumnis in der Vorgehensweise und spricht von einem kritischen Fehler: Beide Unsicherheiten führen dazu, dass es nicht ein Ergebnis gibt, sondern eine Spannweite möglicher richtiger Ergebnisse. Die Abweichung, das sogenannte Konfidenzintervall, sagt aus, wie weit das tatsächliche Ergebnis von einer Schätzung entfernt liegen könnte. Je kleiner dieses Intervall, desto präziser die Schätzung. Genau dieses Intervall wurde allerdings in der Hochrechnung der Daten aus Heinsberg auf Deutschland zu eng gefasst. Statistiker Berens vergleicht das so: ""Das ist so ähnlich wie mit der Wettervorhersage. Da kann ich Ihnen sagen: Ja, vielleicht regnet es. Aber vielleicht ist es auch plausibel, dass die Sonne scheint."" Auch andere Wissenschaftler, wie der Biowissenschaftler und Virenforscher Richard Neher von der Universität Basel haben bereits Kritik an der Hochrechnung geäußert. Die Dunkelziffer lässt sich damit durch die Heinsberg-Studie nicht präziser schätzen, als das schon mit bisherigen Studienergebnissen möglich war. Das Robert Koch-Institut (RKI) beispielsweise verweist seit mehreren Wochen bereits auf zwei Studien, die zur Dunkelziffer zu sehr unterschiedlichen Erkenntnissen kommen. Demnach könne die Dunkelziffer beim elf- bis 20-Fachen liegen. Wenn die Heinsberg-Studie ebenfalls nur eine ähnlich breite Spannweite ergibt, liefert sie für die Präzisierung der Dunkelziffer in Deutschland kaum neue Erkenntnisse. Auf Nachfrage des SWR räumte der an der Studie beteiligte Statistikprofessor, Matthias Schmid, ein, dass für die Hochrechnung seiner Ergebnisse auf Deutschland tatsächlich ein notwendiger Rechenschritt fehle: Mit ""Paper"" ist die wissenschaftliche Veröffentlichung gemeint, die zur Diskussion mit anderen Forschern ins Netz gestellt wurde. Davon unabhängig hatte die Uni Bonn die Studie der Öffentlichkeit anders dargestellt und eine Übertragbarkeit auf Deutschland deutlich in den Vordergrund gestellt. Schon zuvor war die Studie an anderen Punkten kritisiert worden - unter anderem wegen der stark verkürzenden und zuspitzenden Vermarktung durch eine Kommunikationsagentur.  "
