date,topline,headline,content14.12.2021 10:08 Uhr,38 Grad in Sibirien,Hitzerekord in der Arktis bestätigt,"Brennende Wälder, schmelzendes Meereis - 2020 war für die Arktis eins der wärmsten je gemessenen Jahre. Nun hat die Weltwetterorganisation für die Region offiziell einen Hitzerekord bestätigt. Experten sind alarmiert. Das nordsibirische Werchojansk hält mit 38 Grad einen neuen Temperaturrekord. Die Weltwetterorganisation (WMO) erkannte die Messung vom 20. Juni 2020 als Rekord für die Region nördlich des Polarkreises an. WMO-Generalsekretär Petteri Taalas wertete das als ""Alarmglocke für den Klimawandel"". Die seit 1885 betriebene meteorologische Beobachtungsstation hatte den Rekordwert in Werchojansk während einer beispiellosen Hitzewelle 2020 gemeldet. Die Messstelle liegt 115 Kilometer nördlich des Polarkreises. Damals lagen die Temperaturen in der Region rund zehn Grad über dem langfristigen Durchschnittswert. Das führte zu verheerenden Waldbränden und einer großen Meereisschmelze. 2020 war eines der drei wärmsten Jahre, verglichen mit dem Durchschnitt von 1850 bis 1900. Die Arktis gehört laut WMO zu den Regionen mit den am raschesten steigenden Temperaturen. Die Klimaerwärmung verläuft dort mehr als doppelt so schnell wie im globalen Durchschnitt. Ein Expertenausschuss hatte deshalb die höchste gemessene Temperatur nördlich des Polarkreises als eigene Kategorie in das WMO-Archiv der Wetter- und Klimaextreme aufgenommen. Entsprechende Spitzenwerte in der Südpolregion werden seit 2007 dokumentiert. Auch dort, in der Antarktis, wurde 2020 ein Wärmerekord gemessen: 18,3 Grad. Aktuell untersuchen die WMO-Experten laut eigenen Angaben drei weitere mögliche Rekorde. Zwei Messungen von 54,4 Grad in diesem und im vergangenen Jahr stammen vom heißesten Ort der Welt: dem Death Valley im US-Bundesstaat Kalifornien. Zudem wurden diesen Sommer auf Sizilien 48,8 Grad gemessen. Das Team habe noch nie so viele Untersuchungen für Temperaturrekorde gleichzeitig geführt. Der neue Hitzerekordhalter in der Arktis ist für ein trockenes Kontinentalklima mit Extremwerten bekannt. Im ostsibirischen Jakutien herrschen neben warmen Sommern auch besonders kalte Winter. Ein 1892 dort verzeichneter Kältewert von -67,8 Grad galt zeitweise als tiefste je gemessene Temperatur weltweit. Derzeit prüft die WMO als Rekord für die Nordhalbkugel einen Messwert von -69,6 Grad. Den hatte die Wetterstation Klinck in Grönland am 22. Dezember 1991 registriert. Die WMO prüft vor der Aufnahme ins Rekordregister, mit welchen Instrumenten und unter welchen Bedingungen gemessen wurde. Damit will sie unzuverlässige Messungen oder außergewöhnliche Umstände ausschließen. "
14.12.2021 09:56 Uhr,Produktionsverlagerung,BMW fertigt künftig auch X5 in China,"China gewinnt auch für BMW immer mehr an Bedeutung. Deshalb will der Autohersteller neben dem erfolgreichen SUV-Modell X3 auch den X5 in der Volksrepublik bauen. BMW weitet seine Präsenz in China aus und will noch mehr Modelle in dem Land produzieren. So soll der Stadtgeländewagen (SUV) X5 künftig nicht mehr nur in den USA im Werk Spartanburg (South Carolina) vom Band laufen, sondern auch in der Volksrepublik. Damit bestätigte ein Sprecher des Münchener DAX-Konzerns einen entsprechenden Bericht des ""Handelsblatts"". Die SUV-Modelle der X-Baureihe wurden früher ausnahmslos im US-Werk gefertigt, mittlerweile baut BMW aber mehrere der gewinnträchtigen Wagen auch in China, den X3 auch in Südafrika. BMW stärkt damit die Bedeutung seiner beiden Werke in der Volksrepublik weiter. Denn außer den beiden Oberklasse-Modellen der 7er-Reihe (Limousine und SUV) sowie einzelnen Tuning-Fabrikaten produzieren die Münchener mit der Teilverlagerung des X5 bald alle wichtigen Baureihen auch in China. Bisher kam der X5 nur aus den USA. Vor der Corona-Pandemie wurde rund ein Viertel der Produktion von rund 400.000 Autos von South Carolina nach Asien geliefert. Spartanburg ist das weltweit größte BMW-Werk. Allein über den Hafen in Charleston verschifft das Unternehmen jährlich 40.000 bis 55.000 Einheiten des X5 nach Fernost. Die Produktion folge der Nachfrage, sagte der BMW-Sprecher nun. Lokalisiert das Unternehmen eine Fahrzeugversion in China, dann kann der Konzern das Modell im Land genauer an die chinesischen Käuferbedürfnisse anpassen - und spart sich so auch etwaige Zollschranken zwischen den USA und China, wie sie im Handelsstreit zwischen beiden Ländern eine Rolle spielten und auf den Gewinnen lasteten. China hat zeitweise gedroht, Autoimporte aus den USA mit einem Strafzoll von 25 Prozent zu belegen. Wie das ""Handelsblatt"" unter Berufung auf Konzernkreise weiter berichtet, soll künftig auch eine Elektroversion vom BMW 3er exklusiv in China gefertigt werden. Diese Information wollte der Sprecher unter Verweis auf ""Spekulationen"" nicht kommentieren. Die Münchener wollen zudem im ersten Quartal 2022 eine Option ausüben, die ihnen zum Preis von 3,6 Milliarden Euro weitere 25 Prozent am Joint Venture mit ihrem chinesischen Partner sichert. BMW würde dann 75 Prozent des Gemeinschaftsunternehmens kontrollieren und die Gesellschaft auch in den eigenen Konzernzahlen konsolidieren. Der Konzern wäre der erste westliche Autohersteller, der dieses Privileg ausüben darf. Auch Daimler und Volkswagen haben den Wunsch geäußert, die Mehrheit ihrer chinesischen Joint-Ventures zu übernehmen, bisher allerdings ohne Erfolg. China ist der größte Einzelmarkt des Konzerns, wie auch bei den anderen deutschen Autokonzernen Volkswagen (VW) und Daimler. In den ersten neun Monaten hatte BMW von gut 1,9 Millionen Autos aller seiner Marken fast 670.000 in China verkauft - etwas mehr als jedes dritte Auto. Dass BMW weitere SUV-Modelle in China fertigen lassen wollte, war schon länger ein offenes Geheimnis. "
14.12.2021 09:19 Uhr,Corona als Begründung,Tiefststand bei Verkehrstoten erwartet,"Die Zahl der Verkehrstoten in Deutschland sinkt zwar mit gewissen Schwankungen seit rund 40 Jahren. 2021 erwartet das Statistische Bundesamt aber nun mit 2450 Opfern einen neuen Tiefstand. 2021 wird nach Schätzung des Statistisches Bundesamt das Jahr mit der niedrigsten Zahl der Verkehrstoten. Die Statistiker erwarten eine Zahl von 2450 Opfern. ""Das wäre der niedrigste Stand seit Beginn der Statistik vor mehr als 65 Jahren"", teilte die Behörde zu ihrer Schätzung auf Basis der vorliegenden Daten für den Zeitraum Januar bis September mit. Der bisherige Tiefststand war 2020 mit 2719 Verkehrstoten erfasst worden, das waren 327 oder elf Prozent weniger als 2019. ""Die Rückgänge sind maßgeblich auf das im Vergleich zu 2019 deutlich geringere Verkehrsaufkommen infolge der Corona-Pandemie zurückzuführen"", erklärten die Statistiker die Entwicklung. In den seit 1950 vorliegenden durchgehenden Daten des Statistischen Bundesamtes war die Zahl der Verkehrstoten nie niedriger. Noch 1991 tauchten in der Statistik 11.300 Opfer auf. Im Jahr 1970 waren es sogar 19.193 - allein in der alten Bundesrepublik. Seitdem wurde zahlreiche Sicherheitsmaßnahmen eingeführt - etwa die Promillegrenze und die Helm- und Gurtpflicht. Im Corona-Jahr 2021 ging auch die Zahl der Verletzten im Straßenverkehr zurück. Die Behörde rechnete mit einem Rückgang um rund acht Prozent auf etwa 301.000. Dennoch bedeute dies weiterhin täglich durchschnittlich knapp sieben Todesopfer und mehr als 800 Verletzte im Straßenverkehr, so das Statistische Bundesamt. Die Zahl der polizeilich erfassten Unfälle wird bis zum Jahresende voraussichtlich leicht um etwa ein Prozent fallen. Insgesamt dürft es schätzungsweise mehr als 2,2 Millionen Unfälle auf Deutschlands Straßen geben. Die Zahl der Unfälle mit Personenschaden dürfte demnach um rund acht Prozent auf etwa 244.000 zurückgehen. Die Zahl der Unfälle, die ausschließlich zu Sachschaden führen, dürfte auf knapp 2,0 Millionen ebenfalls leicht sinken. Für mehr Verkehrssicherheit auf den Straßen und besseren Klimaschutz haben sich viele Experten für ein Tempolimit auf Autobahnen ausgesprochen. Auf Druck der FDP fand dies im Koalitionsvertrag mit SPD und Grünen aber keine Berücksichtigung. Die Verkehrsminister der Länder hatten sich zuletzt im Grundsatz dafür ausgesprochen, das Mindestalter für begleitetes Fahren von 17 auf 16 Jahre herabzusetzen und zudem bestehende Führerschein-Vorgaben für Fahranfänger zu verschärfen. ""Angesichts des erhöhten Unfallrisikos bei jungen Menschen halten wir vor allem eine Verlängerung der Probezeit von zwei auf drei Jahre für den richtigen Weg, für mehr Sicherheit zu sorgen"", sagte Schleswig-Holsteins Ressortchef Bernd Buchholz (FDP). Allerdings sahen die Ressortchefs noch viele offene Fragen, die nun bis zum Frühjahr kommenden Jahres geklärt werden sollen. "
14.12.2021 09:11 Uhr,EU-Energiepolitik,"Mit Kernkraft zum ""Green Deal""-Ziel?","Taugt Atomkraft als ""grüne"" Energie? Berlin und Paris sehen das unterschiedlich, die EU-Kommission wird sich in ihrem Regelbuch für Investoren wohl auf Frankreichs Seite schlagen. Nicht nur Klimapolitiker finden das fragwürdig. Europas nachhaltiger Umbau, der ""Green Deal"", kostet Hunderte Milliarden Euro. Um öffentliches und privates Kapital in grüne Bahnen zu lenken, gibt die EU-Kommission Anlegern Empfehlungen, welche Finanzinstrumente aus ihrer Sicht Umwelt und Ressourcen schonen - die sogenannte Taxonomie. Doch reichen erneuerbare Energiequellen alleine nicht aus, erklärte Präsidentin Ursula von der Leyen nach dem jüngsten EU-Gipfel: ""Daneben brauchen wir eine verlässliche Quelle - Kernenergie-, und während des Übergangs natürlich Erdgas. Deshalb legen wir, wie im April angekündigt, unseren Taxonomie-Vorschlag vor."" Atomkraft als nachhaltige Technologie - dabei beruft sich die EU-Kommission auf Gutachten ihres wissenschaftlichen Dienstes. Demnach verursacht Kernenergie praktisch keine Treibhausgase und richtet im Vergleich zu anderen Energieträgern keine signifikanten Schäden an. Das sieht das deutsche Bundesamt für die Sicherheit der nuklearen Entsorgung ganz anders. Abteilungsleiter Jochen Ahlswede wirft den Kommissionsgutachtern vor, die Risiken der Kernenergie systematisch zu unterschätzen: ""Erstens ist die Entsorgung weltweit ungelöst. Zweitens bleibt beim Betrieb ein Restrisiko durch Unfälle oder terroristische Angriffe und drittens wird für den Brennstoff von Kernkraftwerken Uran benötigt, das oftmals unter fragwürdigen Bedingungen außerhalb der Europäischen Union abgebaut wird - und auch hierbei entstehen radioaktive Abfälle."" Deshalb rechne es sich auch wirtschaftlich nicht mehr, Geld in die Nuklearenergie zu stecken, sagt Sebastian Rausch vom Leibniz-Zentrum für Europäische Wirtschaftsforschung in Mannheim: ""Atomkraft hat hohe Bau- und Kapitalkosten, die mit unsicheren und niedrigen Einnahmen in liberalisierten Strommärkten auch künftig voraussichtlich nicht zu einem profitablen Geschäftsmodell führen werden. Selbst eine Verlängerung der Reaktorlaufzeiten auf zum Beispiel 60 Jahre verbessert diese Bewertung nicht wesentlich."" Investoren überlegen sich deshalb genau, ob sie noch Geld in diese Technologie investieren - sogar wenn die EU-Kommission ihr das grüne EU-Siegel verpassen sollte, sagt der Wirtschaftsexperte der EVP-Fraktion im EU-Parlament, Markus Ferber. Er glaube nicht, dass internationale Anleger plötzlich ""ihre Liebe zur Kernenergie"" entdeckten und das dann ihren Aktionären oder Anteilseignern als grünes Investment verkaufen könnten: ""Das halte ich doch für vermessen."" Der Klimaexperte der Europa-Grünen, Michael Bloss, sieht die gesamte EU-Taxonomie entwertet, falls Brüssel den Finanzmärkten darin faktisch empfiehlt, in Atomanlagen zu investieren: ""Die Idee, dass wir jetzt eine Orientierung geben am Finanzmarkt: Was ist wirklich nachhaltig? - das gibt’s damit nicht mehr. Damit ist der ganze Prozess, der seit 2018 läuft, eigentlich gescheitert."" Frankreichs Regierung gibt der Kernkraft trotzdem eine große Zukunft. Präsident Emmanuel Macron will sogar eine Milliarde Euro in deren Ausbau investieren und die Entwicklung neuer kleiner Meiler (SMR) fördern. Seine Begründung: Kernkraft mache die EU unabhängig von Lieferanten fossiler Brennstoffe und sei klimafreundlich. Frankreich gewinnt seinen Strom zu 70 Prozent aus der Atomkraftnutzung. Entsprechend groß ist das Interesse der Regierung in Paris daran, private Investitionen in Nuklearenergie zu erleichtern und sicherzustellen, dass die Atomkraft staatlich förderbar bleibt. Eine erste Belastungsprobe für die gerade frisch beschworene deutsch-französische Partnerschaft? Soweit will es Bundeskanzler Olaf Scholz offenbar nicht kommen lassen. Er betont demonstrativ gelassen: ""Andere Länder verfolgen andere Zielsetzungen und ich glaube, wir sind noch nicht beieinander. Aber alle diskutieren, wie man zueinander kommen kann. Mal sehen."" Die EU-Kommission steht in der heiklen Atomfrage zwischen den zwei größten und wichtigsten Mitgliedsstaaten. Ein möglicher Kompromiss: Brüssel stuft Atomkraft nur übergangsweise und mit klarem Enddatum versehen als nachhaltig ein. Bis Ende des Jahres will die Kommission ihr Regelbuch vorlegen. "
14.12.2021 08:45 Uhr,Corona-Pandemie,Erneute Proteste in zahlreichen Städten,"In mehreren Städten haben Gegner der Corona-Maßnahmen protestiert. In Magdeburg gingen 3500 Teilnehmer auf die Straße, in Rostock 2900. In Mannheim wurden sechs Polizisten im Einsatz gegen eine verbotene Versammlung verletzt. Gegner der Corona-Schutzmaßnahmen haben am Montagabend in zahlreichen deutschen Städten demonstriert. Die größte Ansammlung von Demonstranten gab es laut Polizei in der sachsen-anhaltischen Landeshauptstadt Magdeburg. Dort nahmen rund 3500 Menschen an einem Protest teil. Bei einer verbotenen Demonstration mit bis zu 2000 Teilnehmenden in Mannheim wurden sechs Polizistinnen und Polizisten verletzt. Die Mannheimer Polizei teilte mit, die Menschen seien ohne Einhaltung der Abstandsregeln und der Maskenpflicht in mehreren Aufzügen durch die Innenstadt gezogen. Platzverweise seien ignoriert worden, und einige Menschen hätten versucht, eine Polizeiabsperrung zu durchbrechen. Die Polizei zeigte insgesamt 121 Personen wegen Verstößen gegen das Versammlungsgesetz an. Weitere drei Menschen müssten wegen verschiedener Straftaten wie Widerstand oder Beleidigung mit Strafverfahren rechnen. In Erfurt versammelten sich einige Hundert Gegner der Corona-Maßnahmen. Einsatzkräfte hinderten laut Innenministerium mehrere Gruppen daran, in der Innenstadt zu demonstrieren. An mehreren Orten der thüringischen Landeshauptstadt kam es zu Festnahmen. Einsatzschwerpunkte der Polizei in Sachsen waren Chemnitz und Freiberg, wo zusammen mehr als zehn Versammlungen angemeldet worden waren. In Chemnitz stoppten die Beamtinnen und Beamten schließlich einen Aufzug von etwa 100 Menschen. Die Teilnehmerzahl in Freiberg gab die Polizei mit 450 Personen an. Im ostsächsischen Bautzen nahmen laut Polizei mehr als 500 Personen an angemeldeten und nicht angemeldeten Versammlungen teil. In Dresden versammelten sich laut Polizei rund 150 Menschen. Ein Zug von mehr als 100 Personen wurde aufgelöst. Gegen ein Dutzend Menschen wurden Ordnungswidrigkeitsverfahren eingeleitet. In den Regionen Dresden und Leipzig kam es an mehreren weiteren Orten zu Versammlungen. Demonstrationen gab es auch in Brandenburg und Mecklenburg-Vorpommern. In Rostock zählte die Polizei 2900 Teilnehmende, in Neubrandenburg 1200 und in der mecklenburg-vorpommerischen Landeshauptstadt Schwerin 1400 Personen. "
14.12.2021 08:12 Uhr,Zögerliche Buchungen,Omikron bremst die Reiselust,"Noch vor wenigen Wochen sah es nach einem Comeback der Reisebranche aus. Nun dämpfen die neue Corona-Variante Omikron und Reiserestriktionen die Lust auf Urlaub in der Ferne. Wo kann man noch sorgenlos hinreisen? Das fragen sich immer mehr Bürgerinnen und Bürger angesichts zunehmender Corona-Neuinfektionen und neuer (Teil-)Lockdowns in mehreren Ländern. Manche Staaten wie Israel, Australien und Japan haben ihre Grenzen wieder dicht gemacht. Andere Länder haben die Einreisebedingungen verschärft. Selbst die liberale Schweiz verlangt von allen Einreisenden, auch von Geimpften, einen negativen PCR-Test. Und die Weltgesundheitsorganisation WHO rät derzeit über 60-Jährigen ganz vom Reisen ab. Die Kundinnen und Kunden reagieren verunsichert. ""Die Ungewissheit, wie sich die Situation weiter entwickelt, führt zu einer spürbaren Zurückhaltung bei den Buchungsentscheidungen"", hat Norbert Fiebig, Präsident des deutschen Reiseverbands DRV, festgestellt. Er rechnet erst mit einer deutlichen Belebung der Nachfrage ab dem zweiten Quartal 2022. Das Reiseanalysehaus TDA prophezeit der Branche einen harten Winter. Schon in den beiden ersten November-Wochen habe es bei Neubuchungen einen leichten Abwärtstrend gegeben, wissen die Experten. Dass die hohen Corona-Infektionszahlen und Omikron die Nachfrage für die Wintermonate weiter bremsen werden, sei absehbar. Fluggesellschaften vermelden erste negative Auswirkungen der Reiserestriktionen. Der britische Billigflieger Easyjet berichtete jüngst über eine etwas nachlassende Nachfrage. ""Bei kurzfristigen Buchungen sehen wir auf wenigen Strecken Stornierungen"", sagte ein Lufthansa-Sprecher. Noch verbreiten die Reiseveranstalter Optimismus. Vor zwei Wochen jubelte TUI-Deutschland-Chef Stefan Baumert über die ""Wintersaison, die Fahrt aufgenommen"" habe. Viele Urlaubsorte, die noch vor einem Jahr aus dem Programm genommen waren, seien inzwischen wieder buchbar und gut nachgefragt. Der größte deutsche Reiseveranstalter ging von so hoher Nachfrage nach Flugreisen in den Weihnachtsferien aus, dass er sein Angebot aufstockte. Die Airline TUIfly bietet 36.000 zusätzliche Sitzplätze an - vor allem für Flüge zu den Kanarischen Inseln, aber auch zu Badezielen in Portugal und auf die Kapverden. Laut TUI liegen die klassischen Ziele wie die Kanarischen Inseln im Winterreisegeschäft derzeit ganz vorn. Begehrt seien auch die Kapverden, die Malediven, die Seychellen, Mauritius, die Dominikanische Republik und die Vereinigten Arabischen Emirate wie Dubai. Auf die Malediven würden fast so viele Menschen reisen wie vor der Pandemie, sagt Baumert. In Ägypten sieht die TUI noch Nachholeffekte. Ähnliche Kunden-Präferenzen hat der Reiseveranstalter Alltours festgestellt Aktuell ""laufen Kanaren, die Dominikanische Republik und die Malediven gut"", sagte ein Konzernsprecher zu tagesschau.de. Der Kölner Reisekonzern DER Touristic, eine Tochter von Rewe, berichtete jüngst ebenfalls über eine hohe Nachfrage: Ende Oktober lagen die Buchungen für das beliebte Winterziel Ägypten doppelt so hoch wie im Jahr 2018 vor der Pandemie, hieß es. Reisen auf die Kanaren und auf die Malediven seien auch sehr beliebt. Auch bei Reisebüros liegen Fernreise-Ziele in der Karibik und im Indischen Ozean in dieser nasskalten Jahreszeit im Trend. Sie berichteten über eine starke Nachfrage in die ""DomRep"", Kuba sowie einzelne Traumressorts auf den Malediven. Das Südafrika-Geschäft dagegen ist eingebrochen. Wer jetzt lieber innerhalb Europas verreisen möchte, der dürfte es schwer haben. Die Skisaison droht zur Zitterpartie zu werden. Österreich hat gerade erst einen mehrwöchigen Lockdown beendet. Nun hofft die Tourismusindustrie in der Alpenrepublik, dass die Saison endlich losgehen kann. Sollten die Corona-Zahlen aber wieder massiv steigen, könnte es erneut Einschränkungen geben. Klar ist, dass Ungeimpfte wohl nicht in Berghütten und Seilbahn-Gondeln hineindürfen. Wer Urlaub in Österreich machen will, braucht für Hotels, Restaurants, Skilifte und sonstige Kultureinrichtungen einen Impf- oder Genesenen-Nachweis. Die 2G-Regel gilt auch für Kinder ab zwölf Jahren. Eine Alternative könnte Skiurlaub in der Schweiz sein. Die Eidgenossen sind deutlich lockerer. Sie lassen alle Ausländer auf Skipisten zu. Allerdings muss man bei der Einreise seit eineinhalb Wochen einen negativen PCR-Test vorweisen, selbst wenn man geimpft ist. Drei bis vier Tage nach der Einreise muss dann ein weiterer Antigen-Schnelltest gemacht werden. Das kann für Familien mit Kindern schnell ins Geld gehen, zumal die Schweiz schon jetzt als sehr teures Reiseland gilt. Der Schweizer Franken hat zuletzt deutlich aufgewertet gegenüber dem Euro. Billiger ist Skiurlaub in Deutschland. Doch ob dieser möglich ist, bleibt nach wie vor ungewiss. Wegen hoher Corona-Neuinfektionen hat Bayern harte Restriktionen verhängt. Für Seilbahnen wird jetzt 2G verlangt. Zwar hat vor dreieinhalb Wochen die Zugspitze die Skisaison unter 2G-Regeln gestartet, aber der große Ansturm blieb aus. Viele Skifahrer haben ein mulmiges Gefühl, wenn unten im Tal die Krankenhäuser mit Corona-Kranken überbelegt sind. Noch wäre ein Abgesang auf den Skiurlaub verfrüht, warnt die TUI. Der Reisekonzern ist zuversichtlich, dass die Wintersaison in Österreich stattfinden kann. Die Saison laufe erst nach Weihnachten richtig an. ""Die österreichischen Winterziele werden weiter gut gebucht, ebenso wie die Schweiz"", hieß es noch vor zwei Wochen von der TUI. Wem das Risiko zu groß ist, der kann relativ flexibel umbuchen - vorausgesetzt, er hat die Reise schon lange gebucht. Die TUI bietet weiterhin den ""Flex-Tarif"" an: Kunden können gegen einen Aufpreis bis zwei Wochen vor Reisebeginn umbuchen oder stornieren. Noch kulanter ist Alltours: Die Aktion ""Flexibel buchen"" wird bis zur Sommersaison 2022 verlängert. Wer bis Ende Januar eine Klassik-Reise für die Zeit bis Ende April bucht, kann bis sieben Tage vor der Abreise eine kostenlose Stornierung oder Umbuchung machen. Ab Mai ist dann eine Umbuchung bis 14 Tage vor der Abreise möglich. Für Last-Minute-Bucher indes sind Umbuchungen deutlich schwieriger und teurer. Erteilt das Auswärtige Amt eine Reisewarnung für ein Hochrisiko- oder Virusvariantengebiet oder kann der Veranstalter die Reise nicht wie vereinbart durchführen, dürften Kunden in der Regel kostenfrei stornieren. Wer jedoch eine Reise bucht, obwohl Einschränkungen schon absehbar waren, erhält meist kein Geld zurück, sagen Verbraucherschützer. Vor allem Individualreisende haben im Vergleich zu Pauschalreisenden deutlich weniger Rechte. "
14.12.2021 07:51 Uhr,"Stärke von 7,3",Schweres Seebeben erschüttert Indonesien,"Menschen rennen aus schwankenden Häusern oder fliehen auf dem Motorrad: Im südostasiatischen Indonesien gab es ein heftiges Seebeben. Berichte über Opfer und Sachschäden liegen bislang nicht vor. Vor der Ostküste Indonesiens hat es ein heftiges Seebeben gegeben. Die US-Erdbebenwarte USGS bezifferte die Stärke mit 7,3. Die nationale Erdbebenwarte löste zunächst eine Tsunami-Warnung für die umliegenden Inseln aus. Die hoben die Behörden hoben sie wenige Stunden später aber wieder auf. Berichte über Opfer oder Sachschäden gab es zunächst nicht. Der US-Erdbebenwarte zufolge gab es ein Nachbeben der Stärke 5,6. Das erste Beben ereignete sich um 12.20 Uhr (Ortszeit), etwa 110 Kilometer nordwestlich der Insel Flores. Sein Zentrum lag laut indonesischer Behörden in rund zwölf Kilometern Tiefe, die USGS sprach von 18,5 Kilometern. Die Erdstöße waren nach Angaben des Leiters der indonesischen Katastrophenschutzbehörde, Abdul Muhari, deutlich zu spüren. Fernsehaufnahmen zeigten, wie Menschen aus schwankenden Häusern rannten und zu Fuß oder auf Motorrädern versuchten, die Küstenregionen zu verlassen. Der Verwalter des Bezirkes Flores Timur, Anton Hayon, rief die Menschen auf, sich besonders im Norden von der Küste fernzuhalten. Dort habe es 1972 einen Tsunami gegeben. Dank einer erst vor Kurzem abgehaltenen Tsunami-Übung hätten die Einwohnerinnen und Einwohner auch gewusst, wie sie sich verhalten mussten. Der südostasiatische Inselstaat Indonesien liegt auf dem Pazifischen Feuerring, der geologisch aktivsten Zone der Erde. Dort gibt es häufig Erdbeben und Vulkanausbrüche. Besonders folgenschwer war ein Seebeben der Stärke 9 vor der Insel Sumatra, das an Weihnachten 2004 gewaltige Tsunamis auslöste. Insgesamt kamen etwa 230.000 Menschen ums Leben. Neben Indonesien waren damals vor allem Indien, Sri Lanka, Thailand und Malaysia betroffen. "
