date,topline,headline,content22.08.2022 15:05 Uhr,Schriftstellerin Ganijewa,"""Es braucht eine andere Art von Widerstand""","Schriftstellerin Alissa Ganijewa hat Russland aus politischen Gründen verlassen. Sie beschreibt, warum herkömmlicher Protest ""sinnlos"" ist - und wie unterschiedlich die Russen mit ihrer moralischen Verantwortung umgehen. ARD: Fiel es Ihnen schwer, Russland zu verlassen? Ganijewa: Mir schien immer, dass ich nie freiwillig emigrieren würde, sondern nur, wenn der Anfang vom Ende sichtbar sein würde - also vielleicht jahrelange Haft drohen würde. Leute fragten mich ständig, warum ich noch da sei: ""Du warst mit Protestplakaten auf der Straße, du hast Pakete gepackt für ukrainische Kriegsgefangene. Es ist zu gefährlich."" Ich wollte lange nicht gehen. Doch es wurde täglich beunruhigender. Es gab immer weniger Flüge ins Ausland, die Duma verabschiedete ein bedrohliches Gesetz nach dem anderen - das Gesetz über Fake News, das Gesetz über Diskreditierung der Armee. Bald danach begannen die Festnahmen und Strafverfahren. ARD: Was hat den Ausschlag gegeben für Ihre Ausreise? Ganijewa: Es war ja fast physisch spürbar, wie es enger wird, wie sich eine Schlinge zuzieht. Bei einigen meiner Bekannten gab es Hausdurchsuchungen, andere bekamen vorbeugende Haftstrafen. Aus den Chats, in denen wir uns austauschten, verschwanden nach und nach die Leute. Sie schrieben: ""Ich bin festgenommen, ich verlasse jetzt die Gruppe, damit sie Eure Kontakte nicht finden."" Zu gehen war dann nicht einmal meine eigene Entscheidung. Es war mein Mann, der sagte: ""Du solltest für eine Weile ins Ausland."" Die Entscheidung fiel abends um neun. Und um Mitternacht saß ich im Zug. Sie können sich vorstellen, in welcher Hast ich gepackt habe. Es war ja nicht klar, ob die Grenze geöffnet bleiben würde. ARD: War Ihnen bewusst, dass aus der ""Weile"" Monate werden könnten? Ganijewa: Ich hoffte immer, dass es nicht für lange sein würde. Du lebst - vielleicht wie alle Emigranten - in der Erwartung, dass es vorübergeht, dass es nur eine Frage der Zeit ist. In den ersten Wochen schien es mir noch, als könnte ich, falls nötig, schnell zurückkehren. Aber ich sah dann auch, wie sinnlos der Protest in Russland ist. Wer mit einem Plakat auf die Straße geht, wird sofort festgenommen. Und wer nur eine Verwaltungsstrafe bekommt, also eine Geldstrafe, finanziert zwangsläufig den Krieg. Es braucht eine andere Art von Widerstand, der überall praktiziert werden kann und wirkt, auf beiden Seiten der Grenze. Eine innere moralische Einstellung. ARD: Gibt es dieses Bewusstsein auch in Russland? Ganijewa: Es gibt so tiefe Gräben jetzt. Nicht nur zwischen Russen und Ukrainern, das ist unvermeidlich - sondern auch innerhalb der russischen Gesellschaft gibt es so viele Trennlinien. Die schärfste, so scheint mir, verläuft nicht zwischen denen, die gegangen und denen, die geblieben sind. Sondern zwischen denen, die ihre eigene, sei es auch nur relative Verantwortung für die blutigen Ereignisse in der Ukraine anerkennen - und denen, die das nicht tun. Auch denen, die sich selbst freisprechen und sagen: ""Wir haben nichts damit zu tun. Und seht, wir helfen doch jetzt Flüchtlingen."" Diese Leute sind verletzt, wenn Ukrainer in sozialen Medien über den Schmerz, das Leid schreiben und dafür auch sie verantwortlich machen. Sie wollen nicht akzeptieren, dass es unmöglich ist, Angehörige eines Volkes zu lieben, das dich gerade töten will, das dich bombardiert. Sie wollen trotz des Krieges nach den Gesetzen des Friedens leben, in denen es keinen Hass gibt. ARD: Noch einmal zurückgeblickt: Wie haben Sie den 24. Februar in Erinnerung? Ganijewa: Morgens habe ich auf Telegram die Nachrichten gelesen, mit dieser Vorahnung. Und dann waren da die Eilmeldungen, die Karte der Ukraine, übersät mit roten Symbolen, eines für jeden Angriff. Die Bomben auf Kiew, die Schlangen von Menschen, die die Stadt verlassen. Ich habe sofort den Ukrainern geschrieben, die ich kenne, habe gefragt, wie es ihnen geht, wo sie sind. Du weißt ja nicht, was du tun kannst, wie du helfen kannst, da ist diese totale Machtlosigkeit. Und das Gefühl des Grauens. Plötzlich waren die schlimmsten Fantasien eingetreten. Russland ist wirklich in die Ukraine einmarschiert, wie wir es seit November befürchtet hatten. ARD: Das heißt, Sie hatten damit gerechnet? Ganijewa: Ja, im Gegensatz zu vielen anderen habe ich es immer für möglich gehalten. Ich hatte für mich sogar das Datum festgelegt, hatte vermutet, dass es der 23. Februar sein könnte, der Feiertag der russischen Armee. Die Olympischen Spiele würden dann vorbei sein, während der Spiele würde niemand diesen quasi-Frieden beenden, so hatte ich mir ausgerechnet. Es war also keine Überraschung für mich. Und dennoch - es war unwirklich, wie in einem Traum. Die Zeit lief langsamer. Überhaupt fühlten sich diese ersten Tage apokalyptisch an. Dein Land hat alle moralischen Schwellen überschritten, sein einzig denkbarer weiterer Weg ist der, auf einen Abgrund zuzurollen und hineinzustürzen ... weil es unmöglich scheint, mit dieser Last weiter zu existieren. Jeder Bürger Russlands, jeder, der auf die eine oder andere Weise zu dieser Gesellschaft gehört, muss nun für sich dieses moralische Rebus, diese Aufgabe lösen: Wie geht man mit dem um, was da gerade geschieht? ARD: Wie fühlt es sich an, Emigrantin zu sein, ohne Zuhause zu sein? Ganijewa: Mir scheint, es hängt von den Auswanderungsgründen ab. Ginge es etwa um eine Revolution wie 1917, wäre das ein ganz anderes Gefühl. Du hättest das Recht, dich zu beschweren über deine Situation, dich ein wenig zu bemitleiden, auch mit deinem Land zu leiden. Jetzt ist die Situation völlig anders. Du hast ein Land verlassen, das ein Aggressor ist, das sich geriert wie ein Terrorstaat. Du kannst nicht einfach Heimweh haben. Denn der Krieg geht weiter. Dein Land tötet weiterhin Zivilisten im Nachbarland. Und solange es das tut, kannst du nicht entspannen. Du erlaubst dir kein inneres Recht auf ein normales Alltagsleben, auf Kreativität, auf Kulturleben. Für mich hat sich alles geändert. Fast all mein Sozialleben findet jetzt virtuell statt. Ich habe keine Arbeit, kein Gefühl für eine Zukunft. Und doch spüre ich inneren Optimismus, eine Gewissheit, auf der historisch richtigen Seite zu stehen. Ich muss nun lernen, loszulassen, nicht mehr ständig auf dem Sprung zu sein, nicht mehr jeden Moment daran zu denken, wann ich zurückkehren kann nach Moskau. Denn es wird lange dauern. Dies ist das Schwierigste: den Standby-Modus auszuschalten. Ich habe das noch nicht geschafft. Und so vielen Menschen mag es ähnlich ergehen. "
22.08.2022 15:02 Uhr,Anschlag auf Dugina,Russland macht Ukraine verantwortlich,"Zwei Tage nach dem Anschlag auf die Kriegsunterstützerin Dugina hat Russland seine Ermittlungsergebnisse präsentiert: Demnach sollen ukrainische Geheimdienste das Attentat vorbereitet und begangen haben. Kiew weist das zurück. Der russische Inlandsgeheimdienst FSB hat ukrainische Geheimdienste für die Tötung der Tochter des nationalistischen Ideologen Alexander Dugin verantwortlich gemacht. Die Tötung Darja Duginas sei von ukrainischen Geheimdiensten ""vorbereitet und begangen"" worden. Ausgeführt habe die Tat eine ukrainische Staatsbürgerin, die im Anschluss von Russland nach Estland ausgereist sei. Der FSB erklärte, dass die Verdächtige Natalja W. eine Wohnung in dem Gebäude gemietet habe, in dem Dugina lebte, und sie beschattet habe. Bevor die 29-Jährige bei der Detonation einer an dem von ihr genutzten Auto angebrachten Bombe starb, hatte sie mit ihrem Vater an einem nationalistischen Festival bei Moskau teilgenommen. Der ukrainische Präsidentenberater Mychailo Podoljak wies die Vorwürfe zurück. ""Die Ukraine hat sicherlich nichts mit der gestrigen Explosion zu tun, weil wir kein krimineller Staat sind"", sagte er. Wie russische Medien am Samstag berichtet hatten, war das eigentliche Ziel des Anschlags wohl Duginas Vater, der als wichtiger Vordenker von Präsident Wladimir Putin gilt. Der ultranationalistische Intellektuelle und Publizist wird wegen seines Einflusses auf den Kreml oft als ""Putins Rasputin"" oder ""Putins Gehirn"" bezeichnet. Dugin vertritt seit Langem eine Ideologie, die die Vereinigung russischsprachiger Gebiete in einem neuen russischen Großreich vorsieht. Aus dieser Überzeugung heraus unterstützt er auch den russischen Militäreinsatz in der Ukraine. Dugin, der auch mit Rechtsextremen in Europa gut vernetzt ist, steht schon seit der Annexion der ukrainischen Schwarzmeer-Halbinsel Krim 2014 auf der Sanktionsliste der EU. In der Ukraine sind mehrere seiner Bücher verboten. Seine Tochter Daria hatte die russische Militäroffensive in der Ukraine ebenfalls offen unterstützt. Die 1992 geborene Journalistin war deshalb von britischen Sanktionen betroffen. Ein ehemaliger Abgeordneter der russischen Opposition, Ilja Ponomarjow, sagte im ukrainischen Fernsehen, eine unbekannte russische Gruppe namens ""Nationale Republikanische Armee"" habe sich zu dem Bombenanschlag bekannt. Die Existenz einer solchen Organisation konnte nicht bestätigt werden. Ponomarjow erklärte, dass die Partisanengruppe eigentlich auch ihren Vater habe treffen wollen: ""Weil Dugin das Gehirn war, Darja war die Hand. Es gab eine Menge Wut auf Darja Dugina selbst"", so Ponomarjow. Das liege daran, dass Dugina in Azowstal gewesen sei. Viele hielten sie auch verantwortlich für den Gefängnisangriff in der Siedlung Oleniwka, so Ponomarjow. ""Es gibt hier ein Element der Rache. Dugin ist der Ideologe des Faschismus. Er ist die Person, die den Begriff 'Neurussland' allgemein in das russische politische Lexikon eingeführt hat"", so Ponomarjow weiter. Ponomarjow ist wegen seiner politischen Vergangenheit höchst umstritten. Zudem hat man zuvor noch nie etwas von der genannten ""Nationalen Republikanischen Armee"" gehört. Experten vermuten, dass es sich genauso gut um die Aktion eines Trittbrettfahrers handeln könnte. "
22.08.2022 14:54 Uhr,Energiebranche,Zwölf Unternehmen wollen die Gasumlage,"Ein Dutzend Energiefirmen wollen die neue Gasumlage in Anspruch nehmen. Insgesamt geht es um 34 Milliarden Euro. Aber brauchen wirklich alle Unternehmen das Geld aus der Umlage unbedingt? Nun ist die Liste der Energieunternehmen, die die Gasumlage nutzen wollen, offiziell: Laut Gemeinschaftsunternehmen Trading Hub Europe, das heute eine entsprechende Aufstellung veröffentlichte, haben sich zwölf Unternehmen der Branche für die Nutzung der Umlage registrieren lassen. Unter ihnen sind Uniper, die EnBW-Tochter VNG, der Versorger EWE, Wingas, die zur ehemaligen Gazprom Germania, jetzt Sefe, gehört sowie die WIEH GmbH. Außerdem sind einige ausländische Unternehmen auf der Liste: Der österreichische Öl- und Gaskonzern OMV, das schweizerische Energiehandelsunternehmen Axpo sowie der niederländisch-schweizerische Rohstoffhändler Vitol und sein Schweizer Wettbewerber Gunvor. Hinzu kommen die Schweizer Unternehmen DXT Commodities und Enet Energy. Insgesamt geht es laut Bundeswirtschaftsministerium um Ansprüche von insgesamt rund 34 Milliarden Euro, die über die Gasumlage erstattet werden sollen. Auch der Energiekonzern RWE hat sich für die Umlage registrieren lassen, aber bereits angekündigt, die Gelder nicht in Anspruch nehmen zu wollen. RWE erklärte dazu heute: ""Ja, wir sind dort formal gelistet, haben aber keinen finanziellen Schaden dort gemeldet beziehungsweise geltend gemacht. Wir tragen wie bekannt die Verluste selber."" Eine Sprecherin sagte, dass mit der Registrierung formal ein Rechtsanspruch bestehe. RWE plane aber ""auch keine Geltendmachung in der Zukunft"". Im ersten Halbjahr hatte RWE 2,8 Milliarden Euro verdient - über ein Drittel mehr als im Vorjahreszeitraum. Auch Shell verzichtet auf die Nutzung der Gasumlage. Das teilte eine Sprecherin in der vergangenen Woche mit. ""Shell und RWE haben sich offenbar bewusst gegen eine Gasumlage entschieden, um nicht öffentlich angreifbar zu werden"", sagte Jörg Scheyhing, Geschäftsführer der Energieberatungsfirma ECG, gegenüber tagesschau.de. Bei anderen Gas-Importeuren wie VNG gehe es um viel Geld: ""Da können sie nicht einfach darauf verzichten."" Allerdings profitieren gerade die ausländischen Energieunternehmen derzeit von den hohen Öl-, Gas- und Strompreisen. Sie haben im ersten Halbjahr ihren Gewinn zum Teil um bis zu 200 Prozent steigern können. Auch bei einigen deutschen Antragsstellern ist Experten zufolge fraglich, ob sie auf die Gasumlage wirklich angewiesen sind. Der Gasimporteur VNG erlitt zwar in den ersten sechs Monaten dieses Jahres Verluste, gehört aber zum Energieversorger EnBW. Und dieser machte im ersten Halbjahr einen Gewinn von 1,4 Milliarden Euro. EnBW-Chef Frank Mastiaux erklärte jüngst im ""Handelsblatt"", es sei unwahrscheinlich, dass VNG in eine Schieflage wie Uniper geraten könne. Das Risiko sei zwar ""nicht klein, aber auch nicht existenziell"". Auch der Oldenburger Versorger EWE ist profitabel. Im abgelaufenen Geschäftsjahr verdienten die Niedersachsen operativ rund 355 Millionen Euro. Zudem hat EWE mit der Investmentgesellschaft Ardian einen finanzstarken Partner. Ardian hält 26 Prozent am Versorger. Verbraucherschützer übten Kritik an Unternehmen, die die Gasumlage in Anspruch nehmen wollen, ohne sie zu benötigen. Die Chefin des Bundesverbands der Verbraucherzentralen (vzbv), Ramona Pop, warnte davor, die falschen Firmen zu stützen. ""Die Bundesregierung hat eindeutig formuliert, dass sie mit der Gasumlage Insolvenzen verhindern will, die Absicherung von Gewinnen auf Kosten der Verbraucher aber ausgeschlossen werden soll"", sagte sie im ""Handelsblatt"". Es sei dringend geboten, dass denjenigen Unternehmen, ""die trotz sprudelnder Gewinne von der Umlage profitieren wollen, keine Unterstützung gewährt wird"". Es dürfe nicht sein, dass Verbraucher die Gewinne und Dividenden von Unternehmen finanzieren. Theoretisch konnte jedes Unternehmen, das russisches Gas importiert, den Antrag auf die Gasumlage stellen. In Deutschland kamen nach Schätzung von Experten wie Scheyhing bis zu 20 Unternehmen in Frage. Gas-Importeure sind derzeit gezwungen, wegen der deutlich gedrosselten russischen Lieferungen teure Alternativen einzukaufen, um ihre Verträge einzuhalten. Um Schieflagen zu vermeiden und letztlich die Versorgungssicherheit zu gewährleisten, können sie ab Oktober 90 Prozent der so entstehenden Zusatzkosten weiterreichen. Diese sollen über die Gasumlage auf alle Endkunden verteilt werden. "
22.08.2022 14:06 Uhr,Devisenhandel,Euro sackt wieder unter Dollar-Parität,"Der Euro war heute zwischenzeitlich wieder weniger wert als ein Dollar. Investoren fürchten eine weitere Straffung der US-Geldpolitik. Auch die Gaskrise trägt zur Flucht aus der Gemeinschaftswährung bei. Der Euro ist erstmals seit Mitte Juli wieder unter die Dollarparität gefallen. Unter Parität versteht man ein Tauschverhältnis von eins zu eins zwischen zwei Währungen. Mit 0,9988 hat die Gemeinschaftswährung zeitweise um bis 0,5 Prozent nachgegeben und erreichte den niedrigsten Stand seit fünf Wochen. Grund für das neuerliche Schwächesignal des Euro ist wieder einmal die Zinspolitik der US-Notenbank Federal Reserve (Fed). Viele Anleger rechnen derzeit damit, dass die Fed den Leitzins am 21. September erneut um 75 Basispunkte anheben wird. Zuletzt hatten relativ starke Konjunkturdaten aus den USA darauf hingedeutet, dass sich die US-Wirtschaft weiterhin robust zeigen wird. Dadurch erweitert sich der Spielraum der Fed für kräftige Zinserhöhungen. Generell werden in den USA stärkere Zinserhöhungen im Kampf gegen die hohe Inflation erwartet als in der Eurozone, was dem Dollar Vorteile beim Handel mit dem Euro verschafft. So hatte sich der Chef der Fed-Filiale von St. Louis, James Bullard, im ""Wall Street Journal"" für eine Erhöhung der Leitzinsen um 0,75 Prozentpunkte bei der nächsten Sitzung ausgesprochen. Die Federal Reserve (Fed) sollte sich weiterhin zügig auf ein Zinsniveau bewegen, das die Inflation deutlich nach unten bringe, sagte Bullard: ""Ich verstehe nicht, warum man Zinsanhebungen ins nächste Jahr hinauszögern sollte."" Die Fachleute der Helaba wiesen darauf hin, dass sich zahlreiche Vertreter der US-Notenbank zuletzt einhellig für weitere Leitzinserhöhungen ausgesprochen hätten - selbst wenn eine Rezession ausgelöst würde. Neben der Geldpolitik der Fed spielt auch die europäische Energiekrise eine wichtige Rolle bei der Schwäche der Gemeinschaftswährung: Die Furcht vor Engpässen treibt den Gaspreis weiter an. Der europäische Future stieg um mehr als zehn Prozent auf 282,50 Euro je Megawattstunde. Der russische Exporteur Gazprom hat am Freitag angekündigt, zum Monatsende erneut vorübergehend den Betrieb der Pipeline Nord Stream 1 wegen Wartungsarbeiten zu unterbrechen. Die steigenden Energiepreise befeuern Sorgen, dass es zu einem schwerwiegenderen konjunkturellen Abschwung kommen könnte: Es ist die Angst vor einer Rezession in Europa, die - durch die Energiekrise ausgelöst - Anleger vor Investments in den Euro zurückschrecken lässt. Und je heftiger der wirtschaftliche Rückschlag ist, desto geringer sind die Möglichkeiten der EZB, die Zinsen scharf anzuheben. "
22.08.2022 14:06 Uhr,DHL mit neuen Zuschlägen,Paketpreise für Firmenkunden steigen,"Auf Geschäftskunden von DHL Paket kommen ab 2023 kräftige Preissteigerungen zu. Neben einer Erhöhung des Basispreises müssen sie künftig einen variablen Energiezuschlag und einen ""Peakzuschlag"" in der Weihnachtszeit zahlen. Ab Anfang 2023 müssen Firmenkunden der Deutsche -Post-Tochter DHL Paket deutlich mehr für den Versand von Paketen zahlen. Wie das Unternehmen ankündigte, steigen die Basispreise deutlich. Zudem führt DHL Paket zwei neue Zuschläge ein. So soll es zum einen ab dem 1. Januar 2023 einen variablen Energiezuschlag geben, der sich an der Preisentwicklung von Diesel, Gas und Strom orientiert. Der ""indexierte Energiezuschlag"" auf den Basispreis verschiedener Produkte werde zur Absicherung gegen Schwankungen der Energiekosten eingeführt, hieß es als Begründung. Die Höhe des Zuschlags werde monatlich ermittelt. Zum anderen erhebt DHL Paket in den Monaten November und Dezember ab dem kommenden Jahr einen sogenannten ""Peakzuschlag"" in Höhe von 19 Cent pro Sendung. In den beiden letzten Monaten des Jahres ist das Paketaufkommen aufgrund der Weihnachtszeit besonders hoch. Diesen neuen Zuschlag begründete das Unternehmen mit notwendigen Investitionen in die eigene Infrastruktur, mit dem hohen Personalaufwand und höherer Einkaufspreisen rund um Weihnachten. Details zur Erhöhung des Basispreises bei DHL Paket nannte der Konzern aber nicht. Die Preise für Firmenkunden werden individuell ausgehandelt. Ein weiterer Bestandteil der angekündigten Preiserhöhungen ist den Angaben zufolge die Anpassung des Maut- und CO2-Zuschlags, der sich um 0,01 Euro pro Sendung erhöht. ""Wir alle nehmen die sich verändernden Kosten wahr. Daher werden wir aufgrund der volatilen und stark extern getriebenen Marktentwicklung sowie notwendiger Investitionen in unser Netzwerk neue Zuschläge einführen“, erklärte Ole Nordhoff, Marketingchef bei Post & Paket Deutschland der Deutsche Post DHL Group. Für Privatkunden sollen sich die Preise für den DHL-Paketversand nicht ändern, teilte das Unternehmen mit. Die angekündigten Preiserhöhungen betreffen demnach ausschließlich Geschäftskunden. Auch das nationale und internationale Express-Geschäft der Tochter DHL sind den Angaben zufolge von dem Erhöhungspaket nicht betroffen. Auch wenn die Preiserhöhungen nicht unmittelbar für Privatkunden gelten, könnten die Unternehmen ihre steigenden Kosten in Form höherer Versandkosten letztlich an die Endkunden weitergeben. Die Preise für Privatkunden hatte der Konzern zudem bereits im Vorfeld angehoben. Seit Juli werden beispielsweise für die Beförderung eines Pakets von bis zu zwei Kilogramm 50 Cent mehr fällig als davor. "
22.08.2022 14:01 Uhr,Berlin,Neuer Botschafter Israels im Amt,"Der neue israelische Botschafter hat offiziell sein Amt in Berlin angetreten. Prosor betonte, er wolle auch künftig seine Stimme gegen Antisemitismus erheben. Der frühere UN-Botschafter hat familiäre Beziehungen zu Deutschland. Der neue israelische Botschafter in Deutschland, Ron Prosor, hat heute sein Amt in Berlin angetreten. Der 63-Jährige erhielt von Bundespräsident Frank-Walter Steinmeier in Schloss Bellevue seine Akkreditierung. Prosor löst Jeremy Issacharoff ab, der seit August 2017 Botschafter des Staates Israel in Deutschland war. Der 63-Jährige hat familiäre Beziehungen zu Deutschland: Prosors Vater Uri, der ebenfalls für Israel als Diplomat tätig war, wurde 1927 in Berlin geboren. Nach der Machtergreifung der Nationalsozialisten floh seine Familie 1933 nach Palästina. Sein Vater sei ein echter Preuße gewesen, sagte Prosor kürzlich in einem Interview. Seine Mutter stamme aus Odessa. Er selbst wurde 1958 in Tel Aviv geboren. Prosor gilt als einer der profiliertesten israelischen Diplomaten. Zwischen 2011 und 2015 war er Israels Botschafter bei den Vereinten Nationen. Davor vertrat der gelernte Artillerieoffizier im Rang eines Majors vier Jahre lang sein Land in Großbritannien. Von 1988 bis 1992 war Prosor an der Botschaft in Bonn und pflegte Verbindungen in die DDR. Nach dem Fall der Mauer 1989 knüpfte er Kontakte in die neuen Bundesländer. Es sei ihm eine große Ehre, als Botschafter Israels in Deutschland zu sein, schrieb Prosor auf Schloss Bellevue ins Gästebuch des Bundespräsidenten. Die Ernennung sei für ihn ""nicht nur eine berufliche Aufgabe, sondern auch ein tiefes persönliches Anliegen"", hob er nach Angaben der Botschaft hervor. Bei seinem Eintreffen in Berlin Anfang August hatte er in fließendem Deutsch betont, die deutsch-israelischen Beziehungen lägen ihm seit Langem sehr am Herzen. Wegen seiner Familiengeschichte schließe sich mit dem Botschafterposten für ihn ein Kreis: ""Für mich ist es nicht nur eine berufliche Aufgabe, sondern auch eine persönliche."" Wie persönlich der Kontakt zwischen Berlin und Jerusalem ist, zeigt ein Tweet zum Amtsantritt des früheren deutschen Regierungssprechers Steffen Seibert als neuer Botschafter in Israel: Prosor duzte seinen Amtskollegen. Er nannte Seibert einen lieben Freund. Schon vor seinem offiziellen Amtsantritt hat Prosor klar gemacht, dass er auch künftig seine Stimme gegen Antisemitismus erheben wird. Den Holocaust-Vergleich von Palästinenserpräsident Mahmud Abbas kommentierte Prosor auf Twitter mit ""Schande!"" und forderte null Toleranz gegenüber dem Leugnen des Holocausts. Abbas hatte Israel am Dienstag vielfachen ""Holocaust"" an den Palästinensern vorgeworfen und damit Empörung ausgelöst. "
