date,topline,headline,content
22.08.2022 22:23 Uhr,Auswertung historischer Daten,Schweizer Gletscher halbiert,"Erstmals haben Forschende die Entwicklung der Schweizer Gletscher im 20. Jahrhundert rekonstruiert. Ihre Beobachtungen sind alarmierend: Seit 1931 nahm das Eisvolumen um knapp die Hälfte ab. Und die Entwicklung verläuft immer rasanter. Die Schweiz hat zwischen 1931 und 2016 knapp die Hälfte ihres Gletschereises verloren. Das geht aus einer in der Fachzeitschrift ""The Cryosphere"" veröffentlichten Studie hervor. Den Forschenden der Eidgenössischen Technischen Hochschule Zürich (ETH) und der Eidgenössischen Forschungsanstalt für Wald, Schnee und Landschaft (WSL) lagen für den Zeitraum ab 1931 unter anderem Fotos von Landvermessern vor, die in der ersten Hälfte des 20. Jahrhunderts an rund 7000 Standorten fotografiert und etwa 86 Prozent der vergletscherten Fläche der Schweiz abgedeckt hatten. Anhand der historischen Bilder konnten sie das Volumen schätzen und mit aktuelleren Messungen vergleichen. Die Wissenschaftler stützen sich bei ihren Analysen außerdem auf Langzeitbeobachtungen von Gletschern, Messungen im Gelände sowie Luft- und Gipfelfotos. Durch die Verwendung mehrerer Quellen konnten die Forscher Lücken schließen, denn nur wenige Gletscher in der Schweiz wurden im Laufe der Jahre regelmäßig untersucht. Die Teams verglichen auch die Oberflächentopographie von Gletschern zu verschiedenen Zeitpunkten, was Berechnungen über die Entwicklung des Eisvolumens ermöglichte. So glich etwa der Fieschergletscher 1928 noch einem großen Eismeer. 2021 waren auf dem Berghang nur noch kleine weiße Flecken zu sehen. Seit 2016 habe sich der Eisschwund nach den Messdaten des Gletschermessnetzes Glamos sogar noch beschleunigt, berichtet die ETH. Demnach schrumpfte das Eisvolumen der Gletscher in den vergangenen sechs Jahren um weitere zwölf Prozent. Nicht alle Gletscher waren gleichermaßen betroffen. ""Wie stark sich das Volumen verringert hat, hängt im Wesentlichen von drei Faktoren ab: Erstens auf welcher Höhe sich die Gletscher befinden, zweitens wie flach die Gletscherzunge ausläuft und drittens wie stark die Gletscher mit Schutt bedeckt sind"", berichtete die ETH. Den Fachleuten zufolge haben sich die Gletscher im vergangenen Jahrhundert aber nicht immer verkleinert. In den 1920er- und den 1980er-Jahren sei die Masse einzelner Gletscher teils gewachsen und es kam zu einzelnen Gletschervorstößen. ""Auch wenn es über kürzere Zeiträume zu einem Zuwachs kam ist es trotzdem wichtig, das Gesamtbild im Auge zu behalten. Unser Vergleich zwischen den Jahren 1931 und 2016 zeigt deutlich, dass es in diesem Zeitraum einen markanten Gletscherschwund gab"", sagte ETH-Glaziologe Daniel Farinotti - und der Rückgang beschleunige sich. "
22.08.2022 22:11 Uhr,Börsen in Sorge,Böses Erwachen,"Rund um den Globus sind die Inflations- und Wachstumssorgen wieder erwacht. Wie in Europa gerieten auch die amerikanischen Märkte unter starken Abgabedruck. Die Geldentwertung schreitet fort, und die Wachstumsaussichten werden einfach nicht besser. Diese Tatsachen schlagen nun wieder an den Aktienmärkten durch. Wie zuvor an den europäischen Märkten haben sich die Kursverluste an der Wall Street im Verlauf ausgeweitet. Der Dow Jones ging 1,9 Prozent tiefer aus dem Handel. Die Investoren werden also wieder vorsichtiger, nachdem sie zuletzt darauf gesetzt hatten, dass die Inflation ihren Höhepunkt erreicht haben könnte - trotz deutlicher Warnungen von Experten und Notenbankern. Ein Indiz dafür, dass sich die US-Anleger vor allem um die Zinsentwicklung sorgen, ist der noch deutlichere Verlust der Technologietitel, die wegen ihrer vergleichsweise höheren Verschuldung als besonders zinssensitiv gelten. Der Technologieindex Nasdaq 100 büßte 2,7 Prozent ein. Mit besonderer Spannung blicken die Anleger auf das an diesem Donnerstag beginnende Notenbanktreffen in Jackson Hole im US-Bundesstaat Wyoming. Anleger spekulieren, dass die US-Notenbank Federal Reserve (Fed) weiter einen strikten Straffungskurs verfolgen wird, um die hohe Inflation in den Griff zu bekommen. Im Falle eines erneuten deutlichen Zinsschritts der Fed von 0,75 Prozentpunkten würden Aktien im Vergleich zu verzinslichen Anlagen weiter an Attraktivität verlieren. Das Treffen in Jackson Hole könnte den Ton für den Rest des Jahres bestimmen, meinte Michael Hewson vom Handelshaus CMC Markets. Am deutschen Markt mehrten sich derweil die Hinweise auf eine nahende Rezession. So sind die deutschen Exporteure beim wichtigen Geschäft mit den nicht zur EU zählenden Ländern schwach in die zweite Jahreshälfte gestartet. Die Ausfuhren in die sogenannten Drittstaaten brachen im Juli um 7,6 Prozent im Vergleich zum Vormonat ein. Das war der erste Rückgang nach zuvor drei Anstiegen in Folge. Der DAX stand seit Handelsbeginn unter Druck und ging 2,3 Prozent tiefer aus dem Handel. Die Sorgen wurden noch durch die Ankündigung Russlands verstärkt, die Gaslieferungen über die Pipeline Nord Stream 1 Ende August für drei Tage zu unterbrechen. Zudem rechnet die Deutsche Bundesbank nach einer Stagnation im Sommer mit einer Rezession im Winter. So dürfte das Bruttoinlandsprodukt (BIP) in Deutschland wegen der anhaltenden Energiekrise Ende 2022/Anfang 2023 schrumpfen, heißt es heute im August-Monatsbericht der Notenbank: ""Die Wahrscheinlichkeit, dass das BIP im kommenden Winterhalbjahr zurückgeht, hat sich aufgrund der ungünstigen Entwicklungen am Gasmarkt deutlich erhöht."" Mit Auslaufen der Entlastungsschritte der Regierung erwartet die Bundesbank - nach europäischer Messung (HVPI) - im Herbst Inflationsraten von rund zehn Prozent. Im Juli hatte die Teuerung nach dieser Rechnung bei 8,5 Prozent gelegen. China will mit einer erneuten Senkung des Leitzinses die Kreditnachfrage in der durch die Immobilienkrise und Corona-Ausbrüche gebeutelten Wirtschaft weiter ankurbeln. Der Schlüsselsatz für einjährige Kredite (LPR) wurde bei der monatlichen Festsetzung durch die Zentralbank um fünf Basispunkte auf 3,65 Prozent gesenkt, der für fünfjährige Kredite um 15 Basispunkte auf 4,30 Prozent. Der Euro erlebte einen außerordentlich schwachen Tag. Im Tief wurden für einen Euro nur noch 0,9930 Dollar bezahlt. Damit ist der Euro, wie schon im Juli, wieder unter die Parität zum Dollar gefallen. Der Dollar profitierte zuletzt von verstärkten Spekulationen über einen erneuten kräftigen Zinsschritt der US-Notenbank Federal Reserve (Fed) von 75 Basispunkten im September. Die Ölpreise standen bis zum späten Nachmittag stark unter Druck. Die Äußerung des saudischen Energieministers, das Kartell OPEC+ müsse vielleicht die Ölförderung zur Stabilisierung der Preise verringern, sorgte dann für eine deutliche Erholung. Ein Barrel (159 Liter) der Nordseesorte Brent kostet am späten Abend mit 95,70 US-Dollar rund 0,5 Prozent weniger. Nach Einschätzung von Marktbeobachtern sinken die Ölpreise neben den Rezessionssorgen weiterhin durch die Aussicht auf verstärkte Ölexporte aus dem wichtigen OPEC-Förderland Iran. Derzeit laufen Verhandlungen über eine Wiederbelebung des internationalen Atomabkommens. Die Furcht vor Engpässen treibt den Gaspreis derweil weiter an. Der europäische Future stieg um mehr als zehn Prozent auf 282,50 Euro je Megawattstunde. Grund ist die Ankündigung des russischen Exporteurs Gazprom vom Freitag, zum Monatsende für drei Tage erneut den Betrieb der Pipeline Nord Stream 1 wegen Wartungsarbeiten zu unterbrechen. Ein US-Gericht hat Ford nach einem tödlichen Unfall zu einer Zahlung in Höhe von 1,7 Milliarden Dollar verurteilt. Dem zweitgrößten US-Autobauer wird vorgeworfen, das Dach des Pickup-Truck-Modells F-250 nicht ausreichend verstärkt zu haben, um die Insassen bei einem Überschlagsunfall hinreichend zu schützen. Der Autobauer will gegen das Urteil vorgehen. Wie schon in den Medien vor einigen Wochen berichtet, macht Ford außerdem Ernst mit seinem geplanten Stellenabbau. Der Konzern streicht rund 3000 Stellen in Nordamerika und Indien, um Kosten zu senken und mehr Geld in seine Elektro-Offensive stecken zu können. Laut dem jüngsten Quartalsbericht hatte Ford weltweit zuletzt ungefähr 182.000 Beschäftigte. Ebay hat heute seine Absicht bekundet, den spezialisierten Marktplatz TCGplayer für bis zu 295 Millionen Dollar zu kaufen. Auf TCGplayer werden Sammelkartenspiele wie Magic oder Pokemon gehandelt. Anfang 2023 soll die Transaktion abgeschlossen sein. TCGplayer soll danach eigenständig weitergeführt werden. Im DAX legte die Fresenius-Aktie gegen den Trend deutlich zu. Auch die Aktie der Dialysetochter FMC lag leicht im Plus. Nach turbulenten Zeiten soll ein neuer Mann den Medizin- und Krankenhauskonzern aus der Dauerkrise führen. Der Aufsichtsrat bestellte mit Wirkung zum 1. Oktober 2022 den amtierenden Chef der Fresenius-Tochter Kabi, Michael Sen, zum Vorstandsvorsitzenden. Am Markt hieß es, es handele sich um einen von Anlegern erhofften Schritt angesichts des Aktienkurses, der mittlerweile auf das niedrigste Niveau seit 2012 gesunken ist. Der Personalwechsel kommt nicht ganz überraschend: Der scheidende Konzernchef Stephan Sturm hatte nach mehrmaligen Gewinnwarnungen in den vergangenen Jahren erst kürzlich auch die Ziele für das laufende Jahr zurechtstutzen müssen. Dies brachte wohl auch für den Aufsichtsrat das Fass zum Überlaufen, der Sturm trotz anhaltender Probleme die Treue gehalten hatte. Der Manager verlasse das Unternehmen ""im guten Einvernehmen"", hieß es. Aktien aus dem Volkswagen-Konzernumfeld gehörten zu den größten DAX-Verlierern. Die VW-Vorzugsaktie und die Konzernholding Porsche SE büßten über vier Prozent ein. Unter Investoren mehre sich die Kritik daran, dass der Autobauer seinen Chef künftig mit der Sportwagentochter Porsche AG teilen muss, hieß es am Markt. Diese ist nicht mit der vorgenannten Holding Porsche SE zu verwechseln. Marktteilnehmer verwiesen auf einen Bericht in der ""Frankfurter Allgemeinen Zeitung"", wonach laut einer Umfrage des Analysehauses Bernstein zwei Drittel der Anleger die ab September vorgesehene Doppelrolle von Oliver Blume kritisierten. Adidas muss sich einen neuen Chef suchen. Der Vorstandsvorsitzende Kasper Rorsted und der Aufsichtsrat hätten sich im gegenseitigen Einvernehmen darauf geeinigt, dass Rorsted 2023 aus seinem Amt ausscheiden werde, teilte der DAX-Konzern überraschend heute mit. Die in diesem Jahr bislang schwer gebeutelte Adidas-Aktie weitete ihre Verluste auf die Nachricht hin aus und verlor über fünf Prozent. Der Sportartikelhersteller hatte wegen Problemen in China sowie einer zu erwartenden schwächeren Konsumlaune in anderen Ländern Ende Juli die Prognosen gesenkt. Die BioNTech-Aktie drehte im Verlauf ins Plus. Der Mainzer Impfstoffentwickler und sein US-Partner Pfizer haben die Notfallzulassung des auf die Omikron-Variante zugeschnittenen Corona-Vakzins in den Vereinigten Staaten beantragt. Ein entsprechender Antrag sei bei der US-Aufsicht FDA eingereicht worden, teilen die Unternehmen mit. Der Impfstoff soll gegen die Urform des Coronavirus sowie die derzeit dominanten Varianten BA.4 und BA.5 wirken. Die Deutsche-Post-Tochter DHL Paket erhöht zum Jahreswechsel die Preise für Geschäftskunden. Gründe dafür seien die volatile Entwicklung der Energiepreise und die gestiegenen Transport- und Personalkosten, teilte die Post mit. Die Preise für den Paketversand durch Privatkunden bleiben unverändert. Die T-Aktie konnte gegen den Trend ein kleines Plus verbuchen. Die Deutsche Telekom soll nach dem Ziel von Vorstandschef Timotheus Höttges in absehbarer Zukunft zum wertvollsten deutschen Börsenunternehmen aufsteigen und dabei den Software-Konzern SAP überholen. ""Mein Anspruch ist: Die Telekom soll das wertvollste Unternehmen Deutschlands werden"", sagte Höttges der ""Augsburger Allgemeinen"". Der Konzern sei dem Spitzenreiter SAP als Nummer 2 schon auf den Fersen. Das Geschäft laufe gut. Höttges verwies darauf, dass die Telekom jüngst ihre Ergebnisprognose auf 37 Milliarden Euro vor Steuern, Zinsen und Abschreibungen erhöht habe. Ein Wechselbad der Gefühle erlebten heute Aktionäre von Online-Apotheken. Die Aktie der Shop Apotheke war zunächst ins Plus gedreht, als die Nachrichtenagentur Bloomberg meldete, dass der schweizerische Konkurrent Zur Rose strategische Optionen prüfe, darunter auch einen Verkauf. Kurz darauf sackte der SDAX-Titel aber kräftig ab, nachdem die kassenärztliche Vereinigung Schleswig-Holstein (KVSH) mitgeteilt hatte, dass das Land vorerst aus dem E-Rezept aussteige. Grund sei, dass eine Mail-basierte Umsetzung nach dem Landesdatenschutzgesetz untersagt sei. Eigentlich sollte das E-Rezept von der kommenden Woche an in Westfalen-Lippe und Schleswig-Holstein als Pilotprojekt starten. Der unter einem hohen Schuldenberg ächzende britische Kinobetreiber Cineworld erwägt eine Sanierung unter US-Insolvenzrecht. Der weltweit zweitgrößte Kinokonzern prüfe entsprechende Optionen, teilte er am Montag mit und schickte damit seine in London notierten Aktien auf einen weiteren Sinkflug. Ende 2021 beliefen sich die Schulden auf rund 8,9 Milliarden Dollar. Die Branche leidet unter den Folgen der Corona-Krise und geänderten Sehgewohnheiten der Zuschauer. "
22.08.2022 20:38 Uhr,US-Bundesstaat Arkansas,Kritik an brutalem Polizeieinsatz,"Erneut sorgt ein Video von brutal vorgehenden Polizisten in den USA für Empörung. Darauf schlagen drei Beamte auf einen am Boden liegenden Mann ein. Nach Behördenangaben wurden sie vom Dienst suspendiert, gegen sie wird ermittelt. Ein Video von einem brutalen Polizeieinsatz hat in den USA für scharfe Kritik gesorgt. Die Polizei des Bundesstaates Arkansas teilte am Sonntagabend (Ortszeit) mit, sie habe wegen des Einsatzes von Gewalt bei der Festnahme eines 27-Jährigen eine Untersuchung des Vorfalls angestoßen. Offiziellen Angaben zufolge wurden die drei beteiligten Polizisten vorerst vom Dienst freigestellt. Zuvor waren in sozialen Medien Videoaufnahmen der Szene veröffentlicht worden, gefilmt aus einem in der Nähe geparkten Auto. In dem Video ist zu sehen, wie drei Polizisten einen am Boden liegenden Mann gewaltsam niederdrücken und auf ihn einprügeln. Einer der Beamten schlägt mehrfach mit der Faust auf den Kopf des Mannes ein, greift dessen Kopf und rammt ihn auf den Boden, ein anderer tritt mehrfach mit dem Knie gegen den Körper des Mannes. Die Festnahme ereignete sich nach Polizeiangaben am Sonntagvormittag vor einem Geschäft in der Kleinstadt Mulberry. Laut einem Bericht des TV-Senders 40/29 News war der Mann festgenommen worden, nachdem er den Angestellten einer Tankstelle bedroht haben soll. Demnach kooperierte er zunächst mit den Polizisten, attackierte sie aber später. Der 27-Jährige sei nach dem Vorfall zunächst zur Untersuchung und Behandlung ins Krankenhaus gebracht und später in Haft genommen worden. Ihm würden unter anderem Hausfriedensbruch, Körperverletzung und Widerstand gegen die Festnahme zur Last gelegt. Es soll sich nach Angaben der Polizei um einen weißen US-Bürger handeln. Der Bürgermeister der Kleinstadt, Gary Baxter, schrieb in einer Stellungnahme, das Video habe ihn schockiert. Das Ergebnis der Untersuchung werde sehr ernst genommen. Ein solcher Vorfall dürfe sich nicht wiederholen. Der republikanische Gouverneur von Arkansas, Asa Hutchinson, schrieb auf Twitter, er habe mit der Polizei des Bundesstaates über den Vorfall gesprochen. Er versprach ""Ermittlungen auf Grundlage der Beweisvideos und der Forderungen der Staatsanwaltschaft"". Das Video des Einsatzes verbreitete sich rasant in Online-Netzwerken. Zu sehen ist außerdem, wie Passanten die Polizisten auf ihr Verhalten ansprechen - woraufhin ihnen einer der Beamten befiehlt, fernzubleiben. Die Aufnahme ist das jüngste Beispiel von dokumentierter Polizeigewalt in den USA. Im Mai 2020 hatte das Video der Tötung des Schwarzen George Floyd weltweite Proteste gegen Rassismus und Polizeigewalt entfacht. "
22.08.2022 19:30 Uhr,Unwetter in Pakistan,Seit Juni Hunderte Opfer durch Überflutungen,"Südasien leidet derzeit unter ungewöhnlich starken Regenfällen. Allein in Pakistan kamen seit Beginn der Regenzeit bereits fast 800 Menschen durch Überschwemmungen ums Leben. Tausende sind derzeit vom Rest des Landes abgeschnitten. Sturzfluten, ausgelöst durch ungewöhnlich heftigen Monsunregen, haben in Pakistan seit Juni fast 800 Menschen das Leben gekostet. Allein im August seien es bisher etwa 300 Tote gewesen, teilte die Katastrophenschutzbehörde mit. Wolkenbrüche und Überschwemmungen hätten seit dem 14. Juni rund 1,8 Millionen Menschen betroffen. Das Militär versucht, Menschen mit Booten und Hubschraubern aus ihren überfluteten Dörfern zu retten. Die Wassermassen spülten den Angaben zufolge landesweit knapp 60.000 Häuser fort, unterbrachen Straßen und beschädigten Brücken. Retter haben es daher noch schwerer, Betroffenen zu Hilfe zu kommen. Mehr als 317.000 Menschen lebten immer noch in Notlagern. Die Behörden wollen in abgelegenen Regionen der besonders stark betroffenen Provinzen zusätzliche Unterkünfte und medizinische Versorgung einrichten. Sie erklärten, sie hätten weitere Nahrung, Zelte und andere wichtige Güter in fast alle Flutgebiete gebracht. Im Internet kursierten jedoch Videos, die zeigten, dass offenbar immer noch viele Menschen auf Hilfe warten. Die südwestliche Provinz Balutschistan etwa ist derzeit vom Rest des Landes abgeschnitten, weil Wassermassen Gleise und Straßen überschwemmt haben sowie Brücken zerstört haben. Auch in der angrenzenden Provinz Sindh ist der Zugverkehr lahmgelegt. Die Behörden in Balutschistan ordneten die Schließung aller Schulen für eine Woche an. ""Wir erwarten in den kommenden Tagen noch mehr Regen und Überschwemmungen"", begründete ein Sprecher der Provinzbehörde die Maßnahme. Der Monsunregen in Pakistan dauert normalerweise bis September, in diesem Jahr ist er ungewöhnlich stark. Weil Naturkatastrophen wie Dürren, Hitzewellen oder Fluten in Pakistan auf dem Vormarsch sind, warnte Klimaschutzministerin Sherry Rehman bereits vor einer ""existenziellen Krise"" ihres Landes. Auch in den Nachbarländern Indien und Afghanistan starben in den vergangenen Tagen bei Sturzfluten im Zusammenhang mit heftigen Regenfällen zahlreiche Menschen. Für die kommenden Tage wird in einigen Gebieten weiterer Regen erwartet, wie der indische Wetterdienst mitteilte. "
22.08.2022 19:22 Uhr,Nach Abberufung der rbb-Intendantin,Schlesinger wird fristlos entlassen,"Der rbb-Verwaltungsrat hat die abberufene rbb-Intendantin Schlesinger fristlos entlassen. Sie soll keine Abfindung oder Ruhegeldzahlungen erhalten. Zudem sprach sich das Gremium dafür aus, dass sie durch einen Interimsintendanten ersetzt werden soll. Der Verwaltungsrat des Rundfunks Berlin-Brandenburg (rbb) hat nach der Auflösung des Vertrages mit der abberufenen Intendantin Patricia Schlesinger dieser die fristlose Kündigung ausgesprochen. Das teilte die amtierende Verwaltungsratsvorsitzende des ARD-Senders, Dorette König, nach einer Sitzung des Rats mit. Schlesinger soll auch keine Abfindung oder Ruhegeldzahlungen erhalten. Die Entscheidung sei mehrheitlich gefallen, sagte König weiter. Das Vertrauen zwischen Schlesinger und dem Sender sei hochgradig zerstört. Schlesinger ließ über ihren Anwalt zur außerordentlichen Kündigung mitteilen: ""Ich bedaure diese Entscheidung, die offensichtlich politisch motiviert ist, um einen Sündenbock zu haben. Dieses Vorgehen ist durch die Faktenlage keinesfalls gedeckt."" Weiter hieß es: ""Die Untersuchungen sind längst nicht abgeschlossen. Ich sehe ihrem Ergebnis zuversichtlich entgegen."" Der Verwaltungsrat sprach sich zudem für die Einsetzung eines Interimsintendanten aus. Aktuell führt der nach rbb-Angaben derzeit krankgeschriebene Verwaltungsdirektor Hagen Brandstäter die Geschäfte, der wegen der Aufarbeitung der Krise um Vorwürfe der Vetternwirtschaft gegen Schlesinger ebenfalls in der Kritik steht. Man sei der Überzeugung, dass die Strukturanalyse und Neuaufstellung nur glaubwürdig durch externe Unterstützung gelingen könne, sagte König weiter. Man wolle in den nächsten Tagen einen Fahrplan dafür entwickeln und habe die aktuelle rbb-Geschäftsleitung zugleich gebeten, zur Sicherstellung der Stabilität ihre Aufgaben zunächst weiter wahrzunehmen. Vor einer Woche war Schlesinger vom Rundfunkrat - dem zweiten Kontrollgremium - abberufen worden. Die 61-Jährige sieht sich seit Ende Juni zahlreichen Vorwürfen des Filzes und der Vetternwirtschaft ausgesetzt. Sie war seit Jahresbeginn ARD-Vorsitzende und seit 2016 rbb-Intendantin. Von beiden Ämtern trat sie zurück. Im Zentrum des Skandals steht neben der abberufenen Intendantin auch der zurückgetretene rbb-Verwaltungsratschef Wolf-Dieter Wolf. Beide wiesen die Vorwürfe zurück. Es geht unter anderem um umstrittene Beraterverträge für ein rbb-Bauprojekt, um Abstimmungen zwischen beiden zum Gehalt und Boni für Schlesinger. Und um Aufträge für den Ehemann und Ex-""Spiegel""-Journalisten Gerhard Spörl bei der Messe Berlin - wo Wolf bis vor kurzem in Personalunion auch Chefaufseher war. Die Generalstaatsanwaltschaft Berlin ermittelt gegen alle drei wegen Untreue und Vorteilsannahme. Es gilt die Unschuldsvermutung. Es läuft zudem eine externe Untersuchung einer Anwaltskanzlei. Es liegen noch keine Ergebnisse vor. "
22.08.2022 18:55 Uhr,Kanada-Reise des Kanzlers,Scholz setzt auf kanadischen Wasserstoff,"Deutschland sucht dringend nach Energielieferanten. Beim Wasserstoff soll dabei Kanada eine ""ganz, ganz zentrale Rolle"" spielen, betonte Kanzler Scholz. Mit Premier Trudeau sprach er auch über Flüssiggas. Angesichts des Kriegs in der Ukraine hat Bundeskanzler Olaf Scholz die Bedeutung einer engen Zusammenarbeit mit Kanada im Energiesektor hervorgehoben. ""Kanada wird für die Entwicklung des grünen Wasserstoffs eine ganz, ganz zentrale Rolle spielen"", sagte der SPD-Politiker nach einem Treffen mit Premierminister Justin Trudeau in Montreal. ""Deshalb sind wir sehr froh, dass wir auch bei dieser Gelegenheit unsere Kooperation in diesem Feld ausbauen können."" Für eine Übergangszeit werde aber auch Flüssiggas benötigt, um die Abhängigkeit von russischem Gas zu reduzieren. Trudeau sagte, man werde den Export von Flüssiggas über den Atlantik prüfen. Eine der Herausforderungen rund um LNG sei jedoch die Höhe der Investitionen in Infrastrukturen. ""Wir prüfen jedoch alle anderen Möglichkeiten, um den Deutschen und Europäern kurzfristig zu helfen, da sie im kommenden Winter vor einer echten Herausforderung stehen."" Russland dürfe Energie nicht als Kriegswaffe benutzen. Russlands Angriffskrieg zwingt Deutschland, sich gerade im Energiebereich breiter aufzustellen. Kanada hat zwar Flüssiggas (LNG), Deutschland kann davon aber erst mittelfristig profitieren, weil zum Beispiel noch Terminals in Deutschland fehlen. Im Fokus der Kanzler-Reise steht deswegen die Wasserstoffproduktion. Außerdem sind deutsche Unternehmen an kanadischen Mineralien und Metallen interessiert. Russland sei kein zuverlässiger Geschäftspartner, sagte der Kanzler weiter. Das Land habe überall in Europa Gaslieferungen mit dem Hinweis auf technische Gründe reduziert, die es nie gegeben habe. ""Und deshalb ist es wichtig, dass wir nicht in Putins Falle tappen und zusammenhalten und zusammenstehen."" Trudeau sagte, Russland habe versucht, anderen die Schuld dafür zu geben, dass es Energiepolitik zu einer Waffe gemacht habe. Der Kanzler lobte die Zusammenarbeit mit Kanada im Streit um eine Turbine für die Gaspipeline Nord Stream 1. ""Russland versucht natürlich, die Weltgemeinschaft zu spalten. Und auch diejenigen, die sich verbündet haben, um die Ukraine zu unterstützen."" Deshalb sei es wichtig, dass Kanada geholfen habe, dass die überholte Turbine wieder zurückgeliefert werden könne. In Montreal wurde auch über die Zukunft der Ukraine gesprochen: Scholz sieht Deutschland in Mitverantwortung für den Wiederaufbau des osteuropäischen Landes. Das sei ""eine wichtige Aufgabe, wo die Weltgemeinschaft rechtzeitig die richtigen Weichen stellen muss"", sagte der SPD-Politiker. Man müsse sich schon jetzt im Krieg mit dem Wiederaufbau des Landes beschäftigen. Deutschland und die EU wollten dies auf einer Wiederaufbaukonferenz vorantreiben. Scholz ist gemeinsam mit Vizekanzler und Bundeswirtschaftsminister Robert Habeck für drei Tage nach Kanada gereist, um mit Premier Trudeau eine Energiepartnerschaft auszuloten. Und die Hoffnungen sind groß, denn das flächenmäßig zweitgrößte Land der Welt könnte helfen, sich aus der Abhängigkeit Russlands zu befreien. Kanada ist einer der größten Erdgasproduzenten weltweit. "
