date,topline,headline,content22.08.2022 13:52 Uhr,Anschlag in Moskau,Mehr Fragen als Antworten,"Am Tag nach dem mutmaßlichen Autobombenanschlag in Moskau wird über mögliche Täter spekuliert. Der im Exil lebende Putin-Gegner Ponomarjow macht Partisanen verantwortlich, andere warnen vor voreiligen Schlüssen. Es ist ein Video, das mehr Fragen aufwirft, als es Antworten liefert. Zu sehen ist eine weiß-blau-weiße Flagge, die in einigen Oppositionellenkreisen als Symbol eines ""befreiten Russland"" gilt. Davor sitzt Ilja Ponomarjow, Ex-Duma-Abgeordneter und Putin-Gegner, der seit Jahren im Exil lebt. Der 47-Jährige erklärt, dass eine Partisanengruppe für den Anschlag an Darja Dugina verantwortlich sei und sie eigentlich auch ihren Vater, den rechtsnationalistischen Ideologen Alexander Dugin habe treffen wollen: ""Weil Dugin das Gehirn war, Darja war die Hand. Es gab eine Menge Wut auf Darja Dugina selbst"", so Ponomarjow. Das liege daran, dass Dugina in Azowstal gewesen sei. Viele hielten sie auch verantwortlich für den Gefängnisangriff in der Siedlung Oleniwka, so Ponomarjow. ""Es gibt hier ein Element der Rache. Dugin ist der Ideologe des Faschismus. Er ist die Person, die den Begriff 'Neurussland' allgemein in das russische politische Lexikon eingeführt hat"", so Ponomarjow weiter. Es folgt ein Manifest einer Gruppe, die Ponomarjow als ""Nationale Republikanische Armee"" vorstellt. Darin wird den politischen Eliten, die für den Militäreinsatz in der Ukraine verantwortlich seien, der Kampf angesagt. Doch ist nicht nur Poromarjow wegen seiner politischen Vergangenheit höchst umstritten, auch hat man zuvor noch nie etwas von der genannten ""Nationalen Republikanischen Armee"" gehört. Experten vermuten, dass es sich genauso gut um die Aktion eines Trittbrettfahrers handeln könnte. Die Journalistin und Politikexpertin Julija Latynina sagt auf ihrem YouTube-Kanal: ""Ich möchte dringend bitten, keine voreiligen Schlussfolgerungen darüber zu ziehen, wer genau die Tochter von Alexander Dugin getötet hat."" Sie wolle darauf aufmerksam machen, dass in kremlfreundlichen Kanälen auf Telegram der Mord unmittelbar danach als ""heiliges Opfer"" bezeichnet wurde. ""Das sollte einen 'Autoimmunprozess' auslösen, also die totalen Säuberungen von Verrätern und der 'fünften Kolonne' innerhalb Russlands."" Die vor allem über soziale Netzwerke verbreiteten Spekulationen reichen von einer möglichen Geheimdienstaktion bis hin zu Mutmaßungen darüber, dass Dugin seine Tochter selbst geopfert haben könnte, um endlich den umfassenden Krieg gegen die Ukraine zu provozieren, den er immer hätte haben wollen. Auf der anderen Seite stehen diejenigen, die die Ukraine für die Tat verantwortlich machen. Sollten sich derartige Vorwürfe bestätigen, so die Sprecherin des russischen Außenministeriums, Maria Sacharowa, dann müsse mit Blick auf die Kiewer Politik in Zukunft von ""Staatsterrorismus"" gesprochen werden. Man warte auf die Ergebnisse der Untersuchungen. Die laufen weiter. Inzwischen gab das Ermittlungskomitee bekannt, dass der Sprengsatz wohl ferngezündet wurde. Mit Hinweisen auf mögliche Täter halten sich auch die Ermittler zurück. Kiew hatte bereits am Sonntag jegliche Verantwortung von sich gewiesen. Doch auch, wenn vieles noch ungeklärt ist und wohl auch vorerst bleibt, werde der Fall Russland verändern - davon ist Politikexpertin Julija Latynina überzeugt. ""Das alles muss irgendwie vom Kreml beantwortet werden. Und das Problem ist offenbar, dass Putin aus militärischer Sicht nichts zu antworten hat. Also wird er im Inneren antworten. Er wird dort antworten, wo es für ihn einfacher ist"", so Latynina. ""Noch einmal: Ich würde auf keinen Fall voreilig Täter dieses Mordes nennen. In der gegenwärtig aufgeheizten Atmosphäre des Hasses ist alles möglich."" "
22.08.2022 13:44 Uhr,Pakistan,Strafverfahren gegen Ex-Premier Khan,"Seit seiner Entmachtung im April dieses Jahres sieht sich Pakistans Ex-Premierminister Khan Anschuldigungen ausgesetzt. Die jüngste lautet: Terrorismus. Die Polizei ermittelt. Die pakistanische Polizei wirft Ex-Premierminister Imran Khan Terrorismus vor. Ein entsprechendes Strafverfahren sei eingeleitet worden, teilten die Behörden mit. Anlass für die Vorwürfe ist eine Rede Khans am vergangenen Samstag in der Hauptstadt Islamabad. Auf der Massenveranstaltung kündigte er an, Polizisten und eine Richterin verklagen zu wollen. Zudem erhob er den Vorwurf, dass ein Vertrauter nach dessen Verhaftung gefoltert worden sei. Bei dem Vertrauten handelt es sich um Shebaz Gill. Das ehemalige Kabinettsmitglied hatte Soldaten öffentlich dazu aufgerufen, sich den ""illegalen Anordnungen"" der Militärführung zu widersetzen. Er wurde daraufhin des Hochverrats beschuldigt, der in Pakistan mit dem Tod bestraft werden kann. Amnesty International fordert inzwischen eine Untersuchung der Foltervorwürfe. Khan selbst äußerte sich zunächst nicht öffentlich zu den Anschuldigungen. Ein Gericht in Islamabad entschied, dass Khan die nächsten drei Tage nicht verhaftet werden kann, wie ein Funktionär seiner Partei Tehreek-e-Insaf mitteilte. Die Partei des ehemaligen Premiers postete im Internet Videos, die Unterstützer zeigten, die Khans Haus umringten, um einen möglichen Zugriff der Polizei zu verhindern. Hunderte hielten sich dort am Montagmorgen auf. Die Partei kündigte landesweite Kundgebungen für den Fall einer Festnahme Khans an. Der ehemalige Informationsminister Fawad Chaudhry hat vor Konsequenzen im Falle einer Anklage und Verhaftung Khans gewarnt. ""Imran Khan ist unsere rote Linie"", schrieb er auf Twitter. Khan war am 9. April dieses Jahres durch ein Misstrauensvotum des pakistanischen Parlaments als Premierminister des südasiatischen Landes abgesetzt worden. Als Nachfolger des 69-jährigen ehemaligen Cricketprofis regiert seitdem Shebaz Sharif, der jüngere Bruder des dreimaligen Premierministers Nawaz Sharif. "
22.08.2022 13:03 Uhr,30 Jahre Rostock-Lichtenhagen,Als Deutschland seine Asylgesetze verschärfte,"Die gewalttätigen Ausschreitungen wie in Rostock-Lichtenhagen vor 30 Jahren führten nicht nur zu einer Debatte über Rassismus. Sie hatten auch massive Einschränkungen des Asylrechts zur Folge - bis heute wirken sie nach. Zwischen den rassistischen Gewaltexzessen vom August 1992 in Rostock-Lichtenhagen und dem Asylkompromiss, den die Bundespolitik bald darauf verabredete, ziehen viele, insbesondere Kritiker, bis heute eine direkte Verbindung. Die CDU/CSU hatte allerdings schon in den 1980er-Jahren einer Verschärfung des Asylrechts das Wort geredet. Der damalige Bundesinnenminister Friedrich Zimmermann sagte etwa: ""Jede Entscheidung zugunsten eines bestimmten Typs von Asylbewerbung hat im Heimatstaat eine Multiplikationswirkung, wenn ein Gerichtsurteil erlassen wird, dann werden in den Zeitungen von Sri Lanka zum Beispiel Anzeigen von Reisebüros veröffentlicht, also absolut organisiert und Anreiz für eine Antragsstellung."" Während ""Bild""-Zeitung und ""Welt am Sonntag"" gegen vorgeblichen Asylmissbrauch polemisierten, schnellte die Zahl der Asylbewerber in die Höhe: 1992 kamen fast 440.000 nach Deutschland, so viele wie nie zuvor, die meisten vom kriegsgeplagten Balkan und aus dem ehemaligen Ostblock. Sie kamen in eine Bundesrepublik, die nach kurzem Wiedervereinigungsboom eine schwere Rezession und hohe Arbeitslosigkeit erlebte, in der rechtsradikale Parteien mit fremdenfeindlichen Parolen in Landtage gewählt wurden, und deren Kommunen mit der Versorgung der Flüchtlinge überfordert waren. Die Union machte nun Ernst mit der Asylrechtsreform. Wolfgang Schäuble, Chef der CDU-Bundestagsfraktion erläuterte die Neuregelung: ""Wir wollen das Asylrecht im Grundgesetz ergänzen, indem wir anstelle des bisherigen Artikel 16 Absatz 2 Satz 2 einen neuen Artikel 16 a einfügen wollen, dessen erster Satz der bisherige Satz bleiben soll: Politisch Verfolgte genießen Asylrecht."" Dann kam Schäuble zu den geplanten Einschränkungen: ""Asylrecht soll nicht genießen, wer aus einem Mitgliedstaat der Europäischen Gemeinschaft oder einem anderen Drittstaat, in dem die Anwendung der Genfer Flüchtlingskonvention und der Europäischen Menschenrechtskonvention sichergestellt ist."" Auch Flüchtlinge aus sogenannten sicheren Herkunftsstaaten hatten danach keinen Anspruch auf Asyl. Umstritten war auch, dass Asylverfahren künftig schon im Transitbereich von Flughäfen möglich sein sollten. Beim kleinen Regierungspartner FDP wollten das nicht alle mittragen, deren Innenpolitiker Burkhard Hirsch kritisierte, vor der Abschiebung aus der Bundesrepublik Deutschland werde dem Flüchtling jeder noch so minimale Rechtsschutz verweigert. In der oppositionellen SPD, deren Stimmen das Regierungsbündnis von Union und FDP für die Grundgesetzänderung brauchte, sträubten sich zunächst viele gegen eine Einschränkung des Asylrechts. Hans Eichel, damals hessischer Ministerpräsident, erinnerte später im Deutschlandfunk daran, dass die Sozialdemokraten im Dritten Reich der Verfolgung ausgesetzt waren und viele nur Dank Asyl im Ausland überlebt hatten: ""Das haben wir nicht vergessen."" Doch der Widerstand in der SPD schwand, im Dezember 1992 vereinbarten Regierung und Opposition einen ""Asylkompromiss"". Die SPD habe ihre Forderungen durchsetzen können, begründete deren Fraktionschef Hans-Ulrich Klose die Zustimmung der Sozialdemokraten: ""Wir erreichen eine Steuerung und Begrenzung, indem wir die wirklich politisch Verfolgten, die asylberechtigten Bewerber im eigentlichen Sinne des Wortes von jenen trennen, die aus anderen Gründen zu uns kommen."" Obwohl Tausende Demonstranten versuchten, die Abstimmung über die Neuregelung am 23. Mai 1993 in Bonn zu verhindern, beschloss der Deutsche Bundestag die Reform mit weit mehr als zwei Drittel der Stimmen. PDS und Grüne hatten geschlossen gegen den Asylkompromiss gestimmt, der einstige DDR-Bürgerrechtler Konrad Weiß (Bündnis90/Die Grünen) erklärte bitter: ""Der neue Artikel 16a, aus dem Kompromiss-Kauderwelsch ins Deutsche übersetzt lautet: Politisch Verfolgte genießen Asylrecht, aber nicht in Deutschland."" Tatsächlich erhalten nur wenige Antragsteller politisches Asyl in Deutschland. Wesentlich häufiger wird jedoch der Flüchtlingsstatus gemäß der Genfer Flüchtlingskonvention zuerkannt, andere erhalten subsidiären Schutz, wenn ihnen im Herkunftsland ernsthafte Gefahr droht. Mit der Verabschiedung des Asylkompromisses war die Debatte über die umstrittene Neuregelung nicht erledigt. Zwar scheiterten Verfassungsbeschwerden gegen den Asylkompromiss, doch es kam eine gesellschaftliche Diskussion darüber in Gang, ob Deutschland Einwanderungsland sein will, und wie Zuwanderung gesteuert werden kann. Der Asylkompromiss gehört deshalb zu jenen Ereignissen des Jahres 1993, die bis heute nachwirken. "
22.08.2022 12:46 Uhr,Klarinettist,Jazzmusiker Rolf Kühn gestorben,"Er war 92 Jahre alt und hatte für die kommenden Monate noch mehrere Konzerte geplant. Doch nun ist der Jazzmusiker und Klarinettist Rolf Kühn gestorben. Er galt als einer der wenigen deutschen Jazzer von internationalem Ruf. Der Jazzmusiker Rolf Kühn ist tot. Er starb im Alter von 92 Jahren in Berlin, wie die Familie, die Agentur und die Plattenfirma des Klarinettisten bekannt gaben. Kühn galt als einer der wenigen deutschen Jazzmusiker von internationalem Ruf. Der gebürtige Kölner spielte mit Benny Goodman, John Coltrane und Chick Corea und gründete mehrere Bands. Kühn leitete das NDR-Fernsehorchester und war Musikalischer Leiter im Berliner Theater des Westens. Neben seinen Alben komponierte Kühn zahlreiche Film- und Fernsehmusiken. In den nächsten Monaten sollte der Klarinettist noch in mehreren deutschen Städten Konzerte geben, unter anderem mit seinem Bruder, dem Jazz-Pianisten Joachim Kühn. Rolf Kühn starb den Angaben zufolge am 18. August. ""Rolf wird immer als der inspirierende, sanfte, innovative und jung gebliebene Künstler und Mensch in Erinnerung bleiben, der er war"", teilten Kühns Ehefrau Melanie, sein Bruder sowie die Agentur Jazzhaus Artists und das Label Edel/MPS mit. ""Er lebte ein erfülltes Leben, das bis zu seinem letzten Tag der Musik, der Kultur und der Freude gewidmet war."" "
22.08.2022 12:31 Uhr,"Ex-""Bild""-Chef Reichelt",Rechtspopulistisches Comeback auf YouTube?,"Der ehemalige ""Bild""-Chefredakteur Reichelt hat einen eigenen YouTube-Kanal. Laut Experten finden seine dort verbreiteten rechtspopulistischen Thesen Anklang. Eine Strategie mit Erfolgsaussichten? ""Grüne lassen uns fürs Klima hungern!"", ""Energiekrise: Darum sollen Deutsche jetzt im Müll wühlen"", oder ""Faeser hetzt ARD gegen die eigenen Bürger auf!"" So lauten einige aktuelle Videotitel vom neuen YouTube-Kanal des ehemaligen ""Bild""-Chefredakteurs Julian Reichelt: ""Achtung, Reichelt!"". Nach seinem Rausschmiss bei der ""Bild""-Zeitung hatte Reichelt angekündigt, mit einer neuen Plattform eine Marktlücke in der deutschen Medienlandschaft schließen zu wollen. Tatsächlich haben mittlerweile 119.000 Menschen den Kanal abonniert, seine Videos wurden insgesamt bereits mehr als fünf Millionen Mal aufgerufen. Kann Reichelt also mit seinem im Juli gestarteten Kanal die für sich auserkorene Lücke zwischen boulevardistischen oder konservativen Medien und den sogenannten Alternativen Medien schließen und erfolgreich bedienen? Der rasante Anstieg der Abonnenten sei schon bemerkenswert, sagt Medienökonom Christopher Buschow von der Bauhaus-Universität Weimar. Dass dies einem YouTube-Format gelinge, das aktuelle Sachverhalte kommentiert, sei nicht selbstverständlich. ""Aber die Frage ist halt, wie schnell das auch wieder abebbt. Das kann auch schnell zu Ende sein"", sagt Buschow. Wie groß die Zielgruppe letztlich sei und wie viele Menschen Reichelt mit seinen polarisierenden Inhalten auf Dauer tatsächlich erreichen könne, werde sich zeigen, so der Medienökonom. Das Setting der Show erweckt den Eindruck einer seriösen Nachrichtensendung. Reichelt sitzt an einem Schreibtisch vor einem Monitor*, auf dem Schlagzeilen, Bilder und Videos eingeblendet werden, die visuell das unterstützen, was Reichelt sagt. Allerdings, so heißt es selbst in der Beschreibung des Kanals, handelt es sich um eine ""Meinungs-Show"". Wie Reichelt auf YouTube schreibt, will er ""zu einer der klarsten und unüberhörbarsten Stimmen dieses Landes werden - zur Stimme der Mehrheit."" So heißt es in der Kanalinfo: ""Wir sind der schärfste Widersacher von Spin, erdrückenden Narrativen, Ideologien, Bigotterie und Scheinheiligkeit in der Politik. Wir wollen furchtlos und respektlos über das sprechen, was in unserem Land passiert."" Auf eine Anfrage von tagessschau.de antwortete Reichelt nicht, stattdessen veröffentlichte er diese auf Twitter. ""Zunächst einmal hebt Reichelts YouTube-Kanal sich von anderen dadurch ab, dass Reichelt und Teile seines Teams eine journalistische Ausbildung absolviert haben"", sagt Jan Rathje, Senior Researcher vom Center für Monitoring, Analyse und Strategie (CeMAS). ""Sonst unterscheidet sich sein Kanal nicht allzu sehr von anderen 'Alternativmedien', die in steter Folge Meinungsbeiträge produzieren, die als Nachrichten aufgefasst werden."" Es bleibe abzuwarten, inwiefern Reichelt die zunehmende Aufmerksamkeit rechtspopulistischer und verschwörungsideologischer Milieus weiterhin sicherstellen könne. In den Videos, die in der Regel zwischen 15 bis 20 Minuten lang sind, fänden sich vor allem rechtspopulistische Inhalte mit einer Tendenz ins Rechtslibertäre, so Rathje. Dies werde etwa in seinen apokalyptischen Darstellungen der Zukunft Deutschlands deutlich. ""Julian Reichelt präsentiert sich auf seinem Kanal als ein weiterer Untergangsprophet und reproduziert rechte Feindbilder."" Das hält Rathje grundsätzlich für problematisch. Im verschwörungsideologischen Milieu kommt Reichelts YouTube-Kanal gut an. Seine Videos werden von reichweitenstarken Telegram-Accounts aus der Szene geteilt, wie etwa den Kanälen von Eva Herman, Bodo Schiffmann oder Oliver Janich, der kürzlich auf den Philippinen festgenommen wurde. Auch das rechtsextreme Magazin ""Compact"" teilte Reichelts Inhalte. Innerhalb der Kanäle und Gruppen zählten Reichelts Videos zu den am meisten geteilten, sagt Rathje. Ihm komme seine vorherige Karriere bei etablierten Medien sogar zugute. ""Innerhalb verschwörungsideologischer Milieus wird er als eine Art Renegat angesehen, der nun mutmaßlich von allen Zwängen des 'Mainstreams' befreit berichten könne."" Inhaltlich bedient Reichelt ähnliche Feindbilder der Szene. Grüne, die durch eine Klimadiktatur das Leben der Deutschen einschränken, öffentlich-rechtliche Medien, die vom Staat gesteuert werden oder Zwangsimpfungen gegen das Coronavirus. ""Die in seinen Videos propagierte unterkomplexe Darstellung von Politik als Auseinandersetzung von gutem deutschem Volk versus böser rot-grüner Elite deckt sich mit verschwörungsideologischen Vorstellungen, die dahinter noch eine Verschwörung unterstellen"", so Politikwissenschaftler Rathje. Hinter Reichelts YouTube-Kanal steht laut Impressum die Firma Rome Medien GmbH. Diese wurde am 28. März 2022 im Handelsregister eingetragen, zum Gegenstand des Unternehmens heißt es: ""Die Produktion, die nationale Verbreitung und Vermarktung von Medieninhalten durch diverse Verbreitungskanäle (z. B. Online, Mobile, Lineares TV)"". Geschäftsführer ist Reichelt selbst. In den vergangenen Wochen und Monaten hatten einige ehemalige Weggefährten Reichelts von der ""Bild"" ihren Wechsel zu Rome Medien bekannt gegeben. Laut Recherchen von ""t-online"" könnte der Milliardär Frank Gotthardt ein zahlungskräftiger Kooperationspartner Reichelts sein. Gotthardt ist nicht nur Hauptgesellschafter der Kölner Haie, sondern mit seinem Regionalsender TV Mittelrhein und WWTV auch im regionalen Fernsehgeschäft tätig. Nach seinem Rauswurf bei der ""Bild"" wegen mutmaßlichen Machtmissbrauchs gegenüber Mitarbeiterinnen hatte Reichelt zunächst über seinen Instagramkanal kurze Videos über politische Ereignisse veröffentlicht. Ein Fanaccount namens ""Reichelt Ultras"" verbreitete diese auch bei YouTube. Anfang Juli übernahm Reichelt den Kanal und holte den vorherigen Betreiber des Accounts eigenen Angaben zufolge in sein neues Team. Von der Aufmachung als auch inhaltlich weisen die Sendungen von Reichelts YouTube-Kanal starke Parallelen zu der Show des Fox-News-Moderators Tucker Carlson auf. Dieser setzt auf einen radikalen, krawalligen Kurs und verteidigt seit Jahren unter anderem regelmäßig den russischen Machthaber Wladimir Putin. Carlson gilt in den USA quasi als Sprachrohr von Ex-Präsident Donald Trump. Inwieweit das US-amerikanische Konzept Carlsons auch in Deutschland Erfolgsaussichten habe, sei fraglich, so Medienökonom Buschow. ""Wir haben in Deutschland nicht so eine polarisierte Gesellschaft und Mediennutzung wie in den Vereinigten Staaten."" Der Großteil der Deutschen vertraue den etablierten Medien und ihrer Berichterstattung. ""Achtung Reichelt"" sei ""letztlich ein Nischenprodukt, bei dem interessant zu sehen sein wird, wie groß es unter den deutschen Marktbedingungen, die völlig andere sind, werden kann."" Das werde die Entwicklung in den kommenden Monaten zeigen. * In einer früheren Version hieß es, dass er vor einem sogenannten Greenscreen sitzt "
22.08.2022 12:28 Uhr,Russisches Öl billiger,Türkei verdoppelt Ölimporte aus Russland,"Weil die Türkei keine Sanktionen gegen Russland verhängt hat, ist das von dort stammende, relativ günstige Öl derzeit besonders attraktiv. Im Vergleich zum Vorjahr hat die Türkei ihre Ölimporte aus Russland mehr als verdoppelt. Die russischen Ölexporte in die Türkei haben sich in diesem Jahr mehr als verdoppelt. Das geht aus am Morgen veröffentlichten Daten des Finanzdienstleisters Refinitiv hervor. Die Einfuhren russischen Öls in die Türkei stiegen in diesem Jahr auf durchschnittlich mehr als 200.000 Barrel pro Tag. Im gleichen Zeitraum des Vorjahres waren es im Schnitt noch 98.000 Barrel am Tag gewesen. Die Türkei hat Russland trotz des Krieges gegen die Ukraine bislang nicht sanktioniert und begründet dies damit, auf russische Energielieferungen angewiesen zu sein. Der russische Präsident Wladimir Putin und sein türkischer Amtskollege Recep Tayyip Erdogan vereinbarten Anfang August darüber hinaus eine verstärkte wirtschaftliche Zusammenarbeit. Die wichtigsten türkischen Raffinerien haben den Daten zufolge deutlich mehr russisches Öl der Sorten Urals und Siberian Light verarbeitet. Zugleich nahmen die Käufe von Ölsorten aus der Nordsee, dem Irak und Westafrika ab. Russisches Öl ist derzeit deutlich billiger zu haben als etwa jenes aus der Nordsee oder dem Irak. Russland ist nach den USA und Saudi-Arabien der drittgrößte Ölproduzent der Welt. Ein Barrel (159 Liter) der Nordseesorte Brent kostet aktuell rund 96 Dollar. ""Die Entscheidung der türkischen Raffinerien lag auf der Hand, da sie keine Beschränkungen für den Kauf von russischem Öl haben"", sagte ein Händler. Die Gewinnmargen seien gut. Weder das türkische Energieministerium noch die Raffinerien wollten sich auf Anfrage zu den Daten äußern. Die Internationale Energieagentur hat ihre Prognose erst in diesem Monat nach oben revidiert und rechnet für dieses Jahr nun mit einer höheren Ölförderung in Russland. Zuvor war die Agentur von einem stärkeren Rückgang des russischen Angebots ausgegangen. Derzeit kurbeln sowohl der steigende Ölverbrauch für die Stromerzeugung als auch die Umstellung von Gas auf Öl die Nachfrage nach dem Rohstoff an. Zwar seien die Exporte von Rohöl und anderen Ölprodukten nach Europa, in die USA, nach Japan und Korea seit Beginn des Krieges zurückgegangen, hieß es in dem Bericht. Die Umleitung der Ströme nach Indien, China, in die Türkei und andere Staaten sowie eine höhere russische Inlandsnachfrage haben die Verluste aber abgefedert. Noch zu Beginn des Jahres standen die Ölimporte aus Russland für ein Fünftel der gesamten Öleinfuhren in die Türkei. Nach Daten der Forschungsorganisation Centre for Research on Energy and Clean Air (CREA) ist die Türkei nach China, den Niederlanden und Deutschland der größte Importeur von russischem Gas. "
22.08.2022 12:16 Uhr,36 Jahre nach Tschernobyl,Wildpilze noch mit Cäsium belastet,"Wer Pilze für den eigenen Verzehr sammelt, sollte auch 36 Jahre nach der Reaktorkatastrophe von Tschernobyl auf die Belastung mit radioaktivem Cäsium-137 achten. Das Bundesamt für Strahlenschutz hat dazu einen Bericht veröffentlicht. In Süddeutschland können Wildpilze auch 36 Jahre nach dem Reaktorunfall in Tschernobyl noch mit mehr radioaktivem Cäsium belastet sein, als der Grenzwert festlegt. Das erklärte das Bundesamt für Strahlenschutz in Salzgitter. Neben der Atomkatastrophe von Tschernobyl im Jahr 1986 sei ein geringer Teil des Cäsiums auch auf Atomwaffentests in den 1950er und 1960er Jahren zurückzuführen, so das Bundesamt. Pro Kilogramm Frischmasse gilt bei Pilzen im Handel ein Grenzwert von 600 Becquerel Cäsium-137. Wer Pilze für den eigenen Verzehr sammele, könne den Pilzbericht des Bundesamts für Strahlenschutz zur Orientierung nutzen, sagte Präsidentin Inge Paulini. In dem Bericht ist nachzulesen, welche Speisepilzarten und welche Regionen in Deutschland besonders betroffen sind. ""In diesen Gebieten - etwa dem Bayerischen Wald, dem Alpenrand und dem Donaumoos südwestlich von Ingolstadt - sollte man selbst gesammelte Pilze nur in Maßen verzehren, um eine unnötige Strahlenbelastung zu vermeiden"", so Paulini. Im Pilzbericht sind Untersuchungsergebnisse aus den Jahren von 2019 bis 2021 zusammengefasst. Semmelstoppelpilze und rotbraune Semmelstoppelpilze wiesen in diesem Zeitraum besonders hohe Werte auf - zum Teil über 4.000 Becquerel Cäsium-137 pro Kilogramm Frischmasse. Verschiedene Schnecklingsarten, gelbstielige Trompetenpfifferlinge, gemeine Rotfußröhrlinge, Maronenröhrlinge, Mohrenkopfmilchlinge, Ockertäublinge, rotbraune Scheidenstreiflinge, seidige Ritterlinge, violette Lacktrichterlinge und Ziegenlippen hatten Messwerte oberhalb von 1.000 Becquerel pro Kilogramm. Champignons, Austernseitlinge und andere Zuchtpilze hat das Bundesamt für Strahlenschutz nicht untersucht. Der Gehalt von Cäsium-137 sei bei diesen Pilzen äußerst gering und vergleichbar mit anderen landwirtschaftlichen Produkten. "
