date,topline,headline,content22.08.2022 16:13 Uhr,Japanische Insel bei Taiwan,"Was aus Yonaguni wird, falls China losschlägt","Die Insel Yonaguni ist der westlichste Punkt Japans - nicht weit von Taiwan. Die Bewohner befürchten, dass bei einem Angriff Chinas Raketen auch ihre Insel treffen könnten. Von Tokio erwarten sie wenig. Fischer Ichinari Toshitsugu und sein Boot sitzen immer häufiger auf dem Trockenen. Die Ausbeute ist mager dieses Jahr: Die Wassertemperatur steigt wegen des Klimawandels, und manchmal muss der 32-Jährige an Land bleiben. Befehl von oben - hinausfahren sei zu gefährlich, wegen der Chinesen. Als im Rahmen der Manöver rund um Taiwan nach US-Politikerin Nancy Pelosis Besuch vor etwas mehr als zwei Wochen mehrere chinesische Raketen in Hörweite der Fischer ins Wasser einschlugen, gab es erstmal fünf Tage Ausfahrverbot. Und ein wachsendes Gefühl der Angst, dass ein möglicher Angriff auf Taiwan den Frieden auf Insel für immer beendet. Yonaguni ist der westlichste Punkt Japans, liegt nur 110 Kilometer östlich von Taiwan, an klaren Tagen kann man die Umrisse der Insel am Horizont erkennen. Die 1500 Einwohner von Yonaguni leben vom Fischfang, arbeiten im kleinen Rathaus oder kümmern sich um die wenigen Tauchtouristen. Viele Jahrzehnte lang litt die Insel unter Bevölkerungsschwund. Vor fünf Jahren dann verlegte das japanische Verteidigungsministerium etwa 160 Angehörige der Selbstverteidigungsstreitkräfte nach Yonaguni - es reagierte damit auf die wachsende Bedrohung durch China. Seitdem ist wieder mehr Leben auf der Insel: Die Armee kontrolliert die Gewässer und den Luftraum, ihre Kinder gehen in die lokale Grundschule, die Frauen der Soldaten arbeiten in den kleinen Lebensmittelläden. Vom Massentourismus ist die Insel bislang unberührt, es gibt keine Hotelressorts, stattdessen azurblaues Wasser und menschenleere Strände. Das hektische Tokio fühlt sich nicht nur unglaublich weit entfernt an, es ist es auch: 2000 Kilometer. Von der dortigen Politik fühlen sich die Bewohner von Yonaguni im Stich gelassen. ""Obwohl gerade 80 Kilometer von hier Raketen einschlugen, war die Reaktion der Regierung ein läppisches Stück Papier. Die haben ein Fax geschickt, um uns darüber zu informieren. Was soll ich denn davon halten?"", fragt Fischer Toshitsugu. Er war selbst Soldat, doch er vertraut nicht darauf, dass die im Falle eines Angriffs die Insel verteidigen können. Seit er vor zwei Jahren ausgeschieden ist, versucht er nun, seine Familie mit dem Fischfang zu ernähren. Seine Frau erwartet ihr erstes Kind. ""Ob das in Frieden aufwachsen kann?"" fragt er sich. Ein paar Kilometer weiter steht Kenichi Itokazu, der Insel-Bürgermeister, in seinem Rathaus über eine große Landkarte gebeugt und runzelt die Stirn. Im Ernstfall möchte er seine Bürger schnellstmöglich evakuieren, doch wohin? ""Es gibt keine sicheren Orte auf der Insel, keinen Platz, um sich zu verstecken"", sagt Itokazu. Er glaubt zwar nicht daran, dass China Taiwan in naher Zukunft angreift - zu sehr fürchtete das Land Sanktionen der USA und Europa - aber falls das doch eintreten sollte, könnte seine Insel zum Kollateralschaden werden. Mindestens eine Woche würde es dauern, alle Inselbewohner auszufliegen. Denn die zwei Häfen sind winzig, ebenso der Flughafen, die Landebahn zu kurz für große Maschinen. Deshalb arbeitet der Bürgermeister nun an einem Plan, die Infrastruktur auszubauen. Doch Tokio ist keine große Hilfe: Demnächst sollen zwar mehr Streitkräfte auf die Yonaguni-Basis versetzt werden, doch bei einer möglichen Evakuierung der Zivilisten nutzen sie wenig, denkt Itokazu. ""In ein bis zwei Jahren ist China Amerika wirtschaftlich ebenbürtig. Dann könnten sie einen militärischen Angriff wagen."" Er hofft, dass die japanische Regierung bis dahin eine Lösung für seine Insel gefunden hat. ""Wenn es hart auf hart kommt, möchte ich keinen einzigen Bürger hier zurücklassen müssen."" Zurück im Hafen macht Toshitsugu auf seinem Boot klar Schiff. Seine Kollegen haben gerade einen großen Fang gemacht: der blaue Marlin, den sie aus dem Wasser gezogen haben, bringt umgerechnet gut 700 Euro. Der 32-Jährige möchte auch bald wieder hinausfahren - trotz des Risikos, dass jederzeit wieder eine chinesische Rakete ins Meer fallen könnte. Aber die Miete muss bezahlt werden, und der Flug auf die nächstgrößere Insel für die nächste Ultraschall-Untersuchung seiner schwangeren Frau."" Wenn ich draußen bin, fahre ich oft an taiwanischen Fischern vorbei. Wir winken uns dann zu wie Freunde"", erzählt er. ""Das sind doch auch Menschen, die vom Meer leben, und die haben ja noch viel größere Angst als wir hier."" Diese und weitere Reportage sehen Sie auch in den tagesthemen - um 22.15 Uhr im Ersten. "
22.08.2022 16:08 Uhr,Kanzler Scholz und Vizekanzler Habeck,"Zwei Stimmen, ein Ziel","Der eine erklärt die Welt in einfacher Sprache, der andere überlegt sich jedes Wort - und schweigt zur falschen Zeit: Die Kommunikation von Scholz und Habeck könnte unterschiedlicher nicht sein. In Kanada müssen sie mit einer Stimme sprechen. Flughafen Montreal. Ein Bundeswehr-Airbus mit der deutschen Regierungsspitze an Bord rollt langsam zu seiner Parkposition. Kanzler und Vizekanzler reisen in derselben Maschine. Was aus US-amerikanischer Sicht undenkbar wäre - dort muss die Macht des Landes aus Sicherheitsgründen auf mehrere Flugzeuge verteilt werden - ist in der deutschen Verfassung nicht eindeutig definiert. Also fliegt man mit nur einer Maschine, was in Zeiten energiepolitischer Probleme vielleicht auch ein Zeichen ist. Die Tür geht auf, heraus kommt Olaf Scholz. Allein. Er schreitet die Treppenstufen hinunter aufs Rollfeld und wird von den Vertretern der kanadischen Regierung begrüßt. Und Robert Habeck? Er erscheint erst später, steht kurz etwas verloren herum, weil die Augen der Delegation auf den Kanzler gerichtet sind. Aber Habeck ist es, der das erste Interview aus Montreal gibt - am Montag im gemeinsamen Morgenmagazin von ARD und ZDF. Dem Gesicht des Vizekanzlers und Wirtschaftsministers sieht man den Jetlag an, die möglicherweise kurze Nacht. Aber Habeck liefert ab. Interviews sind seine Paradedisziplin, das Erklären der Weltlage in einfachen Worten. Habeck spricht von fehlender Infrastruktur, um Deutschland unabhängig von russischem Gas zu machen. Aber man löse das Problem jetzt - durch den Bau von Terminals für Flüssiggas. Trotzdem redet Habeck nichts schön: Deutschland habe einen ""sehr kritischen Winter vor der Nase"". Habeck redet frei, er will überzeugen, spricht in Interviews oft wie in einem privaten Plausch. Er antwortet auf die ihm gestellten Fragen und schweift nur selten aus. Habeck gibt auch häufiger zu, dass er etwas nicht weiß. Das ist selten für einen Politiker. Und er kämpft in deutschen Talkshows auch schon mal mit den Tränen, wenn ihn ein Thema berührt. Habeck ist empathisch, nachdenklich und pragmatisch zugleich. Seine Art erklärt, warum er zu den beliebtesten Politikern Deutschlands gehört. Zusammen mit Außenministerin Annalena Baerbock ist Habeck das Zugpferd der Bundesregierung und der Grünen. Dank seiner guten Umfragewerte ist die ganze Partei im Aufwind: Im ARD-DeutschlandTrend liegt sie wieder vor der SPD. Viele Sozialdemokraten sehen diese Entwicklung mit Sorge. Ist Habeck der bessere Scholz? Oder sogar ein Anti-Scholz? Ist es vielleicht eine Frage des Alters? Könnte sein. Scholz scheint einer anderen Generation von Politikern anzugehören, für die es undenkbar ist, öffentlich Emotionen zu zeigen. Auf Journalistenfragen direkt zu antworten, ist für den 64-Jährigen auch eher die Ausnahme. Er spricht lieber darüber, was ihm gerade in den Sinn kommt. Es ist eine stoische Ruhe, aus der sich Scholz nur ungerne bringen lässt. Der Kanzler gibt keine Fehler zu und zeigt keine Schwächen. Stattdessen ist sein Selbstbewusstsein so ausgeprägt wie bei kaum einem anderen deutschen Spitzenpolitiker. Am Wochenende zeigt sich das beim Tag der Offenen Tür der Bundesregierung. Scholz nennt das Neun-Euro-Ticket prompt ""eine der besten Ideen, die wir hatten"". Etliche Pendler, die sich seit drei Monaten in übervolle Busse und Bahnen quetschen müssen, würden das wohl eher nicht unterschrieben. In Interviews oder auf Pressekonferenzen bügelt Scholz Journalisten auch gerne mal mit einem ""nö"" ab. Dazu sein verschmitztes Grinsen - das kann arrogant wirken. Scholz fühlt sich oft klüger als die anderen, manche nennen ihn daher einen Besserwisser. Kommunikationswissenschaftler Olaf Hoffjann von der Universität Bamberg hat dafür eine Erklärung. Der Kanzler versuche, um jeden Preis Fehler zu vermeiden. Scholz wolle nicht durch unbedachte Äußerungen weitere Krisen heraufbeschwören. Doch Schweigen ist auch nicht immer die beste Methode. Das zeigt sich vergangene Woche, als Palästinenserpräsident Abbas zu Gast im Kanzleramt ist und dort für alle hörbar Worte spricht, die den Holocaust relativieren. Scholz greift nicht ein, lässt die Worte Abbas' zunächst unkommentiert. Experte Hoffjann stellt sich die Frage, ob Scholz ""die Kommunikation einfach nicht wichtig genug ist oder ob es nicht besser kann."" Habeck dagegen kommuniziere überzeugender, so Hoffjann, was Scholz wiederum das Regieren nicht gerade leichter mache. Habeck kann leicht politische Versäumnisse der vergangenen Jahre ansprechen, die Abhängigkeit von Russland in Energiefragen. Seine Kritik richtet sich an die Regierung von Angela Merkel, in der Scholz zuletzt Vizekanzler war. Scholz muss sich beim Blick zurück daher oft an die eigene Nase fassen. Auch wenn sie Politiker von höchst unterschiedlichem Schlag darstellen: Inhaltlich sind Scholz und Habeck zumindest in den Grundzügen einer Meinung. Sie haben dieselben Ziele auf dieser Kanada-Reise: Deutschland in der Energiepolitik unabhängiger von Russland zu machen, die Zusammenarbeit mit Kanada zu stärken - zumindest mittelfristig. Es geht um die berühmte Zeitenwende, die Kanzler Scholz Ende Februar ausgerufen hatte. Die Zeitenwende in der politischen Kommunikation allerdings, scheint sein Vize für sich entschieden zu haben. "
22.08.2022 15:43 Uhr,Nach Fischsterben,Lemke fordert Stopp des Oder-Ausbaus,"Die Suche nach den Ursachen des Fischsterbens in der Oder dauert an. Bundesumweltministerin Lemke forderte einen Stopp des Fluss-Ausbaus. Gleichzeitig wies ihr Ministerium den polnischen ""Fake News""-Vorwurf zurück. Bundesumweltministerin Steffi Lemke (Grüne) hat angesichts des Fischsterbens den Stopp des Oder-Ausbaus für die Schifffahrt gefordert. ""Bei der dramatischen Umweltkatastrophe, die sich gerade auf 500 Flusskilometern entlang der Oder mit einem massiven Fischsterben ereignet, wird drastisch deutlich, dass ohnehin stark belastete Gewässer besonders geschützt werden müssen"", sagte sie. Der Ausbau der Oder ""belastet dieses wertvolle Ökosystem zusätzlich"". Stattdessen forderte Lemke Renaturierungsmaßnahmen. Deutschland und Polen hatten 2015 den Ausbau der Oder vereinbart. Ein Aktionsbündnis klagt gegen das Projekt, auf polnischer Seite wird aber bereits gebaut. Die rund 500 Kilometer lange Oder ist einer der letzten großen, naturnahen Flüsse in Europa. Die Bundesregierung wies polnische Vorwürfe im Zusammenhang mit dem Fischsterben in der Oder zurück. ""Wir bedauern, dass es zu dieser Bewertung von polnischer Seite gekommen ist"", sagte ein Sprecher des Bundesumweltministeriums mit Blick auf den Vorwurf aus Warschau, Deutschland verbreite ""Fake News"" (Falschnachrichten). Die Suche nach den Ursachen für das Fischsterben in der Oder sei nach wie vor nicht abgeschlossen. Mittlerweile gebe es mehrere organische und anorganische Substanzen, die dafür verantwortlich sein könnten, sagte der Sprecher weiter. ""Es scheint sich da wirklich um einen Chemie-Cocktail zu handeln. Keine dieser Substanzen hat nach unseren bisherigen Erkenntnissen allein zum Fischsterben geführt."" Es könnte sich um ein ""multi-kausales Ereignis"" handeln. ""Von keiner Seite und zu keiner Zeit wurde in Deutschland aber behauptet, dass die Pestizide allein ursächlich für das Fischsterben gewesen seien. Dass entsprechende Laborergebnisse vom polnischen Umweltministerium jetzt als Schuldzuweisung verstanden wurden, ist bedauerlich."" Polens Umweltministerin Anna Moskwa hatte am Samstagabend auf Twitter geschrieben: ""Achtung, eine weitere Fake News wird in Deutschland verbreitet! Pestizide und Herbizide. In Polen wurde der Stoff getestet und unterhalb der Bestimmungsgrenze nachgewiesen, d. h. ohne Auswirkungen auf Fische oder andere Tiere, und ohne Verbindung zum Fischsterben."" Heute tage erstmals die eingesetzte deutsch-polnische Expertengruppe. Man hoffe, dass eine ""mögliche Missstimmung"" ausgeräumt werde, wenn dort die Laborergebnisse vorgelegt und besprochen werden. Polens Regierung bemängelte unterdessen, dass deutsche Behörden nur wenige Ölsperren zum Auffangen der massenweise verendeten Fische in der Oder aufgestellt hätten. ""Hier stellt sich wirklich die Frage, warum wir auf polnischer Seite bereits 29 Ölsperren errichten konnten, in denen tote Fische aufgefangen werden, während auf deutscher Seite trotz unserer Bitten darum bisher nur drei solcher Barrieren errichtet wurden"", sagte Vize-Außenminister Szymon Szynkowski vel Sek dem öffentlich-rechtlichen Sender Polskie Radio. Die polnische Feuerwehr sei auch bereit, diese Sperren auszuleihen oder sie auf der deutschen Seite zu errichten. Die Ölsperren werden im Fluss eingesetzt, um verendete Fische aufzufangen und zu bergen, bevor diese noch weiter flussabwärts treiben. Angesichts des massenhaften Fischsterbens riefen deutsche und polnische Kirchen zu mehr Umweltschutz auf. ""Als Kirchen östlich und westlich der Oder vereint uns das Anliegen, dass alle erforderlichen Bemühungen zur Bewahrung der natürlichen Umwelt unternommen werden"", heißt es in einer unter anderem in Berlin und Breslau (Wroclaw) veröffentlichten Erklärung. Zu den Unterzeichnern gehören der katholische Berliner Bischof Heiner Koch, der Bischof der Evangelischen Kirche Berlin-Brandenburg-schlesische Oberlausitz, Christian Stäblein, Bischof Waldemar Pytel von der Evangelisch-Augsburgischen Diözese Breslau, die Generalsuperintendentin im Kirchensprengel Görlitz, Theresa Rinecker, sowie Bischof Tadeusz Litynski vom Bistum Zielona Gora-Gorzow. ""Wir wenden uns an alle Menschen guten Willens, um mit gemeinsamem Engagement die Wiederherstellung der Flora und Fauna in der Oder und in ihrem Naturraum zu ermöglichen"", betonten die Kirchenvertreter. ""Gleichzeitig sehen wir die Möglichkeit und Notwendigkeit einer gesellschaftlichen und materiellen Unterstützung der Bemühungen für die Oder, das kostbare Naturdenkmal, und die mit ihr verbundene Infrastruktur."" Die Oder sei ""unser gemeinsamer Naturschatz, den wir gemeinsam an beiden Ufern erleben."" "
22.08.2022 15:37 Uhr,Nachfolge-Suche läuft,Adidas trennt sich von Chef Rorsted,"Ein Chefwechsel soll Adidas ""einen Neustart ermöglichen"": Kasper Rorsted wird den Sportartikelhersteller 2023 vorzeitig verlassen, wie das Unternehmen mitteilte. Die Suche nach einem Nachfolger läuft. Adidas-Chef Kasper Rorsted verlässt den Sportartikelhersteller aus Herzogenaurach im nächsten Jahr vorzeitig. Das teilte der DAX-Konzern nach einer Sitzung des Aufsichtsrats mit. Der Vertrag des Dänen war eigentlich zuletzt im Jahr 2020 bis 2026 verlängert worden. Das Unternehmen und Rorsted hätten sich auf sein Ausscheiden 2023 ""in gegenseitigem Einvernehmen"" geeinigt. Einen Nachfolger gibt es noch nicht - ""die Nachfolge-Suche läuft"", erklärte der Konzern dazu. Rorsted werde sein Amt so lange weiterführen, bis ein neuer Vorstandsvorsitzender gefunden sei. Gemeinsam mit dem Aufsichtsrat und dem Vorstand soll er für einen reibungslosen Übergang an der Spitze von Adidas sorgen. Adidas-Aufsichtsratschef Thomas Rabe sagte, nach drei herausfordernden Geschäftsjahren, die weltweit von der Corona-Pandemie und geopolitischen Spannungen geprägt gewesen seien, sei nun der richtige Zeitpunkt für einen Wechsel gekommen, ""um dem Unternehmen einen Neustart zu ermöglichen"". ""Unter Kasper Rorsteds Führung hat Adidas seine digitalen Fähigkeiten erheblich ausgebaut und die Online-Umsätze des Konzerns mehr als verfünffacht"", sagte Rabe. Adidas habe zudem seine Führungsposition in Sachen Nachhaltigkeit untermauert. Rorsted war unter anderem für den Verkauf der Marke Reebok verantwortlich, die für Adidas lange Zeit ein Sorgenkind war. Rorsted sagte, die vergangenen Jahre seien von zahlreichen externen Faktoren gekennzeichnet gewesen, die das Geschäft erheblich beeinträchtigt hätten. ""Es hat viel Kraft gekostet, diese externen Herausforderungen zu bewältigen. Deshalb ist ein Neustart im kommenden Jahr für das Unternehmen und mich persönlich richtig und wichtig."" Derzeit hat Adidas vor allem in China immer noch mit den Folgen der Corona-Lockdowns zu kämpfen. Der Konzern hatte zuletzt seine Gewinn- und Umsatzprognose wegen schwächerer Geschäfte in dem Land eingedampft. Rorsted gab die Hoffnung auf, dass sich das hochprofitable China-Geschäft in der zweiten Jahreshälfte erholen wird. Sollte China längerfristig als Wachstumsmarkt ausfallen, könnte das die Gewinn- und Umsatzziele für die Jahre bis 2025 in Frage stellen, sagte Rorsted zuletzt. Ende Juli musste der Sportartikelhersteller seine Jahresprognose nach unten schrauben. Im zweiten Quartal waren die Erlöse in China um knapp 35 Prozent eingebrochen. Die Null-Covid-Strategie sowie Aufrufe zum Boykott westlicher Marken hatten das Geschäft eingetrübt. Kritiker bemängelten jedoch auch die Strategie des Unternehmens, das in China eher auf physische Läden gesetzt hatte als auf die Online-Präsenz. Der 60-jährige Rorsted hatte den Posten bei Adidas im Jahr 2016 übernommen. Zuvor war der gebürtige Däne Chef des Konsumgüterherstellers Henkel gewesen. Das ""Manager Magazin"" kürte ihn zum Manager des Jahres 2019, weil der Börsenwert des Sportartikelkonzerns seit seinem Amtsantritt stark gestiegen war. Nun hat sich der Aktienkurs innerhalb eines Jahres nahezu halbiert. Vor einem Jahr notierten die Adidas-Aktien noch bei knapp über 300 Euro - aktuell zahlen Anleger nur noch 160 Euro. An der Börse gaben die Aktien des Sportartikel-Herstellers nach der Ankündigung des Rorsted-Rückzugs nach. "
22.08.2022 15:23 Uhr,Visavergabe an Touristen,Union fordert Einreiseverbot für Russen,"Sollen russische Touristen als Reaktion auf den Angriffskrieg Russlands auf die Ukraine keine EU-Visa mehr erhalten? Darüber streiten deutsche Politiker - während einige EU-Staaten bereits handeln. Verschiedene Unionspolitiker fordern ein Ende der Visavergabe an russische Touristen. Der CDU-Europapolitiker Dennis Radtke sagte der ""Bild""-Zeitung, es sei unerträglich, dass Russen in Europa Urlaub machen und ihr Geld verjubeln, als wäre nichts geschehen. Und die stellvertretende Fraktionsvorsitzende der CDU/CSU-Bundestagsfraktion, Andrea Lindholz, meinte: ""Urlaubsziele dürfen in Putins Russland nicht länger Paris und Porto, sondern Pjöngjang und Peking heißen."" Die Bundesregierung dürfe sich dabei nicht wieder gegen die europäischen Partner stellen, so Lindholz. Einige EU-Länder hatten die Vergabe von Schengen-Visa an Russen bereits im Alleingang eingestellt. Dazu gehören Estland, Lettland, Litauen und Tschechien. Sie folgten damit auch dem Appell des ukrainischen Präsidenten Wolodymyr Selenskyj, der den Westen wiederholt aufgefordert hatte, Russen die Einreise zu verbieten. Finnland will die Ausgabe von derzeit 1000 Visa pro Tag von September an um 90 Prozent verringern. Auch Polen unterstützt ein EU-weites Visaverbot. Dänemark drängt auf eine gemeinsame EU-Lösung, will aber sonst auch allein handeln. Der Grünen-Vorsitzende Omid Nouripour kritisierte die Forderung der Unionspolitiker, äußerte aber auch Verständnis. Er verstehe die Gefühle derjenigen, die wegen des brutalen Angriffs auf die Ukraine touristische Reisen russischer Bürger in die EU unterbinden wollten, so Nouripour in einem Gespräch mit der Deutschen Presse-Agentur. Auch angesichts der hohen Zustimmung für Präsident Wladimir Putin in Russland, müsse man klarmachen, dass ""das so nicht geht"". Auf der anderen Seite sei das Erleben von Rechtsstaatlichkeit in den Staaten der Europäischen Union etwas, was sehr, sehr hilfreich sei, gerade gegen solche Diktaturen. Anstatt alle Russen auszusperren, müsse mehr unternommen werden, damit diejenigen, die Putin aktiv unterstützten, nicht mehr in die EU reisen könnten, sagte Nouripour. Er berief sich auf den inhaftierten Kremlgegner Alexej Nawalny, der darauf hingewiesen habe, dass weiterhin Hunderte von Oligarchen zum Shoppen nach Saint-Tropez fahren. ""Das ist kein haltbarer Zustand"", so Nouripour. Die Vorsitzende des Verteidigungsausschusses im Bundestag, Marie-Agnes Strack-Zimmermann, ist ebenfalls dagegen, EU-Visa für Russen generell einzuschränken. Man solle den Russen, die Putins System entkommen wollen, eine Chance geben, so die FDP-Politikerin. Strack-Zimmermann betonte im Gespräch mit den Zeitungen der Funke-Mediengruppe aber: ""Das ist nicht nur Putins Krieg. Kein Diktator dieser Welt kann so einen Krieg führen, wenn nicht ein Großteil der Bevölkerung hinter ihm steht."" Deshalb müsse jeder Einreisewunsch in die EU individuell geprüft werden. Auch der CDU-Politiker Philipp Amthor äußerte sich skeptisch zu dem Vorstoß seiner Unionskollegen, russische Touristen aus der EU auszuschließen. Im Interview mit dem Sender ntv warnte er davor, das russische Volk kollektiv zu bestrafen. Bundeskanzler Olaf Scholz hatte auf eine Forderung nach Einstellung der Visavergabe an russische Staatsbürger bereits ablehnend reagiert. Derweil bezeichnete Moskaus Verteidigungsminister Sergej Schoigu auf einem Kongress in der Nähe von Moskau die Vorschläge für ein Einreiseverbot von Russen in die Europäische Union als ""Nazi-Politik"" und warnte vor ""russophoben Ideen"". "
