date,topline,headline,content10.03.2022 18:43 Uhr,"""Global Video Church""",Radikalisierung einer Online-Kirche,"Von Satan gesteuerte Regierungen, Teufelsaustreibungen über Telegram, Impfen - des Teufels. Eine Online-Kirche aus Bingen wähnt sich seit Beginn der Corona-Pandemie im Endkampf und will nun sogar einen eigenen Staat gründen. Gegen die Ehe für alle, Sex vor der Ehe oder Abtreibungen - schon früher fiel die Online-Kirche ""Global Video Church"" Beobachtern als Gemeinde mit extremen Haltungen auf - begründet mit einer wörtlichen Auslegung der Bibel. Doch seit der Pandemie heißt es in den Videos des YouTube-Kanals, Corona sei ein Teil des ""Endzeitszenarios"", der Satan wolle eine ""Weltherrschaft"" aufbauen, Mikrochips im Gehirn seien keine Verschwörungstheorie, ""feurigen"" Christen werde es am Ende wie den Juden im Dritten Reich ergehen. Inga Haase, Gründerin des Vereins ""GVC Global Video Church e.V."" und Predigerin in den YouTube-Videos ruft Christen dazu auf, Europa zu verlassen und sich an der Gründung eines eigenen Christen-Staats zu beteiligen. 19.900 Menschen folgen dem Kanal. Philipp Kohler, Experte für Weltanschauungsfragen bei der evangelischen Landeskirche Württemberg, beobachtet den Online-Auftritt der Gemeinde schon seit der Gründung etwa 2014. Aus seiner Sicht hat sich die ""Global Video Church"" von einem professionell gestalteten theologischen Nischenkanal hin zu einem politischen Kanal mit klarer Systemkritik entwickelt. ""Richtig problematisch ist es meines Erachtens geworden, seitdem Corona angefangen hat und man angefangen hat, diese starke endzeitliche Ausrichtung zu haben. Indem man das System kritisiert, in dem wir leben. Indem man sagt, dass einzelne große Institutionen das Land regieren und steuern."" Während GVC früher eine umstrittene Hauskirchenbewegung gewesen sei, bilde sie jetzt ""ein Einstiegstor zu gefährlichem Verschwörungsdenken und offener Demokratiefeindlichkeit"". Jasmin Neumann, die in Wirklichkeit anders heißt, hat sich über Wochen mit der ""Global Video Church"" beschäftigt. In ihrem Bekanntenkreis habe sie von einer Person gehört, die über eine Berufsfachschule für pastorale Führungskräfte (THS) in Kontakt mit der ""Global Video Church"" gekommen sei. Die THS verfügt mittlerweile über drei Standorte in Deutschland und wurde vor einigen Jahren von Inga Haase und ihrem Mann gegründet. Jasmin erzählt: ""Die Person hat sich innerhalb kürzester Zeit so verändert, dass sie mittlerweile fast alle Kontakte in ihr altes Leben abgebrochen hat - das ganze Umfeld macht sich große Sorgen."" Eine Anfrage des SWR ließ die THS unbeantwortet. Jasmin jedenfalls wollte mehr über diese Gemeinschaft herausfinden. Unter falschem Namen baute sie Kontakte zu Mitgliedern der ""Global Video Church"" und der Berufsfachschule auf, führte lange, persönliche Videotelefonate mit Inga Haase und weiteren Mitgliedern, traf sich mit einer Person auch persönlich. Zu Beginn stellte sie sich in einer der Telegram-Gruppen der ""Global Video Church"" als verzweifelte junge Frau auf der Suche dar. Sie zeigt uns Chatprotokolle. Darin vergleicht ein Gruppenmitglied geimpfte Menschen mit Baalanbetern, die niedergemacht werden müssten. ""Manchmal braucht es echte Waffen"", steht dort in diesem Kontext. Ein anderes Mitglied, das überlegt, ob die Impfung nicht doch eine Option sein könne, bekommt als Reaktion: ""Verschwinde aus der Gruppe Satan. In Jesu Namen. Amen."" Studentin Jasmin bewirbt sich auch an der Berufsfachschule THS, die zwar von Inga Haase und ihrem Mann in Bingen gegründet wurde, heute aber nicht mehr von ihnen geleitet wird. Von Inga Haases Tochter wird sie zu einem Online-Bewerbunsgespräch eingeladen, an dem mehrere Bewerber teilnehmen. Eine Aufgabe für Jasmin: Ein kurzer Impulsvortrag zum Thema ""Ehe für alle"". Die Studentin blieb in ihrer gespielten Rolle, sagte entgegen ihrer tatsächlichen Meinung unter anderem, anhand der Bibel werde deutlich, ""dass die Ehe für alle widernatürlich ist"", sie ""Gottes Intention"" widerspreche und den Menschen schade. Sie wird an der BAföG-berechtigten Berufsfachschule angenommen. Die Bewerbung an der THS ist für die Studentin nur eine Erfahrung von vielen. Über persönliche Chats und Videotelefonate lernt sie schnell die Akteure der ""Global Video Church"" näher kennen. Ihre Erfahrung: ""Ich war da ganz schnell drin in einem Netzwerk. Alle haben mich so offen aufgenommen, haben eine unglaubliche Warmherzigkeit ausgestrahlt und mir auch immer neue Ansprechpartner genannt."" Sie verspürte einen Kontrast, der sie in den vergangenen Wochen beschäftigt habe: ""Wie passt das zusammen, dass so herzliche Menschen, die mich in einer vermeintlich verzweifelten Situation aufgenommen habe, so böse Inhalte vermitteln?"" Inga Haase lebt inzwischen mit ihrem Mann in Paraguay, auch die stellvertretende Vorsitzende des Vereins hat sich dorthin auf den Weg gemacht. Die Vision: Die Gründung eines eigenen Staates - mit eigenen Schulen, Krankenhäusern und Wissenschaft, heißt es. In einem Videochat mit der stellvertretenden Vorsitzenden kündigt diese an, ""wehrhaft (zu) sein, wir werden eine eigene Polizei haben. Und wir werden uns auch selbst verteidigen. Natürlich"". Unter Corona-Leugnern gilt Paraguay als Sehnsuchtsort. Etliche haben sich aus Deutschland auf den Weg gemacht, um dort eigene Kolonien zu gründen und der vermeintlichen Corona-Diktatur zu entkommen. Jasmin Neumann fragte sich, wie weit die Gruppe geht und fragte in einem Chat nach, ob sie nicht einen gefälschten Impfpass bekommen könne. Inga Haase schrieb sie daraufhin privat an, Jasmins Frage sei ""gefährlich"", schickte dann aber doch eine Sprachnachricht, in der es hieß, sie habe ""zwei Adressen, wo das sehr gut erhältlich ist und zuverlässig"". Sie könne Jasmin sehr gerne helfen und sagte weiter: ""Also halte durch, beuge dich bitte nicht. Weil mit jedem einzelnen Menschen, der sich beugt, geben wir diesem ganzen bösen System mehr Macht."" Innerhalb der Gemeinschaft spricht man in Zusammenhang mit dem Verkauf von gefälschten Impfpässen Jasmins Erfahrungen zufolge von ""Orangen"". Eine SWR-Anfrage hierzu lassen Inga Haase und die Berufsfachschule, zu der neben dem Hauptstandort in Bingen auch Standorte in Berlin und Nürnberg gehören, unbeantwortet. Zuletzt habe Inga Haase Jasmin nahegelegt, ihr vermeintliches Studium an der THS online von Paraguay aus durchzuführen und sich parallel dort aktiv in GVC-Projekte einzubringen. Jasmin beendet ihr Projekt, ihr Fazit: ""Was mich schockiert hat ist, dass man da quasi relativ schnell auch mit reingezogen wird und zur Isolation aufgefordert wird. Und mir so schnell auch nahegelegt wurde, nach Paraguay zu kommen."" Ihre Erfahrungen ließen sie auch traurig zurück. ""Viele dieser Menschen, denen ich begegnet bin, sollten eigentlich woanders aufgefangen werden. Und das macht es dann natürlich noch mal ein bisschen schwieriger, damit umzugehen. Dass man merkt, die Leute driften ab. Sie wirken für mich aber nicht wie böse Menschen."" "
10.03.2022 18:33 Uhr,Corona-Regel im Bundestag,AfD-Eilantrag gegen 2G-Plus scheitert,"Das Bundesverfassungsgericht hat einen Eilantrag der AfD-Fraktion gegen die 2G-Plus-Regel im Bundestag abgewiesen. Die Partei hatte mit einem ""Zweiklassensystem"" argumentiert. Dies konnten die Richter nicht nachvollziehen. Auf dem Höhepunkt der Omikron-Welle Anfang Januar 2022 hat auch der Bundestag seine Corona-Regeln verschärft, aus 3G wurde 2G-Plus. Nicht geimpfte und nicht genesene Abgeordnete können seitdem an Plenar- und Ausschutzsitzungen nur getestet und auf gekennzeichneten Tribünenplätzen teilnehmen. Dagegen klagte die AfD-Fraktion im Eilverfahren. Ihre Begründung: Effektive Oppositionsarbeit sei so für die Mitglieder der AfD-Fraktion nicht möglich. Die AfD sieht durch 2G-Plus sogar ein ""völlig neues Zweiklassensystem im deutschen Parlamentarismus"". Der Eilantrag der AfD-Fraktion ist vor dem Bundesverfassungsgericht nun gescheitert. Das Gericht sieht keine schweren Nachteile für die Parlamentsarbeit der AfD-Abgeordneten und keine Notwendigkeit für eine Eilanordnung. Eine ""Zweiklassengesellschaft"" im Parlament drohe nicht. 2G-Plus gelte gleichermaßen für alle Bundestagsabgeordneten, unabhängig davon, ob sie zur parlamentarischen Mehrheit oder Minderheit gehörten. Obwohl es sich um eine Eilentscheidung handelt, setzte sich das Bundesverfassungsgericht sehr detailgenau mit den Beschwerden der AfD auseinander: Auch von den Tribünen aus könnten AfD-Abgeordnete ihre Rede-, Stimm- und Antragsrechte ausüben. Und auch wenn die AfD argumentiere, dass auf der Tribüne des Plenarsaals ""Gemurmel, Raunen oder die ganze Stimmung im Saal"" nicht mitzubekommen seien, dann spreche das dennoch nicht gegen eine gleichberechtigte Mitwirkung an der Parlamentsarbeit. Die 2G-Plus-Regelung hat der Bundestag bis zum 13. März befristet. Die praktische Bedeutung des von der AfD angestrengten Verfahrens ist also gering. "
10.03.2022 18:32 Uhr,Katholische Bischöfe,"Waffenlieferungen ""grundsätzlich legitim""","Der russische Angriffskrieg zwingt die Kirche, ihre Friedensethik zu überdenken. Die katholischen Bischöfe betonten, dass Waffenlieferungen für die Ukraine ""grundsätzlich legitim"" seien. Die evangelische Kirche äußerte sich ähnlich. Auf ihrer Frühjahrsversammlung haben die katholischen Bischöfe den russischen Angriffskrieg verurteilt und sich uneingeschränkt an die Seite der Ukrainer gestellt. Auch Waffenlieferungen halten sie für gerechtfertigt. ""Rüstungslieferungen an die Ukraine, die dazu dienen, dass das angegriffene Land sein völkerrechtlich verbrieftes und auch von der kirchlichen Friedensethik bejahtes Recht auf Selbstverteidigung wahrnehmen kann"", seien ""grundsätzlich legitim"", heißt es in einer Erklärung der Deutschen Bischofskonferenz (DBK). Sie wurde zum Abschluss ihrer Frühjahrsvollversammlung im fränkischen Wallfahrtsort Vierzehnheiligen bei Bad Staffelstein verfasst. Weiter heißt es darin: ""Es ist denjenigen, die die Entscheidung zu treffen haben, aber aufgetragen, präzise zu bedenken, was sie damit aus- und möglicherweise auch anrichten. Dies gilt gleichermaßen für die Befürworter wie für die Gegner von Waffenlieferungen."" Der Krieg in der Ukraine stellt auch die christliche Friedensethik auf die Probe. ""In ihrer Lehre und in ihrem Handeln ist die Kirche der Gewaltlosigkeit Jesu verpflichtet. Auch in der Stunde der Bedrängnis muss sie deshalb der Versuchung einer schrankenlosen Gewaltanwendung entschlossen widersprechen"", heißt es in der DBK-Erklärung. ""Gewalt und Gegengewalt, auch wenn sie legitim ist, treiben eine Spirale der Gewalt an, die diese regelmäßig außer Kontrolle geraten lässt."" Ähnlich äußerte sich auch die Ratsvorsitzende der Evangelischen Kirche in Deutschland (EKD), Annette Kurschus. Sie hält es für schwierig, die geforderten Waffenlieferungen abzulehnen, wenn die Menschen sich nicht allein aus eigenen Kräften verteidigen könnten. ""Aber Waffenlieferungen gewährleisten nicht das Ende der Gewalt, das wir uns wünschen"", sagte die westfälische Präses dem Evangelischen Pressedienst epd. Kurschus betonte das Dilemma der kirchlichen Position. ""Wie immer wir uns positionieren: Wir können in dieser Situation keine weiße Weste behalten."" Sie halte es für zynisch zu sagen, Gebete und Mitgefühl mit den Menschen in der Ukraine müssten ausreichen. ""Ich kann nachvollziehen, dass die Ukraine in ihrer Selbstverteidigung unterstützt wird. Das ist ein echtes Dilemma."" Aber dem dürften die Kirchen nicht ausweichen, indem sie schweigen und sich aus der Verantwortung ziehen. Kurschus sagte zudem, dass die evangelische Friedensethik vor dem Hintergrund des Ukraine-Kriegs ""einer kritischen Prüfung"" unterzogen und neu diskutiert werden müsse. Die katholischen Bischöfe wandten sich in ihrer Erklärung auch gegen die Versuche des russisch-orthodoxen Moskauer Patriarchen Kyrill, den russischen Einmarsch zu verteidigen. ""Alle wahre Religion lehnt den Krieg ab. Er ist eine Niederlage der Humanität."" Wer ihn mutwillig auslöse, begehe ein Verbrechen vor Gott und den Menschen. In ihrer Lehre und in ihrem Handeln sei die Kirche der Gewaltlosigkeit Jesu verpflichtet. Der Vorsitzende der Bischofskonferenz, Georg Bätzing, betonte bei einer Pressekonferenz zum Abschluss der Frühjahrs-Vollversammlung der Bischöfe, es gebe eine große ökumenische Übereinstimmung in der Ablehnung des Krieges. Die Bischöfe forderten Entschlossenheit der westlichen Demokratien und Hilfe für die Opfer. ""Alle spüren: Die Invasion in die Ukraine ist auch ein Angriff auf Europa und seine Werte"", heißt es in dem vierseitigen Text. Europa tue gut daran, sich auf eine lange und schwierige Auseinandersetzung einzustellen. ""Eine Haltung der Entschlossenheit und der Eindeutigkeit, jenseits von Hysterie und von taktischem Lavieren, ist nötig, um diese Herausforderung zu bestehen."" "
10.03.2022 17:45 Uhr,Krieg gegen die Ukraine,Mariupol weiter unter Beschuss,"In Mariupol droht auch der nächste Versuch, Zivilisten in Sicherheit zu bringen, zu scheitern: Die Hafenstadt wird nach ukrainischen Angaben unaufhörlich von russischer Seite beschossen. Auch der russische Vormarsch auf Kiew geht weiter. Die ukrainische Hafenstadt Mariupol ist nach Angaben der ukrainischen Armee weiterhin unter Beschuss - obwohl dort ein Fluchtkorridor für die Bevölkerung geöffnet werden sollte. Die Geschosse würden Wohnhäuser treffen, auch sei ein Universitätsgebäude in der Stadt beschädigt worden, so die Pressestelle der Armee weiter. Angaben zu Opfern lagen zunächst nicht vor. Auf einem Video waren Einschläge zu sehen. Ein Platz war übersät mit Trümmern. Auf Telegram machte der Stadtrat von Mariupol Russland für den Angriff verantwortlich. Die stellvertretende Ministerpräsidentin Iryna Wereschtschuk sagte, am Donnerstag sei es keinem Zivilisten gelungen, die eingekesselte Stadt zu verlassen. Russische Truppen hätten eine vorübergehende Waffenruhe für Evakuierungen nicht respektiert. Der Beschuss habe zudem erneut einen Hilfstransport daran gehindert, dringend benötigte Güter zu den eingeschlossen Einwohnern zu bringen. ""Die Hilfsgüter wurden zurück nach Saporischschja gebracht."" In einem dramatischen Appell wandte Wereschtschuk sich an die internationale Gemeinschaft: ""Helft Mariupol! Dort ist eine reale humanitäre Katastrophe"", bat sie in einer Videobotschaft. ""Weder Wasser, noch Medikamente oder Lebensmittel gelangten zu den Menschen, die sich unter totalem Beschuss mehrere Tage hintereinander befinden."" In den vergangenen Tagen waren bereits mehrere Anläufe für Evakuierungen von Zivilisten aus der Stadt gescheitert. Mariupol im Südosten des Landes hat offiziell 400.000 Einwohner. Am Mittwoch war in Mariupol eine Geburtsklinik bombardiert worden. Bei dem Angriff wurden laut der Stadtverwaltung drei Zivilisten getötet - darunter ein Kind - und 17 Menschen verletzt. Obwohl die russische Seite stets zurückgewiesen hat, zivile Ziele zu bombardieren, stritt Russlands Außenminister Sergej Lawrow dieses mal die Verantwortung für den Angriff auf die Klinik nicht ab. Bei einem Treffen mit seinem ukrainischen Kollegen Dmytro Kuleba im türkischen Antalya bezeichnete er Kritik an dem russischen Vorgehen als ""erbärmliche Schreie"" der Feinde. Lawrow sagte, die Klinik sei zuvor von rechtsradikalen ukrainischen Kämpfern eingenommen worden, die sie als Basis genutzt hätten. Er sprach von einer ""Manipulation"" der gesamten Welt mit Informationen zu mutmaßlichen Gräueltaten der russischen Armee. Dies wies der ukrainische Ministerpräsident Wolodymyr Seleskyj entschieden zurück. ""Die Russen wurden (im Fernsehen) damit belogen, dass angeblich in dem Krankenhaus keine Patienten und in dem Geburtshaus keine Frauen und Kinder waren"", sagte er in einer Videobotschaft. Das sei alles ""Lüge"". ""Das sind Kinder, Frauen, medizinische Mitarbeiter"", sagte der Staatschef. Die ""Propagandisten"" im russischen Fernsehen würden zur Verantwortung gezogen. Tatsächlich hatte Russlands UN-Botschafter Wassili Nebensja am Montag vor dem UN-Sicherheitsrat mit Blick auf Mariupol gesagt: ""Wir stellen fest, dass die ukrainischen Radikalen von Tag zu Tag deutlicher ihr wahres Gesicht zeigen. Die Anwohner sagen, dass sie das Personal einer Entbindungsklinik vertrieben und dann in dieser Klinik einen Ort zum Schießen errichtet hätten."" Zum Ärger Moskaus twitterte UN-Generalsekretär António Guterres trotzdem am Mittwoch: ""Der heutige Angriff auf ein Krankenhaus in Mariupol, Ukraine, wo sich Entbindungs- und Kinderstationen befinden, ist entsetzlich."" Bei dieser Darstellung blieben die Vereinten Nationen auch am Donnerstag: Die Informationen für den Tweet von Guterres beruhten auf eigenen Informationen der UN, sagte ein Sprecher der Nachrichtenagentur dpa. ""Wir stehen zu dem, was wir gesagt haben."" Der Kreml in Moskau kündigte eine Untersuchung an. ""Wir werden unser Militär fragen, weil wir keine genauen Informationen darüber haben, was dort passiert ist"", sagte Sprecher Dmitri Peskow. Selenskyj äußerte sich ebenfalls zu Bemühungen, humanitäre Korridore unter anderem nach Mariupol einzurichten. ""Die russischen Truppen haben bereits eine humanitäre Katastrophe in der Ukraine geschaffen"", sagte er. Das sei Teil des russischen Plans. ""Sie wollen unsere Menschen erniedrigen, damit sie auf Knien Brot und Wasser aus den Händen der Besatzer nehmen."" Dabei würden Mariupol und Wolnowacha im Donezker Gebiet so blockiert, dass Menschen nur Richtung Russland fliehen können. Nach Angaben der Mariupoler Stadtverwaltung kamen während der neuntägigen Belagerung von Mariupol bisher etwa 1200 Menschen ums Leben. Laut Wereschtschuk seien trotz der angespannten Lage in einigen Städten erfolgreich Hilfskorridore eingerichtet worden. ""Aus den Städten Sumy, Trostjanez, Krasnopillja haben wir in Richtung Poltawa innerhalb der vergangenen zwei Tage mehr als 60.000 Menschen herausgebracht"", sagte Wereschtschuk. Das habe Frauen, Kinder, Behinderte und Alte betroffen. Ihr zufolge ist es zudem im Gebiet Charkiw gelungen, etwa 3000 Menschen aus der Stadt Isjum zu retten. Mehr als 100 Tonnen Hilfsgüter seien zudem in die umkämpfte Kleinstadt gebracht worden. Dabei teilte der Leiter des Gebiets Charkiw, Oleh Synjehubow, auf Facebook mit, Russland habe sich in Isjum nicht an die Abmachung für den ""grünen Korridor"" gehalten und die Stadt weiter beschossen. Eine massive Fluchtbewegung gibt es seit Beginn des russischen Angriffskriegs auf die Ukraine offenbar aus der Hauptstadt Kiew. Nach Angaben von Kiews Bürgermeister Witali Klitschko hat mittlerweile fast jeder zweite Einwohner die Stadt verlassen. Es seien nur noch etwa zwei Millionen Menschen in der Metropolregion. Kiew selbst hat nach offiziellen Angaben knapp drei Millionen Einwohner. Die Stadt gleicht laut Klitschko einer Festung. ""Jede Straße, jedes Haus (...) ist befestigt. Die Territorialverteidigung schließt sich an"", sagte er im ukrainischen Fernsehen. Auch Menschen, die dies nie im Leben für möglich gehalten hätten, trügen jetzt Uniform und Maschinenpistole. Unterdessen meldete der ukrainische Generalstab, dass die russischen Streitkräfte in der Nacht zum Donnerstag ihre ""offensive Operation"" zur Einkesselung der Hauptstadt Kiew fortgesetzt haben. Binnen weniger Tage hat sich die Frontlinie rund um die ukrainische Hauptstadt deutlich verschoben: Stand die russische Armee vor fünf Tagen noch rund hundert Kilometer nordöstlich von Kiew entfernt, näherte sie sich am Mittwoch der an Kiew grenzenden Stadt Browary, wie AFP-Reporter berichteten. Nach Angaben der Menschenrechtsbeauftragten des ukrainischen Parlaments, Ljudmyla Denisowa, wurden seit Beginn des Kriegs vor zwei Wochen 71 Kinder im Land getötet. Mehr als 100 seien zudem verletzt worden, teilte Denisowa auf Telegram mit. Die Vereinten Nationen sprechen aktuell von 549 Toten, darunter 41 Kinder. Laut dem Gesundheitsminister Viktor Lyaschko sind bei Angriffen insgesamt 63 Krankenhäuser getroffen worden, dabei seien fünf medizinische Angestellte getötet und mehr als zehn schwer verletzt worden. ""Es gibt auch leicht Verwundete, die bereits wieder im Dienst sind"", zitiert die Agentur Unian den Minister. "
10.03.2022 17:43 Uhr,Höchste Teuerung seit 1982,"US-Inflation steigt auf 7,9 Prozent","Die US-Verbraucherpreise sind im Februar um 7,9 Prozent gestiegen - und damit so stark wie zuletzt vor 40 Jahren. Das erhöht den Druck auf die US-Notenbank, kommende Woche mit einer Leitzinserhöhung gegenzusteuern. Die Inflation in den Vereinigten Staaten hat den höchsten Stand seit 40 Jahren erreicht. Um 0,8 Prozent stiegen die Verbraucherpreise im Februar im Vergleich zum Januar. Gegenüber dem Vorjahr bedeutete das eine Teuerungsrate von 7,9 Prozent. Das war mehr als Experten erwartet hatten und noch einmal 0,4 Prozentpunkte höher als im Januar. Besonders stark stiegen wieder die Preise für Lebensmittel und vor allem für Energie, obwohl der explodierende Ölpreis infolge des Ukraine-Kriegs noch keinen Effekt hatte. Benzin war im Februar 38 Prozent teurer als vor einem Jahr, Gebrauchtwagen 41 Prozent, Lebensmittel acht Prozent. Blickt man auf die Kerninflation und rechnet damit die stark schwankenden Preise für Lebensmittel und Energie aus der Inflationsrate heraus, stiegen die Preise um 6,4 Prozent. Auch das der höchste Wert seit 1982. Die Februar-Inflation wird in den USA besonders beachtet, weil die US-Notenbank Federal Reserve in der kommenden Woche über ihre künftige Zinspolitik entscheiden wird. Dass sie den Leitzins anheben wird, gilt als sicher. Das hatten auch die jüngsten Aussagen von Notenbank-Chef Jerome Powell deutlich gemacht. Offen ist, ob sie einen größeren Zinsschritt von mehr als 0,25 Prozentpunkten gehen wird, um der Inflation etwas entgegenzusetzen. "
10.03.2022 17:30 Uhr,Ukraine-Krieg,Schröder auf Mission in Moskau?,"Versucht Altkanzler Schröder im Ukraine-Krieg zu vermitteln? Berichte über eine angebliche Reise nach Moskau zu Präsident Putin machen die Runde, eine Bestätigung dafür gibt es nicht - weder von der SPD noch von der Bundesregierung. Der frühere Bundeskanzler Gerhard Schröder soll bereits vor Tagen von der Ukraine um Vermittlung gebeten worden sein, habe sich mit einer ukrainischen Delegation im türkischen Istanbul getroffen und werde in Moskau mit dem russischen Präsidenten Wladimir Putin über den Ukraine-Krieg sprechen. Die Nachrichtenwebsite ""Politico"" hatte das geplante Treffen vermeldet und berichtet, es sei Teil von Vermittlungsbemühungen, um den Krieg in der Ukraine zu beenden. In der SPD-Parteizentrale konnte niemand das Treffen des Altkanzlers mit Putin oder auch nur die Vermittlungsbemühungen bestätigen. Man habe seit Tagen Gerüchte über einen Vermittlungsversuch gehört und verfolge das ganze aufmerksam. Schröder reise jedenfalls, so hieß es, nicht im Namen oder Auftrag der SPD. Nach Informationen des ARD-Hauptstadtstudios war auch die Bundesregierung weder im Vorfeld informiert noch hat sie an der Reise mitgewirkt. Schröder selbst hatte noch unmittelbar vor Beginn des Krieges in seinem mittlerweile abgesetzten wöchentlichen Podcast eigene Vermittlungsbemühungen ausgeschlossen und gesagt, das sei nett gedacht, aber keine Politik. Da könne niemand, der auch über gute persönliche Beziehungen verfüge, wirklich helfen. Der ukrainische Botschafter in Deutschland, Andrij Melnyk, hatte bereits vor einer Woche vorgeschlagen, dass Schröder zwischen der Ukraine und Russland vermitteln solle. ""Er ist einer der wenigen hier in Deutschland, die womöglich noch einen direkten Draht zu Herrn Putin haben"", so Melnyk. Der Altkanzler steht seit Wochen in der Kritik, weil er sich bisher weigert, sich von seinen Mandaten bei russischen Energiekonzernen zurückzuziehen. Konkret geht es um Posten bei den Erdgas-Pipeline-Unternehmen Nord Stream 1 und 2 sowie beim russischen Ölkonzern Rosneft, wo er Aufsichtsratschef ist. Bislang hat Schröder auch den Angriffskrieg seines persönlichen Freundes Putin nicht öffentlich verurteilt. Die SPD hatte dem Altkanzler ein Ultimatum gesetzt, acht ehemalige und die beiden amtierenden SPD-Chefs zudem Schröder in einem Brief aufgefordert, sich von Putin zu distanzieren. Ein erster Antrag auf ein Parteiausschlussverfahren läuft. "
