date,topline,headline,content10.03.2022 12:39 Uhr,Neue Präsidentin Novak,"Orbans ""Vorzeigefrau"" für Ungarn","Sie ist konservativ, populär, hochqualifiziert und streng auf Orban-Linie: Katalin Novak ist von Ungarns Parlament zur neuen Präsidentin gewählt worden - mit 44 Jahren. Wie es zu ihrer Nominierung kam. Eigentlich war Parlamentspräsident Laszlo Köver als Staatspräsident gesetzt: 62 Jahre alt, schnauzbärtig, Mitbegründer der Fidesz-Partei - ein gerne polternder ungarischer Nationalist, Urgestein des ""Systems Orban"". Doch dann hatte Ministerpräsident Viktor Orban eine Idee. Der starke Mann in Budapest nominierte die 44-jährige Katalin Novak für das höchste Amt im Staat. Eine, die nicht mal mehr zur ""Generation Orban"" gehört und eine Frau - Aufsehen erregend für ein Ungarn, das fast Schlusslicht ist in Europa, was die Zahl von Frauen in politischen Spitzenämtern angeht. Es sei ihr eine Ehre, sagt Novak, akzeptiert das Angebot, dankt und lächelt weg, dass sie ""nur"" die Nachnominierte ist. Orban dürfte der Wahlkampf zu diesem Schritt gebracht haben, den er gegen eine erstmals vereinte Opposition führt. Als erste Staatspräsidentin werde sie für die ganze Nation da sein, versprach die frühere Vize-Chefin der Orban-Partei. Ihre Parteimitgliedschaft werde sie aussetzen. Novak ist hochqualifiziert, spricht Französisch, Englisch, Spanisch und Deutsch. Gelernt hat sie es in Frankfurt und im Taunus, als ihr Mann eineinhalb Jahre bei der Europäischen Zentralbank (EZB) arbeitete. Novak hat in Ungarn und in Paris studiert, ist Ritterin der französischen Ehrenlegion. Außerdem ist sie Marathonläuferin, Mutter von drei Kindern, die gerne backt und sich dabei strikt an Omas Rezeptbuch hält, wie sie sagt. Sie ist das fröhlich-lachende Gesicht der regierenden Fidesz-Partei. Und: Sie ist populär in Ungarn. Als Familienministerin ist sie die Frau mit den immer guten Nachrichten, die Geld verteilt, etwa für ein größeres Familienauto für Kinderreiche. Als enge Vertraute Orbans steht sie dabei ohne Abstriche hinter dem erzkonservativen Frauen- und Familienbild, das Orban in seiner jetzt zwölfjährigen Regierungszeit zuletzt mit Zwei-Drittel-Mehrheit im ungarischen Grundgesetz verankern ließ. Was Novak vehement verteidigt: ""Vor ein paar Jahren dachten wir nicht, dass wir ins Grundgesetz schreiben müssen, dass die Ehe eine Lebensgemeinschaft von Mann und Frau ist - oder: dass die Mutter eine Frau, der Vater ein Mann ist"", sagt Novak und positioniert sich klar gegen gleichgeschlechtliche Partnerschaften. Sie sagt auch, dass Frauen nicht glauben sollten, dass sie ständig mit Männern konkurrieren müssten. Die Opposition schäumt, wirft ihr vor, sie sei eine, die ""Viktor-Orban-Ohrringe"" trage und die ungarischen Frauen demütige. Allerdings ist der von der Opposition spät nachgeschobene Zählkandidat, Peter Rona, 79, Banker, Wirtschaftsexperte, früher mal Berater des sozialistischen Ministerpräsidenten vor Orban, keine Konkurrenz für die Kandidatin Novak. Novaks Wahl galt als sicher, Orbans Fidesz-Partei hat die dafür nötige Zwei-Drittel-Mehrheit im Parlament. Noch: In drei Wochen wird auch das Parlament neu gewählt. Orbans Mehrheit beharrte darauf, die Präsidentschaftswahl vorher abzuwickeln, nicht abzuweichen vom regulären Wahlzeitpunkt. Das ist Terminglück und Geschick des Wahlkämpfers Orban - und ein Affront gegen die Opposition. Denn Novak sitzt jetzt unabwählbar fünf Jahre an der Spitze Ungarns; allerdings mit eher protokollarischer Macht. "
10.03.2022 12:36 Uhr,Ukraine-Krieg,Wie Geflüchtete vor Corona geschützt werden,"Die Impfquote in der Ukraine ist gering. Viele der Geflüchteten sind vermutlich nicht gegen Corona geschützt. Das könnte in Sammelunterkünften ein Problem werden - doch die Kommunen bereiten sich vor. In der Verbandsgemeinde Hachenburg im Westerwald sind die ersten Geflüchteten in kommunalen Wohnungen oder in Privatfamilien untergekommen. Ob oder mit welchem Impfstoff sie immunisiert sind, wissen die zuständigen Behörden nicht. Der Versuch, den Impfstatus schon bei der Ankunft zu erheben, scheiterte trotz extra angefertigter Formulare an Sprachbarrieren oder fehlenden Nachweisen, erzählt Marco Dörner von der Verbandsgemeinde. Doch man habe vorgesorgt: Masken und Tests warteten schon beim Einzug. Die meisten Menschen aus der Ukraine sind dort in kleinen Wohneinheiten untergebracht. ""Sie leben also weiter innerhalb ihres Familienverbundes - da ist eine Ansteckungsgefahr natürlich deutlich geringer als in großen Sammelunterkünften"", sagt Dörner. Die Verbandsgemeinde würde gern zeitnah im regionalen Impfzentrum einen Nachmittag speziell für die Ukrainer anbieten - inklusive Bustransfer dorthin. Inzwischen kommen täglich Tausende Geflüchtete aus der Ukraine in Deutschland an. Die meisten in Berlin - zuletzt etwa 10.000 Menschen am Tag. Laut Bundesinnenministerium wurden bisher insgesamt 80.035 Kriegsflüchtlinge aus der Ukraine in Deutschland registriert. Tatsächlich könnten es nach Ministeriumsangaben aber viel mehr sein. Nur gut ein Drittel der ukrainischen Bevölkerung ist geimpft. Viele saßen während ihrer Flucht nach Deutschland stunden-, teils tagelang zusammen in Bahnen oder Bussen. Bundesgesundheitsminister Karl Lauterbach (SPD) versichert, dass Flüchtlinge aus der Ukraine in Deutschland behandelt werden sollen wie deutsche Staatsbürger und hier auch medizinische Versorgung in Arztpraxen oder Krankenhäusern erhalten. Das schließe auch Testung und Impfung gegen Covid-19 ein. Darum bemüht sich gerade etwa die Stadt Speyer. Sie hat die aktuell 39 Geflüchteten aus der Ukraine seit deren Ankunft immer wieder auf Corona getestet und will ihnen schnellstmöglich - gemäß der Empfehlung der Ständigen Impfkommission - ein Impfangebot unterbreiten, ""das wir mit dem mobilen Team des DRK- Kreisverbandes Speyer e.V. und einer Dolmetscherin auch noch diese Woche umsetzen wollen"", sagt Pressesprecherin Lisa-Marie Eschenbach. Deutschlandweit bereiten sich viele Erstaufnahmeeinrichtungen auf Geflüchtete vor. Im westpfälzischen Kusel wäre Platz für Hunderte - teils in großen Hallen mit vielen Betten. Um ein eventuelles Ansteckungsrisiko so gering wie möglich zu halten, griffen entsprechende Konzepte für den Infektionsschutz, sagt die rheinland-pfälzische Integrationsministerin Katharina Binz (Grüne): ""Es gibt Testangebote, es gibt alle anderen Möglichkeiten, die wir schon immer in den Aufnahmeeinrichtungen für Asylbegehrende haben, auch Impfangebote für die Bewohnerinnen und Bewohner dort. Und die wird es jetzt natürlich auch für Menschen aus der Ukraine geben."" Noch in dieser Woche wolle man sich mit einem konkreteren Vorgehen und Detailfragen auseinandersetzen. Etwa damit, wie das Land vorgehe, wenn Geflüchtete zum Beispiel mit dem russischen Impfstoff Sputnik geimpft sind, der in Europa nicht zugelassen ist. Damit sich nicht jede noch so kleine Kommune selbst ausdenken muss, wie sie vorgehen will, gibt es beim Deutschen Städte- und Gemeindebund (DStGB) am kommenden Montag ein Treffen zum Erfahrungsaustausch zwischen den Mitgliedern. ""Unser Bestreben ist, dass die Menschen so schnell wie möglich geimpft werden"", sagt Uwe Lübking vom DStGB. Sein Vorschlag: an die Ankunftszentren für die Geflüchteten direkt Impfzentren anzuschließen oder eine Impfung schon bei der Anreise im Zug anzubieten - etwa durch mobile Teams der Bundespolizei. Wichtig seien dabei auch Aufklärungsbögen und Unterlagen in ukrainischer Sprache. Da sieht Lübking den Bundesgesundheitsminister in der Pflicht - ebenso wie bei der Finanzierung der Impfungen für die ukrainischen Geflüchteten - und dabei gehe es nicht nur um den Impfschutz vor Covid, sondern auch um die bei Vielen fehlenden Impfungen etwa gegen Masern, Tetanus oder TBC. Der Deutschen Städte- und Gemeindebund überlegt außerdem, Kontakt mit der ukrainischen Botschaft in Deutschland aufzunehmen. Das Angebot allein reiche natürlich nicht aus, ""die Menschen müssen sich auch impfen lassen wollen"", betont Lübking. Er könne sich vorstellen, den ukrainischen Botschafter zu bitten, seine Landsleute aktiv zur Impfung in Deutschland aufzurufen.    "
10.03.2022 12:29 Uhr,#WirtschaftHilft,Wirtschaftsverbände starten Hilfsinitiative,"Spitzenverbände der deutschen Wirtschaft haben zur Koordinierung von Ukraine-Hilfen die Initiative #WirtschaftHilft ins Leben gerufen. Diese hat auch die Arbeitsmarktintegration Geflüchteter zum Ziel. Die Spitzenverbände der deutschen Wirtschaft haben angesichts des Ukraine-Kriegs eine Hilfsinitiative gestartet. An #WirtschaftHilft beteiligen sich der Industrieverband BDI, der Deutsche Industrie- und Handelskammertag (DIHK), der Handwerksverband ZDH sowie der Arbeitgeberverband BDA. Ziel ist es, die Maßnahmen der Bundesregierung und der internationalen Gemeinschaft zu unterstützen. Auf der Website www.wirtschafthilft.info bündelt die Initiative alle Informationen und Aktivitäten für Betriebe und Unternehmen. Damit wollen die Spitzenverbände Firmen dabei helfen, ihre Hilfsangebote an der Situation vor Ort auszurichten. ""Bedarfsgerecht"" lautet das Stichwort. #WirtschaftHilft informiere über konkrete staatliche Bedarfslisten und liefere Hinweise für Sach- und Geldspenden, inklusive Kontaktmöglichkeiten unter anderen auch zu ukrainischen Unternehmen. Ein weitere Ziel der Wirtschaftsinitiative ist die Integration von Geflüchteten in den deutschen Arbeitsmarkt, wie die Verbände mitteilten. Schließlich suchten derzeit viele Menschen in den Nachbarländern und auch in Deutschland Zuflucht. Es sei damit zu rechnen, dass viele Geflüchtete für einen längeren Zeitraum in Deutschland bleiben. Die Initiative #WirtschaftHilft stelle Informationen zur Verfügung, die für einen guten Zugang und die Integration Geflüchteter in den Arbeitsmarkt notwendig seien - rund um Fragen des Aufenthalts- und Arbeitsrechts, der Arbeitsvermittlung, von Förderinstrumenten sowie des Sozialversicherungsrechts. Informationen gibt es den Angaben zufolge auch zu den Auswirkungen des Konflikts auf Betriebe und Beschäftigung. #WirtschaftHilft informiere hier insbesondere zu den Themen Wirtschaftshilfen und Kurzarbeitergeld. "
10.03.2022 12:19 Uhr,Verabschiedung des ZDF-Intendanten,"""Pressefreiheit ist das Gegengift""","Bundespräsident Steinmeier hat den Kriegsberichterstattern in der Ukraine gedankt und die Pressefreiheit gewürdigt. Steinmeier sprach auf der Verabschiedung des ZDF-Intendanten Bellut. Bundespräsident Steinmeier hat die Pressefreiheit gewürdigt und die neuen russischen Mediengesetze als ""tiefen Einschnitt"" bezeichnet. ""Pressefreiheit ist das Gegengift zum totalitären Wahn - zu dem Wahn, die Hoheit über die Gedanken von Menschen zu erlangen"", sagte Steinmeier in Mainz. Die Freiheit für Medien, ungehindert berichten zu können, erzeuge ""Gleichberechtigung durch Wissen, Enthüllung des absichtsvoll Verborgenen, Ermutigung zum aufgeklärten Streit."" Ohne Pressefreiheit könnten Demokratien nicht überleben, während dagegen Autokratien mit Pressefreiheit auf Dauer nicht existieren könnten, erklärte er. Die neuesten Verschärfungen für Medien in Russland sorgten dafür, dass die Propagandamaschinerie ungehindert ihre Wirkung entfalten könne. Twitter und Facebook seien gesperrt worden, um auch den digitalen Raum unabhängiger Informationen aus der Öffentlichkeit zu verbannen. ""Berichterstattung zu verbieten, ist ein Zeichen von Schwäche."" Es sei das Eingeständnis, dass etwas geschieht, das nicht gesehen werden soll. ""Wenn ich von Pressefreiheit spreche, dann spreche ich von nichts Abstraktem"", sagte Steinmeier. Journalismus werde von Menschen gemacht. Er dankte den Journalistinnen und Journalisten, die unter schwierigen Bedingungen aus den Kriegsgebieten berichten. Ihr Mut sei ""die Steinschleuder gegen Unterdrückung und Propaganda."" Steinmeier verabschiedete in Mainz den ZDF-Intendanten Thomas Bellut, der sein Amt abgibt. Auch in Deutschland sei die Pressefreiheit in Gefahr, betonte Steinmeier. Nach zwei zermürbenden Jahren der Pandemie gebe es Gräben in der Gesellschaft, die ""noch tiefer, noch offenkundiger geworden sind."" Die Idee einer gemeinsamen demokratischen Öffentlichkeit müsse ""unser Anspruch bleiben, und das muss auch der Anspruch an die Öffentlich-Rechtlichen sein."" "
10.03.2022 12:12 Uhr,"Greenpeace-Studie ""Kein Öl für Krieg""","Maßnahmen, die russische Energie sparen","Angesichts des Angriffskriegs gegen die Ukraine sollen russische Energieimporte reduziert werden. Dabei könnten schon einfache Maßnahmen Russland kurzfristig viele Milliarden Euro kosten. Angesichts des anhaltenden Angriffskriegs von Russland gegen die Ukraine mehren sich die Forderungen nach einem Energieembargo gegen Russland. Doch solche Pläne sind umstritten. ""Wir können nur Maßnahmen beschließen, von denen ich weiß, dass sie nicht zu schweren wirtschaftlichen Schäden in Deutschland führen"", gibt beispielsweise Wirtschaftsminister Robert Habeck (Grüne) zu bedenken. Grundsätzlich wären die Ölimporte leichter zu ersetzen. Schließlich handelt es sich beim Rohöl um einen weltweiten Markt, während Deutschland und Europa einen Großteil seines importierten Erdgases durch Pipelines bezieht. Dieses Gas kann kurzfristig nicht so einfach ersetzt werden. Laut der Studie ""Kein Öl für Krieg"" der Umweltschutzorganisation Greenpeace stammen zwischen 30 und 35 Prozent der deutschen Rohölimporte aus Russland, dienen damit der Finanzierung des russischen Staatshaushalts und stellen eine der letzten Einnahmequellen Russlands dar. Laut der Umweltexperten generiert Russland ungefähr Einnahmen von 500 bis 700 Millionen US-Dollar am Tag, mit dem Export von Erdgas dagegen nur rund 100 Millionen Dollar. ""Jede Tankfüllung, jede Heizöllieferung spült Geld in Putins Kriegskasse"", sagt Greenpeace-Verkehrsexperte Benjamin Stephan. Diese unerträglichen Finanzhilfen für Putins Angriff auf die Ukraine ließen sich schon morgen deutlich reduzieren, so Stephan weiter. Die größten Einsparpotenziale beim Ölverbrauch bietet laut Greenpeace der Verkehrssektor. ""Etwas mehr als die Hälfte des deutschen Absatzes bei Ölprodukten entfällt auf Benzin- und Dieselkraftstoff"", teilte die Umweltschutzorganisation mit. Besonders viel würde danach ein Tempolimit von 100 Kilometern pro Stunde auf Autobahnen und 80 Kilometern pro Stunde auf Landstraßen bringen. Hierdurch ließen sich rund zweieinhalb Prozent der deutschen Mineralölimporte pro Jahr einsparen. Durch einen Verzicht auf jede zweite Freizeit-Autofahrt von mehr als 20 Kilometern wären 2,6 Prozent Einsparung möglich. Autofreie Sonntage könnten 3,1 Prozent weniger Ölverbrauch in Deutschland bringen. Die Homeoffice-Pflicht in Teilen zu verlängern, könnte laut Greenpeace weitere 1,7 Prozent einsparen. Ein größerer Einsatz von Fahrrädern bei Strecken bis 20 Kilometern, ein Verbot von Inlandsflügen, mehr Güterverkehr statt Lkw-Verkehr, ein Anteil des Nahverkehrs wie vor Corona, zwei Prozent weniger Raumtemperatur im Winter und ein stärkerer Einsatz von Wärmepumpen könnten die deutsche Rohölimporte zusammengenommen um weitere rund fünf Prozent senken. Alle Maßnahmen zusammen genommen würden die deutschen Rohölimporte damit um mehr als zehn Prozent senken. Bezogen auf den russischen Anteil des Gesamtimports wären die Auswirkungen hingegen recht drastisch. “Schnell umsetzbare Maßnahmen können den Import von russischem Öl nach Deutschland kurzfristig um etwa ein Drittel senken und so einen wichtigen ersten Schritt zu einer vollständigen Unabhängigkeit von russischem Öl leisten”, fasst Greenpeace die Ergebnisse der Studie zusammen. "
10.03.2022 12:03 Uhr,Krieg gegen die Ukraine,"Kein Fortschritt, aber weitere Gespräche","Die Erwartungen an das Treffen der Außenminister Lawrow und Kuleba in der Türkei waren bereits im Vorfeld gering: Bei dem Gespräch gab es nach Angaben beider Seiten keine Fortschritte, die Bemühungen sollen aber weitergehen. Zum ersten Mal seit Kriegsbeginn haben die Außenminister Russlands und der Ukraine direkt miteinander gesprochen: Auf Initiative des türkischen Außenministers Mevlüt Cavusoglu trafen sich Sergej Lawrow und Dmytro Kuleba in Antalya. Dabei gab es nach Angaben Kulebas keine entscheidenden Fortschritte. Es sei auch nicht gelungen, humanitäre Korridore für die Stadt Mariupol zu vereinbaren, sagte Kuleba nach dem Treffen. Er sei bereit zu einem erneuten Gespräch in diesem Format, sein Land sei für eine ausgewogene diplomatische Lösung. Moskau werde ""von der Ukraine keine Kapitulation bekommen"". Sein Eindruck sei, dass Russland derzeit nicht in der Position sei, eine Waffenruhe herzustellen. Die schwierigste Situation sei derzeit in Mariupol. Er hoffe, dass Fluchtkorridore für die Stadt erlaubt würden. Das Gespräch mit seinem russischen Amtskollegen nannte Kuleba leicht und schwierig zugleich: leicht, weil Lawrow an seiner traditionellen Rhetorik festgehalten habe, schwierig, weil er selbst sein Bestes gegeben habe. Die Gespräche sollten fortgesetzt werden. Auch Lawrow sagte nach dem Treffen, Russland wolle die Verhandlungen mit der Ukraine fortsetzen. Präsident Wladimir Putin habe auch nichts gegen ein Treffen mit seinem ukrainischen Kollegen Wolodymyr Selenskyj. Dafür sei aber ""Vorbereitungsarbeit"" erforderlich. Er habe in dem Gespräch mit Kuleba auf die Vorschläge seines Landes verwiesen. Man wolle dazu eine Antwort haben. Zudem sei über humanitäre Fragen gesprochen worden. Der Militäreinsatz seines Landes in der Ukraine verlaufe nach Plan, so Lawrow weiter. Dem Westen warf er gefährliches Verhalten vor: Die Ukraine werde mit tödlichen Waffen versorgt, und es sei unklar, wem die gelieferten Raketenwerfer in die Hände fallen könnten. ""Wir sehen, wie gefährlich unsere westlichen Kollegen, einschließlich der Europäischen Union, jetzt handeln."" Kuleba trug bei dem Treffen nach Angaben seines Ministeriums drei Hauptforderungen der Ukraine vor: ""Einen sofortigen Waffenstillstand, eine Verbesserung der humanitären Lage in Mariupol, Charkiw, Sumy, Wolnowacha und anderen ukrainischen Städten, einen Rückzug der russischen Truppen aus der Ukraine."" Die genannten Städte stehen alle unter schwerem Beschuss der russischen Streitkräfte, viele Zivilisten sind dort eingeschlossen. Die russische Regierung hatte zuletzt von ""Fortschritten"" in Verhandlungen mit der ukrainischen Seite gesprochen und anders als vorher versichert, nicht den Sturz der Regierung in Kiew anzustreben. Der ukrainische Präsident Wolodymyr Selenskyj machte seinerseits seine Kompromissbereitschaft deutlich und rückte von der Forderung nach einem NATO-Beitritt seines Landes ab. Der türkische Präsident Recep Tayyip Erdogan hatte sich wiederholt als Vermittler in dem Konflikt zwischen Moskau und Kiew angeboten. Die Türkei sei nach wie vor in der Lage, ""sowohl mit der Ukraine als auch mit Russland"" zu sprechen, hatte Erdogan am Mittwoch betont. "
10.03.2022 11:47 Uhr,Folgen des Ukraine-Kriegs,Was passiert mit der Energiewende?,"Mit dem russischen Angriffskrieg auf die Ukraine stellt sich die Frage nach der Energie-Versorgungssicherheit. Für den Übergang ist sogar eine stärkere Nutzung der Kohlekraftwerke im Gespräch. Wohin steuert die deutsche Energiepolitik? Die Ampel-Koalition hatte bis vor kurzem einen Plan für die Energiewende: Atomausstieg vollenden, den Kohleausstieg möglichst auf 2030 vorziehen, die Erneuerbaren zügig ausbauen - und die Versorgungslücken durch neue Gaskraftwerke ersetzen. Erdgas sollte die neue Brückentechnologie werden. Aber dieser Plan ist nun wohl Makulatur - angesichts des russischen Krieges in der Ukraine und angesichts der Erkenntnis, viel zu abhängig zu sein von russischem Erdgas. Denn 55 Prozent des hier verbrauchten Erdgases kommt per Pipeline aus Russland. Deutschland hat diese Energieabhängigkeit von dem einen Hauptlieferanten über Jahrzehnte aufgebaut. Weil sich die großen Erdgaspläne nun wohl erledigt haben, werden Forderungen laut, den Ausstiegsplan aus der Kohle zu überdenken. So betont Sachsens Ministerpräsident Michael Kretschmer (CDU), es verstehe sich von selbst, dass der Ausbau von Gaskraftwerken jetzt der völlig falsche Weg wäre. Denn das würde die Abhängigkeit von russischem Erdgas sogar noch erhöhen. ""Und deswegen ist es richtig"", so Kretschmer, ""wenn die Bundesregierung darüber nachdenkt, ob sie bei Atom und Kohle eine Verlängerung in den Blick nimmt."" Kretschmer kommt aus einem Kohleland - und galt daher schon bisher nicht als Vorkämpfer für einen schnellen Ausstieg. Anders als das Potsdam Institut für Klimafolgenforschung. Aber selbst dessen Chef Ottmar Edenhofer blickt nun etwas anders auf die Kohle - zumindest in der akuten Situation. Er verweist auf den Krieg, der in der Wirtschaft unkonventionelle Maßnahmen erfordere. Und Edenhofer fügt hinzu: ""Wir müssen in diesen sauren Apfel beißen und vermehrt Kohlekraftwerke zu nutzen."" Wackelt also der Kohleausstieg? Der grüne Wirtschaftsminister Robert Habeck betont dieser Tage, dass es keine Denk-Tabus geben dürfe, auch wenn er natürlich am zügigen Kohleausstieg festhalten will. Nach einer Sonderkonferenz mit den Energieministern sagte Habeck, dass die Kohlekraftwerke, die eigentlich zur Abschaltung anstehen, in die Reserve überführt werden sollen. ""Die Energieversorgungssicherheit steht im Moment über allem"", so Habeck. ""Das heißt: Kraftwerke, die unter bestimmten Szenarien jetzt vom Netz gehen können, werden trotzdem ready gehalten, falls sie doch noch einmal gebraucht werden."" Das könnte umso mehr der Fall sein, da Habeck die verbliebenen drei Atomkraftwerke auf jeden Fall zum Ende des Jahres abschalten will. Es fehle an Personal, Brennstäben und Sicherheitschecks für den Weiterbetrieb, so der grüne Wirtschaftsminister. Die akute Sorge um die Energiesicherheit will Habeck nun erst recht als Antrieb verstanden wissen, die Energiewende noch schneller voranzutreiben. Im Wirtschaftsministerium werden gerade entsprechende Pläne erarbeitet - insbesondere, um die Abhängigkeit von russischem Erdgas zu reduzieren: Durch den Bau von LNG-Terminals für Flüssiggas aus den USA oder arabischen Ländern, durch massive Investitionen in Wasserstoff-Technologie für die Industrie und einen umfassenden Umbau der Wärmeversorgung - Gasheizungen sollen möglichst breitflächig durch Wärmepumpen ersetzt werden. Habeck will die Energiewende nun ""in Tesla-Geschwindigkeit"" vorantreiben, wie er sagt. Auch die anderen Energieminister wollen jetzt offenbar Tempo machen, betrachten die Energiewende nun als Sicherheitsfrage, betonen den gemeinsamen Willen, schnell voranzukommen, etwa die Genehmigungsverfahren für Windräder oder Stromtrassen zu beschleunigen. Allerdings taucht hier wieder das bekannte Dilemma der deutschen Energiepolitik auf: Ambitionierte Pläne und Zielmarken lassen sich auf dem Papier leicht festlegen - diese in der Realität zu erreichen, ist dann die eigentliche Herausforderung. Dabei geht es nicht nur um langwierige Genehmigungsverfahren, Bürgerproteste gegen Windräder oder vermeintlich renitente Bürgermeister, die sich gegen Stromtrassen wehren. Es geht auch um unvermeidbare Bauzeiten und klimafreundliche Zukunftstechnologien, die sich nicht mal eben so in der Industrie etablieren lassen. So ist mit einem deutsche Flüssiggasterminal wohl nicht vor 2026 zu rechnen, die Industrie plant für die 2030er-Jahre mit dem Umstieg auf grünen Wasserstoff, der gegenwärtig noch nirgendwo auf der Welt in großem Maßstab hergestellt wird. Und der Chef der Deutschen Energieagentur Andreas Kuhlmann hat Zweifel, dass die Wärmeversorgung in Tesla-Geschwindigkeit umgestellt werden kann. In Neubauten sei zwar einiges möglich, im Bestand ließen sich Gasheizungen aber kaum im großen Stil austauschen. Allein schon, weil es an Handwerkern mangele, die Wärmepumpen einbauen könnten. So herrscht in Politik und Industrie zurzeit vor allem Ungewissheit, wie es mit der Energiewende weitergeht und wie es absehbar mit der Versorgungssicherheit aussieht. Viele möchten jetzt zwar mit Tesla-Geschwindigkeit in Richtung klimafreundliche Zukunft. Aber der Masterplan für die Zeit bis dahin fehlt. "
