topline,headline,content
10.03.2022 23:21 Uhr,Europa League,Bayer Leverkusen verliert in Bergamo
10.03.2022 22:22 Uhr,Inflationsängste,Wall Street bleibt unter Druck
10.03.2022 22:11 Uhr,Coronavirus-Liveblog,++ Vorerkrankungen erhöhen Long-Covid-Risiko ++
10.03.2022 22:10 Uhr,EU-Gipfel in Versailles,Streitpunkt russisches Gas
10.03.2022 19:51 Uhr,Sanktionen gegen Russland,"Der Oligarch, den die EU verschont"
10.03.2022 19:37 Uhr,Krieg gegen die Ukraine,Evakuierung von Mariupol erneut gescheitert
10.03.2022 18:49 Uhr,Erlass des US-Präsidenten,Krypto-Verbot in den USA vom Tisch?
10.03.2022 18:43 Uhr,"""Global Video Church""",Radikalisierung einer Online-Kirche
10.03.2022 18:33 Uhr,Corona-Regel im Bundestag,AfD-Eilantrag gegen 2G-Plus scheitert
10.03.2022 18:32 Uhr,Katholische Bischöfe,"Waffenlieferungen ""grundsätzlich legitim"""
10.03.2022 17:45 Uhr,Krieg gegen die Ukraine,Mariupol weiter unter Beschuss
10.03.2022 17:43 Uhr,Höchste Teuerung seit 1982,"US-Inflation steigt auf 7,9 Prozent"
10.03.2022 17:30 Uhr,Ukraine-Krieg,Schröder auf Mission in Moskau?
10.03.2022 17:23 Uhr,Krieg statt Baustelle,Abwanderung verschärft Polens Fachkräftenot
10.03.2022 17:12 Uhr,Autobahn-Brücken,Bund will Sanierungs-Ausgaben deutlich erhöhen
10.03.2022 17:02 Uhr,Russische Energieexporte,Putin sichert Gaslieferungen zu
10.03.2022 16:28 Uhr,EZB reagiert auf Inflation,Zinserhöhung nicht ausgeschlossen
10.03.2022 16:01 Uhr,Deutsche Energiepolitik,Kein russisches Gas mehr - was dann?
10.03.2022 15:39 Uhr,Eingefrorene EU-Gelder,Polen hofft auf baldige Freigabe
10.03.2022 15:32 Uhr,Spritpreis-Explosion,Benzin und Diesel verteuern sich weiter
10.03.2022 14:22 Uhr,Mittelmeerinsel Korsika,Viele Verletzte bei Krawallen
10.03.2022 13:51 Uhr,Krieg gegen die Ukraine,Großbritannien belegt Oligarchen mit Sanktionen
10.03.2022 13:50 Uhr,Kultusministerkonferenz,Flüchtlingskinder schnell an Schulen bringen
10.03.2022 13:48 Uhr,Entwicklungsorganisationen,Hoher Konsum - Fisch geht zur Neige
10.03.2022 13:46 Uhr,"Militärübung ""Cold Response""",Norwegen probt den Verteidigungsfall
10.03.2022 13:37 Uhr,Ökonomen zu Kriegsfolgen,Steigt die Inflation auf zehn Prozent?
10.03.2022 13:22 Uhr,Entwurf des EU-Parlaments,EU soll bei Batterien unabhängiger werden
10.03.2022 12:39 Uhr,Neue Präsidentin Novak,"Orbans ""Vorzeigefrau"" für Ungarn"
10.03.2022 12:36 Uhr,Ukraine-Krieg,Wie Geflüchtete vor Corona geschützt werden
10.03.2022 12:29 Uhr,#WirtschaftHilft,Wirtschaftsverbände starten Hilfsinitiative
10.03.2022 12:19 Uhr,Verabschiedung des ZDF-Intendanten,"""Pressefreiheit ist das Gegengift"""
10.03.2022 12:12 Uhr,"Greenpeace-Studie ""Kein Öl für Krieg""","Maßnahmen, die russische Energie sparen"
10.03.2022 12:03 Uhr,Krieg gegen die Ukraine,"Kein Fortschritt, aber weitere Gespräche"
10.03.2022 11:47 Uhr,Folgen des Ukraine-Kriegs,Was passiert mit der Energiewende?
10.03.2022 11:47 Uhr,Folgen des Ukraine-Kriegs,"""Massive Auswirkungen auf Klimaziele"""
10.03.2022 11:44 Uhr,Außenministerin auf Balkan-Reise,Baerbock für engere Bindung an die EU
10.03.2022 11:16 Uhr,Indonesische Insel Java,Vulkan Merapi spuckt Lava und Asche
10.03.2022 11:13 Uhr,"""Keine Demokratie in Deutschland""",Putins Propagandist im Bundestag
10.03.2022 10:55 Uhr,Ukraine-Krieg,Lawrow und Kuleba zu Gespräch in der Türkei
10.03.2022 10:42 Uhr,Krieg in der Ukraine,Sieben Fluchtkorridore - auch für Mariupol
10.03.2022 10:30 Uhr,Wohnungsbau,Doppelhäuser boomen in Deutschland
10.03.2022 10:20 Uhr,Langwierige Maßnahmen,Zweifel an den Zielen der Bahn
10.03.2022 10:19 Uhr,Corona-Pandemie in China,Infektionen steigen auf Zwei-Jahres-Hoch
10.03.2022 09:28 Uhr,EU-Gipfel in Versailles,Aufbruch zu mehr Unabhängigkeit
10.03.2022 09:23 Uhr,Rückzug aus  Russland,Amazon zieht den Streaming-Stecker
10.03.2022 08:48 Uhr,Zahlen des RKI,Erstmals mehr als 250.000 Neuinfektionen
10.03.2022 08:12 Uhr,Arbeitsvermittlung der BA,Zwischen Anspruch und Wirklichkeit
10.03.2022 07:35 Uhr,Krieg gegen die Ukraine,"USA verlegen ""Patriot""-Raketen nach Polen"
10.03.2022 07:12 Uhr,Podcast,Kein russisches Gas mehr? Was dann?
10.03.2022 06:59 Uhr,Russische Desinformation,"""Es gibt quasi nur zwei Positionen"""
10.03.2022 04:11 Uhr,Kämpfe um Mariupol,Weltweites Entsetzen nach Angriff auf Klinik
10.03.2022 03:07 Uhr,Flucht vor Russlands Krieg,In Polen wird es eng
10.03.2022 00:04 Uhr,Liveblog zum Ukraine-Konflikt,++ Moskau gibt Einsatz von Rekruten zu ++
