topline,headline,content
09.07.2022 23:34 Uhr,Krieg gegen die Ukraine,++ Munitionsnachschub für Gepard wohl gesichert ++
09.07.2022 22:19 Uhr,Umstrittener Diplomat,Selenskyj entlässt Botschafter Melnyk
09.07.2022 20:12 Uhr,Proteste in Sri Lanka,Präsident Rajapaksa kündigt Rücktritt an
09.07.2022 17:52 Uhr,Nach Attentat auf Abe,Polizeichef räumt Sicherheitsprobleme ein
09.07.2022 17:19 Uhr,71 Neuinfektionen,Macau schließt Casinos wegen Corona
09.07.2022 17:03 Uhr,Personalnot nach Pandemie,Wo die Gastro-Kräfte geblieben sind
09.07.2022 16:57 Uhr,Finale gegen Jabeur,Rybakina triumphiert in Wimbledon
09.07.2022 16:23 Uhr,Gasversorger Uniper,Uniper-Eigner will Krisengeschäft an Bund abstoßen
09.07.2022 15:35 Uhr,Preise in Reiseländern,Was den Urlaub im Sommer teuer macht
09.07.2022 15:34 Uhr,Die Dächer von Rotterdam,Quietschblau und öko-grün
09.07.2022 15:33 Uhr,Sri Lanka,Demonstranten stürmen Präsidentenpalast
09.07.2022 15:18 Uhr,SPD-Fest,Polizei ermittelt wegen K.o.-Tropfen-Attacke
09.07.2022 14:48 Uhr,Nach Gletscherabbruch,Letzter Vermisster in Dolomiten tot geborgen
09.07.2022 14:26 Uhr,Maßnahme bis Ende August,Was kommt nach dem 9-Euro-Ticket?
09.07.2022 14:23 Uhr,Radsport,Erste Corona-Fälle bei der Tour de France
09.07.2022 13:08 Uhr,Vorwurf der Anstiftung zur Unruhe,Berlinale-Gewinner Rasoulof im Iran verhaftet
09.07.2022 12:39 Uhr,Habeck zu Energiekrise,"""Müssen uns auf das Schlimmste einstellen"""
09.07.2022 12:18 Uhr,Raketenwerfer und Munition,Neue US-Lieferungen für die Ukraine
09.07.2022 12:02 Uhr,US-Republikaner,"Hoffen auf Trump, bangen vor Trump"
09.07.2022 11:47 Uhr,Baerbock besucht Palau,"In der Klimakrise ""Seite an Seite"""
09.07.2022 10:59 Uhr,Zwischenbilanz zu 9-Euro-Ticket,Wissing will bundesweit gültige ÖPNV-Tickets
09.07.2022 10:28 Uhr,Corona-Pandemie,Intensivstationen in der Bredouille
09.07.2022 09:37 Uhr,UEFA Euro 2022,Ein vielversprechender Auftakt
09.07.2022 09:30 Uhr,Nach Attentat auf Abe,Japan prüft Schutz für Politiker
09.07.2022 09:30 Uhr,Geldanlage,Chancen und Risiken der Anlage in ETF
09.07.2022 09:23 Uhr,Wimbledon-Finalistin Jabeur,Zwei Ziele fest im Blick
09.07.2022 07:35 Uhr,Übernahme geplatzt,Musk bläst Twitter-Kauf ab
09.07.2022 06:16 Uhr,Umsetzung von Sanktionen,Wenn die Oligarchen kein Vermögen melden
09.07.2022 04:15 Uhr,US-Bundesstaat Texas,Berittene Grenzpolizisten werden bestraft
09.07.2022 03:45 Uhr,Häusliche Gewalt,Brandbeschleuniger Corona
09.07.2022 03:35 Uhr,Krieg gegen die Ukraine,++ 18 Russen dürfen nicht bei Leichtathletik-WM starten ++
09.07.2022 02:35 Uhr,USA,Der Great Salt Lake trocknet aus
09.07.2022 00:23 Uhr,Übernahme geplatzt,Musk will Twitter nicht mehr kaufen
