topline,headline,content
31.10.2014 15:52 Uhr,EU startet Triton-Mission,Mit dem Meeresgott gegen Flüchtlinge
31.10.2014 15:11 Uhr,Kaum Wirtschaftswachstum erwartet,Russland erhöht erneut den Leitzins
31.10.2014 13:37 Uhr,Interview zur Lage in Fukushima,"""Die Radioaktivität wird man nicht mehr los"""
31.10.2014 12:46 Uhr,Arbeitslosigkeit in den Euro-Ländern,"18,3 Millionen Menschen ohne Job"
31.10.2014 11:19 Uhr,Erstmals Klage wegen MH 370,Zwei Söhne wollen Gewissheit
31.10.2014 07:18 Uhr,Tarifabschluss ist erzielt,Mehr Geld in der Papierbranche
30.10.2014 18:38 Uhr,Fragen und Antworten,Wie funktioniert die Maut?
30.10.2014 17:37 Uhr,Scharfe Kritik an Dobrindts Maut-Gesetz,"""Ökonomisch und ökologisch sinnlos"""
30.10.2014 17:16 Uhr,Wissenschaftskonferenz in Berlin,Milliarden für die Spitzenforschung
30.10.2014 15:54 Uhr,Überraschend starke Konjunkturwerte,Die US-Wirtschaft wächst und wächst
30.10.2014 15:21 Uhr,Was sich für Autofahrer ändert,Die Kernpunkte der Pkw-Maut
30.10.2014 11:14 Uhr,Ende einer Amtszeit,Barroso?
30.10.2014 10:38 Uhr,BA-Zahlen für Oktober,Überraschend wenige Arbeitslose
30.10.2014 09:29 Uhr,Minister stellt Maut-Konzept heute vor,Dobrindt muss Zugeständnisse machen
29.10.2014 19:56 Uhr,Entscheidung der US-Notenbank,Fed stoppt Anleiheprogramm
29.10.2014 16:47 Uhr,De Maizière fordert Fluggastdatenspeicherung,Terrorschutz oder Datenmüll?
29.10.2014 16:03 Uhr,EuGH-Beschluss zum Urheberrecht,Einbetten von Internet-Videos legal
29.10.2014 15:46 Uhr,Ausländerbericht der Bundesregierung,Diskriminierung bei der Jobsuche
29.10.2014 14:38 Uhr,NASA-Strategie in der Kritik,Outsourcing im All
29.10.2014 11:22 Uhr,Das Beste aus der ARD,Netzperlen zu 25 Jahren Mauerfall
28.10.2014 21:54 Uhr,Streit über Defizit wohl beigelegt,Paris und Rom überzeugen EU
28.10.2014 11:31 Uhr,Zahl der Sozialhilfeempfänger stark angestiegen,"Alt, behindert, arm"
28.10.2014 10:00 Uhr,Neue Sparrunde bei britischer Großbank,Lloyds streicht 9000 Stellen
27.10.2014 17:41 Uhr,Fankultur-Experte zu Ausschreitungen in Köln,"""Neue Organisationsform rechter Hooligans"""
27.10.2014 17:21 Uhr,EU-Nachzahlungsforderung an Großbritannien,Wenig Verständnis für Camerons Protest
27.10.2014 12:50 Uhr,Analyse des EZB-Bankenchecks,Was der Stresstest verschweigt
26.10.2014 16:04 Uhr,Stresstest der EZB,Die Ergebnisse der deutschen Banken
26.10.2014 13:24 Uhr,Fragen und Antworten,Was kommt nach dem Stresstest?
26.10.2014 12:48 Uhr,EZB veröffentlicht Ergebnisse,25 Banken fallen durch den Stresstest
25.10.2014 20:31 Uhr,Fragen und Antworten,Wie funktioniert der Banken-Stresstest?
25.10.2014 16:56 Uhr,Massenproteste in Italien,Gewerkschaften auf Konfrontationskurs
25.10.2014 12:25 Uhr,Zusammensetzung des Europaparlamentes,"""Mangel an Transparenz ist das Problem"""
25.10.2014 09:59 Uhr,Vor Parlamentswahl in der Ukraine,Zwischen Demokratie und Oligarchie
24.10.2014 19:16 Uhr,EU-Nachzahlungsforderung an Großbritannien,"""Vollkommen inakzeptabel"""
24.10.2014 15:23 Uhr,Empörung in Großbritannien,Gesalzene Rechnung aus Brüssel
24.10.2014 13:39 Uhr,Aus für sechs Karstadt-Häuser,Und das ist erst der Anfang ...
24.10.2014 09:00 Uhr,EU-Gipfel einigt sich auf Ziele bis 2030,Ein bisschen Klimaschutz
24.10.2014 00:01 Uhr,DeutschlandTrend im ARD-Morgenmagazin,Regierung tut zu wenig gegen Ebola
23.10.2014 19:12 Uhr,EU-Gipfel tagt zum Klima,Ehrgeizige Ziele auf der Kippe
23.10.2014 15:02 Uhr,Urteil des italienischen Verfassungsgerichts,NS-Opfer können Deutschland verklagen
23.10.2014 11:39 Uhr,Spaniens Arbeitsmarkt erholt sich,So wenige Arbeitslose wie lange nicht
23.10.2014 01:18 Uhr,EU-Gipfel tagt zum Klima,Ringen um neue Klimaschutzziele
22.10.2014 12:48 Uhr,Abstimmung in Straßburg,Junckers Kommission bestätigt
22.10.2014 11:28 Uhr,Künftiger EU-Kommissionspräsident Junker,"""Investitionspaket noch vor Weihnachten"""
22.10.2014 04:43 Uhr,Steinmeier im Südkaukasus,Heikle Gespräche am Rande Europas
21.10.2014 19:21 Uhr,Entscheidung des Europaparlaments,Sacharow-Preis für Frauenarzt
21.10.2014 17:03 Uhr,Nationaler IT-Gipfel,Übernehmen die Maschinen die Macht?
21.10.2014 15:03 Uhr,Debatte über Rot-Rot-Grün im Bund,"""Mehr Risiko als Chance für die SPD"""
21.10.2014 11:54 Uhr,"BIP um 7,3 Prozent gestiegen",Chinas Wachstum schrumpft
21.10.2014 03:13 Uhr,Forschung zu Ebola-Impfstoffen,"""Keine Hilfe für aktuelle Epidemie"""
20.10.2014 20:00 Uhr,Treffen der EU-Außenminister zu Ebola,EU-Weißhelme gegen Seuchen
20.10.2014 16:45 Uhr,Deutsch-französisches Ministertreffen,Mehr Investitionen - aber wie?
20.10.2014 16:31 Uhr,Wie groß ist der Reformstau in Frankreich?,"""Hollande ist kein Schröder"""
20.10.2014 15:56 Uhr,EU setzt Koordinator für Kampf gegen Seuche ein,Gemeinsam im Kampf gegen Ebola
19.10.2014 17:05 Uhr,MH17-Absturz,Separatisten weisen BND-Vorwurf zurück
19.10.2014 15:32 Uhr,BND zur Absturzursache von MH17,"""Es waren pro-russische Separatisten"""
17.10.2014 23:23 Uhr,Streik der Lokführer,"Was tun, wenn die Bahn nicht fährt?"
16.10.2014 16:49 Uhr,Kampf gegen die Ebola-Epidemie,EU setzt auf Kontrollen in Westafrika
16.10.2014 16:12 Uhr,EU und EZB versprechen weitere Unterstützung,Eine Art Blankoscheck für Athen
16.10.2014 15:37 Uhr,EU-Gesundheitsminister beraten über Ebola,Hilfe für Westafrika - Schutz für Europa
15.10.2014 16:29 Uhr,Schlechtere Aussichten für 2014 und 2015,Regierung senkt Prognose deutlich
14.10.2014 16:19 Uhr,Umstrittene Anleihenkäufe der EZB,Warum jetzt der EuGH entscheidet
14.10.2014 15:05 Uhr,Expertengruppe zum Bürokratieabbau in EU,Stoiber vermeldet Einsparungen
14.10.2014 14:34 Uhr,Interview zu Machthaber Kim Jong Un,Wird er Nordkoreas Gorbatschow?
14.10.2014 05:27 Uhr,EuGH verhandelt über Kauf von Staatsanleihen,Es geht um Macht und Geld
13.10.2014 21:28 Uhr,Kehrtwende in der katholischen Kirche,Vatikan geht auf Schwule und Lesben zu
13.10.2014 16:50 Uhr,Nobelpreis für Wirtschaftswissenschaften,Anleitung zum Zähmen der Riesen
13.10.2014 13:29 Uhr,Nobelpreis für Wirtschaftswissenschaften,Auszeichnung für Franzosen Jean Tirole
10.10.2014 18:45 Uhr,Bilanz zur Anhörung der EU-Kommissare,Zu viele faule Kompromisse?
10.10.2014 17:46 Uhr,Neue slowenische EU-Kandidatin Bulc,Umstrittene Quereinsteigerin
10.10.2014 13:23 Uhr,Neue slowenische EU-Kandidatin,Bulc statt Bratusek
10.10.2014 09:33 Uhr,Debatte um Investitionen,Schäuble pocht aufs Sparen
10.10.2014 04:23 Uhr,Interview zum Kooperationsverbot,"Fördern, aber nicht reinreden"
10.10.2014 03:06 Uhr,New York kämpft gegen schlechte Vermieter,Ratten als Mitbewohner
09.10.2014 20:09 Uhr,EU-Innenminister beraten,Wohin mit den Flüchtlingen?
09.10.2014 17:20 Uhr,Nach Protesten gegen Geheimhaltung,EU veröffentlicht TTIP-Papier
09.10.2014 16:01 Uhr,Nach Widerstand im EU-Parlament,Bratusek gibt auf
09.10.2014 15:37 Uhr,Herbstgutachten der Konjunkturforscher,Manche Probleme sind hausgemacht
09.10.2014 14:39 Uhr,Nach EU-Veto gegen Bratusek,Junckers Zeitplan wackelt
09.10.2014 11:59 Uhr,Kurt Masur zu 25 Jahre Mauerfall,"""Die Macht des Staates war sehr groß"""
09.10.2014 11:12 Uhr,Hintergrund,Die Haltung der Türkei im IS-Kampf
09.10.2014 02:46 Uhr,Neuer Kandidat für EU-Kommission,Wer wird Bratusek ersetzen?
09.10.2014 01:11 Uhr,Stationen des Mauerfalls in zwölf Videos,"Bilder, die niemand vergisst"
08.10.2014 19:33 Uhr,Slowenische Kommissars-Kandidatin abgelehnt,Bratusek fällt im EU-Parlament durch
08.10.2014 18:00 Uhr,Flüchtlingszahlen in Krisengebieten,Wie groß sind die Fragezeichen?
08.10.2014 16:09 Uhr,Genehmigung durch EU-Kommission,Briten dürfen umstrittenes AKW bauen
08.10.2014 15:59 Uhr,Kaum Unterstützung für Wirtschaft möglich,IWF findet Banken noch viel zu schwach
08.10.2014 10:47 Uhr,Betrieb setzt auf spanische Fachkräfte,"""In Spanien werden Chefs geduzt"""
08.10.2014 03:06 Uhr,EU-Beschäftigungsgipfel in Mailand,Maßgeschneiderte Lösung gesucht
07.10.2014 18:53 Uhr,EU-Parlament kritisiert neue Kommissare,Junckers Team fällt auseinander
07.10.2014 16:34 Uhr,Neue Jobs trotz Stagnation,Deutsche Industrie stellt auf Vorrat ein
07.10.2014 15:14 Uhr,Verdacht auf illegale Vorteile,EU prüft Steuersparmodell von Amazon
07.10.2014 14:50 Uhr,September 2014,EZB kündigt Kauf von Wertpapieren an
06.10.2014 19:52 Uhr,EU-Parlamentarier verweigern Posten,Ungarns Kandidat fällt durch
06.10.2014 17:05 Uhr,August 2014,Rekordstrafe gegen Bank of America
06.10.2014 16:16 Uhr,SPD kritisiert Seehofers Stromtrassen-Politik,Wandert die Industrie aus Bayern ab?
06.10.2014 14:45 Uhr,Euro Disney in Schwierigkeiten,Rettungsprogramm für Disneyland Paris
06.10.2014 12:18 Uhr,Konjunkturprognose der Regierung,Athen sagt wieder Wachstum voraus
05.10.2014 20:39 Uhr,Kanada spendierte Flug für EU-Spitzen,Ein unerlaubtes Geschenk?
05.10.2014 01:38 Uhr,Kardinal Kasper,"""Keine in Stein gemeißelte Ideologie"""
03.10.2014 12:41 Uhr,Grünes Licht für Facebook,EU winkt WhatsApp-Übernahme durch
02.10.2014 22:23 Uhr,ARD-DeutschlandTrend,Viel Verständnis für die Lokführer
02.10.2014 13:50 Uhr,Französischer EU-Politiker Moscovici,Kommissar im Kreuzfeuer
02.10.2014 10:47 Uhr,Porträt einer mehrfachen Wandlung,Der real existierende Konvertit
02.10.2014 09:50 Uhr,Börsengänge in Deutschland,Fast wie zu Zeiten der T-Aktie
02.10.2014 04:20 Uhr,Streit der Verkehrsminister,Es geht ums Geld für Bus und Bahn
02.10.2014 00:30 Uhr,Kolumne Euroschau,Die EZB verkommt zur Bad Bank
01.10.2014 22:32 Uhr,Kandidaten für die EU-Kommission,Heftiger Gegenwind aus dem Parlament
01.10.2014 03:32 Uhr,Designierte EU-Kommissare,Junckers Wackelkandidaten
01.10.2014 00:00 Uhr,Archiv,EU Nachrichten Oktober 2014
