topline,headline,content
11.02.2022 23:26 Uhr,Fußball-Bundesliga,Leipzig auf Königsklassen-Kurs
11.02.2022 22:32 Uhr,Krisen-Gespräch zum Ukraine-Konflikt,"Lage ""sehr, sehr ernst"""
11.02.2022 22:23 Uhr,Wall Street unter Druck,Der Ausverkauf geht weiter
11.02.2022 22:19 Uhr,Coronavirus-Pandemie,"++ ""Die Gesetzentwürfe sind da"" ++"
11.02.2022 20:54 Uhr,Trucker-Proteste in Kanada,Ontario ruft Notstand aus
11.02.2022 18:51 Uhr,Irans Revolutionstag,Feiern oder fernbleiben
11.02.2022 18:30 Uhr,"""Fridays for Future""","""Was die Regierung macht, reicht nicht"""
11.02.2022 18:28 Uhr,US-Regierung,Afghanistan-Mittel sollen aufgeteilt werden
11.02.2022 17:40 Uhr,USA und chinesische Hacker,Spionjagd mit Nebenwirkungen
11.02.2022 17:20 Uhr,Corona-Pandemie,Wo Europa lockert
11.02.2022 17:07 Uhr,Führerschein,Frist für Umtausch wird verlängert
11.02.2022 17:02 Uhr,Amazonas,"""Es gibt einen Wettlauf um die Abholzung"""
11.02.2022 17:02 Uhr,EU-Risikowächter ESRB,Immobilienmarkt droht Überhitzung
11.02.2022 16:22 Uhr,Parlamentsbrand in Südafrika,Die Brandstifter
11.02.2022 16:22 Uhr,Bundesversammlung trotz Corona,"Eine Wahl ganz ohne ""Glamour"""
11.02.2022 16:04 Uhr,Pläne der Politik,Was tun gegen steigende Energiepreise?
11.02.2022 15:52 Uhr,Deutscher Skeleton-Weltmeister,Olympia-Gold für Christopher Grotheer
11.02.2022 15:25 Uhr,Blinken zur Ukraine,"""Russischer Einmarsch jederzeit möglich"""
11.02.2022 14:58 Uhr,60 Milliarden Euro,Nachtragshaushalt passiert Bundesrat
11.02.2022 14:51 Uhr,Jahresergebnis 2021,Kräftiges Plus bei Mercedes-Benz
11.02.2022 14:36 Uhr,Russischer Auslandssender,RT DE reicht Klage gegen Sendeverbot ein
11.02.2022 13:47 Uhr,Stärkstes Wachstum seit 1941,Britische Wirtschaft erholt sich rasant
11.02.2022 13:05 Uhr,IT-Sicherheit,"""Extrem maßgeschneiderte Angriffe"""
11.02.2022 12:47 Uhr,Initiative der Entwicklungsministerin,Schulze will gefährliche Pestizide verbieten
11.02.2022 12:19 Uhr,Floridas erstes Forschungszentrum,In Thomas Edisons Winterlabor
11.02.2022 12:14 Uhr,Population stark zurückgegangen,Australien will Koalas besser schützen
11.02.2022 11:35 Uhr,Bundesverfassungsgericht,Eilantrag gegen Pflege-Impfpflicht gescheitert
11.02.2022 11:32 Uhr,"""Nordkreuz""-Ermittlungen",Drei Polizisten angeklagt
11.02.2022 11:28 Uhr,Vor Bund-Länder-Treffen,Scholz erwägt Lockerungen
11.02.2022 11:27 Uhr,Lava und Rauch,Vulkan Ätna auf Sizilien ausgebrochen
11.02.2022 11:02 Uhr,Kroatische Grenzwache,Eine E-Mail als Anleitung zu Pushbacks?
11.02.2022 10:59 Uhr,Neue Motive,Berühmte Europäer auf Euro-Scheinen?
11.02.2022 10:51 Uhr,Schutz von Jugendlichen,Drogenbeauftragter für Alkoholkauf erst ab 18
11.02.2022 10:43 Uhr,EZB will abwarten,Lagarde gegen schnelle Zinserhöhung
11.02.2022 10:36 Uhr,Sexuelle Belästigung im Job,US-Gesetz beendet Einigungs-Zwang
11.02.2022 10:29 Uhr,Elektromobilität,Warum gebrauchte E-Autos so teuer sind
11.02.2022 09:43 Uhr,Kontrollen bei Impfpflicht,Arbeitgeber lehnen Impfstatusabfrage ab
11.02.2022 09:01 Uhr,Kalifornien reicht Klage ein,Rassismusvorwürfe gegen Tesla
11.02.2022 08:51 Uhr,Hohe Energiepreise,Polens Fremdeln mit der EU-Klimapolitik
11.02.2022 08:43 Uhr,Peru,Mindestens 20 Tote bei Busunglück
11.02.2022 08:11 Uhr,Verschuldung des Bundes,Kleine Zinserhöhung mit großer Wirkung
11.02.2022 07:50 Uhr,Londoner Polizeichefin,Rücktritt wegen langer Liste von Skandalen
11.02.2022 07:20 Uhr,Coronavirus in Deutschland,Sieben-Tage-Inzidenz steigt erneut
11.02.2022 06:34 Uhr,Ukraine-Krise,Russland beklagt fehlenden Druck Berlins
11.02.2022 06:34 Uhr,Präsident Joe Biden,"""US-Bürger sollten die Ukraine verlassen"""
11.02.2022 05:28 Uhr,Coronavirus,Italiens harmonischer Weg durch die Pandemie
11.02.2022 03:23 Uhr,Allgemeine Impfpflicht,In Österreich wachsen die Zweifel
11.02.2022 03:22 Uhr,Russlands Einfluss im Donbass,"""Das ist Besatzungsverwaltung pur"""
11.02.2022 03:14 Uhr,RKI-Wochenbericht,Omikron-Subtyp BA.2 legt langsam weiter zu
