topline,headline,content
31.10.2015 19:22 Uhr,Griechisches Parlament billigt Gesetz,Athen ebnet Weg für Banken-Hilfen
31.10.2015 17:32 Uhr,Wechsel ins Arbeitsministerium,Fahimi gibt Posten als SPD-Generalsekretärin auf
31.10.2015 11:48 Uhr,EZB-Stresstest,"Athens Banken brauchen 14,4 Milliarden"
31.10.2015 11:45 Uhr,Flüchtlingsdrama in der Ägäis,Fähren oder Grenzöffnung als Rettung?
31.10.2015 03:41 Uhr,Kommunikationsexperte Trebbe,"""Seehofer - so weit rechts wie möglich"""
30.10.2015 21:29 Uhr,Flucht übers Mittelmeer,Tödlicher Rabatt bei Sturm
30.10.2015 18:00 Uhr,VW-Abgasskandal,"Wer auspackt, hat nichts zu befürchten"
30.10.2015 16:48 Uhr,Kritik an Telekom-Plänen,Raus aus der Neutralität?
30.10.2015 13:49 Uhr,Erneut Tote bei Bootsunglücken,Das Sterben im Mittelmeer geht weiter
30.10.2015 11:47 Uhr,Lebenshaltungskosten in Eurozone,Inflationsrate steigt auf null Prozent
29.10.2015 18:38 Uhr,Abstimmung im Europaparlament,Fremdvotum macht Le Pen Ärger
29.10.2015 18:14 Uhr,Entscheidung der EU,Sanktionen gegen Weißrussland ausgesetzt
29.10.2015 16:24 Uhr,Sacharow-Preis für saudi-arabischen Blogger,"""Ein außergewöhnlich mutiger Mann"""
29.10.2015 14:52 Uhr,Deutsche Bank baut Tausende Stellen ab,Kahlschlag nach Rekordverlust
29.10.2015 12:07 Uhr,Europaexperte Verheugen im Interview,"""Nicht unmöglich, dass sich die EU auflöst"""
29.10.2015 10:00 Uhr,Zahlen für Oktober,Niedrigste Arbeitslosenzahl seit 24 Jahren
29.10.2015 04:30 Uhr,SWP-Experte zur US-Strategie,"Syrien-Lösung ""wohl auf dem Schlachtfeld"""
29.10.2015 03:41 Uhr,Fortschrittsbericht wird zurückgehalten,EU verkneift sich Türkei-Kritik bis zur Wahl
28.10.2015 21:23 Uhr,Entscheidung im Aufsichtsrat,Deutsche Bank streicht Dividende
28.10.2015 20:10 Uhr,EU schließt Steuerabkommen,Liechtenstein bald kein Steuerparadies mehr
28.10.2015 19:35 Uhr,EU reagiert auf Betrug durch VW,Abgaswerte 50 Prozent über Labor
28.10.2015 16:56 Uhr,Familiennachzug bei Flüchtlingen,Wer darf wann nachkommen?
28.10.2015 16:49 Uhr,Chef der EU-Handelskammer,Welche Rolle spielt Deutschland im China der Zukunft?
28.10.2015 16:07 Uhr,Wenige Tage vor der Parlamentswahl,Türkische Polizei stürmt Medienkonzern
28.10.2015 11:00 Uhr,Lammert droht mit Nein zu TTIP,Ohne Transparenz keine Zustimmung
28.10.2015 10:19 Uhr,Folge des Abgasskandals,VW meldet Milliardenverlust
28.10.2015 03:57 Uhr,EU ringt um Details der Reform,"Neuer Abgastest, alte Grenzwerte"
27.10.2015 20:38 Uhr,Streit um Flüchtlingspolitik,Und wieder ein Spitzentreffen
27.10.2015 19:19 Uhr,Roaming und Netzneutralität,Was ändert sich für EU-Bürger?
27.10.2015 16:01 Uhr,Streit um Netzneutralität,"""Bislang eher abstrakte Befürchtungen"""
27.10.2015 15:32 Uhr,Abstimmung im EU-Parlament,Billiger nach Hause telefonieren
27.10.2015 15:12 Uhr,Streit um Flüchtlingspolitik,EU erwägt Geld als Druckmittel
27.10.2015 14:08 Uhr,Fehlende Reformschritte,EU zahlt wohl noch nicht an Athen
27.10.2015 11:30 Uhr,Studie zu Gerechtigkeit in der EU,Der Nachwuchs verliert den Anschluss
27.10.2015 11:07 Uhr,Flüchtlinge an der bayerischen Grenze,Seehofer schimpft auf Wien - und droht Berlin
27.10.2015 09:51 Uhr,Entscheidung zu Netzneutralität,Gleiches Tempo - egal welcher Inhalt?
27.10.2015 07:38 Uhr,"Erdbeben der Stärke 7,5",Mindestens 270 Tote im Hindukusch
27.10.2015 05:38 Uhr,Fakten zum Krebsrisiko,Wie gefährlich ist Wurst?
27.10.2015 02:16 Uhr,Kundus nach dem Angriff,"""Die Angst vor den Taliban bleibt"""
26.10.2015 18:41 Uhr,Schwere Erdstöße in Pakistan und Afghanistan,"Ein Beben, das nicht enden wollte"
26.10.2015 17:36 Uhr,Ergebnisse des EU-Sondertreffens,Der 17-Punkte-Plan
26.10.2015 16:51 Uhr,Nach Polen-Wahl,"""Es wird viel Krach geben"""
26.10.2015 13:20 Uhr,Türkischer Polizeieinsatz in Diyarbakir,Neun Tote bei Anti-IS-Operation
26.10.2015 11:32 Uhr,Reaktionen auf Treffen zur Flüchtlingskrise,"""Natürlich zu wenig"""
26.10.2015 02:03 Uhr,EU-Treffen zur Flüchtlingspolitik,Mehr Unterstützung für Balkanländer
25.10.2015 23:22 Uhr,EU-Treffen zur Balkan-Flüchtlingskrise,Vorwürfe und Schuldzuweisungen
25.10.2015 19:47 Uhr,EU-Treffen zur Balkan-Flüchtlingskrise,"Schnelle Hilfe, strenge Maßnahmen"
25.10.2015 09:43 Uhr,Vor EU-Treffen zur Balkan-Flüchtlingskrise,"Kritik, Vorwürfe und Appelle"
24.10.2015 18:23 Uhr,Katastrophale Lage auf Lesbos,Stau vor dem Hotspot
24.10.2015 17:07 Uhr,Situation auf der Balkanroute,"Weitere Flüchtlinge, gereizte Stimmung"
24.10.2015 11:54 Uhr,Merkel verteidigt Flüchtlingspolitik,"""Aus der Zeit der Gastarbeiter gelernt"""
23.10.2015 21:28 Uhr,EU-Kommission legt Plan vor,Juncker fordert Ende des Durchwinkens
23.10.2015 21:14 Uhr,Vor EU-Treffen zur Flüchtlingspolitik,Festungen in Europa
23.10.2015 17:42 Uhr,Slowenische Drohung in Richtung EU,Ein Grenzzaun als letzte Option
23.10.2015 14:37 Uhr,DFB-Affäre um WM-Vergabe,"Was ist Märchen, was sind die Fakten?"
23.10.2015 13:46 Uhr,Bundeswehr-Befehlshaber für Auslandseinsätze,"""Es wäre vernünftig, wenn wir in Afghanistan blieben"""
23.10.2015 08:56 Uhr,Altmaier zu Flüchtlingspolitik,"""Je mehr Zäune, umso größer ist die Misere"""
23.10.2015 00:38 Uhr,Fischfangquoten für die Ostsee,"Weniger Dorsch, mehr Hering"
23.10.2015 00:30 Uhr,DeutschlandTrend im ARD-Morgenmagazin,Deutsche erwarten Gesellschaftswandel
22.10.2015 16:33 Uhr,Hintergrund zur Sixtinischen Kapelle,Ein magischer Ort
22.10.2015 16:28 Uhr,Das Unternehmen Google,Der allwissende Gigant
22.10.2015 16:28 Uhr,Pro und Contra Hauptschule in Deutschland,Hauptschule: Stigma oder einzige Chance?
22.10.2015 16:27 Uhr,Fragen und Antworten,Was bietet die neue Behördennummer 115?
22.10.2015 16:26 Uhr,Daten zur Schuldenkrise,Wie geht es den G20-Staaten?
22.10.2015 16:25 Uhr,Hintergrund,Landesbanken: Die heimlichen Riesen
22.10.2015 16:17 Uhr,Interview mit Katastrophenhelfer Munz,"Kein ""humanitäres Showbusiness"" in Afrika"
22.10.2015 16:15 Uhr,"Hintergrund zur ""Ehe für alle""",Gesetzliche Regelungen in Europa
22.10.2015 16:09 Uhr,Interview mit Ulrich Wickert,"""Sarkozy ist ist ein schwieriger Partner"""
22.10.2015 16:09 Uhr,Generation Y krempelt Arbeitsmarkt um,"Spaß, Selbstverwirklichung und Yoga"
22.10.2015 16:07 Uhr,Recht,Selbst bestimmen: Die Patientenverfügung
22.10.2015 16:03 Uhr,Chronologie,Der BBC-Skandal in Daten
22.10.2015 15:55 Uhr,Hintergrund Fraktionszwang,Nur ihrem Gewissen unterworfen?
22.10.2015 15:53 Uhr,SPD-Wahlprogramm,Was die Sozialdemokraten wollen
22.10.2015 15:45 Uhr,Hintergrund,Daten und Fakten zu Birma
22.10.2015 15:41 Uhr,RWI-Experte im Interview,"""Hilfen für Schlecker wären ungerecht"""
22.10.2015 15:37 Uhr,DGB-Vize Sehrbrock zu Lohnunterschieden,"""Zulagen, Dienstwagen - bei Frauen fällt das oft weg"""
22.10.2015 15:34 Uhr,Flüchtlinge auf der Balkanroute,In Österreich wächst der Unmut
22.10.2015 15:33 Uhr,Die selbsternannten Wächter des Staates,Das Militär als Hüter der Demokratie?
22.10.2015 15:33 Uhr,Angekündigter Rücktritt des Weltbank-Chefs,"""Unter Wolfowitz nur Business as usual"""
22.10.2015 15:27 Uhr,Linke setzt auf Ost-Strategie für Erfolg im Westen,"""Wir wollen die 'Kümmerer' werden"""
22.10.2015 15:26 Uhr,Interview mit ARD-Rechtsexperte Möller,"""Schäuble hat die Sensibilität der Bürger unterschätzt"""
22.10.2015 15:25 Uhr,Interview zur Streikbereitschaft in Deutschland,Die Opferbereitschaft ist erschöpft
22.10.2015 15:24 Uhr,Fragen und Antworten,Wie kommen Sie an die Abwrackprämie?
22.10.2015 15:18 Uhr,Der Kampf um ein neues Urheberrecht,"""In fünf Jahren wird alles entschieden sein"""
22.10.2015 15:16 Uhr,Patentvergabe in Tier-  und Pflanzenwelt,Zwischen  Krebs-Maus und Anti-Matsch-Tomate
22.10.2015 15:14 Uhr,Nigeria im Griff der Terroristen,Die Boko-Haram-Sekte
22.10.2015 15:10 Uhr,WHO ruft höchste Schweinegrippe-Alarmstufe aus,Was bedeutet die Warnstufe 6 für Deutschland?
22.10.2015 15:09 Uhr,Interview mit Politikberater Spreng,"""Die Kanzlerin führt nicht"""
22.10.2015 15:04 Uhr,Fragen und Antworten,Was tun gegen die Euro-Krise?
22.10.2015 14:56 Uhr,Energiegipfel,Die Ergebnisse im Überblick
22.10.2015 14:52 Uhr,Fragen und Antworten zum Bundestrojaner,"Kann man den Staatstrojaner ""aussperren""?"
22.10.2015 14:49 Uhr,Blutspenden in Deutschland,Welches Risiko besteht?
22.10.2015 14:48 Uhr,Plagiatsaffären im Überblick,Wer hat abgeschrieben?
22.10.2015 14:41 Uhr,"Interview mit Jürgen von Jordan, Myanmar-Stiftung","""Es geht ums Überleben, nicht um Umbruch"""
22.10.2015 14:39 Uhr,Energiesparlampen,Sparsamer - aber auch besser?
22.10.2015 14:37 Uhr,Protektionismus im Rüstungsgeschäft,"""EADS hat nun eine Baustelle weniger"""
22.10.2015 14:35 Uhr,Fragen und Antworten,Krankenkassenbeiträge - was ist neu?
22.10.2015 14:33 Uhr,Rente mit 67,Wie lange müssen Sie arbeiten?
22.10.2015 14:32 Uhr,Impfungen haben begonnen,Fragen und Antworten zur Schweinegrippe-Impfung
22.10.2015 14:30 Uhr,Hintergrund,Der Rundfunkstaatsvertrag
22.10.2015 14:28 Uhr,Fragen und Antworten,Was dürfen EU-Abgeordnete entscheiden?
22.10.2015 14:24 Uhr,DFL steigert TV-Erlöse,"""Der sehr hohe Betrag ist eine Sensation"""
22.10.2015 14:22 Uhr,Hintergrund,Das Inzest-Verbot nach Paragraf 173
22.10.2015 14:19 Uhr,Hintergrund,Erdbeben-Spalte unterm AKW Kaschiwazaki
22.10.2015 14:18 Uhr,"Hilfsorganisation ""Help"" stellt Arbeit im Irak ein","""Es ist einfach viel zu gefährlich geworden"""
22.10.2015 14:11 Uhr,Interview mit Gesundheitsministerin Schmidt,"""Niemand muss bezahlen, er ist ja versichert"""
22.10.2015 14:09 Uhr,Fragen und Antworten,Kurzarbeit - was bringt das?
22.10.2015 14:08 Uhr,Weiter niedrige Zinsen im Euroraum,EZB lässt Leitzins auf Rekordtief
22.10.2015 14:04 Uhr,Interview mit Heinrich Oberreuter,"""Die CSU sucht Arme, in die sie sich werfen kann"""
22.10.2015 14:04 Uhr,Doping,Erklärung der Uniklinik Freiburg zum Fall Huber
22.10.2015 14:04 Uhr,Fiskalpakt und ESM,Das letzte Wort haben die Richter
22.10.2015 14:02 Uhr,Gewinne und Suchtgefahr,Das Glücksspiel und die Politik
22.10.2015 13:59 Uhr,Organisation der Transplantation,Organspende - das System und seine Tücken
22.10.2015 13:58 Uhr,91 Institute im Stresstest,Wie Europas Banken auf den Zahn gefühlt wurde
22.10.2015 13:55 Uhr,Zughersteller und Kraftwerksbauer,"""Wir brauchen Ingenieure und Techniker"""
22.10.2015 13:54 Uhr,Kredite aus dem Euro-Schutzschirm,Wie funktioniert die Irland-Rettung?
22.10.2015 13:52 Uhr,ARD-DeutschlandTrend,Jeder zweite Deutsche für NPD-Verbot
22.10.2015 13:49 Uhr,Interview mit dem ARD-Rechtsexperten Bräutigam,"""Das Kruzifix-Urteil ist eine spektakuläre Kehrtwende"""
22.10.2015 13:49 Uhr,Hintergrund,Steinbrücks Pläne zur Tagesmütter-Steuer
22.10.2015 13:49 Uhr,Fragen und Antworten,"Was tun, wenn der ICE zur Sauna wird?"
22.10.2015 13:48 Uhr,Sicherheitsexperte zu IAEA-Bericht,"""Es gibt nur schmerzhafte Wege"""
22.10.2015 13:46 Uhr,Fragen und Antworten zum Bundestrojaner,Taugt der Bundestrojaner als Beweis vor Gericht?
22.10.2015 13:45 Uhr,"Urteil zur ""Cicero""-Razzia",Pressefreiheit steht über Verdacht auf Geheimnisverrat
22.10.2015 13:34 Uhr,Hintergrund zu zehn Jahren Dolly,Der Zoo der Klontiere
22.10.2015 13:33 Uhr,Irakischer Ministerpräsident wirbt um Investitionen,"""Deutsche Firmen können noch Vorreiter sein"""
22.10.2015 13:32 Uhr,Änderungen bei der Kfz-Steuer im Detail,Kombinierte Besteuerung nach CO2-Ausstoß und Hubraum
22.10.2015 13:31 Uhr,Weltbank-Chef soll Freundin begünstigt haben,Die Wolfowitz-Affäre
22.10.2015 13:30 Uhr,Infografik,Auslandseinsätze der Bundeswehr
22.10.2015 13:27 Uhr,Interview zum Weltlehrertag,"""Der Beamtenstatus ist nicht mehr zeitgemäß"""
22.10.2015 13:26 Uhr,Der Fiskalpakt und seine Bedeutung,Muss Deutschland schneller sparen?
22.10.2015 13:19 Uhr,Fragen und Antworten,Elektromobilität - sinnvoll oder nicht?
22.10.2015 13:18 Uhr,Streit um Ökostrom,"EEG-Umlage - Wieso, wie hoch, warum?"
22.10.2015 13:18 Uhr,Hintergrund,Zentrale Punkte des Mittelstandsentlastungsgesetzes
22.10.2015 13:17 Uhr,Nachfolgesuche an der IWF-Spitze,"""Strauss-Kahn ist vollkommen ersetzbar"""
22.10.2015 13:12 Uhr,Afghanistan-Expertin Citha Maas,"""Der Terror der Taliban wird zurückkehren"""
22.10.2015 13:07 Uhr,Möglicher Rauswurf von Wolfgang Clement,Parteiausschlussverfahren bei der SPD
22.10.2015 13:06 Uhr,Die Auslandseinsätze der Bundeswehr,"Afghanistan, Kosovo, Mali ..."
22.10.2015 13:02 Uhr,Historischer Streit,Wem gehört Tibet?
22.10.2015 12:59 Uhr,Interview zur Lage auf dem Lehrstellenmarkt,"''Die Schulen qualifizieren an den Jugendlichen vorbei"""
22.10.2015 12:58 Uhr,Krise in Abchasien,Aufruhr unter Palmen
22.10.2015 12:57 Uhr,Interview zum Stasi-Opfer-Gesetz (2),"""Seit 2001 kann ich nicht mehr arbeiten"""
22.10.2015 12:56 Uhr,Pakistan,Ausnahmezustand beschränkt Freiheitsrechte
22.10.2015 12:56 Uhr,Daten und Fakten zu syrischen Flüchtlingen,Nur ein Tropfen auf den heißen Stein
22.10.2015 12:55 Uhr,Interview zur Krise bei der Sachsen LB,"""Von der Sachsen LB wird nicht viel übrig bleiben"""
22.10.2015 12:52 Uhr,Bundeswehr in Afghanistan,Das Ende des deutschen Armeeeinsatzes
22.10.2015 12:52 Uhr,Interview mit Grünen-Innenexperte Wieland,"""Online-Durchsuchungen braucht man nicht"""
22.10.2015 12:50 Uhr,DeutschlandTrend im Morgenmagazin,Grüne rutschen auf Zwei-Jahres-Tief
22.10.2015 12:48 Uhr,Diskussion um höhere Löhne,"""Da ist einigen Politikern der Gaul durchgegangen"""
22.10.2015 12:45 Uhr,Lohnforderungen und Abschlüsse,Ziele und Ergebnisse der Tarifrunden 2012
22.10.2015 12:29 Uhr,Hintergrund,"""Minsker Gruppe"" der OSZE"
22.10.2015 12:26 Uhr,Experte analysiert deutsche Infrastruktur,Ein einig Land von Schlaglöchern?
22.10.2015 12:26 Uhr,Fragen und Antworten zum Bundestrojaner,Was hilft gegen den Bundestrojaner?
22.10.2015 12:25 Uhr,Pro Bahn kritisiert geheime DB-Verspätungsstatistik,"""Ein Staatsgeheimnis eines Staatsbetriebs"""
22.10.2015 12:23 Uhr,Moskaus Position zum Syrien-Konflikt,"""Russland wird keine Einmischung legitimieren"""
22.10.2015 12:20 Uhr,SPD-Innenexperte zur Eilentscheidung aus Karlsruhe,"""Wir müssen handwerklich besser werden"""
22.10.2015 12:19 Uhr,Kasachstan: ein Riese zwischen Asien und Europa,Rohstoffreich und ohne echte Demokratie
22.10.2015 12:17 Uhr,Hintergrund,Eckpunkte der Etat- und Finanzplanung bis 2011
22.10.2015 12:14 Uhr,Fragen und Antworten zum Atomausstieg,Streit um den Ausstieg mit Verlängerung
22.10.2015 12:13 Uhr,Hintergrund,"""Übergesetzlicher Notstand"" soll Flugzeugabschuss ermöglichen"
22.10.2015 12:10 Uhr,Fragen und Antworten,Was ändert sich bei den Jobcentern?
22.10.2015 12:10 Uhr,Mittlerweile vier Vorschläge,Privatisierungsmodelle für die Bahn
22.10.2015 12:09 Uhr,Interview mit dem amtierenden IWF-Chef Lipsky,"""Strauss-Kahn hat den IWF exzellent geleitet"""
22.10.2015 12:08 Uhr,Hintergrund zum Umweltgesetzbuch,"Einfachere Genehmigungen oder ""Monsterbürokratie""?"
22.10.2015 12:04 Uhr,Fragen und Antworten,Was tun gegen Kostenfallen im Internet?
22.10.2015 11:59 Uhr,Interview zum Stasi-Opfer-Gesetz (1),"""In der Isolationshaft gab es Wasser und Brot"""
22.10.2015 11:57 Uhr,Sitzen statt demonstrieren,"Wem droht der ""Unterbindungsgewahrsam""?"
22.10.2015 11:50 Uhr,Interview zu den Vorstößen des Innenministers,"""Schäuble vom Instinkt verlassen"""
22.10.2015 11:45 Uhr,Fragen und Antworten,Wie geht es im Fall Wulff weiter?
22.10.2015 11:40 Uhr,Welttag des Ehrenamts,"""Steinbrücks Geld ist kein Geschenk"""
22.10.2015 11:24 Uhr,Interview zu transatlantischem Verhältnis,"""Europa muss einheitlich auftreten"""
22.10.2015 11:19 Uhr,Streiks im Luftverkehr,Wer zahlt für den ausgefallenen Flug?
22.10.2015 11:16 Uhr,Fragen und Antworten zur Frequenzversteigerung,Milliardenschlacht um Mobilfunkfrequenzen
22.10.2015 11:15 Uhr,Hintergrund,Wie funktioniert die SPD?
22.10.2015 11:13 Uhr,Hintergrund,Die Regierungsbildung in Griechenland
22.10.2015 11:13 Uhr,"Aufgaben, Strukturen, Akteure",Der Internationale Währungsfonds
22.10.2015 11:08 Uhr,Interview mit dem Präsidenten der Max-Planck-Gesellschaft,''Deutschland ist und bleibt Forschungsnation''
22.10.2015 11:03 Uhr,TV-Rechte und Sponsoren,Die olympische Geldmaschine
22.10.2015 10:57 Uhr,"""News of the World""",Der Abhörskandal um das Murdoch-Imperium
22.10.2015 10:55 Uhr,FDP-Experte zur Nahost-Politik,"""Dann muss man eben mit ihnen sprechen"""
22.10.2015 10:51 Uhr,Birma-Experte Will im Interview,"""Für einen Umsturz fehlen die politischen Strukturen"""
22.10.2015 10:50 Uhr,Fragen & Antworten zum Opel-Verkauf,"Ende gut, alles gut?"
22.10.2015 10:44 Uhr,Interview zu prominenten Gerichtsfällen,Vom Umgang mit Skandalen
21.10.2015 22:12 Uhr,Datenschützer beraten Vorgehen,"Wie geht es nach ""Safe Harbor""-Urteil weiter?"
21.10.2015 18:06 Uhr,Flüchtlinge auf Balkanroute,Europa schaut zu
21.10.2015 17:36 Uhr,EU-Steuerentscheidung,"""Der Druck auf die Konzerne steigt"""
21.10.2015 16:33 Uhr,Manipulations-Skandal,Verkaufsstopp für VW-Neuwagen
21.10.2015 14:44 Uhr,Urteil des Europäischen Gerichtshofs,Wenn Zeitungen ein bisschen wie Fernsehsender sind
21.10.2015 14:34 Uhr,Euroschau,Druckt die EZB jetzt noch mehr Geld?
21.10.2015 13:58 Uhr,Entscheidung der EU-Kommission,Steuervorteile für Fiat und Starbucks illegal
21.10.2015 11:08 Uhr,Flüchtlinge in Europa,Juncker lädt zu EU-Krisentreffen ein
21.10.2015 09:33 Uhr,UNHCR-Sprecherin zur Balkanroute,"""Die Lösung ist in Griechenland"""
20.10.2015 15:18 Uhr,Interview zum Skandal bei der FIFA,"""Platinis Karriere scheint am Ende"""
20.10.2015 11:20 Uhr,ARD-Korrespondent zum IG-Metall-Chef,"""Hofmann ist akribisch"""
19.10.2015 15:24 Uhr,ARD-Korrespondent zur Balkanroute,"""Slowenien fühlt sich überrannt"""
19.10.2015 09:17 Uhr,Diskussion über Umgang mit der Türkei,"""Wahlkampfhilfe"" oder ""Kompromisssuche""?"
19.10.2015 09:10 Uhr,Chinesische Wirtschaft,Schwächstes Wachstum seit 2009
18.10.2015 18:09 Uhr,Außerordentliche Aufsichtsratssitzung,Deutsche Bank baut radikal um
17.10.2015 22:04 Uhr,Messerattacke auf Kölner OB-Kandidatin,Motiv Flüchtlingspolitik
17.10.2015 01:42 Uhr,Griechisches Parlament billigt Rentenreform,Tsipras besteht Kraftprobe
16.10.2015 16:24 Uhr,Nach dem EU-Gipfel zur Flüchtlingskrise,Annäherung an Türkei und offene Fragen
16.10.2015 01:20 Uhr,EU-Flüchtlingsgipfel in Brüssel,Einigung mit der Türkei - im Grundsatz
16.10.2015 00:23 Uhr,EU-Flüchtlingsgipfel in Brüssel,Die wichtigste Frage bleibt unbeantwortet
15.10.2015 20:42 Uhr,Fragen und Antworten,Welche Rechte haben die VW-Käufer?
15.10.2015 19:03 Uhr,Gewalt in Israel,Jugend ohne Perspektive
15.10.2015 18:09 Uhr,Drohnenpilot Bryant im Interview,"""Deutsches Vertrauen ausgenutzt"""
15.10.2015 18:07 Uhr,Flüchtlingsgipfel der EU,Zeit zu liefern
15.10.2015 17:28 Uhr,Aktion in ganz Europa,"VW ruft 8,5 Millionen Autos zurück"
15.10.2015 17:10 Uhr,Flucht aus Afghanistan,Ein Land verliert seine Jugend
15.10.2015 15:14 Uhr,Koalitionsbeschlüsse zu Flüchtlingen,Das Asylpaket im Überblick
15.10.2015 14:55 Uhr,Ehrenamtliche Flüchtlingshelfer,Wie deutscher Alltag funktioniert
15.10.2015 10:00 Uhr,"2,4 Millionen Fahrzeuge betroffen",Kraftfahrt-Bundesamt zwingt VW zum Rückruf
15.10.2015 06:52 Uhr,Wie die EU plötzlich Erdogan umgarnt,Europas neuer Liebling
14.10.2015 18:26 Uhr,EU-Gelder für Flüchtlinge,"Viel versprochen, wenig gehalten"
13.10.2015 12:13 Uhr,Folgen des Abgasskandals,VW kürzt Investitionen drastisch
13.10.2015 11:09 Uhr,Atomabkommen,"Iranisches Parlament sagt ""Ja"""
13.10.2015 05:35 Uhr,Kein Schweinefleisch mehr in US-Bundesgefängnissen,Gebt uns mehr Gemüse!
12.10.2015 19:57 Uhr,EU-Außenminister beraten über Syrien,Alles dreht sich um Assad
12.10.2015 19:06 Uhr,Nach Wahl in Weißrussland,EU setzt Sanktionen vorübergehend aus
12.10.2015 17:40 Uhr,Türkei-Experte zu Ankara-Attentat,"""Totalversagen des türkischen Staats"""
12.10.2015 17:37 Uhr,Nobelpreis für Wirtschaftswissenschaften,Wer ist Angus Deaton?
12.10.2015 14:41 Uhr,Nach Wahl in Weißrussland,Lockert die EU ihre Sanktionen?
12.10.2015 14:04 Uhr,Erklärung der EU-Außenminister,"""Keine russischen Angriffe auf moderate Syrer"""
12.10.2015 13:29 Uhr,Türkische Gemeinde nach Anschlag in Ankara,"""Jugendgruppen provozieren Demonstranten"""
12.10.2015 07:17 Uhr,Warnung der Türkischen Gemeinde,Schwappt die Gewalt nach Deutschland?
12.10.2015 05:02 Uhr,Treffen der EU-Außenminister,Ringen um eine Lösung für Syrien
11.10.2015 18:17 Uhr,Nach dem Attentat von Ankara,Wut und Trauer in einem gespaltenen Land
10.10.2015 22:46 Uhr,Türkei-Experte im Interview,"""Die Eskalation nützt der AKP-Regierung"""
10.10.2015 18:46 Uhr,Großproteste in Berlin,Massenhaft gegen TTIP
10.10.2015 15:51 Uhr,Einschätzung von ARD-Korrespondent Schramm,"""Die Kurden fühlen sich benutzt"""
10.10.2015 13:57 Uhr,Kurzporträt der pro-kurdischen Partei,Wofür steht die HDP?
10.10.2015 11:36 Uhr,Einschätzung des ARD-Korrespondenten Schramm,"""Sie wollten für Frieden demonstrieren"""
10.10.2015 05:15 Uhr,Verhandlungen zwischen EU und USA,Der Streit um TTIP - darum geht es
09.10.2015 20:19 Uhr,Umverteilung von Flüchtlingen,19 machen den Anfang
09.10.2015 19:15 Uhr,Treffen der EU-Justizminister,Meldestellen gegen Hass im Netz
09.10.2015 10:44 Uhr,VW-Abgas-Skandal,Können VW-Kunden ihr Auto umtauschen?
09.10.2015 05:57 Uhr,Kritik an Merkels Kurs,"Seehofer will ""Notmaßnahmen"" beschließen"
08.10.2015 18:27 Uhr,EU-Innenminister zu Flüchtlingen,Einig beim Thema Abschiebung
08.10.2015 17:12 Uhr,Recherchen zu Abgas-Manipulationen,VW-Betrug hatte offenbar System
08.10.2015 16:32 Uhr,Abgas-Skandal,Razzia bei Volkswagen
08.10.2015 14:25 Uhr,Proteste gegen Flüchtlinge,"""Anti-Asyl-Initiativen"" - vom Netz auf die Straße"
08.10.2015 11:54 Uhr,Dank privatem Konsum,Deutsche Wirtschaft wächst stabil
08.10.2015 11:54 Uhr,IWF senkt Konjunkturprognose,Sorge um den Aufschwung
08.10.2015 00:36 Uhr,"Merkel bei ""Anne Will""","""Ich habe einen Plan"""
08.10.2015 00:24 Uhr,Schlechte Zahlen im dritten Quartal,Deutsche Bank kündigt Milliardenverlust an
07.10.2015 18:29 Uhr,Britischer Premier zur EU,Für Cameron ist weniger mehr
07.10.2015 18:17 Uhr,Merkel und Hollande vor Europaparlament,Schulterschluss in Straßburg
07.10.2015 17:09 Uhr,Merkel und Hollande vor Europaparlament,"Für Solidarität, gegen Abschottung"
07.10.2015 17:02 Uhr,Nach Abgasskandal bei Volkswagen,Aufsichtsrat wählt Pötsch zum Vorsitzenden
07.10.2015 11:08 Uhr,Merkel und Hollande reden im EU-Parlament,"Damals hoffnungsfroh, heute ratlos"
07.10.2015 02:56 Uhr,Schlepper-Bekämpfung,Die EU macht ernst im Mittelmeer
06.10.2015 21:35 Uhr,VW-Abgasaffäre im EU-Parlament,Wut und Ratlosigkeit in Straßburg
06.10.2015 19:14 Uhr,EuGH-Urteil zum Datentransfer,Der Datenhafen USA ist nicht sicher
06.10.2015 18:22 Uhr,Fragen und Antworten zum EuGH-Verfahren,"Facebook und der ""sichere Hafen"""
06.10.2015 14:48 Uhr,Afghanistan,Hilfsorganisationen verlassen Kundus
06.10.2015 13:34 Uhr,Abgasskandal bei VW,"Sparen, aber nicht kündigen"
06.10.2015 13:19 Uhr,Datenübertragung in die USA,"Was ist ""Safe Harbor""?"
06.10.2015 09:56 Uhr,Debatte nach Treffen in Brüssel,Wie weit Erdogan entgegenkommen?
06.10.2015 04:30 Uhr,Fragen und Antworten zum EuGH-Verfahren,"Facebook und der ""sichere Hafen"""
05.10.2015 19:38 Uhr,Hintergrund zur Abgasmanipulation bei VW,Wie das Desaster seinen Lauf nahm
05.10.2015 17:05 Uhr,Staaten einigen sich auf Abkommen,Freihandel rund um den Pazifik
05.10.2015 03:58 Uhr,Nobelpreise für Medizin,Kampf gegen Parasiten und Malaria ausgezeichnet
05.10.2015 02:40 Uhr,Die Türkei und die EU,Ein schwieriger Partner
04.10.2015 16:06 Uhr,Bewältigung der Flüchtlingssituation,EU hofft auf Hilfe der Türkei
04.10.2015 09:36 Uhr,"Wearables, Fitness-Apps und der Datenschutz",Das vermessene Ich
04.10.2015 07:50 Uhr,Manipulierte Abgaswerte,Erste Geständnisse im VW-Skandal
02.10.2015 20:25 Uhr,September 2015,Dieselgate erschüttert VW-Konzern
02.10.2015 18:16 Uhr,Islamisten aus Tadschikistan,Eine hausgemachte Gefahr
02.10.2015 15:44 Uhr,Verbotsantrag bei der Kommission in Brüssel,15 EU-Länder gegen Genpflanzen-Anbau
02.10.2015 15:12 Uhr,Psychische Probleme von Soldaten,Krank in den Krieg
02.10.2015 14:09 Uhr,25 Jahre Wiedervereinigung,Wie steht es um die Deutsche Einheit?
01.10.2015 21:29 Uhr,ARD-DeutschlandTrend,Deutsche besorgt über Flüchtlinge
01.10.2015 21:29 Uhr,ARD-DeutschlandTrend,Deutsche besorgt über Flüchtlinge
01.10.2015 11:54 Uhr,September 1995,Zeitgeschichte in der Tagesschau
01.10.2015 00:00 Uhr,Archiv,EU-Nachrichten Oktober 2015
