topline,headline,content
13.11.2021 22:27 Uhr,COP26-Abschlusserklärung,"""Umfassend und vielfältig"""
13.11.2021 22:14 Uhr,Coronavirus-Pandemie,++ Esken will Gesetzentwurf nachbessern ++
13.11.2021 21:48 Uhr,Kompromiss zum Kohleausstieg,Klimagipfel erzielt Einigung
13.11.2021 20:58 Uhr,Bandenkrieg in Ecuador,Viele Tote bei Gefängnisaufstand
13.11.2021 20:10 Uhr,Grenzstreit mit Polen,Belarusische Soldaten zerstören offenbar Grenzbarriere
13.11.2021 18:58 Uhr,Ringen um COP26-Erklärung,"""Moment der Wahrheit"" in Glasgow"
13.11.2021 18:43 Uhr,Drei Wochen nach Putsch,Tote bei Massenprotesten im Sudan
13.11.2021 17:50 Uhr,Junge Liberale,"""Druck machen und Kontra geben"""
13.11.2021 17:01 Uhr,Corona-Lage,"""Jeder Tag kostet Menschenleben"""
13.11.2021 16:32 Uhr,Ziel der Ampel-Koalitionäre,An EU-Außengrenzen soll keiner sterben
13.11.2021 16:03 Uhr,Wege zu mehr Wohnraum,Umbau-Offensive statt Neubau-Boom
13.11.2021 15:51 Uhr,Ampel-Beschluss,Aus für Notlage - viele sind dagegen
13.11.2021 13:33 Uhr,Wahlkampf in Bulgarien,Die mutmaßlichen Königsmacher
13.11.2021 13:29 Uhr,Corona-Intensivpatienten,Impfquote soll täglich erfasst werden
13.11.2021 12:00 Uhr,Spielwaren zu Weihnachten,Die Zukunft kommt ins Kinderzimmer
13.11.2021 11:44 Uhr,FDP-Chef Lindner zu Corona,"""Müssen mehr impfen und boostern"""
13.11.2021 11:39 Uhr,Tierschutz in Polen,Das skrupellose Geschäft mit Welpen
13.11.2021 11:31 Uhr,Tarifstreit im öffentlichen Dienst,Ver.di ruft zu mehr Warnstreiks an Unikliniken auf
13.11.2021 11:09 Uhr,CDU-Parteivorsitz,Merz will offenbar erneut kandidieren
13.11.2021 11:04 Uhr,COP26-Abschlusserklärung,"Neuer Entwurf, abgeschwächtes Novum"
13.11.2021 10:38 Uhr,Corona in Deutschland,Inzidenz erreicht erneut Höchstwert
13.11.2021 09:45 Uhr,Wahlen in Argentinien,Ohrfeige für Linksregierung erwartet
13.11.2021 09:21 Uhr,Prozess um US-Sängerin,Vormundschaft über Spears aufgehoben
13.11.2021 09:07 Uhr,Epidemische Notlage,Grüne uneins - trotz Ampel-Beschluss
13.11.2021 08:16 Uhr,Corona in Deutschland,"""Dramatische"" Lage auf Intensivstationen"
13.11.2021 05:37 Uhr,Siedler-Gewalt gegen Olivenhaine,"""Was bleibt von unserem Dorf?"""
13.11.2021 03:30 Uhr,Teststellen erwarten Andrang,Corona-Tests sind wieder gratis
13.11.2021 03:29 Uhr,Ländliche Regionen,Wenn kleine Kliniken vor dem Aus stehen
13.11.2021 02:44 Uhr,Missachtung des US-Kongresses,Trump-Berater Bannon wird angeklagt
13.11.2021 02:18 Uhr,Coronavirus-Pandemie,Niederlande verhängen Teil-Lockdown
