topline,headline,content
05.04.2022 22:18 Uhr,Schwere Nasdaq-Verluste,Zinsängste bremsen die Wall Street
05.04.2022 21:38 Uhr,Coronavirus-Pandemie,++ Biden beauftragt Forschung zu Long Covid ++
05.04.2022 20:40 Uhr,Einigung auf gemeinsamen Entwurf,Kompromissvorschlag für Impfpflicht ab 60
05.04.2022 20:38 Uhr,Selenskyj spricht vor UN,"""Wo ist der Sicherheitsrat?"""
05.04.2022 18:18 Uhr,Geberkonferenz für Moldau,"""Niemand ist Russlands Hinterhof"""
05.04.2022 18:03 Uhr,Klimaneutrales Bauen,KfW-Programm wird wieder aufgelegt
05.04.2022 18:00 Uhr,Kinderrechte in der Ukraine,"""Was stimmt nicht mit Leuten wie Putin?"""
05.04.2022 17:58 Uhr,Netzagentur übernimmt Kontrolle,Was wird aus Gazproms Deutschlandgeschäft?
05.04.2022 17:46 Uhr,Corona-Pandemie,Was das Ende der Isolationspflicht bedeutet
05.04.2022 17:42 Uhr,Handel und Hersteller,Preisschub im Supermarktregal
05.04.2022 17:41 Uhr,Ukrainischer Botschafter,Schwere Waffen und Gas-Moratorium
05.04.2022 17:37 Uhr,Raketenstarts gebucht,Amazon treibt Satelliten-Netz voran
05.04.2022 17:24 Uhr,Debatte über Isolationspflicht,Lauterbach verteidigt freiwillige Quarantäne
05.04.2022 17:16 Uhr,Verstöße gegen Rechtsstaatlichkeit,EU kündigt Verfahren gegen Ungarn ein
05.04.2022 17:09 Uhr,Weltweiter Agrarmarkt,Hunger als Waffe in Putins Krieg?
05.04.2022 17:00 Uhr,Lauterbachs Corona-Politik,Minister der gebrochenen Herzen
05.04.2022 16:34 Uhr,Neue Embargo-Pläne,Wie wichtig ist die russische Kohle?
05.04.2022 16:33 Uhr,Geberkonferenz in Berlin,Millionenhilfe für Moldau
05.04.2022 16:22 Uhr,Neuzulassungen im März,Engpässe lassen Automarkt einbrechen
05.04.2022 16:22 Uhr,Strafen gegen Russland,EU-Kommission schlägt Kohle-Embargo vor
05.04.2022 15:39 Uhr,Kriminalstatistik 2021,Mehr Kindesmissbrauch - weniger Einbrüche
05.04.2022 15:08 Uhr,Brückenlösung in Tarifrunde,1400 Euro für Chemie-Beschäftigte
05.04.2022 15:03 Uhr,Notkredite,Griechenland tilgt IWF-Schulden vorzeitig
05.04.2022 14:08 Uhr,Butscha nach Abzug der Russen,"Beerdigt, wo es gerade möglich war"
05.04.2022 13:24 Uhr,Staatsanwaltschaft Erfurt ermittelt,Bundesweit Durchsuchungen zu Panama Papers
05.04.2022 13:15 Uhr,Russische Desinformation zu Butscha,"Ablenken, dementieren, verwirren"
05.04.2022 12:31 Uhr,Internet-Nutzung,Millionen Deutsche immer nur offline
05.04.2022 11:41 Uhr,Beschluss der Gesundheitsminister,Kritik an Wegfall von Isolationspflicht
05.04.2022 11:13 Uhr,AOK-Studie,Starker Rückgang bei Klinik-Fallzahlen
05.04.2022 11:12 Uhr,Staatsanleihen,USA blockieren Zinszahlungen Russlands
05.04.2022 11:05 Uhr,"""Hydra Market""",Weltgrößter Darknet-Marktplatz abgeschaltet
05.04.2022 11:00 Uhr,Neue Studie,Die Arktis ist voller Plastikmüll
05.04.2022 10:56 Uhr,Technische Innovationen,Anmelderekord beim Europäischen Patentamt
05.04.2022 10:47 Uhr,"Kosten für Gas, Strom und Benzin",So hoch wird die Energie-Rechnung
05.04.2022 10:29 Uhr,Wegen Ukraine-Krieg,Düsseldorfer Rosenmontagszug abgesagt
05.04.2022 09:06 Uhr,Corona-Ausbruch in Shanghai,Lockdown jetzt auf unbestimmte Zeit
05.04.2022 08:21 Uhr,Energie-Notfallplan,Wer am stärksten vom Gas abhängt
05.04.2022 07:23 Uhr,Krieg gegen die Ukraine,Russische Angriffe im Süden und Osten
05.04.2022 06:00 Uhr,Kriegsverbrechen in der Ukraine,Berichte über Exekutionen und Vergewaltigungen
05.04.2022 06:00 Uhr,Augenheilkunde,Spekulanten greifen nach Arztpraxen
05.04.2022 03:29 Uhr,Kriegsverbrechen in Butscha,USA sammeln Beweise für Anklage
05.04.2022 00:22 Uhr,Krieg gegen die Ukraine,++ Offenbar 1550 Zivilisten aus Mariupol gerettet ++
