topline,headline,content
31.01.2021 22:27 Uhr,Proteste in Russland,Protest trotz Tausender Festnahmen
31.01.2021 17:14 Uhr,US-Nachrichtenmedien,Ein ganz anderer Ton
30.01.2021 19:25 Uhr,Langzeitfolgen von Corona,Diagnose: Post-Covid-Syndrom
30.01.2021 18:15 Uhr,AstraZeneca-Impfstoff,Spahn will Impfverordnung überarbeiten
30.01.2021 18:04 Uhr,"""Putins"" Palast am Schwarzen Meer",Russischer Oligarch will Eigentümer sein
29.01.2021 18:59 Uhr,Atomare Abrüstung,Putin verlängert New-Start-Vertrag mit den USA
29.01.2021 16:31 Uhr,Wirecard,"Ein ""Honigtopf"" für Ehemalige"
29.01.2021 15:09 Uhr,Unternehmensgruppe HNA,Chinesischer Großkonzern vor Zerschlagung
29.01.2021 10:37 Uhr,Puzzle-Boom,Kleine Teile groß im Trend
29.01.2021 08:44 Uhr,Banken in Deutschland,Wie das Filialnetz schrumpft
29.01.2021 05:09 Uhr,Coronavirus,Wie wirkt der Impfstoff von AstraZeneca?
29.01.2021 01:37 Uhr,Neues Gesetz im Bundestag,Dem BND auf die Finger geschaut
28.01.2021 20:38 Uhr,Glücksspiel-Regulierung,Wirecard schickte Politiker auf Lobby-Tour
28.01.2021 19:51 Uhr,Lübcke-Urteil,Harte Strafe und ein Freispruch
28.01.2021 17:42 Uhr,Jurist zu AstraZeneca,"""Die Lösung liegt im Dialog"""
28.01.2021 14:51 Uhr,US-Regierung,Trans-Rechte wecken Jubel und Widerstand
28.01.2021 14:50 Uhr,Nationalkongress in Vietnam,Die Partei hat immer recht
28.01.2021 14:49 Uhr,Pleite-Gefahr im Lockdown,Droht das große Hotelsterben?
28.01.2021 12:51 Uhr,Ursprünge des Coronavirus,WHO-Team beginnt Untersuchung in Wuhan
28.01.2021 11:49 Uhr,Wirecard-Affäre,E-Mails aus Niederbayern
28.01.2021 08:29 Uhr,Deutschland im Korruptionsregister,Es fehlt an Transparenz
28.01.2021 07:49 Uhr,Neuer US-Präsident,Biden will Klimaschutz für alle
28.01.2021 07:01 Uhr,Kritik an EU-Flüchtlingspolitik,"""Pushbacks sind einfach illegal"""
28.01.2021 04:28 Uhr,Kampf gegen Rechtsextremismus,Der Mordfall Lübcke hat vieles verändert
28.01.2021 02:05 Uhr,Pkw-Maut-Ausschuss,Scheuer hat es fast geschafft
27.01.2021 19:57 Uhr,Galeria Karstadt Kaufhof,Was Benko an Kaufhäusern reizt
27.01.2021 19:48 Uhr,Verfassungsschutz,Worum es in den AfD-Anträgen geht
27.01.2021 19:33 Uhr,Lobbyarbeit für Wirecard,Ex-Polizeipräsident als Türöffner?
27.01.2021 19:02 Uhr,tagesthemen mittendrin,Die großen Sorgen des Einzelhandels
27.01.2021 18:34 Uhr,Notfall-Psychologe zu Lockdown,"""Viele stecken das sehr gut weg"""
27.01.2021 18:03 Uhr,Antibiotika-Startup,Am eigenen Erfolg gescheitert
27.01.2021 15:38 Uhr,Fleischersatz im Trend,Pepsi kooperiert mit Beyond Meat
27.01.2021 14:16 Uhr,Bundeskriminalamt,"Schadsoftware ""Emotet"" zerschlagen"
27.01.2021 13:11 Uhr,Umsatz- und Gewinnrückgang,Corona stoppt Starbucks-Expansion
27.01.2021 10:03 Uhr,Gewinner der Corona-Krise,Cloud-Geschäft beflügelt Microsoft
27.01.2021 05:02 Uhr,Ein Jahr Corona in Deutschland,Wo alles begann
26.01.2021 19:21 Uhr,Autojahr 2021,Schöne neue Elektrowelt?
26.01.2021 19:12 Uhr,Corona-Pandemie,Hunderte Shoah-Überlebende gestorben
26.01.2021 17:51 Uhr,Wirecard-Skandal,Die Bedenken des Herrn K.
26.01.2021 16:44 Uhr,Einbau von Thermofenstern,Sittenwidrige Schädigung von Diesel-Kunden?
26.01.2021 15:10 Uhr,Schätzung der Sparkassen,Weniger Insolvenzen als befürchtet?
26.01.2021 14:29 Uhr,Nord Stream 2,Politischer Großkonflikt um eine Pipeline
26.01.2021 14:27 Uhr,Corona-Krise,Spahn gibt Kliniken Gehälter-Garantie
26.01.2021 12:13 Uhr,Neue Regeln für Kreditkarten,Was sich beim Online-Shoppen ändert
26.01.2021 12:06 Uhr,Twitter,"Vogelbeobachtung gegen ""Fake News"""
26.01.2021 12:02 Uhr,Prognos-Studie,Westen verliert wirtschaftliche Dominanz
26.01.2021 11:30 Uhr,Boom der Lieferdienste,Immer mehr Konkurrenz für Lieferando
26.01.2021 09:18 Uhr,Windkraftausbau stockt,Die große Flaute
26.01.2021 03:56 Uhr,ARD-DeutschlandTrend,Impfbereitschaft nimmt zu
25.01.2021 20:37 Uhr,US-Militär,Biden kippt Trumps Transgender-Verbot
25.01.2021 18:34 Uhr,Kampf gegen Corona-Infektion,Was bringen Antikörper-Medikamente?
25.01.2021 18:01 Uhr,Proteste in Russland,"""Katalysator für aufgestaute Probleme"""
25.01.2021 17:58 Uhr,Im Südchinesischen Meer,China verärgert über US-Flugzeugträger
25.01.2021 16:18 Uhr,Pläne des Gesundheitsministeriums,Bald Schnelltests für zu Hause
25.01.2021 14:43 Uhr,Demonstrationen in Russland,Proteste werden als Einmischung dargestellt
25.01.2021 10:45 Uhr,Woran die Pharmabranche forscht,Schwierige Suche nach Covid-Medikamenten
24.01.2021 17:09 Uhr,Pro-Nawalny-Demos in Russland,"""Viele?"" - Kreml spielt Protest herunter"
24.01.2021 13:11 Uhr,Ex-Wirecard-Vorstand,Hat Marsalek Verfassungsschützer bestochen?
23.01.2021 10:37 Uhr,Ein Jahr nach dem Lockdown,"Wuhan - fast so, als wäre nichts gewesen"
23.01.2021 08:35 Uhr,Ideen von Firmengründern,Wie Startups die Krise nutzen
22.01.2021 17:43 Uhr,Biden und der Klimaschutz,Werden die USA jetzt wirklich grün?
22.01.2021 16:07 Uhr,In EU noch nicht zugelassen,Ungarn kauft russischen Impfstoff Sputnik V
22.01.2021 15:34 Uhr,Online-Modehändler,Wie Mytheresa zum Börsenstar aufstieg
22.01.2021 14:30 Uhr,Engagement in Konfliktgebieten,Nur leere Parolen?
22.01.2021 13:34 Uhr,AfD-Politiker Kalbitz,Er ist noch da
22.01.2021 12:49 Uhr,Bio-Boom in der Pandemie,Regionales Gemüse beliebt wie nie
22.01.2021 09:16 Uhr,Arbeitsrecht,Impfen auf Dienstanweisung?
22.01.2021 08:45 Uhr,Atomwaffenverbotsvertrag,Auch Japan fehlt - ausgerechnet
21.01.2021 23:55 Uhr,ARD-DeutschlandTrend,"Zunehmend belastend, zunehmend unzufrieden"
21.01.2021 21:01 Uhr,Italienische Reportage im Faktencheck,Georgische Sniper auf dem Maidan?
21.01.2021 15:39 Uhr,Covid-Langzeitfolgen,"Eine Krankheit, die oft bleibt"
21.01.2021 13:33 Uhr,Neue Corona-Regeln,Planen Großkonzerne mehr Homeoffice?
21.01.2021 13:25 Uhr,EU und Großbritannien,Militärisch weiter Seit an Seit?
21.01.2021 12:29 Uhr,Erneuerbare Energien,China setzt verstärkt auf Windkraft
21.01.2021 12:01 Uhr,Pläne für E-Währung,Was der digitale Euro können soll
21.01.2021 12:01 Uhr,Krise am Golf,Teil der Bundeswehr zieht aus Irak ab
21.01.2021 08:32 Uhr,Podcast,Zuckersteuer? Was dann?
21.01.2021 00:28 Uhr,Beschlüsse des Bundeskabinetts,Weniger Einwegmüll und kein Kükentöten
20.01.2021 17:24 Uhr,Corona-Gipfel,Wie der Lockdown verschärft wird
20.01.2021 15:44 Uhr,Gigafactory Grünheide,Wann steigt die Tesla-Party?
20.01.2021 13:02 Uhr,Norwegen untersucht Todesfälle,"Gezielte Panikmache mit ""Impfmassaker"""
20.01.2021 11:02 Uhr,Textil-Trends in der Pandemie,Mode für Homeoffice und Internet
20.01.2021 07:26 Uhr,Einstiger Chefstratege,Trump begnadigt Bannon
19.01.2021 18:33 Uhr,IWF-Schätzung,Jede neunte Firma ohne Hilfe pleite
19.01.2021 17:23 Uhr,Weltrisikobericht,Klimawandel bleibt größte Gefahr
19.01.2021 12:01 Uhr,Sport in der Pandemie,Preise für Heimtrainer stark gestiegen
19.01.2021 11:50 Uhr,Kampf gegen Corona,Geimpft - und dann?
19.01.2021 11:22 Uhr,Textilbranche in der Krise,"""Mode ist verderbliche Ware"""
19.01.2021 10:54 Uhr,Verurteilung in Thailand,Rekordstrafe wegen Majestätsbeleidigung
19.01.2021 10:32 Uhr,Abgesagte Großveranstaltungen,Haben Messen noch eine Zukunft?
19.01.2021 09:04 Uhr,Corona-Treffen,Über diese Regeln beraten Bund und Länder
19.01.2021 08:55 Uhr,Weltspiegel extra,Angriff auf Amerika
18.01.2021 18:12 Uhr,Guide Michelin,Sterne für das beste geschlossene Restaurant
18.01.2021 17:32 Uhr,Corona-Maßnahmen,Was bringen Ausgangssperren?
18.01.2021 17:24 Uhr,Homeoffice-Pflicht,Schweiz und Belgien machen es vor
18.01.2021 15:13 Uhr,Proteste in Großbritannien,Fischereibranche gegen Brexit-Bürokratie
18.01.2021 14:15 Uhr,Statistisches Bundesamt,Raucher kaufen mehr Tabak in Deutschland
18.01.2021 12:56 Uhr,Insolvente Steakhaus-Kette,Maredo kündigt fast allen Mitarbeitern
18.01.2021 12:45 Uhr,Kabinett setzt EU-Tabakrichtlinie um,Künftig Schockbilder auf Zigarettenschachteln
18.01.2021 12:33 Uhr,Korruption in Südkorea,Samsung-Erbe muss ins Gefängnis
18.01.2021 06:00 Uhr,Menschenhandel mit Vietnamesen,Gefangen in moderner Sklaverei
18.01.2021 01:45 Uhr,Kurz nach der Landung,Nawalny an Moskauer Flughafen festgenommen
17.01.2021 05:57 Uhr,Tötung Patrice Lumumbas,Stockende Aufarbeitung auch nach 60 Jahren
16.01.2021 14:17 Uhr,Unterschied zu Alltagsmasken,So können Sie FFP2-Masken wiederverwenden
16.01.2021 12:39 Uhr,Türkisches Recycling-Projekt,Brot für Müll
15.01.2021 20:44 Uhr,Coronavirus in Deutschland,Schnelltests jetzt auch in Apotheken
15.01.2021 13:33 Uhr,Militärische Beobachtungsflüge,"Auch Russland kündigt ""Open Skies""-Abkommen"
15.01.2021 13:03 Uhr,Machtkampf um den Vorsitz,Was beim CDU-Parteitag wichtig ist
15.01.2021 12:57 Uhr,20 Jahre Wikipedia,Enzyklopädie ohne Profis
15.01.2021 00:23 Uhr,Abgasstreit,Toyota zahlt Millionenstrafe in den USA
14.01.2021 19:01 Uhr,Pushback-Vorwürfe,EU-Behörde ermittelt gegen Frontex
14.01.2021 18:04 Uhr,Bundestagsbeschluss,Eltern erhalten länger Kinderkrankengeld
14.01.2021 17:50 Uhr,Mehr als drei Millionen Euro,"Rekorderlös für ""Tim und Struppi""-Cover"
14.01.2021 17:49 Uhr,Recherchen im Netz,Schneller als die Ermittlungsbehörden
14.01.2021 17:19 Uhr,Nach Eklat im Bundestag,Hausverbot für zwei AfD-Gäste
14.01.2021 16:48 Uhr,EU-Handelskammer warnt,China geht zunehmend eigene Wege
14.01.2021 15:26 Uhr,Abschiebung von Flüchtlingen,EuGH stärkt Schutz von Minderjährigen
14.01.2021 14:42 Uhr,Erste Bilanz zu Impfstoff,Kein erhöhtes Risiko für Nebenwirkungen
14.01.2021 13:34 Uhr,Deutsche Geheimdienste,Spionage in Corona-Zeiten
14.01.2021 12:57 Uhr,Wirkung der Corona-Maßnahmen,Deutschland im Blindflug
14.01.2021 11:32 Uhr,Suche nach Corona-Ursprung,WHO-Experten in Wuhan eingetroffen
14.01.2021 08:31 Uhr,Corona-Hilfen,Steuerberater am Limit
14.01.2021 08:28 Uhr,Korruptionsskandal in Südkorea,Urteil gegen Ex-Präsidentin bestätigt
14.01.2021 07:59 Uhr,Twitter-Chef Dorsey,Trump-Sperre mit Gefahrenabwehr begründet
13.01.2021 18:03 Uhr,Krisenmanagement der Regierung,"""Wie Getriebene, nicht wie Treiber"""
13.01.2021 16:35 Uhr,Schutz vor Corona-Infektion,Welchen Nutzen haben die FFP2-Masken?
13.01.2021 14:47 Uhr,Gurlitts Kunstsammlung,Alle 14 NS-Raubkunstwerke zurückgegeben
13.01.2021 14:43 Uhr,Dreimal mehr E-Autos,VW wird immer elektrischer
13.01.2021 13:24 Uhr,E-Auto-Hersteller Nio,Tesla-Jäger aus China
13.01.2021 12:04 Uhr,Coronavirus-Pandemie,Kabinett beschließt neue Einreiseregeln
13.01.2021 10:12 Uhr,Mangelnder Rückhalt in der Wirtschaft,Der letzte Sargnagel für Trumps Business?
13.01.2021 09:14 Uhr,Eingestelltes Windows 7,Millionen PCs mit alter Software
13.01.2021 03:56 Uhr,Debatte über Gefährder,Abschiebung mit Hindernissen
13.01.2021 03:52 Uhr,Extremismus in den USA,"""Erhebliche terroristische Gefährdung"""
12.01.2021 18:52 Uhr,Grundgesetzänderung,Kinderrechte nur Lippenbekenntnisse?
12.01.2021 17:22 Uhr,Stadler-Aussage im Audi-Prozess,"""Eine nie dagewesene Stresssituation"""
12.01.2021 16:31 Uhr,Spitzenbeamter Röller,"Merkels ""Firewall"" im Wirecard-Skandal?"
12.01.2021 15:36 Uhr,Helgoland,Geburtenrekord bei Kegelrobben
12.01.2021 14:03 Uhr,Nach 100 Jahren,Ford verabschiedet sich aus Brasilien
12.01.2021 13:38 Uhr,Technikmesse CES,"Alles bunt, alles virtuell"
12.01.2021 13:28 Uhr,Commerzbank und Deutsche Bank,Beginnt die Suche nach neuen Partnern?
12.01.2021 13:21 Uhr,Künftig keine Geschäfte mehr,Deutsche Bank macht Schluss mit Trump
12.01.2021 13:18 Uhr,Großbank auf Chefsuche,Streit über Zukunft von UniCredit
12.01.2021 12:17 Uhr,Angriff auf das Kapitol,"Keine Attacke ""unter falscher Flagge"""
12.01.2021 11:48 Uhr,"Jury der ""Sprachkritischen Aktion""",Erstmals zwei Unwörter des Jahres gekürt
12.01.2021 10:55 Uhr,Juristische Probleme,Homeoffice-Pflicht? Rechtlich schwierig
12.01.2021 10:12 Uhr,Erstmals seit zehn Jahren,Deutschlands Bevölkerung nicht gewachsen
12.01.2021 09:26 Uhr,Modebranche,Lockdown lässt Textillager überquellen
11.01.2021 21:29 Uhr,UN-Klimagipfel,"""Es muss heute gehandelt werden"""
11.01.2021 17:49 Uhr,Union und SPD einigen sich,Kinderrechte kommen ins Grundgesetz
11.01.2021 16:47 Uhr,Ostjerusalem und Westjordanland,Israel kündigt Ausbau von Siedlungen an
11.01.2021 14:32 Uhr,Verkauf der ostdeutschen Marke,Spreewaldgurken werden französisch
11.01.2021 14:25 Uhr,Tesla-Jobs in Grünheide,Wie ist die Arbeit für Herrn Musk?
11.01.2021 13:10 Uhr,Corona-Impfungen,"Angstmache, Falschmeldungen und Gerüchte"
11.01.2021 12:05 Uhr,Digitaler Wandel,Wo sind die deutschen Tech-Stars?
11.01.2021 10:10 Uhr,Debatte über strengere Regeln,DGB fordert Anspruch auf Homeoffice
11.01.2021 09:33 Uhr,Corona-Pandemie,Andere Krankheiten nach Lockdown seltener
11.01.2021 05:00 Uhr,"Parler, Gab und BitChute",Radikale Parallelwelten
10.01.2021 20:15 Uhr,Wahl in Kirgistan,Schaparow wird neuer Präsident
10.01.2021 01:49 Uhr,Covid-19-Pandemie,Brasiliens lustloser Kampf gegen Corona
09.01.2021 10:37 Uhr,Nach Twitter-Sperre,Neue Heimat für @realDonaldTrump?
09.01.2021 08:02 Uhr,Wirecard-Skandal,Eine halbe Milliarde Euro veruntreut?
09.01.2021 04:52 Uhr,Konto des US-Präsidenten,"Twitter sperrt Trump ""dauerhaft"""
08.01.2021 15:58 Uhr,Ermittlungen laufen weiter,IS-Rückkehrerin aus U-Haft entlassen
08.01.2021 14:00 Uhr,Boom der Kryptowährungen,Wie Bitcoins funktionieren
08.01.2021 12:40 Uhr,Debatte um Vorgaben,Wie viel Homeoffice ist tragbar?
08.01.2021 11:37 Uhr,Klimawandel,2020 war wärmstes Jahr in Europa
08.01.2021 10:50 Uhr,Zu wenig Bauteile,Chip-Knappheit belastet Autoindustrie
08.01.2021 02:46 Uhr,Biden sieht Schuld bei Trump,"""Beispielloser Angriff auf unsere Demokratie"""
07.01.2021 17:58 Uhr,Bundesverfassungsgericht,Eilantrag der Fleischindustrie abgelehnt
07.01.2021 17:53 Uhr,Experte zu Republikanern,"""Sie sind ihm gefolgt bis in den Abgrund"""
07.01.2021 16:42 Uhr,Gespaltene USA,Wie kam es zum Sturm aufs Kapitol?
07.01.2021 14:50 Uhr,Politologe zu US-Politik,"""Der Trumpismus ist quicklebendig"""
07.01.2021 13:29 Uhr,Bitkom-Umfrage,Homeoffice befeuert Umzugswünsche
07.01.2021 13:07 Uhr,Nach Erstürmung des Kapitols,Kann Trump noch abgesetzt werden?
07.01.2021 11:50 Uhr,Trumps radikale Anhänger,"In einer ""alternativen Realität"""
07.01.2021 11:01 Uhr,USA,Kongress bestätigt Bidens Wahlsieg
07.01.2021 08:27 Uhr,Reaktionen auf Postings,Facebook und Twitter sperren Trump
06.01.2021 23:58 Uhr,Ausschreitungen in Washington,Trump-Anhänger stürmen Kapitol
06.01.2021 19:41 Uhr,Corona-Pandemie,Berliner Charité verhängt Besuchsverbot
06.01.2021 17:43 Uhr,USA,Warum die Wahl in Georgia so wichtig ist
06.01.2021 17:04 Uhr,Protestaktion #WirMachenAuf,Aufruf zum Regelbruch
06.01.2021 15:00 Uhr,Maßnahme für Corona-Hotspots,Was die 15-Kilometer-Regel bringen soll
06.01.2021 11:38 Uhr,Einzelhandel in der Pandemie,Wer profitiert vom Online-Boom?
06.01.2021 11:26 Uhr,Regelung für Vorstände,Kabinett bringt Frauenquote auf den Weg
06.01.2021 07:21 Uhr,Polizist im US-Staat Wisconsin,Keine Anklage nach Schüssen auf Schwarzen
06.01.2021 06:55 Uhr,Bundesländer zu neuem Lockdown,"Die ersten Länder suchen nach ""Spielräumen"""
06.01.2021 06:50 Uhr,Bund-Länder-Treffen,Merkels versteckte Botschaft
06.01.2021 06:34 Uhr,Corona-Beschlüsse,Das sind die Regeln bis Ende Januar
05.01.2021 18:19 Uhr,Corona-Pandemie,Städte und Gemeinden hoffen auf Neustart
05.01.2021 17:59 Uhr,Vor Corona-Gipfel,Worüber Bund und Länder streiten
05.01.2021 17:55 Uhr,Kastrationspflicht für Katzen,Ein Herz für wilde Streuner
05.01.2021 16:17 Uhr,Alexey Mordaschow,Ein Oligarch rettet TUI
05.01.2021 15:47 Uhr,Trotz Urananreicherung,EU steht zu Abkommen mit dem Iran
05.01.2021 15:44 Uhr,Lebensmittel-Ketten,Neuer Preiskampf bei Discountern
05.01.2021 13:44 Uhr,"""Schweinestau""",Verstöße gegen Tierschutz wegen Corona?
05.01.2021 13:27 Uhr,Bitkom-Studie,Corona-Schub für kontaktloses Bezahlen
05.01.2021 11:06 Uhr,Entscheidung des US-Kongress,"""Historischer"" Erfolg im Kampf gegen Geldwäsche"
05.01.2021 04:32 Uhr,Kinderbetreuung im Lockdown,Was Eltern beim Sonderurlaub beachten sollten
05.01.2021 01:41 Uhr,Neue Maßnahmen in England,Lockdown zum Erhalt des Gesundheitssystems
04.01.2021 19:58 Uhr,Impfkampagne in Deutschland,Warum so langsam?
04.01.2021 17:56 Uhr,Bundesgerichtshof bestätigt,Schwangerschaftsabbruch ab Geburtsbeginn strafbar
04.01.2021 17:15 Uhr,Dover nach Brexit,"Kaum Stau, aber mehr Bürokratie"
04.01.2021 15:58 Uhr,Fusion von PSA und Fiat Chrysler,Warum ein neuer Autogigant entsteht
04.01.2021 13:17 Uhr,Umgang mit Corona,Frankreichs Schulen bleiben offen
04.01.2021 04:04 Uhr,Pelosi bleibt Vorsitzende,Neuer US-Kongress vereidigt
03.01.2021 16:21 Uhr,Schneeregionen überfüllt,"""Der Ansturm ist enorm"""
03.01.2021 15:36 Uhr,Schattenwirtschaft,Corona-Schub für die Schwarzarbeit
03.01.2021 09:26 Uhr,Corona-Impfung,Termin-Hotline offenbar überlastet
03.01.2021 08:43 Uhr,Rüstungsexporte in Milliardenhöhe,Deutsche Waffen für Krisenregion
02.01.2021 18:35 Uhr,Terrorattacke in Mumbai 2008,Festnahme nach zwölf Jahren
02.01.2021 13:36 Uhr,Verstoß gegen Abkommen,Iran will Uran-Anreicherung erhöhen
02.01.2021 12:56 Uhr,Folgen des Lockdowns,Händler befürchten Pleitewelle
01.01.2021 07:37 Uhr,Video-Rückblick,Dezember 2000
01.01.2021 04:19 Uhr,Corona-Maßnahmen,Die Pandemie und die Grundrechte
01.01.2021 02:21 Uhr,Winter in Afghanistan,Hunderttausende Kinder von Kälte bedroht
