topline,headline,content
24.04.2022 23:06 Uhr,Krieg gegen die Ukraine,++ US-Außenminister Blinken in Kiew ++
24.04.2022 22:17 Uhr,Macrons Wahlsieg,Keineswegs alles gut
24.04.2022 21:42 Uhr,Neue Spielkartenfabrik in Altenburg,Noch längst nicht ausgereizt
24.04.2022 18:54 Uhr,SPD-Chef Klingbeil,"""Es gibt keine Koalitionskrise"""
24.04.2022 18:00 Uhr,Eindrücke aus Pariser Wahllokal,"""Man muss heute wählen gehen"""
24.04.2022 17:24 Uhr,Formel 1 in Imola,Verstappen siegt im Ferrari-Land
24.04.2022 17:14 Uhr,Frankreich,Etwas niedrigere Wahlbeteiligung als 2017
24.04.2022 16:11 Uhr,"""Bericht vom Parteitag""",Sondersendung zum FDP-Parteitag
24.04.2022 16:00 Uhr,Corona-Pandemie,Shanghai meldet Höchstwert bei Todesfällen
24.04.2022 15:25 Uhr,Kampf um Grundnahrungsmittel,"Mexikos ""Limetten-Krimi"""
24.04.2022 15:07 Uhr,Liberale Politik,"""Zeitenwende"" als Chance und Risiko für die FDP"
24.04.2022 14:48 Uhr,Abwehr russischer Angriffe,Warum die Ukraine auf Drohnen setzt
24.04.2022 13:35 Uhr,EU-Sanktionen,Muss Oligarch-Sein strafbar werden?
24.04.2022 12:07 Uhr,Krieg gegen die Ukraine,Viele Kämpfe statt Osterfrieden
24.04.2022 11:41 Uhr,Parteitag Ende Juni,Linke wählt gesamten Parteivorstand neu
24.04.2022 10:07 Uhr,Im Südosten Nigerias,Dutzende Tote bei Explosion illegaler Raffinerie
24.04.2022 10:05 Uhr,Neuer FDP-Generalsekretär Djir-Sarai,Mann mit besonderer Rolle
24.04.2022 09:41 Uhr,Schwesigs Russland-Politik,Rückendeckung und Rücktrittsforderung
24.04.2022 09:17 Uhr,Wahl in Frankreich,Links denken - aber wen wählen?
24.04.2022 08:26 Uhr,Jugendarbeitslosigkeit,Mehr Jobs für junge Spanier
24.04.2022 08:25 Uhr,Slowenien vor der Wahl,"Verdrängt ein Newcomer ""Marshall Twito""?"
24.04.2022 08:01 Uhr,Merz kritisiert Regierungskurs,"""Deutschland ist zunehmend isoliert"""
24.04.2022 05:33 Uhr,Krieg gegen die Ukraine,US-Minister in Kiew erwartet
24.04.2022 04:42 Uhr,Corona-Pandemie,Inzidenz sinkt auf 807
24.04.2022 04:07 Uhr,Nach Schiffsunglück,Tausende Liter Diesel vor Galápagos-Inseln
24.04.2022 01:02 Uhr,Krieg gegen die Ukraine,++ Blinken und Austin in Kiew erwartet ++
24.04.2022 00:29 Uhr,Parlamentswahl in Slowenien,Zeit für etwas Neues?
