topline,headline,content
31.05.2018 23:59 Uhr,Archiv,EU-Nachrichten Mai 2018
31.05.2018 20:47 Uhr,EU nach Zoll-Entscheidung,Von Trump kaltgestellt
31.05.2018 19:53 Uhr,Chronologie im Fall Babtschenko,Was geschah wann?
31.05.2018 19:51 Uhr,Zollentscheidung der USA,EU kündigt Gegenmaßnahmen an
31.05.2018 17:37 Uhr,USA kontra Europa,Zusätzliche Zölle heizen Handelsstreit an
31.05.2018 16:15 Uhr,Entscheidung der USA,Zusätzliche Zölle für Stahl aus der EU
31.05.2018 13:53 Uhr,Fragen und Antworten,Mit Paragrafen gegen Vollverschleierung?
31.05.2018 13:15 Uhr,Zollstreit zwischen USA und EU,Wie könnte ein Deal aussehen?
31.05.2018 13:00 Uhr,Europaparlament,"Ein ""Car-Pass"" gegen Tachobetrug?"
31.05.2018 12:02 Uhr,Arbeitslosigkeit im Euroraum,Niedrigster Wert seit 2008
31.05.2018 11:05 Uhr,Verspätete Anschlussflüge,Entschädigung auch außerhalb der EU
31.05.2018 10:22 Uhr,Migranten auf dem Arbeitsmarkt,Jeder vierte Flüchtling hat einen Job
31.05.2018 08:53 Uhr,Mai 1998,Zeitgeschichte in der Tagesschau
30.05.2018 22:10 Uhr,Italien und seine Finanzen,"""Keine Krise herbeireden"""
30.05.2018 20:57 Uhr,Handelsstreit mit den USA,EU stellt sich auf Zölle ein
30.05.2018 15:33 Uhr,Geplante Musterfeststellungsklagen,Eine juristische Luftnummer?
30.05.2018 15:33 Uhr,Möglichkeit der Sammelklage,Wie die EU Verbraucher stärken will
30.05.2018 04:33 Uhr,Österreichischer Vizekanzler,Strache stellt Personenfreizügigkeit infrage
30.05.2018 03:17 Uhr,Asyl-Skandal beim BAMF,Bremer Ex-Chefin verteidigt ihr Vorgehen
29.05.2018 17:15 Uhr,Pariser Libyen-Konferenz,Konfliktparteien einigen sich auf Wahlen
29.05.2018 17:11 Uhr,Gerichtsentscheidung,Kohls Entschädigung ist nicht vererbbar
29.05.2018 11:53 Uhr,Satire über die Grünen,Kein Alkoholverbot im Ramadan gefordert
29.05.2018 09:16 Uhr,Kim-Trump-Gipfel,Knackpunkt Denuklearisierung
28.05.2018 15:09 Uhr,Gegen Billiganbieter,Bahn lockt mit neuen Tickets
28.05.2018 14:54 Uhr,EU-Plastikverbot,Ein Problem in eine Chance verwandeln
28.05.2018 14:30 Uhr,Regierungsbildung in Italien,Erleichterung und Sorge in Brüssel
28.05.2018 12:28 Uhr,Vorwürfe von Kramp-Karrenbauer,Ist die AfD antisemitisch?
28.05.2018 08:08 Uhr,EU gegen Plastikmüll,"""Das Problem ist das billige Öl"""
27.05.2018 19:30 Uhr,Manipulationsvorwürfe in Bremen,BAMF überprüft 18.000 Asyl-Entscheidungen
27.05.2018 13:18 Uhr,Forderung von Kanzler Kurz,Frontex-Beamte nach Afrika?
27.05.2018 12:23 Uhr,"""Ankerzentren"" in der Kritik",Seehofers verbales Schulterzucken
27.05.2018 11:14 Uhr,Kampf gegen Plastikmüll,EU will Strohhalme und Co. verbieten
26.05.2018 11:26 Uhr,Ein Jahr vor Europawahl,Für Europa elektrisieren
25.05.2018 17:42 Uhr,Treffen EU-Finanzminister,Strengere Regeln für EU-Banken
25.05.2018 15:35 Uhr,MH17-Abschuss,Russischer Offizier verantwortlich?
25.05.2018 13:31 Uhr,Bericht zu MH17-Abschuss,Russische Zweifel
25.05.2018 04:35 Uhr,Bayerisches Polizeigesetz,Was steht drin - und was nicht?
25.05.2018 03:51 Uhr,EU-Datenschutz-Verordnung,Die Reifeprüfung beginnt
24.05.2018 19:51 Uhr,Transporte ins Ausland,Tierquälerei - amtlich genehmigt
24.05.2018 18:54 Uhr,Entscheidung des BGH,Straffreiheit für viele IS-Frauen
24.05.2018 18:48 Uhr,Deutsch-chinesische Beziehungen,Partnerschaft mit Schönheitsfehlern
24.05.2018 17:45 Uhr,Trumps Brief im Wortlaut,"""Sehr geehrter Herr Vorsitzender,..."""
24.05.2018 17:35 Uhr,IAEA-Atomwächter,Iran hält sich weiter an Abkommen
24.05.2018 16:07 Uhr,Abgasaffäre bei Daimler,Kraftfahrtbundesamt lässt Vitos zurückrufen
24.05.2018 14:47 Uhr,Internationale Untersuchung,Wie weit sind die MH17-Ermittlungen?
24.05.2018 14:12 Uhr,Regierungsbildung in Italien,Populistenregierung macht EU Sorgen
24.05.2018 12:21 Uhr,Erster Bericht vom Absturz über der Ostukraine,"MH17 von Objekten ""durchlöchert"""
24.05.2018 07:46 Uhr,Grünen-Politikerin Roth,Wenn umdrehen zur Nazi-Methode wird
23.05.2018 16:49 Uhr,EU nach Facebook-Anhörung,Nächstes Mal soll es anders laufen
23.05.2018 05:00 Uhr,Resolution im EU-Parlament,EU-Abgeordnete wollen Gipfel mit Trump
22.05.2018 21:36 Uhr,Facebook-Chef vor EU-Parlament,Peinlich für die EU
22.05.2018 20:42 Uhr,Zuckerberg vor EU-Parlament,"Eine Entschuldigung, wenige Antworten"
22.05.2018 17:41 Uhr,Handelsstreit mit den USA,EU gibt sich selbstbewusst
22.05.2018 16:55 Uhr,Schulschwänzen vor Ferienbeginn,Mit welchen Folgen müssen Eltern rechnen?
22.05.2018 16:10 Uhr,Fragen und Antworten,Wie geht es im Fall Puigdemont weiter?
22.05.2018 12:57 Uhr,Infobroschüre in Schweden,"""Falls Krise oder Krieg kommt"""
22.05.2018 12:55 Uhr,Fall Puigdemont,"OLG-Entscheidung ""ein Zwischenschritt"""
22.05.2018 11:42 Uhr,Entscheidung über Haftantrag,Puigdemont bleibt auf freiem Fuß
22.05.2018 01:32 Uhr,Facebook-Chef vor EU-Parlament,Zuckerberg steht Rede und Antwort
22.05.2018 00:18 Uhr,Facebook-Chef vor EU-Parlament,Zuckerberg akzeptiert öffentliche Anhörung
19.05.2018 20:57 Uhr,Nach Eklat um Erdogan-Treffen,Gündogan und Özil bei Steinmeier
19.05.2018 09:31 Uhr,EU-Kommissarin Vestager,"""Kartelle sind von Habgier getrieben"""
18.05.2018 20:48 Uhr,Merkel-Besuch bei Putin,Verbunden durch Nord Stream 2
18.05.2018 17:36 Uhr,Streit um Flüchtlingspolitik,Hat die AfD-Klage Aussicht auf Erfolg?
18.05.2018 13:55 Uhr,Bundesverfassungsgericht,AfD klagt gegen Merkels Flüchtlingspolitik
18.05.2018 11:50 Uhr,Datenschutz beim Hausarzt,"Mehr Papierkram, weniger Zeit für Patienten"
18.05.2018 09:24 Uhr,Handelsstreit,Trump schimpft - Altmaier mahnt
18.05.2018 09:06 Uhr,Diesel-Nachrüstungen,"Das Ende der ""Aussitztaktik""?"
18.05.2018 06:01 Uhr,Statistiken über rechte Gewalt,Welche Zahlen stimmen?
18.05.2018 00:01 Uhr,DeutschlandTrend,Große Mehrheit stützt Iran-Deal
17.05.2018 18:15 Uhr,Gauland-Attacke gegen Özoguz,Kein Verfahren wegen Volksverhetzung
17.05.2018 17:57 Uhr,Gesetz gegen Iran-Sanktionen,EU bietet den USA die Stirn
17.05.2018 17:37 Uhr,BGH-Urteil,"Darum darf Bier nicht ""bekömmlich"" sein"
17.05.2018 17:33 Uhr,EU versus USA,Geschlossenheit ist Trumpf
17.05.2018 17:07 Uhr,Töpfer zu EU-Klage,"""Regierung hätte früher handeln müssen"""
17.05.2018 16:00 Uhr,Weidel-Äußerung im Bundestag,Werden Ausgaben für die EU verschwiegen?
17.05.2018 15:28 Uhr,Reaktionen auf EU-Klage,"""Guter Weg"" oder ""schallende Ohrfeige""?"
17.05.2018 15:28 Uhr,Luftverschmutzung,EU-Kommission verklagt Deutschland
17.05.2018 11:22 Uhr,Möglicher EU-Beitritt,Die Kandidaten auf dem Balkan
17.05.2018 10:48 Uhr,EU-Gipfel in Sofia,"Eine ""geschlossene Front"" gegen Trump"
17.05.2018 02:37 Uhr,Bundesgerichtshof,"Darf Bier ""bekömmlich"" sein?"
17.05.2018 01:06 Uhr,EU-Gipfel in Sofia,Gemeinsam gegen Trumps Iran-Politik
16.05.2018 18:55 Uhr,EU-Gipfel in Sofia,Notfalls per Gesetz gegen US-Sanktionen
16.05.2018 17:59 Uhr,#kurzerklärt,Nur noch so viele Daten wie nötig
16.05.2018 16:12 Uhr,Seehofers Asylkonzept,Ankerzentren - nur zwei sind dabei
16.05.2018 16:02 Uhr,Trotz EU-Sanktionen,Oligarchen auf Einkaufstour in Deutschland?
16.05.2018 15:40 Uhr,Chlorgas in Sarakeb,Wie die OPCW zu ihrem Ergebnis kam
16.05.2018 13:42 Uhr,Anwalt zu Polizeigesetz,"""Das ist Totalüberwachung"""
16.05.2018 12:07 Uhr,EU-Gipfel,Der Balkan als Garant für Sicherheit?
16.05.2018 09:09 Uhr,ARD-Journalist Seppelt,Im Visier der russischen Propaganda
16.05.2018 08:37 Uhr,Rettungsversuch für Atomabkommen,"""Patient auf der Intensivstation"""
16.05.2018 06:53 Uhr,Atomabkommen mit dem Iran,Europa muss emanzipiert handeln
16.05.2018 03:50 Uhr,Nach BGH-Urteil,Versicherer wollen Dashcam-Videos nutzen
16.05.2018 02:18 Uhr,Verfassungsgericht,Rundfunkbeitrag - das sind die Streitpunkte
15.05.2018 18:51 Uhr,NSU-Prozess,Anwälte fordern Freispruch Wohllebens
15.05.2018 14:52 Uhr,Russische Software-Firma,Kaspersky zieht in die Schweiz
15.05.2018 14:00 Uhr,Özil und Gündogan,Heftige Debatte um Treffen mit Erdogan
15.05.2018 12:29 Uhr,NSU-Mitangeklagter Wohlleben,"Rechtes Denken, intellektuelle Fassade"
15.05.2018 12:29 Uhr,Mutmaßlicher Terrorhelfer in Untersuchungshaft,Der braune Strippenzieher
15.05.2018 11:33 Uhr,Urteil zu Dashcams,Warum Filmen nicht grundsätzlich erlaubt ist
15.05.2018 10:59 Uhr,Ungarisches Parlament,Weg frei für umstrittenes NGO-Gesetz
15.05.2018 02:26 Uhr,BGH urteilt zu Dashcams,Wann dürfen Aufnahmen verwertet werden?
14.05.2018 15:30 Uhr,Quim Torra gewählt,Katalonien hat einen Regierungschef
14.05.2018 14:06 Uhr,Transparenz bei Facebook,Aus der Seiten-Geschichte lernen
14.05.2018 00:33 Uhr,Irans Chefunterhändler,"""Wir brauchen jetzt genügend Garantien"""
13.05.2018 14:25 Uhr,Parteitag in Berlin,FDP steht hinter Russland-Sanktionen
13.05.2018 05:45 Uhr,Leben in der West-Side,Die verlorene Jugend Chicagos
12.05.2018 17:14 Uhr,Katholikentag in Münster,Proteste gegen AfD-Politiker
12.05.2018 15:10 Uhr,Entwicklungshilfe als Druckmittel,"""Soll ich ihnen den Wasserhahn wieder zudrehen?"""
11.05.2018 17:15 Uhr,Hotelier Sondland,Trump nominiert EU-Botschafter
11.05.2018 09:41 Uhr,Strafmaßnahmen gegen den Iran,Diese Firmen sind von Sanktionen betroffen
11.05.2018 08:27 Uhr,Kooperation mit dem Iran,"Retten, was zu retten ist"
09.05.2018 22:23 Uhr,ARD-DeutschlandTrend,Große Mehrheit für Macrons EU-Engagement
09.05.2018 17:41 Uhr,Designierte CIA-Chefin Haspel,Keine Folter mehr - niemals
09.05.2018 13:40 Uhr,Nach US-Ausstieg,EU will Iran-Deal retten
09.05.2018 11:50 Uhr,Iran zu US-Ausstieg,Zwischen Diplomatie und Drohungen
09.05.2018 04:05 Uhr,BGH-Verhandlung,Haftet YouTube für Urheberrechtsverletzungen?
08.05.2018 23:29 Uhr,Trumps Atom-Entscheidung,Die Hardliner jubeln
08.05.2018 22:23 Uhr,Maas in den tagesthemen,"""Das Abkommen ist nicht tot"""
08.05.2018 21:54 Uhr,Entscheidung von Trump,USA kündigen Iran-Atomabkommen
08.05.2018 21:29 Uhr,Erneute Iran-Sanktionen,US-Botschafter warnt deutsche Firmen
08.05.2018 18:25 Uhr,Asylaffäre in Bremen,Interner Bericht belastet BAMF-Zentrale
08.05.2018 10:42 Uhr,Fragen und Antworten,Was verrät die Kriminalstatistik?
08.05.2018 07:35 Uhr,Abkommen mit Iran,Wer vertritt welche Position im Atomstreit?
08.05.2018 05:42 Uhr,Libanon,Hisbollah-Lager gewinnt Parlamentswahl
08.05.2018 01:36 Uhr,Iran-Atomabkommen,"""Trump wird es kippen - nur wie?"""
07.05.2018 20:51 Uhr,Fünf Jahre NSU-Prozess,Der Preis des Rechtsstaats
07.05.2018 20:44 Uhr,"""Anti-Abschiebe-Industrie""",Was ist dran an Dobrindts Asyl-Vorwurf?
07.05.2018 17:55 Uhr,Pläne der Großen Koalition,Was jetzt passieren soll
07.05.2018 17:17 Uhr,Migration nach Europa,Mehr Flüchtlinge erreichen Griechenland
07.05.2018 08:15 Uhr,Prozess in Griechenland,Spanische Flüchtlingshelfer vor Gericht
06.05.2018 10:59 Uhr,Unions-Forderung,Entwicklungshilfe - gekoppelt an Abschiebungen?
05.05.2018 05:05 Uhr,200. Geburtstag von Karl Marx,"""Arbeitern geht es besser, als er erwartete"""
04.05.2018 12:10 Uhr,US-Klage gegen Ex-VW-Chef,Was droht Winterkorn?
04.05.2018 06:35 Uhr,125 Jahre Eisenbahn-Blase,Ewig lockt die Spekulationsblase
03.05.2018 20:05 Uhr,EU-Projekt für Jugendliche,Quer durch Europa - kostenlos
03.05.2018 12:38 Uhr,IGeL beim Arztbesuch,Kassen halten Zusatzleistungen für nutzlos
03.05.2018 04:13 Uhr,Südchinesisches Meer,Peking stationiert offenbar Raketen
02.05.2018 20:21 Uhr,Haushaltspläne,Das muss die EU wert sein
02.05.2018 19:16 Uhr,Kompromiss für Anfangsphase,Koalition einigt sich bei Familiennachzug
02.05.2018 15:47 Uhr,Smog in Neu-Delhi,Atmen ist ungesund
02.05.2018 15:25 Uhr,Appell an Regierung,Ärzte fordern Zuckersteuer
02.05.2018 09:50 Uhr,Deutsche EU-Zahlungen,"""Bis zu zwölf Milliarden Euro on top"""
02.05.2018 07:46 Uhr,Finanzminister beraten,Neue Grundsteuer führt zu neuem Streit
02.05.2018 05:00 Uhr,EU-Haushaltsentwurf,Geld nur bei Rechtsstaatlichkeit
02.05.2018 04:30 Uhr,Sammelklage auf Deutsch,Gemeinsam gegen die Großen
01.05.2018 16:10 Uhr,Kommentar zu Zöllen,Trump zermürbt die EU
01.05.2018 13:33 Uhr,Vorwürfe gegen den Iran,IAEA widerspricht Israel
01.05.2018 12:59 Uhr,Vorerst keine US-Zölle für EU,Trumps Gnadenfrist reicht keinem
01.05.2018 07:33 Uhr,Atom-Anschuldigungen gegen den Iran,USA vorwurfsvoll - EU skeptisch
